標題,分類,時間,網址,內文
川普新關稅動作留談判空間 亞股反彈漲多跌少,產經,2018/09/18 19:57,https://www.cna.com.tw/news/afe/201809180307.aspx,（中央社香港18日綜合外電報導）亞洲股市今天止跌反彈，區域股市終場漲多跌少，主因美國總統川普雖宣布對中國祭出新回合的關稅，但未一口氣祭出最高關稅稅率，留給雙方談判空間。川普政府宣布對價值2000億美元的中國輸美商品加徵10%關稅，自24日起生效，雙方若未在明年1月1日前達成協議，關稅將提高至25%。中國今天警告，北京將採取反制措施，並指出美國堅持提高關稅，將對雙方談判帶來新變數。亞股盤初走跌，之後在市場期盼美中年底前達成協議的樂觀心理帶動下，止跌反彈。華府這次新關稅清單放過部分重要商品，加上川普11月將和中國國家主席習近平會面，可能會希望在此之前達成協議。萬達（Oanda）亞太交易主管殷尼斯（Stephen Innes）說：「美國新關稅動作不算客氣，但也沒比預期糟，除非中國還以顏色，否則股市早盤的反射性反應後，應該仍有所支撐。」「關稅將分階段調高至25%，提供更多的談判空間，所以中國可能也會視狀況回應。」亞洲主要股市漲多跌少，陸股上證綜合指數收盤上漲1.8%；日股日經指數收盤上漲1.4%；港股恆生指數收漲0.6%；韓股收漲0.3%，紐西蘭股市收高0.5%。澳洲雪梨股市則跌0.4%，新加坡股市也挫0.1%。摩根資產管理公司（JPMorgan Asset Management）全球市場策略師前川將吾（Shogo Maekawa）說：「之前投資人認為關稅會一口氣課到25%。所以，這可說是不幸中的大幸。」（譯者：劉淑琴/核稿：林治平）1070918
首宗監理沙盒 手機門號可申請信用卡信貸,產經,2018/09/19 08:35,https://www.cna.com.tw/news/afe/201809180308.aspx,（中央社記者邱柏勝台北18日電）金管會今天核准首宗金融科技創新實驗申請案，中華電信門號持有人即便過去未曾在金融機構留下任何聯徵紀錄，透過中華電信的身份認證機制，仍可在凱基銀行申請信用卡或個人信貸。此「金融監理沙盒（金融科技創新實驗）」，對一些尚未與銀行往來，信用紀錄是張白紙的「信用小白」，例如學生、社會新鮮人而言，只要他們擁有中華電信門號，連6個月正常繳交電話費，且沒有被列電信黑名單，就可以憑電信門號申請信用卡與個人信貸。金管會表示，這創新實驗若能成功，可望作為未來純網銀經營模式的示範，預計將於12月5日正式進入沙盒實驗，為期一年。根據凱基銀行與中華電信所提案的內容，是由中華電信提供處理過的客戶資料給凱基銀行，再由凱基銀行的評分系統進行信用評比，根據客戶以往繳款有無欠繳紀錄，或者根據其他項目建立評分模型，最終進行信用卡核發與信貸業務的差別化定價。而透過電信認證方式申請信用卡與信貸業務的客戶條件，仍比照一般的信用卡與信貸申請資格，申請年齡須在20歲以上，信用卡額度上限為新台幣25萬元，個人信貸額度最高為50萬元。金管會指出，本實驗案預計開放4000人申辦，授信總額度為2億元，但授信金額已達1.6億元時，即不再受理新申請案；另外，若冒貸申請案達4件，即會啟動退場機制，宣告實驗終止。金管會綜合規劃處處長林志吉表示，凱基銀行與中華電信合作的金融科技創新實驗案，對凱基銀行而言，可以開拓以往不在銀行體系的客戶，而對中華電信而言，也能開拓金融相關業務。外界認為可望成為中華電信未來開辦純網銀的基礎。媒體提問，部分中華電信門號持有人與使用人並非同一人，例如父母會幫小孩辦手機，或者門號持有人雖是小孩，但繳費者仍是父母。凱基銀行要如何取得申請人的徵信？對此林志吉表示，凱基銀行會有控管機制，例如電信費是從父母帳戶自動扣款，當小孩想用自己的門號申請信用卡或貸款，就會被拒絕（reject）。媒體進一步問，若冒貸案達4件，該實驗案宣告終止，那凱基銀行已經放款的部分，是否會要求申貸人立即歸還？林志吉表示，凱基對客戶的貸款仍依合約進行，不會立刻要求客戶還款。（編輯：林孟汝）1070918
可課稅美國商品所剩不多 中國仍有其他武器,產經,2018/09/18 20:04,https://www.cna.com.tw/news/afe/201809180310.aspx,（中央社北京／華盛頓18日綜合外電報導）美國總統川普宣布，將對新一批總值2000億美元中國商品加徵關稅。中國則揚言，對600億美元的另一批美國產品課稅。這是北京的報復目標總額首度和美國不對等。美國「華盛頓郵報」（The Washington Post）報導，中國堅稱，其有充分能力抵擋可能無限期延續的地緣政治角力衝擊，即使該國今年的成長率預料會趨緩。自1月以來，中國人民銀行已放手讓人民幣貶值約5%，讓該國出口品在海外市場具有優勢，不過也讓中國進口的外國商品變貴。分析家表示，人民銀行可能不會允許人民幣有太多繼續貶值的空間，因為弱勢的人民幣可能導致更多資產撤離中國。麥格理大宗商品及全球市場公司（Macquarie Commodities and Global Markets）中國首席經濟學家胡偉俊（Larry Hu）表示：「人民幣走弱可能有助於抵消新關稅的衝擊，不過中國自己也會受傷。」川普計劃對中國輸美的約半數產品加徵關稅，北京發現自己無法對同等總值的美國產品進行報復，因為中國自美進口額遠低於對美出口額。川普17日表示，自24日起對總值2000億美元的中國輸美商品課徵10%關稅。在此之前，美國今夏即已對500億美元中國產品加徵關稅。美國去年共自中國進口總值約5000億美元的商品。中國目前共對總值500億美元的美國商品課徵報復性關稅，並揚言對另一批600億美元產品進行報復。不過北京手中還未課稅的美國商品越剩越少—中國去年自美進口商品總額約僅1300億美元。北京已警告，會採取「數量型和質量型」相結合的綜合措施，進行強有力的反制。這暗示中國手中握有關稅以外的報復武器。以下是國際媒體列出中國可以採取的非關稅報復選項：●刁難美商中國當局可能會無所不用其極，為難境內的美資企業。中國是全球第二大航空市場，美國航太巨擘波音公司（Boeing Co.）的1/4飛機都是在中國售出。中國官媒「環球時報」曾警告，北京可能「調整（飛機的）銷量」。北京可能比較不傾向傷害對中國忠誠的美國企業，例如中國國營企業持有重大比率股份的麥當勞（McDonald's）、通用汽車（General Motors）或福特汽車（Ford Motor）等。●杯葛美國中國國營媒體至今仍相當克制，未像先前北京和日本、南韓爆發外交齟齬時那樣，鼓動反美情緒。不過中國社會科學院美國研究所所長吳白乙警告：「一般中國百姓都積極關注國際議題。」吳白乙無法確定中國輿論的冷靜能維持多久。他說：「若13億中國人的心被美國人傷害，恐怕非常難以修補。」●中斷交流吳白乙還指出：「中國家長一直樂於送孩子到美國深造，但若美國繼續這樣，我們可以把孩子送往英國、德國，甚至巴西或印度。」目前中國每年約有35萬人前往美國留學，是部分美國大專院校的重要財源。每年也有數以十萬計的中國人前往美國觀光，在比佛利山（Beverly Hills）名店街羅迪歐大道（Rodeo Drive）或賭城拉斯維加斯（Las Vegas）狂灑錢。●官僚主義由於中國的反壟斷監管機關遲不批准，美國半導體巨擘高通（Qualcomm）今夏取消購併荷蘭競爭對手恩智浦半導體公司（NXP Semiconductors NV）交易案。外界普遍認為，前述交易案是美中關係緊張下的受害者，北京藉此證明，中國的龐大市場擁有左右國際購併交易命運的力量。中國也曾宣稱，該國今年實施的金融開放，允許外資機構取得中國本地商業銀行的多數股權。不過專家表示，若美中緊張關係持續升高，美國金融放款機構可能會被中國排除在審批和許可範圍之外。中國美國商會（American Chamber of Commerce in China）主席蔡瑞德（William Zarit）指出，白宮認為，華府對2000億美元的新一批中國商品課稅後，北京就會舉白旗投降，「不過前述假設可能低估中國繼續以其人之道還治其人之身的能耐」。●美國公債和人民幣部分分析家指出，中國是美國公債的最大持有者，共持有將近1兆2000萬美元的美國國庫券。不過中國若拋售部分美國公債，可能會自食惡果，蒙受虧損。人民幣的情況也一樣。分析家表示，人民幣貶值可抵消美國關稅的衝擊效應，不過中國決策者並不想承受資金外逃的風險。（譯者：陳宜君/核稿：何宏儒）1070918
綠島加油站漏油 中油3個月內提污染調查評估,產經,2018/09/18 20:20,https://www.cna.com.tw/news/afe/201809180312.aspx,（中央社記者廖禹揚台北18日電）台東縣綠島中油加油站漏油，環保署今天公布地下水採檢報告，其中苯超標294倍，中油表示，會負起整治責任，將在3個月內提出污染調查評估計畫，待環保署核可再提污染整治計畫。中油綠島加油站7月漏油3.7公秉，環保署檢測報告今天出爐，土壤檢測都合格，但地下水部分有苯、甲基第三丁基醚（MTBE）、總石油碳氫化合物（TBH）、甲苯及萘等5項化學物質超標，其中苯超標達294倍，中油面臨開罰及整治復原責任。中油副總經理畢淑蒨表示，中油會負起整治責任，在3個月內提出污染調查評估計畫，待環保署審核後再提污染整治計畫，環保署同意後就會著手進行整治作業。畢淑蒨也說明，先前從鄰近居民使用地下水井取樣，委託SGS化驗結果的確合格，而環保署取樣位置則是在加油機附近，靠近洩漏源，因此污染濃度較高。中油表示，漏油會朝向民宅使用地下水擴散，已第一時間提供鄰近民宅自來水接管，即使檢測結果未超標，未來在整治期間內也都會提供民眾乾淨用水，並持續監控污染擴散狀況。中油說明，這次洩漏的95無鉛汽油揮發性高，土壤部分目前已進行土壤氣體抽除，並持續進行中，地下水則可能採用注氣抽氣合併工法，去除溶解性污染物質，如有必要，也可能採用化學氧化或攔截工法等方式，後續報告中會視污染區域狀況評估至少3到4種方式，提出最適當工法組合。根據環保署統計，國內加油站地下環境污染整治時間約需3到5年，不過，中油指出，這次漏油到發現時間較短，整治時間有望較平均值更短，但得視當地地質及水文條件而定。此外，高雄市中芸大排出現來源不明的黑色浮油污染，中油今天澄清，該浮油為使用過的潤滑油脂，非中油生產油品，且中油也未在中芸大排設置排放口，並非中油造成，當地環保局正持續追查來源。不過，中油仍配合當地環保局協助提供機具及人力，指派人員設置攔油索，防止大量浮油漂進中芸漁港，並調派2部抽油車，進行油污圍堵及回收處理，避免污染擴大。（編輯：黃國倫）1070918
美發動貿易戰歷史 台灣紡織半導體趁勢崛起,產經,2018/09/18 20:33,https://www.cna.com.tw/news/afe/201809180318.aspx,（中央社記者韋樞台北18日電）美國針對2000億美元中國商品加徵10%關稅。台經院景氣預測中心主任孫明德認為，美國歷次與他國貿易摩擦從來占不到便宜，且造就台灣紡織和半導體業興起，這次台灣等著擇肥而噬。孫明德今天下午參加中信房屋第3季宅指數記者會做以上表示。孫明德表示，美國1930年代的斯姆特-霍利關稅法提高國外進口農產品等2萬種商品關稅，導致他國一致對抗，加重經濟大蕭條危機，被認為是引發第二次世界大戰的一個原因。美國前總統尼克森在1971年要求加徵10%進口附加稅，日本和歐洲要求立即撤回，最終附加稅被廢止，日本向歐洲的出口增加，導致貿易摩擦。而日美貿易摩擦從1970年開始持續到90年代，美國對日本的紡織、鋼鐵、半導體、及汽車等商品施壓，並發動制裁關稅。日本接受出口管制，於1971年簽下「纖維協定」，日本自主限制化纖製品5%、毛纖製品1%出口，有效期3年，同時擴大對美投資、開放市場等要求，而日本相關產業外移弱化，造成泡沫經濟成因之一。1986年日美之間半導體協定，日本承諾自主限制出口並接受外國半導體進口。孫明德指出，美國過去與他國貿易摩擦時占不了多少便宜，日美半導體協定後，美國要求日本每年進口15%半導體，美國每年調查進口比例。但美國半導體為軍用商品，不符合日本民生消費需要，因此日本將技術傳授給韓國三星及LG，由韓國進口達成15%要求，但最終美國並未因此受益，日本半導體卻開始走弱、韓廠實力快速提升。孫明德說，台灣的紡織業和半導體業也就是在1970年代和1990年代趁勢開始茁壯，奠定今天這兩大產業雄厚的基礎；而這次美國再度掀起和中國的貿易戰，中國打算打長期戰，拖得愈久對美國愈不利，因為歷次都是美國內部不團結，消費者發聲抗議物價過高，政府最後只好妥協而占不到便宜。他強調，對台灣來說，只要美中貿易戰打得愈久，才愈能享有廠商轉單或回來台灣生產的利多。前次造就台灣紡織業和半導體業的興起，這次美國針對中國銷美2000億美元的化學、紡織，及食品等民生用品課稅，兩岸供應鏈關聯較深的資通訊產品比重不高，若是未來再進一步對約2600億美元商品課高關稅，蘋果手機遭波及時，相關供應鏈的資通訊業可能就會是下一個更蓬勃發展的產業。（編輯：楊凱翔）1070918
證交所明年業務目標  日均成交值1250億,證券,2018/09/18 20:49,https://www.cna.com.tw/news/afe/201809180323.aspx,（中央社記者田裕斌台北18日電）台灣證券交易所今天召開董事會，定下明年業務目標，除了申請上市掛牌家數要有28家外，日均成交值則估為新台幣1250億元。證交所表示，在28家申請上市掛牌中，包括國內上市公司20家，來台上市的外國企業要有8家。證交所副總經理陳麗卿表示，對於明年上市公司預估值會參考財政部對證交稅的預估以及對整體經濟情勢的判斷，不過，今年截至9月14日止，日均成交值達1376.08億元，明年整體成交值希望能不受到美中貿易戰影響而減少。除了對明年成交值及申請上市家數的預估外，陳麗卿指出，2020年交易方式將改為逐筆交易，模擬交易平台建置以及宣導，也將是明年的業務重點。（編輯：李信寬）1070918
美對中新關稅剔除稀土 暴露依賴中國弱點,產經,2018/09/18 22:09,https://www.cna.com.tw/news/afe/201809180327.aspx,（中央社北京18日綜合外電報導）美國昨天宣布對2000億美元中國輸美貨品加徵關稅的最終清單，當中未包括製作磁鐵、雷達和消費電子產品所需的原料稀土元素。這凸顯美國對這類戰略礦物的需求，仍依賴中國供應。根據美國地質調查所（USGS）的資料，中國是全球最大稀土產國，也是美國最主要稀土供應國。稀土元素包含15種鑭系元素加上鈧和釔，這些金屬礦物在美國產業界應用廣泛，從噴射機的發動機、手機到油氣鑽井。美方關稅原本鎖定的金屬項目，大多包括在美國內政部5月公布對國家安全和經濟繁榮至關重要的35種礦物中。稀土、合成稀土和一系列稀土氧化物與氯化物，也全部名列美國貿易代表署（USTR）7月公布計劃對2000億美元中國輸美貨品加徵關稅的初步清單上。然而，昨天公布的關稅最終清單並未包括稀土。新關稅將在24日上路，稅率為10%。最終清單還剔除永久磁鐵和能夠製成永久磁鐵的材料，包括稀土釹和鐠的氧化物。根據美國貿易代表署統計，去年美國進口這類貨品的規模達1億9120萬美元。里昂證券（CLSA）駐雪梨資源分析師凱利（Dylan Kelly）指出，美國8月通過法律，禁止2019財政年度向中國採購軍事用稀土磁鐵，這顯示美方知道稀土的戰略重要性。凱利表示，美方立法「清楚凸顯美國暴露在任何中國供應鏈中斷的風險程度有多高」。美國政治人物「應該非常了解，美國過去以來已讓自己落入困境」。凱利還說，中國是否將利用這點報復美國，或未來和美國談判時，以稀土作為籌碼或「策略槓桿」，仍有待觀察。「不過，這顯然是許多投資人會關注的焦點。」（譯者：張正芊/核稿：何宏儒）1070918
強化雙邊連結 波蘭官員盼台商前往投資,產經,2018/09/18 22:46,https://www.cna.com.tw/news/afe/201809180328.aspx,（中央社記者侯姿瑩台北18日電）波蘭投資貿易台北辦事處上週開幕。波蘭企業及技術部次長柯慶斯基表示，希望藉此強化台波雙邊連結；也盼未來有更多台商赴波蘭參與基礎建設、資通訊等領域的投資。柯慶斯基（Tadeusz Koscinski）日前訪台接受中央社專訪時表示，新設辦事處主要目的之一是幫助波蘭企業找到台灣的合作夥伴；波蘭希望未來可以直接將產品直接輸出到台灣。他舉例，波蘭有許多優質農產品，包括雞肉、蘋果。其中，波蘭的蘋果近期將輸出到台灣。同時，柯慶斯基也說，台灣與波蘭的企業在資通訊產業、金融科技、生物科技、太陽能等產業，有許多合作空間。他指出，新設立的投資貿易辦事處將提供台灣企業更多關於投資波蘭的資訊，另外，也將幫助波蘭企業進一步了解產品輸出到台灣的機會，以及與台灣企業合作的機會。柯慶斯基也表示，希望有更多台灣企業赴波蘭投資基礎建設，包括鐵路、機場等，以及資通訊、航空等產業。波蘭投資貿易台北辦事處是波蘭投資貿易局（PAIH）在台灣開設的海外貿易辦事處；PAIH是波蘭政府招攬海外投資人的專責機構。波蘭台北辦事處也表示，作為波蘭在台官方代表處，將全力協助PAIH的台北辦事處推動工作。關於波蘭為鼓勵外來投資提供的誘因，柯慶斯基表示，波蘭政府提供在經濟特區內投資的廠商10到15年免公司稅的優惠。另外，對於投資具有戰略重要性產業的企業，波蘭也提供補助金。此外，對於台灣與歐盟洽談雙邊投資協定，柯慶斯基說，波蘭支持開放、自由的貿易協定，包括降低關稅與非關稅的貿易障礙，以及保障投資者的機制。日前率團來台參加第八屆台波經濟諮商會議的柯慶斯基也表示，希望盡快再度訪台，率領波蘭企業來台與潛在的台灣合作夥伴見面交流。（編輯：林沂鋒）1070918
川普新關稅：智慧表躲過一劫  連網設備遭波及,產經,2018/09/18 21:09,https://www.cna.com.tw/news/afe/201809180329.aspx,（中央社紐約17日綜合外電報導）美國總統川普宣布對價值2000億美元的中國輸美商品加徵關稅。蘋果公司的Apple Watch和Air Pods幸運躲過一劫，但很多科技公司使用的連網設備等科技產品將受到影響。根據美國有線電視新聞網（CNN）報導，川普政府資深官員表示，智慧表和藍芽裝置等消費性電子產品，不在美國下週起加徵10%關稅的中國商品清單中。他說：「我們正在想辦法，我們認為消費性產品不會涵蓋在內。」但路由器類的連網設備產品將面臨關稅。戴爾公司（Dell）、思科公司（Cisco）、瞻博網路公司（Juniper Networks）、慧與科技公司（HPE）等曾表示，美國對連網設備加徵關稅，可能對公司獲利造成影響，恐造成美國就業流失。根據分析師，谷歌（Google）、臉書（Facebook）和亞馬遜（Amazon）等公司的雲端運算用的都是中國的路由器和數據機。美國消費科技協會（Consumer Technology Association）發聲明說，雖樂見特定消費產品自關稅清單中移除，卻還是認為關稅是「糟糕的政策」。協會說：「我們尤其關切針對印刷電路板、路由器和連網設備等課徵報復性關稅。那會阻礙我們在5G的領先，形同課徵網路稅，對企業帶來不確定性。」（譯者：劉淑琴/核稿：羅苑韶）1070918
理監事會前 央行再次說明國際收支資金凈流出,產經,2018/09/18 21:54,https://www.cna.com.tw/news/afe/201809180342.aspx,（中央社記者邱柏勝台北18日電）央行今天發布台灣國際收支資金淨流出補充說明，強調經常帳順差「反映」國內超額儲蓄，是國際上相當普遍的用法，但「恆等式關係」不等於「因果關係」，另也重申匯率對貿易的影響已弱化。央行總裁楊金龍8月底才曾針對國際收支議題，罕見親自召開記者會說明，但今天央行又選在理監事會議前一週，針對國際收支議題再次出具6頁報告，顯見央行對國際收支議題的重視。央行今天出爐的國際收支資金淨流出的補充說明資料中，強調楊金龍當時以國民所得會計恆等式說明經常帳順差，是反映國內的超額儲蓄，但不具因果關係。但在國際上是相當普遍的用法與觀點，表示一國的國內資源無法完全於國內使用，而是用於國外。因此，諸如國際貨幣基金（IMF）的外部部門報告（External Sector Report），與美國每半年公布的匯率政策報告，對於經常帳長期順差國家，政策建議多以提振國內需求（包含消費與投資），或採行擴張性的財政政策或財政改革，減緩超額儲蓄累積。反之，對於經常帳逆差的國家，則建議增加國民儲蓄（national savings）以縮減外部不平衡。另外，針對經常帳調整的結構性因素，楊金龍在8月的記者會中，曾以瑞士為借鏡，今天報告也補充說明。央行表示，台灣與瑞士的情況類似，皆有龐大的國外淨債權部位，國外投資所得收入大於支出、人口老化速度快，以及三角貿易發達等現象，均導致經常帳順差擴大。因此不宜單以經常帳順差來評估新台幣的公平價值。此外，央行也引用國際清算銀行（BIS）的研究指出，隨全球價值鏈興起，原以出口最終財為計算基礎的實質有效匯率指數（REER），已不能完全適用於當前中間財貿易盛行的相關分析。央行表示，台灣出口以中間財為主，全球價值鏈參與度高達67.7%，且商品出口集中電子資通訊產品，出口對進口的引申需求大，因此匯率變動對進口的影響，將抵銷其對出口的效果。整體而言，匯率對貿易餘額的影響不若以往。央行進而指出，在金融自由化風潮下，各國金融帳開放，短期國際資本快速移動，金融交易已成為影響各國匯率的重要因素。自1980年台灣開放外國專業投資機構（QFII）直接投資國內證券市場以來，隨著經濟規模擴大與金融帳開放，外資鉅額且頻繁的外匯交易，已成為影響新台幣匯率變動的主因。央行表示，當前各國貨幣政策分歧，國際熱錢流竄，加上國際重大事件頻傳，國際金融市場與匯率波動加劇，已阻礙匯率對經常帳與經濟基本面的調整。（編輯：林沂鋒）1070918
主要車廠涉共謀規避開發反汙染科技 歐盟調查,產經,2018/09/18 22:32,https://www.cna.com.tw/news/afe/201809180350.aspx,（中央社布魯塞爾18日綜合外電報導）「柴油門」汽車排氣數據舞弊事件爆發3年後，飽受醜聞衝擊的汽車業再遭重創，德國數大車廠涉嫌共謀規避積極開發反汙染科技的指控，歐洲聯盟今天展開深入調查。主管市場競爭事務的歐盟執行委員維斯塔哲（Margrethe Vestager）表示，BMW集團、戴姆勒集團（Daimler）和福斯汽車集團（Volkswagen）疑似達成共識，在開發和推出汽、柴油客車反汙染系統上「互不競爭」。維斯塔哲表示：「若證實為真，這項共謀行動可能剝奪消費者購買較低汙染車輛的機會，儘管製造商已掌握相關科技。」歐盟展開調查3年前的此時，美國揭發一項驚人事實：福斯汽車為了在排氣檢測中作弊，在行銷全球的數以百萬計柴油車中安裝控制軟體。歐盟的最新調查行動並未針對所謂的「減效裝置」（defeat devices），而是專注調查能減少引發霧霾汙染的先進控制系統。歐盟執行委員會表示，調查是以「五大集團」的會議和串謀作為證據。五大集團包括BMW、戴姆勒、福斯及其旗下的奧迪（Audi）和保時捷（Porsche）。（譯者：陳宜君/核稿：林治平）1070918
