標題,分類,時間,網址,內文
美企業財報亮麗國際油價飆漲 歐股收高,證券,2019/04/24 00:46,https://www.cna.com.tw/news/afe/201904240004.aspx,（中央社倫敦23日綜合外電報導）由於美國企業公布一系列正面財報，加上美國宣布一些進口伊朗石油國家所享有制裁豁免待遇下週都將終止，國際油價應聲漲至今年最高點，支撐石油類股，歐洲主要股市今天收紅。倫敦FTSE 100指數上揚0.9%，收7523.07點。法蘭克福DAX 30指數上揚0.1%，以12235.51點作收。巴黎CAC 40指數上漲0.2%，收在5591.69點。（譯者：陳政一）1080424
白宮首席經濟顧問：對美中達成貿易協議審慎樂觀,產經,2019/04/24 03:46,https://www.cna.com.tw/news/afe/201904240007.aspx,（中央社華盛頓23日綜合外電報導）美國總統川普的首席經濟顧問柯德洛（Larry Kudlow）今天表示，美國和中國的貿易談判正取得進展，他對達成協議的前景「審慎樂觀」。國家經濟會議主席柯德洛在全國記者俱樂部（National Press Club）午餐會表示，美中仍有問題要解決，正討論以「交換訪問」做為目前談判的一部分。他回答記者提問表示：「我們還沒到達成協議的地步，但是我們取得很大的進展。我們已較美中貿易史任何時期走得更遠、更深、更廣、規模更大。」「我們距達成協議越來越近，我們仍在解決問題，所謂的結構問題，技術轉移。強制執行所有權絕對重要，降低障礙以買賣農產品和工業商品。這些議題都擺在談判桌討論。」美國正尋求中國改革經濟結構，包括降低工業補貼，以及停止強迫尋求進入中國市場的美國企業技術轉移。（譯者：陳政一）1080424
企業財報較預期佳 美股收高,證券,2019/04/24 06:19,https://www.cna.com.tw/news/afe/201904240012.aspx,（中央社紐約23日綜合外電報導）由於一連串企業財報較預期佳，緩和經濟成長放緩的憂慮，美股今天收高，標準普爾和那斯達克指數都收在歷史高點。道瓊工業指數上揚145.34點或0.55%，以26656.39點作收。標準普爾指數上揚25.71點或0.88%，收在2933.68點。科技股那斯達克指數上揚105.56點或1.32%，收8120.82點。（譯者：陳政一）1080424
波灣產油國對增產審慎以對 國際油價續漲,產經,2019/04/24 08:09,https://www.cna.com.tw/news/afe/201904240013.aspx,（中央社紐約23日綜合外電報導）在美國宣布一些進口伊朗石油的國家所享有制裁豁免待遇下週都將終止後，由於消息人士透露波斯灣產油國只在有需求時才會增產，國際油價今天推升到約6個月高點。紐約商品交易所西德州中級原油5月交割價上漲75美分，以每桶66.30美元作收。倫敦北海布倫特原油6月交割價上揚47美分，收在每桶74.51美元。（譯者：陳政一）1080424
美股財報助威 標普500那斯達克創收盤新高,證券,2019/04/24 08:09,https://www.cna.com.tw/news/afe/201904240015.aspx,（中央社記者尹俊傑紐約23日專電）隨著聯準會貨幣政策立場轉趨寬鬆，美股今年表現銳不可當，加上企業財報普遍優於預期，標普500指數與那斯達克綜合指數今天創收盤新高，推特股價大漲逾15%，表現突出。標準普爾500指數開高走高，終場上漲25.71點，漲幅0.88%，收在2933.68點，改寫去年9月20日收盤所創2930.75點紀錄，下一步將挑戰歷來盤中最高水準2940.91點。那斯達克綜合指數收盤勁揚105.55點，漲幅1.32%，攻上8120.82點，超越去年8月29日收盤締造的8109.69點。道瓊工業指數上漲145.34點，漲幅0.55%，收在26656.39點，再漲1.1%就能創歷史新高。美國聯邦準備理事會（Fed）今年首季未升息，並暗示利率將持穩一段時間，貨幣政策立場轉彎，加上美國經濟表現比預期穩健，吞下定心丸的投資人再度「錢進」股市等高風險資產，帶動去年第4季慘跌的美股強勢反彈，形成V型反轉格局。去年第4季利空紛陳，全球金融市場瀰漫悲觀氣氛，美股賣壓沉重，回吐前3季累積的漲幅，那斯達克綜合指數一度從前波高點拉回逾20%，陷入熊市，標普500與道瓊指數也在熊市邊緣徘徊，美股從2009年3月展開的史上最長牛市岌岌可危。美股今年撥雲見日，標普500指數年初以來漲幅逾17%，創32年來最猛開年表現；以科技股為主的那斯達克綜合指數漲幅更達22%，創28年來最佳開年表現。美股財報季4月中旬展開以來，指標企業財報普遍優於預期。根據金融數據供應商FactSet，業績已出爐的100多家標普500指數成分企業中，79%獲利優於市場預期，比例高於前一季的69%。社群媒體推特（Twitter）、航太大廠洛克希德馬丁（Lockheed Martin）和工業巨擘聯合技術公司（United Technologies）在財報利多加持下，今天股價表現突出。推特公布月活躍用戶數達3.3億，優於市場預期，股價飆漲15.6%。洛克希德馬丁公布航太與飛彈等主要事業營業利潤率亮眼，股價大漲5.7%。道瓊指數成分股聯合技術公司與可口可樂（Coca-Cola）漲幅分別達2.3%、1.7%。隨著全球經濟成長趨緩，蘋果公司（Apple）等指標企業下修全年財測，美股財報季揭開序幕前，市場預估標普500指數成分企業獲利恐出現3年來首次衰退，投資人放低期待，使得企業更容易繳出優於預期的業績。去年一度淪為投資人「提款機」的指標科技股今年再獲青睞，由臉書（Facebook）、亞馬遜（Amazon.com）、蘋果、Netflix及Google母公司Alphabet組成的「FAANG股票」再現光芒，去年第4季蒸發的市值幾乎全數收復，再度扮演大盤中流砥柱。臉書、亞馬遜和微軟（Microsoft）預定本週公布財報，投資人樂觀以待，這3檔個股今天漲幅都超過1.2%，下週財報出爐的蘋果股價則上漲1.4%。（編輯：施燕飛）1080424
台股站上11000點 觀察財報及產業動態效應,證券,2019/04/24 08:42,https://www.cna.com.tw/news/afe/201904240021.aspx,（中央社記者韋樞台北24日電）台股昨天在蘋概三雄和5G概念股帶動下，指數量縮站上11000點；近日市場資金集中5G概念股，漲多個股回檔，法人表示，後續可觀察首季財報、車電展、中國聯通5G大會效應。由於美國企業公布一系列正面財報，加上美國宣布一些進口伊朗石油國家所享有制裁豁免待遇下週都將終止，國際油價應聲漲至今年以來最高點，支撐石油類股，歐洲主要股市收紅。美股受惠企業財報普遍優於預期，經濟成長憂慮緩和，道瓊工業指數上揚145.34點或0.55%，以26656.39點作收；標準普爾指數上揚25.71點或0.88%，收在2933.68點；那斯達克綜合指數上揚105.56點或1.32%，收8120.82點。標準普爾和那斯達克綜合指數均收在歷史高點。近日台股逐步量縮，指數靠著蘋概三雄台積電盤堅，加上鴻海、大立光高點回檔後反彈，以及5G概念股撐盤，指數5度上攻11000點，終於收在11000點之上。惜量能未同步放大，台股仍處於高檔整理格局。法人表示，台股在11000點前盤整太久，不少個股漲多拉回，今天台股若能繼續上攻，連續數天收在11000點之上，則11000點會從壓力轉為支撐。法人指出，現階段市場資金集中在5G概念股，先前散熱、印刷電路板族群漲多後，資金轉到網通族群，但仍在5G相關供應鏈概念股中輪動；後續投資人不妨多注意中國聯通5G合作夥伴大會訊息，將影響台灣5G相關供應鏈。「2019台北國際車用電子展」今天開展，各家業者將展出最新自駕車或電動車相關技術，投資人可觀察全球大型車廠對電動車和自駕車動態趨勢及銷售量所帶動相關零組件概念股的成長。（編輯：楊玫寧）1080424
台股開盤漲28.34點,證券,2019/04/24 09:04,https://www.cna.com.tw/news/afe/201904240026.aspx,（中央社台北24日電）台北股市今天開盤漲28.34點，加權股價指數為11054.02點，成交金額新台幣21.71億元。1080424
新台幣開盤升0.5分 為30.853元,產經,2019/04/24 09:07,https://www.cna.com.tw/news/afe/201904240027.aspx,（中央社台北24日電）台北外匯市場新台幣兌美元匯率今天以30.853元開盤，升0.5分。新台幣兌美元開盤交易區間為30.853元至30.840元。1080424
蘋果傳第4季推2款新AirPods 艾克爾切入供應鏈,產經,2019/04/24 09:19,https://www.cna.com.tw/news/afe/201904240031.aspx,（中央社記者鍾榮峰台北24日）蘋果新款AirPods耳機傳新進展。分析師預估，蘋果可能最快在今年第4季推出2款新AirPods，其中封測大廠艾克爾有機會切入系統級封裝供應鏈。天風國際證券分析師郭明錤出具報告預期，蘋果最快可能在今年第4季推出2款新AirPods，並預計在今年第4季到明年第1季量產，一款為全新外觀設計，售價高於目前款式，另一款外觀設計與目前AirPods相同，售價也與目前款式相同。報告預期，這兩款新AirPods共通點為內部設計捨棄目前的SMT+軟硬板設計，改採系統級封裝（SiP）設計以提升組裝良率、節省內部空間與降低成本。從出貨量來看，報告預估今年與2020年AirPods出貨量分別可達5200萬組與7500萬到8500萬組。從供應鏈來看，報告預估，封測大廠艾克爾（Amkor）是新AirPods受惠者，可能是SiP獨家供應商，預期Amkor將在今年下半年進入試產，並在今年第4季到明年第1季量產，新訂單可能自第4季開始對Amkor有顯著貢獻。此外報告預估立訊是全新外觀設計新款AirPods的主要組裝廠商。歌爾是另一款新AirPods的主要組裝廠商，預期新AirPods量產後，歌爾訂單可望提升到30%到40%。（編輯：李信寬）1080424
台積電股價創新高 市值突破7兆元,證券,2019/04/24 10:58,https://www.cna.com.tw/news/afe/201904240032.aspx,（中央社記者張建中新竹24日電）晶圓代工廠台積電股價持續攀高，今天開盤跳空達新台幣270元，創歷史新高價，市值突破7兆元關卡，同創歷史新高，並改寫台股單一企業市值歷史新高紀錄。台積電製程技術領先全球，不僅搶先量產7奈米技術，並領先同業至少一年時間。台積電還領先商用極紫外光技術量產7奈米，也搶先完成5奈米設計基礎架構。隨著聯電與格芯(GlobalFoundries)營運策略紛紛轉向，不再競逐先進製程技術，台積電製程技術領先效益進一步發酵，不僅高通(Qualcomm)訂單回籠，超微(AMD)先進製程產品也轉往台積電代工生產。台積電今年受全球經濟趨緩，手機市場趨於飽和，比特幣市場需求急凍，半導體供應鏈庫存問題嚴重等多重因素影響，營收將僅微幅成長，不過，法人看好台積電未來營運依然成長可期。外資連續8個交易日共買超台積電8萬5047張，帶動台積電股價不斷走高，今天延續強勁走勢，開盤達270元，漲2元，漲幅0.74%，創歷史新高價，市值也突破7兆元，同創歷史新高紀錄。（編輯：楊玫寧）1080424
半導體設備出貨連3個月降 創28個月低,產經,2019/04/24 09:22,https://www.cna.com.tw/news/afe/201904240035.aspx,（中央社記者張建中新竹24日電）北美半導體設備製造商3月出貨金額持續滑落，達18.3億美元，連續3個月下滑，並創28個月新低。據國際半導體產業協會(SEMI)估計，3月北美半導體設備製造商出貨金額18.3億美元，較2月的18.7億美元減少1.9%，也較去年同期減少24.6%，並為2016年12月來新低水準。3月北美封測設備製造商出貨較2月略有改善，只是3月整體北美半導體設備製造商出貨金額持續滑落，SEMI預期，北美半導體設備供應商在今年剩下時間的出貨金額將微幅增長。因應保守市況，動態隨機存取記憶體(DRAM)廠南亞科已決定將今年資本支出降至新台幣70億元，降幅達34%；SEMI先前預期，今年記憶體廠設備支出恐將減少30%，並將連帶影響今年全球晶圓廠設備支出減少14%。（編輯：林孟汝）1080424
郭台銘擬選總統 顧立雄：要做好企業接班資訊揭露,產經,2019/04/24 09:50,https://www.cna.com.tw/news/afe/201904240038.aspx,（中央社記者邱柏勝台北24日電）鴻海董事長郭台銘擬參選總統，金管會主委顧立雄今天表示，這是創業第一代的生涯規劃，也涉及企業接班議題，會請證交所要求鴻海，針對企業接班人選做好重大資訊揭露。郭台銘日前宣布投入國民黨總統提名人黨內初選，引發熱議，也導致近期鴻海股價大幅波動。顧立雄今天出席立法院財政委員會備詢，會前接受媒體訪問。有媒體提及，金管會是否有關切鴻海近期股價波動，並呼籲投資人須注意鴻海基本面？顧立雄回應，投資人本來就應該關注基本面，鴻海現在面臨的，應該是創業第一代有不一樣的生涯規劃，企業接班是否有做好的問題。顧立雄說，金管會將請證交所，要求鴻海若有企業接班人選，務必做到重大資訊揭露。（編輯：蘇志宗）1080423
明基三豐首季每股賺0.46元 受惠新事業發酵,證券,2019/04/24 09:41,https://www.cna.com.tw/news/afe/201904240040.aspx,（中央社記者韓婷婷台北24日電）明基三豐受惠新事業及新通路布局成效發揮，帶動第1季營收、獲利成長，每股盈餘0.46元，年增283%。展望第2季，明基三豐表示，各產品線均將延續推廣力道，持續深化客戶關係。明基三豐經董事會通過第1季財報，營收新台幣3.33億元，年增28%，稅後盈餘2311萬元，歸屬於母公司業主淨利為2036萬元，較去年同期倍數增長，每股稅後純益（EPS）達0.46元。明基三豐總經理管新寶表示，在既有醫療設備與醫療耗材的技術與通路基礎下，拓展明基口腔、明基聽力、醫學影像，例如可攜式超音波等新事業領域，均逐漸看見成效。由於新事業投資達規模經濟，改善獲利體質，再加上第1季既有產品的新標案挹注，是第1季獲利表現比去年同期大幅成長的主要原因。明基三豐第1季持續推廣海外市場，參加杜拜及印度醫療展，也參與台灣地區的牙材展，展示第1台全國產自製的口腔掃描機，並和馬來西亞LKL集團簽訂經銷合作協議，共同拓展馬來西亞市場。在聽力市場方面，虹韻助聽器持續以提升台灣助聽器配戴率為目標，近來並將觸角延伸至關懷單側聽損兒。（編輯：張均懋）1080424
媒體控涉掏空誠美材  蘇震清：不實報導,產經,2019/04/24 10:17,https://www.cna.com.tw/news/afe/201904240041.aspx,（中央社記者王揚宇台北24日電）鏡週刊今天報導，民進黨立委蘇震清涉掏空誠美材。蘇震清表示，這是不實報導，已備妥相關資料，將向檢調進一步說明與澄清。鏡週刊今天報導，檢調偵辦股市金釵葉美麗涉嫌掏空誠美材集團弊案，有驚人發現；葉美麗在檢調偵訊時，供出名下近億元的郡宏光電股份有限公司股票，多是幫立委蘇震清所買，她只是蘇的人頭，雙方並簽有密約，已遭檢調查扣。蘇震清國會辦公室今天發出聲明稿指出，蘇震清否認有涉及誠美材公司經營權或掏空一事，對於郡宏光電股票的取得，沒有任何不法或有藉此獲取利益；地方服務處助理賴麗團名下所賣給茂豐、茂宇公司的郡宏公司股票，並非蘇震清所有。聲明稿表示，案件正由檢調偵辦，基於偵查不公開，不適合公開案情，但已備妥相關資料，將向檢調進一步說明與澄清。（編輯：林孟汝）1080424
白宮：制裁伊朗不會衝擊油價 美國大量供油,產經,2019/04/24 09:58,https://www.cna.com.tw/news/afe/201904240042.aspx,（中央社華盛頓23日綜合外電報導）白宮經濟顧問柯德洛（Larry Kudlow）今天表示，因為有美國大量的石油供應，因此加緊對伊朗制裁，對油價將「沒有實質衝擊」。柯德洛說：「我們是一個富含原油與天然氣的國家。」在美國制裁伊朗石油出口後，今天世界油價寫下今年來新高。白宮22日宣布，如果中國、印度、土耳其、日本、南韓、台灣、義大利與希臘繼續購買伊朗石油，5月起將面對美國制裁。即去年美國給予台灣等8個國家地區有關伊朗「石油制裁豁免國」（significant reduction exceptions）的許可，今年5月到期，將不再延長效期。儘管柯德洛說這對油價沒有實質衝擊，但今天布倫特原油達74.7美元一桶，為去年11月初以來新高，稍後價格略為回跌；西德州原油也創近半年新高，達每桶66.45美元。（譯者：紀錦玲/核稿：徐睿承）1080424
經長：新機組非填補中火除役缺口 夏季才是挑戰,產經,2019/04/24 09:50,https://www.cna.com.tw/news/afe/201904240044.aspx,（中央社記者廖禹揚台北24日電）台中市長盧秀燕表示，台中火力發電廠減量5成仍不影響供電，中火機組退場應不是問題；經濟部長沈榮津今天說，現在還未進入用電高峰期，「夏季才是挑戰」。沈榮津也指出，雖然近期有林口、大林、通霄等新機組陸續上線，但台電做電源開發規劃時，會考慮用電成長、應除役機組等，「這幾個機組不是針對台中電廠除役而去做規劃，是整體系統考量」。沈榮津表示，現在台商回台投資，工商企業界對穩定供電有所期待，經濟部會配合台中市要求，在許可情況下，盡量進行環保調度，但中火「退場有它的困難」。至於近期連續高溫，今年夏天是否有缺電疑慮，沈榮津表示，中央氣象局預測今年將有極端高溫氣候，台電確實要更謹慎因應，也跟氣象局密切聯繫，掌握氣象資料以做為機組調度依據，希望備轉容量率能維持在10%，以應付極端氣候變化。目前核二廠2號機等多部機組仍在歲修，中火3部機組因進行放流水改善而停機，台電先前說明，預計機組將在6月初陸續上線，備轉容量率也將逐步提升至10%。（編輯：李信寬）1080424
彭雪芬兼任新光金董事 顧立雄要求限期改善,產經,2019/04/24 13:56,https://www.cna.com.tw/news/afe/201904240048.aspx,（中央社記者邱柏勝台北24日電）台新金董事長夫人彭雪芬成為4家新光金家族控股公司董事長，金管會主委顧立雄今天表示，彭雪芬是台新金董事長吳東亮的關係人，若同時兼任新光金的董事，就違反「金金分離」。金管會已要求台新金限時提出改善方案。顧立雄今天上午出席立法院財政委員會備詢，會前接受媒體訪問。媒體提問，彭雪芬3月一口氣拿下新光金家族控股公司的董事長，成為新勝、王田毛紡、永光、允德4家公司的董事長，外界表示這是「台新金與新光金合併的第一步」，對此金管會有何看法。顧立雄表示，彭雪芬是台新金董事長吳東亮配偶、關係人，但同時兼任新光金的董事，就抵觸金融監督管理委員會「金金分離」的原則。他強調，彭雪芬不能以新光金大股東董事長的身分，同時擔任新光金的董事。至於彭雪芬擔任新勝、王田毛紡、永光、允德4家新光家族控股公司的董事長，顧立雄表示，那是上一代留下來的，單一家族持有的事業，金管會關注的是，彭雪芬不能以金控董事長關係人的身分，去擔任另一家金控公司的董事。台新金去年5月時曾表示，彭雪芬是因家族投資公司邀請，自2016年起以進賢投資代表人身分擔任新光金控董事，並非代表台新金控，且台新金對進賢投資無任何持股，強調進賢投資的新光金法人董事身分與台新金無關，但會配合金管會新規範辦理。媒體進一步追問，外界認為彭雪芬兼任4間新光家族控股公司董事長，是台新金與新光金合併的第一步，對此顧立雄有何看法？顧立雄表示，若整併有益整體金融業，站在政策角度，他對兩家金控合併「樂觀其成」，至於金金分離新規定，是今年7月1日上路，因此金管會已要求台新金限時提出改善方案。金管會銀行局局長邱淑貞補充，今年7月1日後，新選任董事一定不可以違反金金分離規定，但若公司願用高標準看待，提前改派董事，有助公司治理。（編輯：林孟汝）1080424
法人放AirPods利空 燿華華通股價受挫,證券,2019/04/24 10:30,https://www.cna.com.tw/news/afe/201904240053.aspx,（中央社記者江明晏台北24日電）蘋果傳今年第4季將推2款新AirPods，法人認為AirPods將改變設計，原先受惠者燿華、華通恐受影響，拖累燿華股價跌停、華通下挫；燿華回應，營運一切正常，客戶訂單也在追加。根據市場研究機構Counterpoint Research的調查，2018年全球無線耳機銷量多達4600萬台，其中，蘋果AirPods銷量達3500萬台，市占超過75%，看好2019年將是耳機成為重要市場的一年。天風證券分析師郭明錤去年底才發表報告指出，陸廠歌爾與台系的燿華為Google與Amazon類AirPods產品的獨家供應商，燿華同時更是蘋果AirPods最大受惠者。但郭明錤近期發表報告更改看法，預期蘋果今年第4季可能推出2款新AirPods，但因設計改變，可能影響台軟硬板大廠燿華、華通、韓廠Young Poong，預期立訊、歌爾、全球第2大封測廠Amkor為主要受惠者。燿華、華通今天股價受影響，燿華打入跌停至18.85元，爆出2.3萬張大量；華通下跌近4%，至26.5元。燿華3月合併營收新台幣17.27億元，月增47.73%，較去年同期成長15.79%；累計1至3月合併營收48.32億元，較去年同期成長8.79%；燿華今天回應指出，與客戶關係緊密，營運一切正常，客戶訂單也都在追加。郭明錤指出，蘋果今年可能於第4季推出2款新AirPods，且估計在2019年第4季至2020年首季量產，內部設計捨棄既有型號的SMT + 軟硬板設計，改採SiP設計；而這2款新AirPods，其中一款將擁有全新的外觀設計，售價將高於目前既有型號，而另一款外觀則與目前的AirPods相同，售價也將維持與目前一致。郭明錤表示，此2款新AirPods在改採SiP設計之後，將提升組裝良率、節省內部空間與降低成本，故正向看待新AirPods的需求與蘋果在TWS市場的領導地位，同時預期2019年與2020年AirPods出貨量分別可達5200萬與7500萬至8500萬台。（編輯：李信寬）1080424
電支法規鬆綁下一步  顧立雄：打破電支電票界線,產經,2019/04/24 10:34,https://www.cna.com.tw/news/afe/201904240057.aspx,（中央社記者邱柏勝台北24日電）金管會開放台灣電支機構可申請提供客戶在國外使用電支帳戶支付購物款項的服務，金管會主委顧立雄表示，電子支付開放是趨勢，未來希望打破電支與電票的界線，達到虛實整合。金管會昨天宣布，今天起開放台灣電支機構提供客戶在國外使用電支帳戶支付購物款項的服務，但須先向金管會申請，目前一卡通已表達申請意願，台灣民眾未來赴日本旅遊時，將可使用LINE Pay一卡通消費。顧立雄今天出席立法院財政委員會備詢，會前接受媒體訪問時指出，電子支付逐步開放是趨勢，日前金管會預告修正電子支付管理規則，放寬電支機構數項業務，也是法令鬆綁，未來更希望做到電子支付業與電子票證業的整合，目前電支業者已經可以發行實體儲值卡，電支與電票的界線越來越模糊，未來就不用去區分電支與電票，達到虛實整合的目標。另外，金管會今天開放電支機構提供客戶出國可使用電支帳戶消費的服務，但需要事先向金管會申請。為因應電支機構推動業務需求，金管會日前預告修正電子支付管理規則，放寬可透過簡訊等方式通知消費者交易訊息，也可發行專用儲值卡，及可在便利商店等代收機構支付規費等5大規定，對電子支付業者祭利多。（編輯：蘇志宗）1080424
