標題,分類,時間,網址,內文
美服務業數據意外惡化 英股創8個月新低,證券,2019/10/04 02:32,https://www.cna.com.tw/news/afe/201910040005.aspx,（中央社倫敦3日綜合外電報導）美國9月服務業數據惡化，創下3年來新低，出乎意料之外，令市場對全球經濟放緩的恐懼升高，導致英國倫敦股市挫跌到8個月來最低點，法國股市則收漲。德國適逢假日休市。美國供應管理協會（ISM）非製造業指數從8月的56.4下跌3.8至52.6，來到2016年8月以來新低，顯示企業活動、新訂單、就業及進口整體需求減弱。英國倫敦FTSE 100指數下跌44.90點或0.63%，收在7077.64點。德國法蘭克福DAX 30指數適逢假日休市。巴黎CAC 40指數上漲16點或0.3%，收在5438.77點。（譯者：徐崇哲）1081004
投資人盼聯準會續降息 美股止跌反彈,證券,2019/10/04 05:54,https://www.cna.com.tw/news/afe/201910040009.aspx,（中央社紐約3日綜合外電報導）華爾街股市今天終結連兩天跌勢，終場反彈收紅，反應市場期望，疲弱的美國經濟將促使聯邦準備理事會（Fed）繼續調降利率。美國供應管理協會（ISM）非製造業指數從8月的56.4下跌3.8至9月的52.6，來到2016年8月以來新低，顯示企業活動、新訂單、就業及進口整體需求減弱。道瓊工業指數終場上漲122.42點或0.47%，收在26201.04點。標準普爾500指數上漲23.02點或0.8%，收在2910.63點。以科技股為主的那斯達克指數上漲87.02點或1.12%，收在7872.27點。（譯者：徐崇哲）1081004
經濟前景引憂 紐約油價連8天下跌,產經,2019/10/04 05:39,https://www.cna.com.tw/news/afe/201910040010.aspx,（中央社紐約3日綜合外電報導）紐約原油價格今天下跌，創10個月以來最長連跌走勢，儘管投資人預測美國聯準會（Fed）本月將降息刺激經濟，但經濟疲態令需求前景蒙上陰影。紐約市場西德州中級原油的11月期貨價格下跌19美分，收在每桶52.45美元。倫敦市場北海布倫特原油的12月期貨價格上漲2美分，收在每桶57.71美元。（譯者：徐睿承）1081004
美股反彈終結連2黑 台股有望挑戰10900點,證券,2019/10/04 08:07,https://www.cna.com.tw/news/afe/201910040014.aspx,（中央社記者張建中台北4日電）美股止跌反彈，道瓊工業指數漲122.42點，法人預期，台股可望隨著展開反彈走勢，有機會挑戰10900點關卡。美股終結連兩天跌勢，終場反彈收紅，反應市場期望，疲弱的美國經濟將促使聯邦準備理事會（Fed）繼續調降利率。道瓊工業指數終場漲122.42點，漲幅0.47%；標準普爾500指數漲23.02點，漲幅0.8%；那斯達克指數漲87.02點，漲幅1.12%。國內外產業訊息方面，大同宣布，持股50%的大同美國公司（TUS）已於9月30日在美國法院聲請重整，法院於10月2日開庭並核准重整。英業達斥資新台幣11億7898萬元購買中國電器桃園龜山工業區資產，將做為生產伺服器相關用途。中電估計獲利約9億元。中華精測自結9月營收3.92億元，創歷史單月新高，第3季營收11.02億元，季增64.4%，同創歷史新高紀錄。液晶顯示器廠佳世達9月營收152.32億元，創歷史新高，第3季營收428億元，同創歷史新高紀錄，除現有事業維持旺季水準，轉投資事業持續擴增，是推升業績攀高的動能。（編輯：楊凱翔）1081004
全新9月營收年增64% 歷年同期新高,證券,2019/10/04 09:01,https://www.cna.com.tw/news/afe/201910040020.aspx,（中央社記者韓婷婷台北4日電）砷化鎵磊晶廠全新9月營收新台幣2.17億元，月減7.2%，年增則有64%，為歷年同期新高。展望第4季，全新表示，完全看客戶實際拉貨狀況，迎接明年新5G手機，後勢不看淡。全新表示，10月營收需視客戶實際拉貨狀況，無法預估數字，隨時都有可能改變，2020年5G手機滲透率增加、2月即將迎接世界行動通訊大會（MWC），預料明年5G手機將進入百花爭鳴時代，看好RF（射頻元件）及ToF（飛時測距）需求，營運有機會提前在第4季反應。全新9月營收儘管連2個月月減，不過年增逾6成；累計今年1至9月營收17.87億元，年增13.61%。根據美系外資預測，中國加速5G建設加上明年3款iPhone可望全面搭載5G強力助攻，5G商機將比預期更快爆發。（編輯：鄭雪文）1081004
新台幣開盤升6.4分 為31元,產經,2019/10/04 09:04,https://www.cna.com.tw/news/afe/201910040021.aspx,（中央社台北4日電）台北外匯市場新台幣兌美元匯率今天以31元開盤，升6.4分。新台幣兌美元開盤交易區間為31.020元至30.980元。1081004
台股開盤漲31.78點 站上10900點,證券,2019/10/04 09:04,https://www.cna.com.tw/news/afe/201910040022.aspx,（中央社台北4日電）台北股市今天開盤漲31.78點，加權股價指數為10907.69點，成交金額新台幣28.34億元。1081004
西勝9月營收2.98億元 單月歷史次高,證券,2019/10/04 09:38,https://www.cna.com.tw/news/afe/201910040025.aspx,（中央社記者韓婷婷台北4日電）NB電池模組廠西勝公告9月份合併營收新台幣2.98億元，月增7.8%，年增13.2%，創下今年以來單月最高，歷史次高紀錄，第4季旺季效應可望更勝以往。西勝第3季單季營收8.32億元，較去年同期成長6.4%，創單季歷史新高。西勝表示，下半年為產業旺季，NB品牌廠在開學潮備貨之後，第4季進入歐美消費旺季，品牌廠拉貨力道不減，旺季效應更勝以往。西勝指出，NB品牌廠下半年陸續推出新品，並積極備貨，西勝主要客戶LG Chem、Costlight（光宇國際）分居全球前2大NB電池芯供應商，涵蓋HP、Dell、Acer等前五大品牌廠，其中Acer全球市佔排名拉升，西勝接單也跟著成長。從目前接單情況來看，第4季將是今年最旺的一季，全年營運成長可期。（編輯：鄭雪文）1081004
蘋果傳明年推低價iPhone 鴻海工業富聯可吃補,產經,2019/10/04 10:31,https://www.cna.com.tw/news/afe/201910040027.aspx,（中央社記者鍾榮峰台北4日電）蘋果可能在明年第1季推出新品，分析師預估，蘋果可能推出較低售價iPhone SE2，預估鴻海旗下工業富聯可望受惠機殼訂單，預估最快今年第4季到明年第1季開始貢獻營收獲利。天風國際證券分析師郭明錤出具報告預期，蘋果將在明年第1季發售較低售價的iPhone SE2，大部分外觀設計與硬體規格與iPhone 8相似，預估配備A13處理器與3GB容量的LPDDR4X記憶體。展望出貨表現，郭明錤預估2020年iPhone SE2出貨量可到3000萬支到4000萬支。受惠iPhone SE2搭配的A13處理器與3GB LPDDR4X記憶體，因此蘋果內容與服務可順暢在iPhone SE2上運作。從供應鏈來看，報告預估，工業富聯、可成與捷普科技（Jabil）可望受惠iPhone SE2機殼訂單，預估今年第4季到明年第1季開始貢獻營收與獲利。報告指出，iPhone SE2對產業鏈的主要貢獻主要在於強勁出貨量，預估較高單價零組件供應商受益較大。其中機殼單價顯著高於其他一般iPhone SE2零組件、此外機殼供應商也可受惠明年下半年iPhone新機因支援5G採用更高單價機殼。郭明錤日前也出具報告預期，明年下半年新款iPhone為支援5G應用，金屬中框設計將顯著改變。他並推估，金屬中框與機殼單價將顯著提升，最高分別約增加50%到60%、以及40%到50%，包括工業富聯、可成與捷普科技，也將是最大受惠者。（編輯：楊凱翔）1081004
立積連4個月營收創新高 股價衝破200元,證券,2019/10/04 09:43,https://www.cna.com.tw/news/afe/201910040028.aspx,（中央社記者張建中新竹4日電）射頻晶片廠立積受惠中國客戶轉單效益，9月營收持續攀高，達新台幣2.83億元，連4個月創歷史新高紀錄，激勵股價表現強勁，一度突破200元關卡，創歷史新高價。隨著中國去美化趨勢成形，立積受惠來自中國客戶的轉單效益發酵，第3季射頻前端模組（FEM）新產品出貨放量，帶動業績逐月攀高，9月營收達2.83億元，月增3.85%，連4個月創歷史新高。立積第3季營收8.24億元，季增超過2成水準，同創歷史新高紀錄。法人預期，除中國新客戶效益持續發酵外，立積手機業務也將擴大，明年整體營運成長可期。在市場買盤積極湧入下，立積今天股價表現強勁，盤中一度突破200元關卡，達201元，創歷史新高價，大漲13元，漲幅達6.91%。（編輯：鄭雪文）1081004
第3季營收衝新高 精測早盤股價走堅,證券,2019/10/04 10:31,https://www.cna.com.tw/news/afe/201910040032.aspx,（中央社記者鍾榮峰台北4日電）中華精測今天開盤最高來到866元，漲5.86%，精測第3季大幅季增64%，創歷史單季新高，法人預估第4季業績拚同期新高。精測早盤衝高後漲幅收斂，來到840元，漲2.69%。精測自結9月合併營收3.92億元，創歷年單月新高，月增6.8%，比去年同期大增44.86%。精測自結第3季合併營收11.02億元，創歷年單季新高，較第2季大增64.4%。精測跨入5G高頻段毫米波（mmWave）半導體測試領域，可同時提供5G低頻段sub-6GHz及高頻段毫米波的半導體測試介面，切入應用處理器（AP）、功率放大器（PA）、模組、射頻（RF）等晶片測試，提供探針卡產品為主。法人指出，精測第3季5G相關業績小量挹注，目前5G應用業績占精測整體業績比重約5%，預估明年第1季開始逐步放量。展望第4季營運，精測日前表示整體營運不會差，可能較第3季高峰小幅修正。法人預估，精測第4季業績較第3季小幅下滑在10%以內，預估單季業績有機會逼近新台幣10億元，來到歷史同期新高和單季次高。（編輯：鄭雪文）1081004
頂級消費酒店式公寓 新美齊：競爭趨白熱化,產經,2019/10/04 10:47,https://www.cna.com.tw/news/afe/201910040045.aspx,（中央社記者潘羿菁台北4日電）國內飯店業供過於求的隱憂浮現，帶動建商切入酒店式公寓市場，日前在地建商宣布投資逾236億元，興建至少300戶的酒店式公寓，新美齊集團觀察，酒店式公寓競爭趨於白熱化，走向分眾化將成趨勢。馥華集團9月初宣布將攜手萬豪國際集團，在板橋推出「馥華艾美」，興建兩棟酒店式公寓、辦公室與五星級酒店，其中，酒店式公寓戶數量高達318戶。由於酒店式公寓的目標客群為頂級商務客，屬於金字塔端消費族群，座落在雙北地區為主，馥華集團的開發案也意味著未來供給量將大增，引發酒店式公寓業者高度關注。新美齊集團旗下酒店式公寓品牌「PARK 259」，目前投入營運約10個月，新美齊分析，過去開發飯店熱潮造成市場供給大增，加上陸客自由行禁令等發酵，目前飯店營運狀況相對辛苦，因此，逐漸看到開發浪潮往酒店式公寓型態發展。新美齊舉例，近年設定地上權的標案增多，過去建商取得後可能會開發純住宅案，不過礙於華人「有土斯有財」觀念，地上權銷售案需要較長消化期，若是改成酒店式公寓，利潤就會相對好。因此整體大環境促使酒店式公寓型態供給越來越多，勢必帶動競爭愈加白熱化，服務必需更加精緻化，例如公司近期也加入Tesla車隊接送服務，期望讓租客感受賓至如歸的感受，或是「PARK 259」與永豐餘合作，提供包含生鮮蔬果、高級牛排等套裝式頂級食材，推出「懶人包」簡單加熱即可。不過新美齊認為，未來酒店式公寓朝向分眾客群將是趨勢，例如，公司近期加強行銷家族來台long stay或是頂級消費客群小孩在台就讀的生活機能服務等。不僅是新美齊開拓新客群，國內老牌酒店式公寓新光人壽則是推出出租式樂齡宅，鎖定65歲到80歲健康長者，很顯然，各方業者企圖尋求新藍海策略，避免價格戰。有趣的是，新美齊提到，近期受到政府產業政策影響，有不少加拿大籍或法籍風力發電工程師入住，或是受到美中貿易戰，暫時退回台灣觀望承租酒店式公寓作為行動辦公室的貿易商，成為國內新現象。（編輯：楊凱翔）1081004
航運股強勢 台股盤中一度收復10900點,證券,2019/10/04 11:07,https://www.cna.com.tw/news/afe/201910040050.aspx,（中央社記者張建中台北4日電）美股止跌反彈，台股今天也隨著同步反彈，指數一度收復10900點關卡，航運類股指數大漲逾1%，表現最強。但大盤漲幅逐步收斂，10時57分指數翻黑，10900點得而復失。截至11時5分，大盤指數來到10867.93點，跌7.98點，成交量約新台幣745.70億元。傳統產業股今天漲跌互見，慧洋-KY第3季營收創高，股價表現強勁，盤中一度達30.65元，漲3.54%，台灣高鐵股價也展開跌深反彈，開高走高一度達36.5元，漲6.88%，帶動整體航運類股指數漲逾1%，表現最佳。其餘食品、塑膠與紡織等類股也同步小漲，水泥與造紙類股表現則相對疲弱，類股指數同步下挫。電子股方面，除台積電股價止跌回升，瑞昱、義隆與立積在業績表現亮麗下，股價同步走高。其餘IC設計服務與矽智財（IP）廠世芯-KY及M31等，和杰力等金氧半場效電晶體（MOSFET）廠也都有不錯表現，帶動整體電子類股指數反彈。（編輯：楊凱翔）1081004
大同美國子公司重整獲准 股價淡定,證券,2019/10/04 11:09,https://www.cna.com.tw/news/afe/201910040051.aspx,（中央記者江明晏台北4日電）繼爆出華映、綠能地雷後，大同3日晚間宣布持股50%的大同美國公司（TUS）在美國法院聲請重整並核准，但大同強調「TUS重整對公司營運沒有影響」，今天股價也相對淡定。大同今天開盤一度走高至16.55元，隨後翻黑小下跌，低點下探16.3元，跌幅0.91%。不過，外資已連續5日大舉賣超大同，累積約1.4萬張。創業逾百年的大同近年面臨內憂外患，有旗下面板廠華映聲請破產、太陽能廠綠能通過解散清算、尚志終止上市等內憂，經營大同的林家也受市場派步步進逼，經營權遭逢危機。大同說明，主因為民國100年TUS作為協助採購，在矽料供應商Hemlock的要求下，和台灣的綠能公司共同與Hemlock訂立三方多晶硅原料供應契約，原料市場價格迅猛崩跌，導致台灣綠能公司步入解散清算程序。TUS於今年7月接獲美國Hemlock公司通知，要求給付依原先和解契約內容綠能需給付的500萬美元，其後以違約為由，提出要求TUS以3500萬美元和解。大同表示，為保護TUS不受突然大額債務影響公司營運，TUS依美國破產法第11章聲請重整，以保護公司得以繼續營業及服務客戶。但大同對TUS為股東關係，損益影響尚待評估，TUS重整對大同營運沒有影響。（編輯：鄭雪文）1081004
面板雙虎庫藏股護盤 群創不到兩個月再買逾5萬張,證券,2019/10/04 11:16,https://www.cna.com.tw/news/afe/201910040053.aspx,（中央社記者潘智義台北4日電）面板廠群創統計，自8月21日至10月3日買回庫藏股5萬900張，群創今天盤中來到6.82元，上漲1.63%。也實施庫藏股的友達盤中小跌後翻紅，來到8.01元，上漲1.39%。面板雙虎群創光電、友達光電目前都在實施庫藏股期間，群創光電統計，自8月21日至10月3日止，買回庫藏股5萬900張，買回金額累計新台幣3億4484萬8元，平均每股買回價格6.77元；加計先前已買回庫藏股，累計持有自家公司股票17萬7100張，占已發行股份總數1.78%。群創自7月實施庫藏股，買回8萬張自家股票護盤之後，又宣布自8月21日起至10月20日再買回庫藏股，以每股4.93元到10.47元區間，在集中市場再買回30萬張庫藏股，目前仍在實施庫藏股期間。友達董事會決議，自9月10日至11月9日買回庫藏股12.5萬張，每股買回區間價格為5.71元到11.84元。友達前次實施庫藏股為2002年，睽違近17年後再啟動庫藏股護盤。（編輯：蘇志宗）1081004
精測營運研發總部落成 招募5G+AIoT有志青年,證券,2019/10/04 12:06,https://www.cna.com.tw/news/afe/201910040054.aspx,（中央社記者鍾榮峰桃園4日電）中華精測新營運研發總部今天舉行落成啟用典禮，也對5G+AIoT有興趣的青年發出英雄帖，鼓勵他們加入精測行列，在全新的營運研發總部為科技夢想努力；預期未來員工人數可望破千人。精測營運研發總部位於桃園市平鎮工業園區，總投資額包括購地約新台幣27億元，樓地板面積6萬平方公尺，建築物地上10層樓、地下2層樓。精測董事長黃秀谷表示，精測技術研發核心成員來於中華電信研究院內部高速PCB研發團隊，精測2005年從中華電信獨立分割成公司以來，持續堅持當年在研究院時對前瞻技術創新的深耕精神，一路從PCB、IC積體電路測試跨到今日的垂直式探針卡（VPC）智慧製造等。中華電信總經理郭水義指出，精測有良好的企業經營理念，以技術為本，掌握智慧型手機蓬勃發展契機，成就今日榮景。精測掛牌交易，吸引更多人才，營運總部啟用之後，預期員工人數可望破千人。展望未來，精測總經理黃水可指出，期盼對5G+AIoT有興趣的青年，可以加入精測行列，共同在全新的營運研發總部為科技夢想努力。精測日前推出5G高頻段毫米波半導體測試方案，可提供5G低頻段sub-6GHz及高頻段毫米波（mmWave）的半導體測試介面及服務。精測產品涵蓋晶圓測試專用的探針卡電路板（Probe PCB）、探針頭（Probe Head）、垂直探針卡專用基板substrate、IC測試載板（Load Board）、以及記憶體測試專用的DUT Board，並新推出垂直式探針卡（Vertical Probe Card）。（編輯：林孟汝）1081004
台商回流翻轉頹勢 商業服務業景氣降速續緩,產經,2019/10/04 11:26,https://www.cna.com.tw/news/afe/201910040068.aspx,（中央社記者廖禹揚台北4日電）商研院今天指出，台商回流潮正翻轉台灣長期以來的低投資、低成長經濟，商業服務業景氣降速持續減緩，但因國際政經情勢紛擾，預估至明年2月都會呈現下行態勢。財團法人商業發展研究院今天公布最新商業服務業景氣預測，領先指標各子指標循環趨勢中，受惠於產線轉移回台，實質民間固定資本形成持續加速向上，服務業貿易收支逆差也持續改善，但運輸倉儲實質GDP、商業服務業僱員淨進入率、失業給付初次認定受理案件皆持續惡化。商研院指出，景氣循環同行指標綜合指數於去年止升轉降後，今年上半年降速進入高峰期，但預測今年9月至明年2月降速會持續明顯減緩。商研院表示，近期台商明顯回流，加上生產基地加速轉移、轉單效應發酵，有望翻轉台灣30年來國際直接投資出多進少所形成的低投資、低成長、低薪化等3低長期發展趨勢。不過，商研院也提醒，世界經貿情勢與地緣政治紛擾有增無減，提高全球景氣走向「停滯膨脹」風險，台灣商業服務業也缺乏足夠向上動能，因此建議配合數位轉型與智慧行銷新解決方案，針對不同部門採取「精準策略」，特別要加強供給面改革措施。（編輯：楊凱翔）1081004
新台幣午盤勁揚1.29角 暫收30.935元,產經,2019/10/04 12:05,https://www.cna.com.tw/news/afe/201910040079.aspx,（中央社台北4日電）台北外匯市場新台幣兌美元今天中午暫收30.935元，升1.29角，成交金額7.44億美元。新台幣兌美元今天開盤價為31元，早盤最高30.928元、最低31.020元。1081004
義隆明年營收可望刷新紀錄 挑戰百億元大關,證券,2019/10/04 12:11,https://www.cna.com.tw/news/afe/201910040082.aspx,（中央社記者張建中新竹4日電）觸控晶片廠義隆電營運前景看俏，今年營收可望突破新台幣90億元，法人預期，明年營收應可進一步突破100億元大關，續創歷史新高紀錄。義隆電為利基人機介面方案供應商，囊括超過6成全球筆記型電腦觸控螢幕控制晶片市占率，觸控板市占率也達40%，在聯想指向裝置市占率更達80%至90%。受惠旺季效應發酵，與客戶轉單效益，義隆電第3季營運表現亮麗，季營收達27.12億元，季增24.3%，創歷史新高。義隆電前9月營收67.75億元，較去年同期增加6.4%，法人預期，義隆電今年總營收可望突破90億元，刷新歷史新高紀錄。法人預期，隨著市占率持續提升，義隆電明年業績可望延續成長趨勢，營收將可進一步突破100億元大關，續創歷史新高。（編輯：鄭雪文）1081004
中火規劃2氣6煤 台電預估可減7成污染,產經,2019/10/04 12:15,https://www.cna.com.tw/news/afe/201910040085.aspx,（中央社記者廖禹揚台北4日電）台中電廠規劃新增2部燃氣機組，引發爭議，台電今天表示，未來將以「2氣6煤」運轉，絕不會12部機組全開，且依以往經驗，一部備用機組啟用機率不到3%。台電規劃在台中火力發電廠新增2部燃氣機組，1日通過環評初審，但台中市政府對此提出抗議，認為機組「不減反增」，忽視民意。台電今天發布新聞稿表示，2025年2部燃氣機組上線後，規劃以「2氣6煤」方式運轉，預估污染物排放將減少6至7成。既有10部燃煤機組中4部將轉為備用機組，而備用機組最多只會啟動2部，且啟動機率極低，絕不可能有12部機組同時運轉狀況。台電說明，備用機組是用於機組發生故障等突發狀況或受天災影響導致備轉容量率偏低時救急，且訂有相關條件，包括於春夏非空污季期間、空氣品質指標（AQI）小於100，且備轉容量率低於8%時才能啟用。而依過往數據推估，動用一部備用機組的機率不足3%，動用到兩部備用機組的機會則更低。台電強調，要達到減排效率高的「2氣6煤」規劃，關鍵還是新增2部燃氣機組必須如期上線商轉，台電會持續努力爭取環評大會通過，也呼籲各界共同支持，推動中火燃氣機組如期上線，以落實增氣減煤的能源政策，兼顧穩供與環保的雙重目標。（編輯：楊凱翔）1081004
英文版公開資訊觀測站升級 新增法說會等資訊,證券,2019/10/04 12:27,https://www.cna.com.tw/news/afe/201910040087.aspx,（中央社記者潘智義台北4日電）台灣證券交易所今天表示，推出全新改版英文版公開資訊觀測站，除強化外國投資人對台灣證券市場的瞭解及資訊使用頻率，長期目標是英文版揭露資訊與中文版一致。因應外資投資台灣資本市場比例逐年增加，證交所積極推動股市資訊國際化，自10月2日起，推出全新改版英文版公開資訊觀測站。證交所表示，這次英文版公開資訊觀測站升級改版，主要是強化目前英文版公開資訊觀測站揭露項目，新增法說會資訊、指數股票型基金（ETF）商品、權證商品、指數投資證券（ETN）商品以及其他投資專區內的資訊。另外，這次改版也將頁面資訊分類排序參考中文版的揭露方式呈現，如此中英文資訊揭露方式將更為一致且可相互對照，外國投資人可依照更準確的細目找到所需資料。台灣證券交易所指出，這次新版公開資訊觀測站上線後，內容充實度及搜尋便利度均大幅提升，雙語對照方式更與國際潮流接軌。未來將持續擴充英文版公開資訊觀測站內容，以利外國投資人接觸台灣資本市場。（編輯：蘇志宗）1081004
美降息預期增 新台幣午盤大升1.29角 見30字頭,產經,2019/10/04 12:50,https://www.cna.com.tw/news/firstnews/201910040092.aspx,（中央社記者潘姿羽台北4日電）美國接連公布的經濟數據都表現不佳，使市場對美國聯準會（Fed）降息預期升溫，期待降息帶來資金行情，今天外資明顯匯入，激勵新台幣盤中勁揚，午盤暫收30.935元，升值1.29角。新台幣兌美元今天開盤價為31元，早盤最高30.928元、最低31.020元，由於市場期待資金行情，交投升溫，台北外匯市場成交金額7.44億美元。外匯交易員解釋，除了國際美元走弱，美國近期公布的經濟數據惡化，9月製造業指數降至10年低點，就業數據也欠佳，導致市場降息預期升溫，這些因素都會帶動新台幣走升。外匯交易員接著說，降息預期增加，市場認為新興市場會出現資金行情，外資因而轉為匯入搶先布局，使得新台幣盤勢偏升。（編輯：楊凱翔）1081004
