標題,分類,時間,網址,內文
川普再舉關稅大刀 美中貿易緊張升高市場挫咧等,產經,2019/05/06 11:21,https://www.cna.com.tw/news/firstnews/201905060046.aspx,（中央社華盛頓5日綜合外電報導）美國總統川普今天宣布從10日起將對2000億美元中國商品關稅稅率調升至25%，而且不久後關稅大刀也會砍向3250億美元中國商品，顯示全球兩大經濟體美中之間貿易緊張加劇。川普兩天前才說美中貿易會談有進展，如今態度大轉變，急劇增加對中國的壓力，以期達成貿易協議。●中方部分承諾跳票 川普不滿談判進度太慢美國貿易代表萊特海澤（Robert Lighthizer）4月底在北京會談後帶回的最新消息不甚樂觀，包括中國先前給出若干承諾卻又反悔，促使川普決定提高關稅，並上推特（Twitter）砲轟北京。川普推文說：「與中國的貿易協商仍持續，但速度太慢，因為他們企圖重新談判。不行！」●川普式談判策略 新一輪談判前先發制人示警美國財政部長梅努欽（Steven Mnuchin）稱上週在北京的貿易會談「富有成效」後，中國國務院副總理劉鶴本週將赴華府展開新一輪會談。川普在美中8日展開新一輪會談前宣布提高關稅，被視為一種談判策略。白宮經濟顧問柯德洛（Larry Kudlow）在川普今天推文後告訴福斯新聞（Fox News），川普是在「發出警告」。他表示，儘管美中會談已有「很大進展」，結構性與執行機制問題仍未解決。柯德洛說：「我們希望他們會在這項協議上改變立場，如果他們依然故我，總統說『你猜怎麼著，關稅會繼續加徵下去』。」●金融市場反應負面 投資人挫咧等川普升高威脅語調，美股期貨聞訊下挫，標準普爾500指數期貨下跌1.6%；道瓊期貨跌420點或1.6%；人民幣貶值0.8%，為去年8月以來最大跌幅。紐約MUFG聯合銀行（MUFG Union Bank）首席金融經濟學家拉普基（Chris Rupkey）表示，目前不清楚中國會如何反應，但今日的發展可能引爆劇烈反應，因為市場先前「被催眠」，預期美中即將達成貿易協議。美股主要指數交易一直在接近歷史高位，部分是因為市場樂觀地以為美中很快將結束激烈的貿易戰。拉普基今天在致客戶備忘錄中說：「這似乎很可能會演變成一場全面性災難，恐會導致股市暴跌。投資人，請繫好安全帶。」●美企陷兩難 川普強硬策略罕見獲兩黨支持川普心繫2020年大選連任之戰，有意安撫美國消費者，他表示今日這些措施不會導致物價上漲。他推文說：「那些付給美國關稅的措施，對於產品成本幾乎沒有影響，大多是中國要承擔。」對中國商品祭出的關稅，實際上是進口商付給美國。那些企業的總部大多設在美國。路透社報導，美商多半支持川普打擊中國貿易作法，但內心渴望關稅撤銷，而不是提高關稅及擴大徵稅範圍。美國零售業領導協會（Retail Industry Leaders Association）發言人費南德茲（Christin Fernandez）說：「提高關稅意味著對數以百萬計美國家庭增稅，招致對手進一步報復美國農民。」然而川普強勢策略罕見獲得兩黨支持，聯邦參議院民主黨領袖舒默（Chuck Schumer）推文敦促川普「堅持到底」。舒默說：「不要打退堂鼓。力量是贏中國唯一之道。」前白宮首席策士巴農（Steve Bannon）表示：「現在雙邊鷹派都將勝利。總統剛告訴了我們，中方一直想重談協議。」巴農說，這股氣氛來自那些「不認為中國應屈從美方條件」的鷹派，例如中國國家副主席王岐山。巴農的反中團體應對當前危險委員會（Committee on the Present Danger）一直在促使川普進一步調升中國輸美商品關稅。●傳中國考慮取消貿易談判川普矢言調高中國商品關稅後，「華爾街日報」引述消息來源報導，中國考慮取消劉鶴赴美參與新一輪貿易會談。報導說，北京對川普揚言對中國徵收新貿易關稅感到意外，而中國不想在威脅下進行談判。中國目前尚未做出最終決定。（譯者：盧映孜/核稿：陳昱婷）1080506
港金管局：香港無可避免受中美貿易牽連,產經,2019/05/06 11:18,https://www.cna.com.tw/news/afe/201905060048.aspx,（中央社記者張謙香港6日電）對於美國總統川普突然加徵中國產品關稅，香港金融管理局總裁陳德霖今早說，香港無可避免會受到中美貿易牽連。官方香港電台報導，陳德霖在立法會財經事務委員會上答覆質詢時說，中美貿易談判原先預期很快談妥，但川普突然對中國產品加徵關稅，外界有人解讀為美國希望在談判中爭取到更好的條款。他說，目前不知道中美能否完成貿易談判，但即使談妥，中美在科技及5G（第5代手機通訊）方面仍充滿矛盾。陳德霖說，香港無可避免會受到中美貿易牽連，3月出口就較去年同期下跌了1.2%。但他說，中國大陸的製造業採購經理人指數（PMI）近期由收縮重返輕微擴張水平，這屬於正面訊息，反映出大陸經濟可能開始穩定下來。（編輯：沈朋達）1080506
商業服務業景氣震盪 商研院：向上動能不足,產經,2019/05/06 11:21,https://www.cna.com.tw/news/afe/201905060051.aspx,（中央社記者廖禹揚台北6日電）商研院今天發布最新商業服務業景氣預測，指出動向領先指數從去年第4季迄今呈現上下震盪、微幅下降走勢，雖然下降風險降低，但向上動能明顯不足，建議持續加強提振景氣措施。財團法人商業發展研究院今天發布台灣商業服務業景氣預測，預測今年9月仍將在長期趨勢（指數100）下微幅震盪，也是實際值自去年5月碰頂後第16個月的下滑，雖然預測5、6月會稍稍回升，但第3季預期將略為下滑。商研院指出，與以前各循環指數開始低於長期趨勢後的步調相比，這次坡度較為平緩，意味景氣走勢已無急降風險，但向上動能仍感不足，同時也代表政府實施中的抗衰措施確有作用，但仍待加強加速。進一步觀察子指標，商研院表示，同行指標子指標走勢各部門呈現不同循環走勢，但進入去年第4季後，5個子指標只剩不動產及住宅服務業實質GDP持續去年下半年以來的回升趨勢，其餘4個子指標均見下降，尤其是金融及保險業實質GDP。商研院推估，至今年4月，只剩批發與零售業及住宅服務水電瓦斯及其他燃料業的循環指數仍高於長期趨勢；商研院並提醒，就業不前、失業就會惡化，今年第1季整體失業率已開始高於去年同期，是值得正視的問題。商研院就此預測，今年1月起循環指數會低於長期趨勢，並持續下降；在5、6月會些微震盪後，預測到9月會又降為99.69，顯示目前走緩向下的景氣仍難見明快回升，唯降幅有減緩趨勢，景氣不致於有再急降風險。（編輯：鄭雪文）1080506
報稅季股票借錢繳稅 券商讓理財更彈性,證券,2019/05/06 11:34,https://www.cna.com.tw/news/afe/201905060054.aspx,（中央社記者韓婷婷台北6日電）5月報稅季節到來，證券商推出不限用途款項借貸服務，想賺股息不想變賣股票的投資人，可改用股票借錢繳稅，等除息後有現金進帳再還錢，讓理財更具彈性。根據財團法人金融聯合徵信中心「新增個人信用貸款狀況統計趨勢資料」最近資料顯示， 2018年新增使用信用貸款的高峰期約落在5至6月，5月新增信貸金額高達新台幣37.9億元，顯示報稅季前後都是民眾有短期資金需求的最大時刻。富邦證券表示，民眾若有短期資金需求，可以使用券商的不限用途款項借貸服務，5月報稅季節到來，民眾可不必再「賣股繳稅」，可改用股票借錢繳稅，等除息後有現金進帳再還錢，讓理財更具彈性。凱基證券指出，券商提供投資人可利用證券商的不限用途款項借貸服務，以自己的庫存股票做擔保品，直接向券商借款，不用變賣股票，讓投資與理財可同時兼顧。富邦證券表示，目前借款餘額較去年年底成長31%以上，顯示該業務符合客戶資金周轉需求，又能兼賺股息股利。富邦證券也提醒投資人，「不限用途款項借貸」擔保品以上市櫃股票為主，借款期限為半年，最多展期2次，故期限最長可達1年半。（編輯：楊凱翔）1080506
今年經濟成長率 朱澤民：有把握應會逐季成長,產經,2019/05/06 16:35,https://www.cna.com.tw/news/afe/201905060071.aspx,（中央社記者范正祥台北6日電）國民黨立委林德福今天在立法院聯席會議質詢，台灣今年經濟成長率，每季會逐季成長或有高有低。對此，行政院主計總處主計長朱澤民預測，按照目前資料，應該有把握會逐季成長。立法院財政、內政委員會聯席會議審查「中華民國106年度中央政府總決算審核報告（含附屬單位決算及綜計表）案」。林德福質詢時關切今年經濟成長率議題。林德福指出，主計總處4月30日發布2019年第1季經濟成長率概估為1.72%，較2月預測數減少0.10個百分點，他質詢朱澤民，對於今年經濟成長率一季比一季成長的看法是否有把握。朱澤民答覆，根據現行資料估計，應該有把握。質詢時，林德福也提及，美中貿易戰將進入談判階段，台商回台會不會有變數。朱澤民說，5月8日美中好像就要談判，美國總統川普在推特上說要提高稅率，但美國官方並沒有說關稅稅率要提升，是否往好的方向發展，「我們還在觀察」。林德福認為，美中即將談判，「沒有叫陣就沒有籌碼」，當然川普會在推特上說要提高稅率，他解讀，這是川普拿來當美中談判籌碼。對此，朱澤民尊重立委讀。另外，林德福也質詢，短期內台灣是否還有降息的空間。朱澤民答覆，他個人認為要不要降息應慎重考慮，如果降的太低，將來貨幣政策就沒有運作空間、沒有效果，經濟學上叫做「流動性陷阱」，所以利率降低應慎重考量。對於林德福再問，利率維持目前情況是否比較適當。朱澤民說，是的。（編輯：楊凱翔）1080506
美股盤後期貨重挫 富邦VIX大漲逾7%,證券,2019/05/06 11:56,https://www.cna.com.tw/news/afe/201905060072.aspx,（中央社記者潘智義台北6日電）受到美國恐慌指數大漲影響，富邦VIX指數股票型基金今天早盤來到新台幣5.54元，大漲7.7%，一掃年初以來大跌的陰霾。富邦VIX指數股票型基金（ETF）自今年初的9.25元一路下跌，到4月底下跌已逾4成，近日跌勢才緩和，甚至上漲，今天更因VIX指數大漲17%帶動，早盤即跳空大漲。群益期貨分析師容逸燊表示，富邦VIX指數股票型基金（ETF）標的為美國芝加哥選擇權交易所發行的恐慌指數（VIX），對應的是美國標準普爾500指數（S&P500），若S&P500指數大跌，則投資人恐慌情緒增加，恐慌指數（VIX）就大漲。容逸燊解釋，雖然美國標準普爾500指數前一交易日上漲28.12點，但台北時間今天早上6時開盤的標準普爾500指數期貨電子盤開盤即下跌近2%，造成恐慌指數上漲，自昨天晚上低點14.26點，來到今天早上的16.77點，大漲17%。因此，鎖定恐慌指數的富邦VIX指數股票型基金跟著大漲7.7%。他說，因美國標準普爾500指數期貨大跌，帶動投資人恐慌情緒提升，使恐慌指數大漲，波動率變大，發揮避險功能。（編輯：鄭雪文）1080506
辛耘第1季獲利創歷年同期新高 每股賺1.18元,證券,2019/05/06 12:00,https://www.cna.com.tw/news/afe/201905060073.aspx,（中央社記者張建中新竹6日電）半導體設備暨再生晶圓廠辛耘第1季稅後淨利新台幣9454萬元，創歷年同期新高紀錄，每股純益1.18元。受惠再生晶圓客戶需求熱絡，加上代理的面板設備與自製的半導體濕製程設備出貨暢旺，辛耘第1季營收達10.48億元，季增7.45%，也較去年同期大增51.07%，表現淡季不淡。因產品組合變化影響，辛耘第1季毛利率33.63%，較去年第4季下滑13.07個百分點，也較去年同期下滑0.76個百分點。辛耘第1季稅後淨利9454萬元，季減45%，不過，較去年同期大增近5倍，並為歷年同期新高，每股純益達1.18元。法人預期，辛耘今年營運可望延續成長趨勢，營收應可續創歷史新高紀錄，代理與自製設備業務將是推升辛耘今年營運成長的主要動能。（編輯：郭萍英）1080506
新台幣午盤貶1.8分 暫收30.925元,產經,2019/05/06 12:03,https://www.cna.com.tw/news/afe/201905060074.aspx,（中央社台北6日電）台北外匯市場新台幣兌美元今天中午暫收30.925元，貶1.8分，成交金額5億美元。新台幣兌美元今天開盤價為30.930元，早盤最高30.917元、最低30.940元。1080506
郭台銘傳交棒黃秋蓮 投顧：保守看待,證券,2019/05/06 12:20,https://www.cna.com.tw/news/afe/201905060083.aspx,（中央社記者江明晏台北6日電）鴻海董事長郭台銘參選總統，傳新任董事長規劃由財務重臣黃秋蓮擔任，投顧分析師保守看待此消息，認為鴻海版圖廣大，涉及的產業包山包海，要能從郭台銘手上接下棒子並不容易。郭台銘表態投入國民黨總統初選，鴻海內部高層接班態勢漸明朗，傳郭台銘將退居第二線，仍位居集團總裁，鴻海新任董事長規劃由財務重臣黃秋蓮擔任，總經理另由專業經理人專任。黃秋蓮從鴻海草創到富可敵國，45年協助郭台銘打下江山，她更是鴻海集團財務投資的關鍵人物，目前擔任鴻海集團副總裁暨集團總財務長，主導鴻海旗下負責財務會計的J次集團。鴻海集團內部員工稱黃秋蓮為「錢媽媽」，她是鴻海集團重要的財務大臣，鴻海大大小小投資案，需要她簽字才能過關。黃秋蓮更主掌鴻海在全球各地大型投資案的關鍵資金調度。對於這個消息，華南投顧董事長儲祥生認為，鴻海版圖廣大，涉及的產業包山包海，要能從郭台銘手上接下棒子並不容易，因此還要持續觀察。兆豐投顧協理黃國偉認為，若交棒給財務背景出身的專業經理人，未來沒有郭台銘的鴻海，在擴張力道上可能就會採取比較保守的路線，但判斷黃秋蓮是早期的創業團隊之一，對於郭台銘的決策模式相當熟悉，若消息為真，中性看待對鴻海股價的影響。他也認為，台塑、台積電等集團都曾面臨一代強人交棒的局面，過程難免會遇到一些瑕疵，遭質疑「螺絲是不是鬆了」，但只要集團基礎堅實，出現一些問題反而能提高警覺，還是回歸到公司有沒有建立制度，落實公司治理。另一位不願具名的分析師則表示，如果郭台銘要把董事長一職交棒給財務背景出身的黃秋蓮，指揮各立山頭的科技人，其實挑戰不小，要能有一定歷練，才能敢有遠景，做出正確決策，認為短期內鴻海股價將會保守看待此消息。（編輯：楊玫寧）1080506
川普揚言對中國商品提高關稅 亞股應聲大跌,證券,2019/05/06 18:02,https://www.cna.com.tw/news/afe/201905060093.aspx,（中央社香港6日綜合外電報導）美國總統川普揚言10日起，要對中國2000億美元商品提高關稅至25%，來加快美中貿易談判的進度後，亞洲股市應聲重挫。許多觀察家預期美中貿易談判步入尾聲，但殺出川普這個程咬金從中搗亂，陸股和港股在亞洲地區領跌，人民幣也重貶。川普昨晚發推文說：「過去10個月來，中國高達500億美元的高科技商品已向美國支付25%關稅，其他2000億美元商品也被課徵10%關稅。10%關稅將於週五（10日）提高至25%。」中國國務院副總理劉鶴本週將赴美談判，美國媒體報導中方正在考慮他們的立場，川普發出警告將讓後續幾輪談判蒙上陰影。外匯交易商萬達（OANDA）資深市場分析師海利（Jeffrey Halley）說：「川普今天早上用牛刀殺雞，交易員和投資人本週可能只想到『貿易談判』這4個字而已。」港股早盤重挫3.6%，上海股市大跌逾5%。新加坡股市下跌3%，台北股市下挫1.8%，雪梨和威靈頓股市都挫跌1%。東京和首爾股市因逢國定假日休市。摩根大通集團（JPMorgan Chase & Co.）全球研究主管張愉珍說：「在每個人都聚焦在10日的截止期限之下，這使得最後結果非好即壞的可能性更高了。」（譯者：陳昱婷/核稿：盧映孜）1080506
國際廢鋼小跌 豐興本週平盤型鋼調降,產經,2019/05/06 12:49,https://www.cna.com.tw/news/afe/201905060096.aspx,（中央社記者韋樞台北6日電）美國貨櫃廢鋼報價本週每公噸小跌3美元，國內鋼筋大廠豐興鋼鐵本週各式鋼品報價平盤，僅型鋼基價每公噸小跌400元。豐興表示，國際廢鋼價格暫平穩，未來觀察貿易戰後續效應。豐興鋼鐵最新廢鋼收購價每公噸新台幣8200元；鋼筋每公噸1萬6900元；型鋼基價下跌400元，每公噸2萬1300元，其中扁鋼產品附價每公噸另跌200元，方鋼和圓鋼產品附價每公噸另跌300元。國際原料行情方面，豐興鋼鐵指出，美國大船廢鋼本週無報價；日本2H廢鋼本週無報價；美國貨櫃廢鋼報價本週小跌3美元，每公噸280美元；澳洲鐵礦砂本週每公噸漲1.85美元，由每噸92.8美元漲至94.65美元。豐興表示，本週美國貨櫃廢鋼小跌3美元，走勢暫時平穩；日本4月底以來10天黃金週假期至今天收假，因此日本國內2H廢鋼無報價，豐興決議本週各式鋼品維持平穩，僅型鋼反應過去1個月以來的跌勢。豐興指出，美中貿易戰再生波瀾，但由於中國進口廢鋼量很少，美國貨櫃廢鋼出口對中國影響不大，但可能會影響國際貿易架構，對鋼鐵業的影響還須再觀察。（編輯：楊凱翔）1080506
BVI經濟實質法台商停看聽 會計師：留意3重點,產經,2019/05/06 13:10,https://www.cna.com.tw/news/afe/201905060102.aspx,（中央社記者吳佳蓉台北6日電）英屬維京群島（BVI）日前發布「經濟實質法施行細則草案」，讓外界得以一窺經濟實質法上路後，具體的可能影響對象及範圍。勤業眾信（Deloitte）提醒，台商應留意3大草案重點。擋不住全球反避稅浪潮，過去有租稅天堂之稱的BVI、開曼等地，陸續增訂「經濟實質法」，要求當地企業營運必須具有「經濟實質」，否則將處以罰鍰，甚至撤銷公司登記，表態不再歡迎紙上公司。為找出最佳因應之道，各界高度關注相關施行細則內容。針對4月23日BVI發布的「經濟實質法施行細則草案」，勤業眾信聯合會計師事務所稅務部會計師廖哲莉認為，企業可關注3項重點。首先，經濟實質法的適用對象只限BVI當地稅務居民，註冊在當地、但身份為其他國家稅務居民的企業，可以豁免適用。至於如何證明是其他地區的稅務居民，施行細則草案指出，包括居住者證明、納稅證明，或核定通知書等都可作為證明文件。若來不及準備證明文件，向BVI當地說明理由，提出申請，該財務年度可暫時豁免。不過，廖哲莉提醒，要留意假設企業申報為A地區稅務居民，那BVI公司產生的全部相關所得，也要在A地區申報才算符合條件。第二，BVI經濟實質法的適用對象並非所有公司，而是鎖定以9種活動類型為主的企業，包括純控股公司。至於純控股公司定義，廖哲莉說，施行細則草案認定為「僅持有股權投資、單純賺取股利收入及資本利得的相關個體」；也就是說，從事股票、債券、基金等財務性投資的企業，並非適用對象。不過，現行僅有控股功能的BVI公司，是否能藉由轉投資其他非股權投資來解套，廖哲莉認為，仍有待商榷。草案目前還在意見徵詢階段，仍待歐盟及經濟合作暨發展組織（OECD）進一步討論認定，企業應持續留意最新法令發展。第三，根據施行細則草案，純控股公司要落實經濟實質功能，須在當地有「適當」的人員與場所，並符合公司法規定。不過，對於怎樣算「適當」，看來還是要回歸個案情形認定。廖哲莉說，其實不論是BVI還是開曼的經濟實質相關規範中，都存在很多概念性字眼，例如足夠、適當、適切，並未明定數量或條件；未來執行上，將視公司規模大小及實際從事活動等個案條件來判斷。因此，建議企業可諮詢專業機構，對人員及營運成本配置，進行合理評估。（編輯：楊凱翔）1080506
美中貿易戰增溫 台股失守月線大跌近200點,證券,2019/05/06 14:04,https://www.cna.com.tw/news/firstnews/201905060115.aspx,（中央社記者韋樞台北6日電）美中貿易戰再生波，美國總統川普推文宣布10日起調高中國進口品關稅至25%。亞股驚嚇一片慘綠，台股重挫199點，跌破月線。法人表示，持股多且無避險者可考慮調節持股比重。台股終場下跌199.18點，收在10897.12點，成交值新台幣1378.63億元。外界以為美中貿易談判進入尾聲之際，川普今天推文，由於中國試圖重新協商，談判牛步，宣布10日起，對2000億美元中國商品的懲罰性關稅將調高至25%。消息傳來，亞股紛紛倒地，陸股的上證A股和深圳A股跌幅均逾5%，為亞股跌幅最重；台股也開低走低，盤中跌幅最重達226點，最低10870點，失守月線10940點。各大類股均下跌，電子股中的半導體與其餘電子族群分別重挫2.3%、3%以上；傳產跌逾1.3%，塑膠、玻璃、鋼鐵、橡膠、觀光等族群跌幅相對較輕，約1%。蘋概三雄中台積電與鴻海賣壓較重，跌幅分別有2.26%和3.74%。台積電收在259元；鴻海收在84.9元。股王大立光受惠4月營收逾50億元，股價反而逆勢走揚，推升股價到4745元，漲幅1.5%。股市資深分析師林成蔭表示，川普突然在中國副總理劉鶴赴美之前拋出調高課重稅的震撼彈，施壓中國迫使接受美國的條件，但接下來中國如何接招，相關情勢發展將影響市場走向。林成蔭指出，可觀察外資今天是否大幅賣超，若大幅賣超代表後勢謹慎，同時台股一路上漲到11100點附近的上升軌道若因此而改變，台股順勢拉回整理期不會太短。手中持股多且無避險的投資人，可能要考慮調節持股，若是檢視手中持股僅小跌甚至上漲，代表基本面無虞，也不是外資或大戶調節重點，但後續仍須謹慎觀察貿易戰發展。（編輯：楊凱翔）1080506開低走低 台股大跌199點（中央社台北6日電）台北股市今天開低走低，收盤跌199.18點，為10897.12點，跌幅1.8%，成交金額新台幣1378.63億元。加權指數開盤為11005.36點，盤中最高11005.36點，最低10870.40點；不含金融股指數9192.69點，跌175.91點。八大類股漲跌幅：泥窯股跌1.37%、食品股跌0.86%、塑化股跌0.92%、紡織股跌1.37%、機電股跌2.26%、造紙股跌1.93%、營建股跌0.94%、金融股跌1.28%。委買張數1088萬375張，委賣張數780萬4977張，成交張數511萬7456張。收盤時上漲91家，下跌793家，持平56家。成交量前5名個股為元大滬深300正2、富邦VIX、富邦上証正2、聯電、元大台灣50反1。漲幅前5名個股為富邦VIX估、三洋電、誠研、泰聚亨-DR、富邦VIX。跌幅前5名個股為元大滬深300正2、國泰中國A50正2、富邦上証正2、國泰中國A50正2估、元大滬深300正2估。1080506
