標題,分類,時間,網址,內文
英特爾處理器缺貨 宏碁新筆電支援AMD,產經,2019/05/23 12:28,https://www.cna.com.tw/news/afe/201905230095.aspx,（中央社記者吳家豪台北23日電）電腦品牌廠宏碁今天宣布推出支援第2代AMD Ryzen行動處理器的全新Nitro 5電競筆電及Swift 3輕薄筆電；市場認為，宏碁試圖擴大採用AMD處理器的產品比重，來因應英特爾處理器缺貨。宏碁發布新聞稿指出，採用第2代AMD Ryzen處理器的全新Nitro 5與Swift 3，將在今年5月28日至6月2日期間，於台北信義香堤大道廣場的宏碁攤位展示。受英特爾處理器（CPU）缺貨的影響，宏碁4月合併營收約新台幣140億元，年減14%；累計今年前4月合併營收達686.8億元，年減3.3%。美系外資日前發布研究報告指出，在季節性需求帶動下，宏碁今年第2季營收可望季增，但仍受到英特爾處理器小幅缺貨的影響，預期宏碁第2季將提高Chromebook筆電出貨，雖可能影響獲利率，卻有利營運槓桿效益。（編輯：楊凱翔）1080523
華為若推自家系統 台灣消費者恐不買單,產經,2019/05/23 12:41,https://www.cna.com.tw/news/afe/201905230101.aspx,（中央社記者江明晏台北23日電）憂Google不支援服務，中華電表態將停賣華為新機，消費者認同此舉為了避免後續客訴糾紛，但不少華為用戶都表態，如果華為以後推出的新機，搭載的是自家作業系統而非Google，就不會考慮再買。中美貿易戰延燒，美方禁止華為技術公司與美國企業往來禁令，Google未來恐停止供應華為安卓（Android）作業系統更新和軟體，儘管美國商務部20日宣布臨時通用許可證，將此禁令暫時放寬管制90天，但後續發展仍有隱憂。憂Google不支援服務，中華電22日明確表態將停賣華為新機，台灣大也停賣新機型，華為在台代理訊崴維持先前聲明指出，產品使用和持續安全升級及售後服務不受影響。有消息指出，華為消費者業務CEO余承東透露已自行開發作業系統，最快將在今年秋天發布，以解決日後新機沒有安卓系統可用的窘境。但消費者怎麼看？華為用戶韓先生對中央社記者說，會選用華為手機是因為強大的照相功能、系統穩定、CP值高，但如果華為以後推出的新機搭載自家作業系統而非Google，他就不會考慮再買，因此「可以理解電信公司不賣華為，畢竟台灣消費者仍習慣使用Google」。不過，「政治是一時的、賺錢是一世的」，他看好華為是全球手機二哥，Google不會輕易與華為撕破臉，應不會走到這一步。而根據記者採訪，多數華為用戶評估，若華為真的被迫與Google分手，屆時將無法使用Gmail、看YouTube，就絕對不會購買華為新機。也因此Google若停止和華為合作，將對其後續發展是致命的打擊。3C達人Tim哥表示，國內電信商停賣華為新機目的在於避免未來會發生的客訴，不如先壯士斷腕止血；估計華為在台銷量會減少約10至15%左右，來自於新機未來恐無法搭載Google，但舊機應不受影響；不過，華為未來推出新機，還要重新教導用戶使用自家的系統和APP，雖是一個關卡，也不代表不會成功。3C部落客林小旭則認為，中華電、台灣大會跳出來喊話，是想要先中斷會發生的客訴問題，也有電信商採取彈性作法，讓消費者來決定，他觀察華為現有用戶並沒有恐慌，且台灣綁約的用戶變少了，電信商此舉不見得對華為有很大的傷害。（編輯：楊凱翔）1080523
5奈米明年首季量產 台積電：全球最先進,產經,2019/05/23 12:49,https://www.cna.com.tw/news/afe/201905230104.aspx,（中央社記者張建中新竹23日電）晶圓代工廠台積電對先進製程技術發展深具信心，業務開發副總經理張曉強表示，5奈米製程明年第1季量產，仍會是全世界最先進的製程技術。台積電今天在新竹國賓飯店舉辦技術論壇，總裁魏哲家表示，技術、製造與客戶信任是台積電的3個支柱，台積電是一個可以信任的技術與產能供應者，會全心全意與客戶合作，絕不會跟客戶競爭。為滿足客戶需求，魏哲家指出，台積電過去5年共投入500億美元投資產能，除12吋晶圓外，8吋晶圓產能也相當大，2018年出貨1100萬片，2013年至2018年複合成長率超過2位數百分點。台積電今年資本支出仍將維持100億美元以上水準，台積電2廠及5廠廠長簡正忠表示，今年總產能將擴增至1200萬片約當12吋晶圓，將微幅增加2%，其中，以7奈米產能增加最多，總產能將超過100萬片規模，將增加1.5倍。至於製程技術進展，簡正忠說，第2代7奈米製程良率已與第1代7奈米一樣，將於第3季量產，5奈米製程也完成試產，預計明年第1季量產。對於與對手三星間的競爭態勢，張曉強不評論對手，不過，他表示，台積電5奈米製程明年第1季量產，有信心仍會是全世界最先進的製程技術。（編輯：鄭雪文）1080523
華為風暴擴大 台股盤中跌破10300點,證券,2019/05/23 12:58,https://www.cna.com.tw/news/afe/201905230110.aspx,（中央社記者潘智義台北23日電）美國制裁華為風暴擴大，高通「反托拉斯法」案敗訴，帶動美半導體股下殺，美股重挫。台股今天早盤大跌逾百點，跌勢迅速擴大，盤中大跌逾150點，一度跌破10300點整數關卡。12時45分加權指數來到10302.60點，大跌154.62點，成交值新台幣946.83億元。8大類股盤中僅食品類股小漲，其餘各類股全面下跌，由其機電類股跌勢最猛。處理器矽智財（IP）龍頭大廠英商安謀（ARM）加入制裁華為行列，恐影響華為採用安謀為架構的晶片開發，連帶影響華為對台積電的訂單，台積電盤中來到230元，下跌3.36%。光學鏡頭供應商股王大立光在蘋果之外，找到華為大客戶，原本看好華為訂單可彌補蘋果產品銷售下滑影響的業績，卻因美國制裁華為，成為受害者，盤中股價來到3770元，大跌7.71%。系統組裝大廠鴻海盤中來到71.5元，下跌3.37%。高通在反托拉斯法敗訴，競爭對手聯發科盤中來到295元，漲2.6%。國泰證期顧問處經理蔡明翰表示，除華為事件擴大影響，造成台股大跌，晶片大廠高通遭美聯邦法院判決違反「反壟斷」規定，盤中股價大跌10%，造成半導體股弱勢，引領台股領先指標的費城半導體指數跟著下跌，台股今天開盤即跳空大跌，早盤大跌逾百點。蔡明翰指出，美國對華為制裁原只封殺軟體來源，影響華為海外銷售，但處理器矽智財（IP）龍頭廠英商安謀（ARM）加入制裁，使華為連中國內銷都受波及，影響全面化。美國態度強硬，甚至更進一步要求韓國配合，加入制裁華為行列。他說，美國制裁華為不僅傷到華為一家廠商，或是供應鏈，更可能影響終端市場的消費意願，拖累經濟景氣；高通因違反「反托拉斯法」受挫，雖然台廠競爭對手聯發科一家受惠，但對其它廠商卻是「多家受害」，影響的也是整體經濟。他分析，台股前些日子好不容易上漲有量，下跌無量，價量關係轉為正向，但台股重新站上半年線10645點後，又再跌破半年線，今天更跌至波段低點，又轉為帶量下跌的負向價量關係。他直言，台積電法說會的第2季是谷底說法即使未變，但下半年是否逐季上揚恐怕仍有疑慮，因此台股資金流向非電子族群，投資人短線可選擇高殖利率的非電子股介入，迎接6月的除權息行情。（編輯：楊凱翔）1080523
雙子星案審查 經濟部：目標6月底前結果出爐,產經,2019/05/23 13:02,https://www.cna.com.tw/news/afe/201905230112.aspx,（中央社記者廖禹揚台北23日電）台北雙子星案得標公司涉中資疑雲，經濟部今天表示，已要求各相關單位在5月25日前送回審查意見，必要時會請投資人來報告，目標在6月底前審查完畢。台北市雙子星開發案去年由港商南海控股旗下南海控股、馬來西亞商馬頓有限公司組成的團隊得標，但南海控股卻捲入中資疑雲，立法院經濟委員會邀請經濟部等單位就雙子星案是否涉及中資及國安問題等爭議進行專案報告。經濟部政務次長王美花答詢時表示，經濟部已要求各單位在5月25日前回報審查意見，再看情況決定是否召開小組會議，或直接排審，若有必要，也會要求投資人前來報告說明，希望全案在6月底前能有結果出爐。時代力量立法委員徐永明與民進黨籍立委郭國文質詢時指出，國安局為防堵假消息，目前監控6個中國自媒體及5個內容農場，其中香港01創辦人為南海控股集團主席于品海，質疑有國安疑慮；國安局表示，已掌握此事，相關資料都會蒐集齊全，交由聯審機制審查。經委會今天通過臨時提案，要求經濟部投審會針對雙子星案召開會議確認審議結果的前一週，若立院有開臨時會，要偕同陸委會、國安局、外交部等相關部會至經委會進行專案報告，若無臨時會，則須彙整書面報告送交經委會。（編輯：林淑媛）1080523
越南台資廠房大火 無人員傷亡損失待估,產經,2019/05/23 13:07,https://www.cna.com.tw/news/afe/201905230114.aspx,（中央社河內23日電）位於越南南部平陽省（Binh Duong）一號越香工業區（Viet Huong）的台資眾安公司廠房昨天發生大火，幸好沒有造成人員傷亡，但財務損失可能不小。中央社記者今天聯繫眾安公司，但眾安公司尚未對外說明事故詳情。據平陽台商會表示，會員企業眾安公司越香一膠帶工廠昨天下午發生鍋爐爆炸。越南「青年報」新聞網站報導，火災於昨天下午2時許在眾安公司其中一個工廠發生，由於廠內具有許多易燃材料，在場人員試圖滅火但未果，火勢迅速蔓延，廠房隨後陷入一片火海。報導指出，平陽省消防機構獲報後調派數百名人員與數十台消防車趕往現場全力灌救，因為火勢太大，在胡志明和同奈（Dong Nai）等附近省市消防力量的支援下，直到晚上9時許才能控制火勢。報導說，大火造成整個面積約2000平方公尺的5層樓廠房倒塌，場內所有財產都燒毀，幸好火災沒有造成人員傷亡，確切損失金額仍有待估算，起火原因尚待消防單位鑑識。眾安科技有限公司共有5個廠房，專門生產鞋類與膠帶等產品，發生火災的建築是生產膠帶的廠房。（編輯：馮昭）1080523
大林2號機配電盤燒毀 台電：不影響供電穩定,產經,2019/05/23 13:09,https://www.cna.com.tw/news/afe/201905230115.aspx,（中央社記者蔡芃敏台北23日電）大林電廠2號機2具配電盤燒毀，台電表示，釐清原因中，原估大林2號機組有望在5月下旬併聯發電，不過受此事影響，盼6月上旬能併聯發電，但也強調，此事件不影響未來穩定供電。大林電廠2號機在22日凌晨3時冒出煙霧，根據台電官網，大林電廠2號機今天淨發電量為0。台電發言人徐造華表示，經檢查，大林電廠2號機有2具配電盤燒毀，還有一具配電盤遭濃煙波及，所幸現場並無人員受傷。台電已派員調查事故原因，目前還在釐清中，也根據程序通報經濟部。他說，大林電廠2號機組裝置容量為80萬瓩，正在進行檢點作業，為停機狀態。台電本來預估大林電廠2號機組有機會在5月下旬併聯發電，但目前還在釐清事故原因，不確定上線時程，但希望在6月上旬能併聯發電。徐造華指出，核二廠2號機將在5月底滿載發電，加上機組已經陸續歸隊，此事件對穩定供電沒有太大影響，未來2個月備轉容量率都在10%以上，亮起代表供電充裕的綠燈。（編輯：鄭雪文）1080523
台積電：下半年強勁成長 全年成長目標不變,證券,2019/05/23 13:35,https://www.cna.com.tw/news/afe/201905230121.aspx,（中央社記者張建中新竹23日電）晶圓代工廠台積電資深副總經理暨財務長何麗梅表示，近期客戶需求沒有特別變化，下半年營運強勁成長看法不變，全年營運目標也不變，將微幅成長。美中貿易戰升溫，華為遭美國政府列入貿易黑名單，雖然禁令延後90天至8月中執行，矽智財(IP)廠安謀(ARM)仍決定暫時停止與華為各式授權合作與支援，震撼各界，憂心恐將影響下半年產業景氣旺季不旺。何麗梅今天在台積電技術論壇接受媒體訪問說，近期客戶需求沒有特別變化，只是半導體市場變化很快，台積電仍將持續密切與客戶聯繫。何麗梅表示，下半年營運強勁成長看法維持不變，全年營運目標也維持不變，將可微幅成長；台積電並將持續致力成為全世界的晶圓代工廠。外界憂心美國未來若禁止設備出口中國，台積電企業訊息處資深處長孫又文說，目前這種狀況還沒有發生，若美國禁止設備出口中國，台積電可在台灣生產。孫又文表示，台積電南京12吋廠目前月產能1萬片，今年底前將擴產5000片，明年將進一步擴產至2萬片規模。（編輯：郭萍英）1080523
台股開低走低 跌148.85點,證券,2019/05/23 13:45,https://www.cna.com.tw/news/afe/201905230129.aspx,（中央社台北23日電）台北股市今天開低走低，收盤跌148.85點，為10308.37點，跌幅1.42%，成交金額新台幣1177.46億元。加權指數開盤為10404點，盤中最高10404點，最低10289.69點；不含金融股指數8633.76點，跌143.65點。八大類股漲跌幅：泥窯股跌0.42%、食品股漲0.22%、塑化股跌0.39%、紡織股跌0.08%、機電股跌2.39%、造紙股跌1.43%、營建股跌0.07%、金融股跌0.15%。委買張數1098萬5380張，委賣張數709萬4722張，成交張數433萬7133張。收盤時上漲187家，下跌649家，持平97家。成交量前5名個股為元大滬深300正2、富邦VIX、元大台灣50反1、群創、欣興。漲幅前5名個股為奇偶、晶心科、云辰、全宇生技-KY、台南。跌幅前5名個股為尚志、南電、易華電、元翎、日月光投控。1080523
6月電子期金融期齊跌,證券,2019/05/23 13:56,https://www.cna.com.tw/news/afe/201905230132.aspx,（中央社台北23日電）台北股市今天下跌148.85點，收10308.37點。6月電子期收404.25點，下跌11.20點，逆價差0.17點；6月金融期收1260.40點，下跌4點，正價差3.06點。6月電子期以404.25點作收，下跌11.20點，成交4113口。7月電子期以395.45點作收，下跌11.35點，成交24口。電子現貨以404.42點作收，下跌10.05點；6月電子期貨與現貨相較，逆價差0.17點。6月金融期貨以1260.40點作收，下跌4點，成交2325口。7月金融期以平盤1239點作收，成交14口。金融現貨以1257.34點作收，下跌1.92點；6月金融期貨與現貨相較，正價差3.06點。實際收盤價以期交所公告為準。1080523
6月台指期跌169點,證券,2019/05/23 13:57,https://www.cna.com.tw/news/afe/201905230133.aspx,（中央社台北23日電）台北股市今天終場跌148.85點，收10308.37點。6月台指期以10310點作收，下跌169點，與現貨相較，正價差1.63點。台灣期貨交易所為近2個月指數期貨契約訂定開盤參考價為，6月期貨10479點、7月期貨10255點。台股今天終場跌148.85點，收10308.37點，成交金額新台幣1177.46億元。6月台指期貨以10310點作收，跌169點，成交14萬726口；7月期貨以10090點作收，跌165點，成交1237口。實際收盤價格以期交所公告為準。1080523
三星在台首季超標 銷售額拚年增1成,產經,2019/05/23 14:01,https://www.cna.com.tw/news/afe/201905230137.aspx,（中央社記者江明晏台北23日電）華為遭電信商停賣新機，三星不便評論，但強調競爭對手有高低起伏，「三星一直做好充足準備」，在台銷售連半年穩步成長，今年首季目標達陣，力拚三星在台全年銷售額年增10%。台灣三星電子行動與資訊事業部副總經理陳啟蒙今天表示，三星近期在台灣市場表現優於預期，過去6個月在台銷售量市占率穩步提升，銷售量市占從17%一路成長到23%，首季也達成目標，旗艦機S10系列過去2個月也穩居安卓旗艦的第一名，銷售表現穩定，今年也會有非常兵強馬壯的A系列，有助於帶動全年度銷售額達成年增10%的目標。今年首季，三星中高階手機占三星整體銷量逾3成，較去年同期成長逾30%，中階以下占5成，各價格帶持續朝向3、3、4黃金比例(高階3成、中階3成、低階4成)邁進。三星今天在台發表A系列新機，包括A40s、A60、A80，其中，A80預計6月底上市。至於華為目前遭遇電信商停賣新機，他表示，不便評論，但「三星做好很多充足準備」。他指出，競爭者有高低起伏，還是有其他競爭者存在，今年三星做對兩件事，第一，在台灣市場準備最充足的A系列，做此選擇是觀察台灣是分眾市場，市場規模小卻布滿7000個通訊行零售點，電信商也希望能有獨家合作的機款；第二，進行掛招零售店的改革，包括所有通路庫存維持更健康的水位，要求銷售比例達到70%，並在細節上更用心檢視。另外，三星摺疊手機Galaxy Fold先前在實測時，傳出螢幕破裂狀況，三星陸續推遲4月在香港、上海、台灣舉行的發布會，台灣三星今天表示，目前暫時無明確時程，但應會在幾週之內。而因應部分中國品牌強打台灣電商市場，三星表示，考慮引進專為電商通路打造的M系列，內部也建立O2O的平台，布建更完整的通路滿足不同客群。觀察未來市況，他指出，5月母親節前兩週整體台灣市場銷售量年成長約15%，但母親節過後，熱度隨即下降，預估5月銷量也會持平在50萬支上下，預估全年銷售量仍會衰減約1成。（編輯：郭萍英）1080523
廢印花稅影響地方財源 財長：替代方案很多,產經,2019/05/23 16:01,https://www.cna.com.tw/news/afe/201905230139.aspx,（中央社記者吳佳蓉台北23日電）行政院長蘇貞昌指示檢討印花稅存廢，因涉及地方財源，立委要求須有替代財源配套。財政部長蘇建榮說，會儘速完成研議，若要廢除，以過去經驗，可以編列預算方式補助，未必要改課營業稅或修財劃法。蘇建榮今天受邀赴立法院財政委員會備詢。針對行政院指示檢討印花稅，國民黨立委賴士葆質詢時表示，印花稅每年稅收近新台幣120億元，若要廢除，光台北市就會減少財源40億元，財源缺口財政部是否會全部買單，不然等於是「中央請客、地方買單」。民進黨立委余宛如詢問，印花稅跟營業稅是否有重複課徵的問題，同時貨物稅的課徵也有影響產業發展的疑慮，為促進消費，是否也要一併檢討，民進黨立委王榮璋則追問，印花稅若廢除了，有沒有可能改課營業稅。對此，蘇建榮回應，過去加值型及非加值型營業稅法上路時，就曾討論要在適當時機廢除印花稅，過去賦改會也曾有類似建議，但印花稅涉及地方重要財源，最終各方討論後，沒有得出具體結果。既然如今業者提出檢討意見，行政院也指示要檢討，現正朝此方向審慎研議中。至於替代財源怎麼來，蘇建榮說，方式很多，改課營業稅也是方式之一，也可比照過去土增稅減半課徵的經驗，透過財政部賦稅署編列預算來彌補地方財源，不一定要動營業稅，或是修財劃法。若要廢除印花稅，必須要修法，提出方案後會先送行政院審議，之後送立法院完成修法。（編輯：鄭雪文）1080523
華為風暴波及台廠供應鏈 台股退守10300點,證券,2019/05/23 14:31,https://www.cna.com.tw/news/firstnews/201905230143.aspx,（中央社記者潘智義台北23日電）美國制裁華為風暴擴大，華為供應鏈台積電、大立光領跌，台北股市盤中大跌逾150點，一度跌破10300點，但收盤重回10300點之上。加權指數至終場收在10308.37點，大跌148.85點，跌幅1.42%，成交量放大至1177.46億元，8大類股僅食品類股小漲，其他各類股全面下跌，尤其機電類股跌勢最重。處理器矽智財（IP）龍頭大廠英商安謀（ARM）加入制裁華為行列，恐衝擊台股供應鏈廠商，晶圓代工龍頭台積電收在230元低點，下跌3.36%。系統組裝大廠鴻海收在最低點71.5元，下跌3.38%。光學鏡頭大廠大立光收在3800元，大跌6.98%。受到競爭對手高通在反托拉斯法案敗訴影響，IC設計大廠聯發科收在292元，上漲1.57%，新光投信董事長劉坤錫表示，美國制裁中國通訊大廠華為並非單一事件，接下來還可能會有第2家、第3家遭制裁廠商，由於影響重大，甚至可能拖累全球經濟，因此現階段只要美國有進一步制裁中國企業的動作，全球股市都可能受累，台股也會進一步下跌。劉坤錫指出，美中貿易戰、科技戰不停，台股仍有機會再跌，解鈴還須繫鈴人，除非美國總統川普對中國釋出善意，否則台股觀望氣氛恐將持續，若時間拖太久，甚至可能促使資金退場，成交量縮。他認為，短線非電子族群股價有支撐，但美國制裁華為等中國企業時間若拉長，恐拖垮全球經濟，只怕連非電子股也要下跌。（編輯：楊凱翔）1080523
貿易戰升溫高科技股下跌 日股收黑,產經,2019/05/23 14:32,https://www.cna.com.tw/news/afe/201905230145.aspx,（中央社東京23日綜合外電報導）美中貿易戰與華為禁令衝擊擴大，導致主要高科技股挫跌，東京股市今天收低。日經225指數收跌0.62%或132.23點，收21151.14。東證一部指數下滑0.36%或5.63點，收1540.58。（譯者：張曉雯/核稿：劉淑琴）1080523
三大法人賣超台股132.73億元,證券,2019/05/23 14:59,https://www.cna.com.tw/news/afe/201905230153.aspx,（中央社台北23日電）台股今天跌148.85點，收在10308.37點，成交值新台幣1177.46億元。三大法人同步賣超，合計賣超新台幣132.73億元。自營商賣超14.05億元，投信賣超8.43億元，外資及陸資賣超110.25億元。新光投信董事長劉坤錫表示，美國制裁中國通訊大廠華為並非單一事件，接下來還可能會有第2家、第3家遭制裁廠商，由於影響重大，甚至可能拖累全球經濟，因此現階段只要美國有進一步制裁中國企業的動作，全球股市都可能受累，台股也會進一步下跌。1080523
永豐金：新台幣31.5元已到短線滿足點,產經,2019/05/23 15:14,https://www.cna.com.tw/news/afe/201905230161.aspx,（中央社記者邱柏勝台北23日電）近期新台幣「跌跌不休」，創28個月新低價，但永豐金經研處表示，新台幣貶幅已深，預計31.5元是短線滿足點；且下半年美元可望轉弱，建議投資人暫時觀望，不要在這時搶進美元。另外，美中貿易戰升溫，戰線更延伸到科技戰，美國近期擴大對中國通訊大廠華為的制裁，也對華為供應鏈造成極大影響，今天台股重挫148.85點。不過永豐金認為，台股這波段跌幅至少已達8成，預估台股萬點有守，因此建議可以挑選適合類股「逢低買進」。永豐金今天召開第一季法說，公布第一季稅後盈餘新台幣37.2億元，年增41%創歷年同期新高，主因財富管理與銀行、證券手續費收入大幅成長，加上法人金融放款規模突破1兆元，挹注金控手續費淨收益來到3067億元，創單季新高。針對近期新台幣貶勢不止，永豐金控首席經濟學家黃蔭基表示，近期美元強勢，除了美中貿易戰因素影響外，第二季是歐元區經濟谷底，導致歐元疲弱，也是美元走強原因之一。但第三季歐元區經濟將好轉，帶動歐元反彈，因此他預估美元下半年偏弱機會高。永豐金經研處表示，近期新台幣貶幅已深，預計31.5元是短線滿足點，若下半年美元轉弱，新台幣也可望反彈，因此建議未持有美元部位的投資人，先不要在這時搶進美元。今天台股重挫148.85點，盤中一度跌破10300點大關，主要是因為美國擴大制裁華為，對台灣的華為供應鏈造成影響，台積電今天跌幅逾3%，市值也跌破6兆元。不過，黃蔭基表示，觀察外資賣超台股情況，近日賣超金額逐漸收斂，顯然已經賣得差不多，且目前這個波段跌幅「至少已經跌掉8成」，離谷底已不遠。尤其明年美國、台灣都要舉辦總統大選，在選前政府都會想辦法拉高股市，因此台股跌破萬點的機會不高，萬點有守，建議投資人已經可以挑選適合的類股逢低買進。（編輯：蘇志宗）1080523
