標題,分類,時間,網址,內文
盧秀燕：設自經區有利台中產業國際競爭,產經,2019/05/06 14:06,https://www.cna.com.tw/news/afe/201905060117.aspx,（中央社記者郝雪卿台中6日電）高雄市長韓國瑜要推動自經區，台中市長盧秀燕今天受訪時表示，對於自經區，她應該是相當專業的，如果可以設置自經區，她一定會爭取，將有利於台中產業的國際競爭。盧秀燕上午主持治安、公安、食安聯合會報，會後針對自由經濟示範區的議題受訪時表示，自經區有兩個重點，包括「境內、關外」及「降低關稅障礙」，有些國家都會設置自經區，用比較低的稅率減免行銷產品，將有利於台中產業的國際競爭。如果台中市要設置自經區，盧秀燕指出，除了「境內、關外」及「降低關稅障礙」的概念，她還要加上兩個條件，包括一定要採購台灣的原物料，還要一定比率用台灣人才。盧秀燕認為，比較不希望國外產業到台灣，貼個標籤就再銷出去，那樣只利用台灣關稅的優勢，只做加工，這樣是不夠的。希望要大量使用台灣本地的材料及人才，才能從中獲得加值效果。如果能准許設置自經區，盧秀燕說，當然要爭取，讓台中市人才有更多就業機會，原物料有更多出口及國際競爭機會，對城市來講是好的，台灣早期有很多加工出口區就是這種概念，就是拚經濟的方法之一，當然不能只靠自經區而已，但的確是一個城市很重要的拚經濟方法。（編輯：陳俊碩）1080506
川普再舉高關稅 中國學者：想賺更多便宜,產經,2019/05/06 13:59,https://www.cna.com.tw/news/afe/201905060118.aspx,（中央社記者翟思嘉上海6日電）美國總統川普在推特聲稱10日起對中國商品加徵懲罰性關稅。中國大陸學者認為，這是美方希望中國多讓步的策略，想再賺得便宜。但若美方執意施行，貿易談判將再度中斷。大陸國務院參事、中國人民大學國關學院教授時殷弘表示，川普此舉可能意在促使中方作更多讓步。此外，川普即將在明年總統大選競選連任，對中國的強硬態度是在對國內選民宣示他能「搞定中國」。川普揚言，10日起將對2000億美元中國商品的懲罰性關稅調高至25%，而中國國務院副總理劉鶴本週本預計赴華府繼續會談，時殷弘認為，美方課徵高關稅的可能性雖然較小，但美方若真的施行，劉鶴將不會赴美，中美貿易談判就可能再一次中斷。上海華中科技大學教授陳波則表示，川普此舉可能是談判策略，想再賺得便宜，也可能是想表達對近來中美各種問題的不滿，比如委內瑞拉局勢、北韓問題等。陳波認為，川普反覆的言行與推文，和美國談判主導者美國財政部長梅努欽（Steven Mnuchin）、貿易代表萊特海澤（Robert Lighthizer）的說法並非完全一致，顯示出「中美貿易問題的癥結就是川普本人」。他表示，美方若課徵懲罰性關稅，劉鶴可能會缺席這週的談判，交由各自談判團隊處理協商。不過，陳波認為中美貿易商談雖可能暫時中斷，但應會儘快達成協議。由於美國總統大選準備開跑，中美貿易戰持續可能對美國經濟帶來影響，不利川普競選連任。同時，中國經歷去年貿易戰衝擊，今年第一季經濟數據表現仍然不錯，美方也擔心貿易爭端遲未解決，雙方經濟情勢可能出現反轉，美方有部分聲音認為，現在談成的中美貿易協議將會是最好的協議。陳波說，中美貿易談判能否繼續的變數，還包括美國經濟表現，及美國的外部壓力是否讓川普情緒性遷怒中國。不過，川普今天推文後，中國即釋出降準消息，可見中國有其應對計畫，能很快反應。（編輯：周慧盈）1080506
5月台股期指跌235點,證券,2019/05/06 13:53,https://www.cna.com.tw/news/afe/201905060119.aspx,（中央社台北6日電）台北股市今天終場跌199.18點，收10897.12點。5月台指期以10857點作收，下跌235點，與現貨相較，逆價差40.12點。台灣期貨交易所為近2個月指數期貨契約訂定開盤參考價為，5月期貨11092點、6月期貨11087點。台股今天終場跌199.18點，收10897.12點，成交金額新台幣1378.63億。5月台指期貨以10857點作收，跌235點，成交15萬7580口；6月期貨以10854點作收，跌233點，成交3885口。實際收盤價格以期交所公告為準。1080506
群電首季每股賺0.86元 營收獲利雙創同期新高,證券,2019/05/06 13:54,https://www.cna.com.tw/news/afe/201905060120.aspx,（中央社記者韓婷婷台北6日電）群光電能第1季稅後淨利為新台幣3.28億元，年成長56%；每股稅後純益0.86元，年增54.2%，營收與獲利創同期歷史新高。展望第2季，營運將較第1季好，第3季則進入產業旺季。群光電能今天舉行法人說明會公佈2019年第1季合併營業額達72.29億元，較去年同期成長15.9%，連續4個季度呈現雙位數營收成長，創同期歷史新高紀錄。受惠於營業額成長，加上去年影響獲利的人民幣升值、大陸缺工等不利因素緩解，第1季合併毛利提升至10.36億元，年成長為29.2%，合併營業淨利更是較去年大幅成長99.3%，達2.98億元。歸屬於母公司業主稅後淨利3.28億元，年成長56%；每股稅後純益為0.86元，創同期歷史新高。群光電能今天同時公布4月份自結合併營收26.14億元，年增率為15.8%，續創同期歷史新高，並寫下單月營收連續7個月年增雙位數的紀錄。累計1至4月合併營收98.43億元，年成長達15.9%。法人表示，今年受到Intel CPU缺貨的影響，第1季全球PC出貨年衰退3至5%左右，群光電能PC用電源首季出貨量逆勢成長。尤其是電競筆電、Type C筆電電源等高值產品的出貨量均維持3成以上高成長，帶動群光電能的首季營收獲利同步走揚。群電指出，雖然預期第2季CPU缺貨問題仍未解決，將壓抑群光電能部分的成長動能，使公司第2季營收呈現溫和年成長的走勢，但待下半年開始智慧家庭產品的旺季來到，加上潛在伺服器新產品的貢獻，營收可望重啟強勁動能。（編輯：郭萍英）1080506
5月電子期金融期齊跌,證券,2019/05/06 14:00,https://www.cna.com.tw/news/afe/201905060122.aspx,（中央社台北6日電）台北股市今天下跌199.18點，收10897.12點。5月電子期收445.9點，下跌12.05點，逆價差2.0點；5月金融期收1272.6點，下跌16.2點，逆價差0.24點。5月電子期以445.9點作收，下跌12.05點，成交3643口。6月電子期以446.0點作收，下跌11.65點，成交220口。電子現貨以447.9點作收，下跌10.35點；5月電子期貨與現貨相較，逆價差2.0點。5月金融期貨以1272.6點作收，下跌16.2點，成交2349口。6月金融期以1269.8點作收，下跌16.0點，成交88口。金融現貨以1272.84點作收，下跌16.52點；5月金融期貨與現貨相較，逆價差0.24點。實際收盤價以期交所公告為準。1080506
機械業者看美中貿易戰：短空長多,產經,2019/05/06 14:11,https://www.cna.com.tw/news/afe/201905060125.aspx,（中央社記者蔡芃敏台北6日電）美中貿易戰再升溫，機械業者分析，美中貿易戰對台機械產業是「短空長多」，即使客戶短期持觀望態度，不過，貿易戰使世界工廠從中國移轉至各地，勢必將帶動設備需求。美國總統川普透過推特表示，美國與中國的貿易協商持續中，不過進度太過緩慢，美國從10日起將調高價值2000億美元中輸美商品關稅，稅率從10%調升至25%。外貿協會今天舉行「台灣智慧機械國際媒體記者會」，經濟部國貿局主秘倪克浩、中華民國對外貿易發展協會祕書長葉明水、台灣機械公會理事長柯拔希、台灣機械公會副秘書長許文通和工具機公會副理事長謝瑞木等人均出席活動。台灣機械公會理事長柯拔希指出，中國市場占台灣機械出口約3成，確實受到美中貿易戰影響。若川普真的調整關稅，短期將讓許多客戶保持觀望態度，訂單可能產生遞延效應。柯拔希表示，長期看來，美中貿易戰機械業是最大受益者。本來客戶是只有汰舊換新的需求，不過，客戶為了移轉風險而撤離中國，中國將不再是唯一的世界工廠。客戶將工廠移轉到其他國家，屆時將增加機械設備需求，預估客戶將花上數年調整市場布局，重新採購對機械業者是絕佳商機。他說，綜觀上述因素，美中貿易戰對台機械產業是「短空長多」。謝瑞木形容美中貿易戰是「經濟上升時遇到的亂流」，不過，隨著工業4.0發展、5G時代來臨，客戶需求將持續提升。他認為，美中貿易戰就是台灣業者練兵最佳時機，業者應加快研發步調，搭上全球機械自動化、智慧化風潮，機械業者後市依然看俏。許文通則說，相較其他國家，台灣內需市場小，外銷腳步更快，機械業者也提供彈性、客製化需求，藉此增加台灣競爭優勢，機械業受惠於台商回台投資，已經接到多筆台商訂單。根據經濟部統計，機械出口產值去年達274億美元，創歷年新高。機械產值去年達新台幣1.18兆元，也是台灣繼半導體、面板後的第3個兆元產業。（編輯：林興盟）1080506
上銀第1季每股賺2.06元 獲利8季來低點,證券,2019/05/06 14:21,https://www.cna.com.tw/news/afe/201905060127.aspx,（中央社記者鍾榮峰台北6日電）傳動元件大廠上銀第1季稅後淨利新台幣6.19億元，每股稅後純益2.06元，法人指是8季來相對低點，預期上銀第2季營運可季增，下半年看佳，全年營運力拚成長10%。上銀第1季合併營收50.48億元，比去年第4季66.48億元減少24%，較去年同期65.53億元減少22.95%，法人指出，上銀第1季營收來到歷年同期次高。上銀第1季合併毛利率36.8%，較去年第4季35.92%增加0.88個百分點，比去年同期40.04%減少3.24個百分點。上銀第1季合併營業利益7.59億元，合併營益率為15.05%，較去年第4季13.07%增加1.98個百分點，比去年同期21.37%減少6.32個百分點。上銀第1季稅後淨利6.19億元，較去年第4季8.69億元減少28.7%，比去年同期12.15億元下滑49%，上銀第1季每股稅後純益2.06元，低於去年第4季EPS 2.85元和去年同期EPS 4.21元。法人指出，上銀第1季獲利是8季來相對低點。本土法人報告日前指出，上銀第1季業績可望築底，單季毛利率和淨利率可觸底。第2季開始自動化產業衰退週期可望落底，上銀第2季開始業績可逐季復甦，產業需求可望在下半年回溫，上銀今年下半年營運動能可優於上半年，訂單回流可帶動獲利率逐季上揚，預期今年業績挑戰成長10%。（編輯：郭萍英）1080506
美中貿易談判生波 台股前景蒙塵,證券,2019/05/06 14:39,https://www.cna.com.tw/news/afe/201905060132.aspx,（中央社記者江明晏台北6日電）美中貿易戰談判再起波瀾，台股今天重挫近200點，失守10900點大關，投顧認為，8日的美中貿易談判若沒如期舉行，談判就重回原點，台股難保不會重演去年第4季陰霾。就在外界以為美中貿易談判進入尾聲之際，美國總統川普推文，由於中國試圖重新協商，談判牛步，宣布10日起對2000億美元中國商品的懲罰性關稅將調高至25%，而且不久後關稅大刀也會砍向3250億美元中國商品，顯示全球兩大經濟體美中之間貿易緊張加劇。受此消息影響，台股今天開低走低，收盤大跌199.18點，為10897.12點，跌幅1.8%，成交金額新台幣1378.63億元。兆豐投顧協理黃國偉今天表示，目前市場都在關注美中貿易戰動態，美國總統川普舉動背後的盤算動機，對股市來說影響很大，如果只是因應中國拖延態度的反擊，意味著雙方談判還是會朝向和解方向進展，但如果是川普刻意節外生枝，兩方的戰火恐怕會難以止息。他指出，關鍵要看5月8日在美國華盛頓舉行的中美貿易談判，是否會如期舉行，如果取消的話，可能就意味著重回原點，國際股市也將會有所反應，台股不排除重回去年第4季的情況，跌破萬點關卡。他進一步說，台股從去年10月起漲至今，主要有兩大利多支撐，第一是中美貿易戰和解有望，第二是聯準會升息速度放緩，如果利多因素去掉一半，對台股來說相當不利，因此今天市場充斥山雨欲來的肅殺之感，要小心因應。華南投顧董事長儲祥生表示，目前談判進度要推進有困難，但美國和中國大陸有實力差距，中國如果不願意完全受制於美國，最後一哩路會走得很辛苦。目前雙方舉動不是目的，應只是手段，只是要觀察雙方的談判會延續到什麼時間點，考驗股市忍受程度。展望台灣，他認為，台股還是看美股臉色，還是會守住萬點關卡，但「時間拉得越久，會越麻煩」。（編輯：楊玫寧）1080506
神基4月營收回溫 年增逾17%,證券,2019/05/06 14:52,https://www.cna.com.tw/news/afe/201905060137.aspx,（中央社記者吳家豪台北6日電）強固型工業電腦廠神基科技公布4月自結合併營收新台幣21.35億元，年增17.04%，今年單月營收再度突破20億元；累計2019年1到4月營收78.19億元，年增5.98%。受美中貿易戰延燒影響，世界主要經濟體成長疲軟，神基今年第1季各事業體成長力道趨緩，合併營收較去年同期微幅上揚2%；其中強固型電腦第1季主要動能來自聯邦政府市場及汽車車廠相關應用訂單出貨。展望2019年，神基董事長黃明漢日前受訪時看好強固型電腦和汽車機構件今年將維持成長，綜合機構產品審慎樂觀，今年整體營收有望成長雙位數百分比（10%以上）。（編輯：林沂鋒）1080506
三大法人賣超台股143.13億元,證券,2019/05/06 15:03,https://www.cna.com.tw/news/afe/201905060143.aspx,（中央社台北6日電）台股今天大跌199.18點，收在10897.12點，成交值新台幣1378.63億元。三大法人外資及陸資、投信賣超，自營商買超，合計賣超新台幣143.13億元。自營商買超2.03億元，投信賣超5.59億元，外資及陸資賣超139.57億元。股市資深分析師林成蔭表示，外資今天大幅賣超，台股順勢拉回整理期不會太短。1080506
台泥攜手寶武環科 搶循環經濟商機,產經,2019/05/06 15:07,https://www.cna.com.tw/news/afe/201905060145.aspx,（中央社記者韋樞台北6日電）台泥集團旗下台泥國際公司與大陸寶武環科公司，今天在上海就共同推進循環經濟發展簽訂戰略合作框架協定，雙方在3到5年內目標成為工業窯爐協同處置工業和城市固體及危險廢棄物的典範。今天雙方簽署框架協定是由寶武環科董事長陸熔、台灣水泥資深副總經理呂克甫代表雙方簽約。寶武環科總經理陳在根、高級技術總監李文、總經理助理張波；台灣水泥資深協理王建全、台泥杭州運營管理中心總經理姚成府、北京台泥環保公司總經理田巍等出席。台泥國際表示，雙方根據協議將聚焦循環經濟，充分發揮各自在資源、技術、裝備、市場、融資、品牌等方面的獨特優勢，積極推動雙方優勢資源的協同、共用、集成與互補。未來，雙方將圍繞礦粉供應、固廢消納、協同處置工業和城市固體及危險廢棄物、土壤修復、二氧化碳減排及後期商用等領域在政策研究、市場調研、工藝技術、市場拓展等方面展開全方位合作。台泥國際指出，雙方將力爭在3到5年內，在環境與環保服務領域發展成為工業窯爐協同處置工業和城市固體及危險廢棄物的典範，樹立海峽兩岸環保產業友好合作的成功範例。陸熔強調，雙方的合作是實踐2018年底台北上海雙城論壇中「聚焦循環經濟、實現永續發展、鑄就永續城市」核心主題。他指出，雙方在資源保障、工藝技術、經營管理、運營實踐、品牌商譽、政策溝通等方面各有優勢，具備合作互補的良好基礎。未來雙方將更廣泛領域開展更高層次、國際化的環保戰略合作。（編輯：楊凱翔）1080506
商總理事長選舉 王令麟：全力拚事業無意願,產經,2019/05/06 15:16,https://www.cna.com.tw/news/afe/201905060146.aspx,（中央社記者江明晏台北6日電）全國商業總會理事長選舉明年改選，但近日媒體報導副理事長許舒博參選一事，扯上曾擔任商總理事長的東森集團總裁王令麟，王令麟今天聲明指出，對擔任理事長沒有任何意願。新新聞日前報導指出，全國商業總會理事長於2020年進行改選，副理事長許舒博，早在去年12月18日宣布將競逐下一任商總理事長；不禁令人想到王又曾、王令麟父子聯手掌控商總長達4屆的年代；雖然目前尚未有人跳出來向許挑戰，但前商總理事長、東森集團總裁王令麟所擁有的網路媒體，隔幾天就以專題規格「伺候」許舒博、賴正鎰。王令麟今天發布聲明指出，此刻全心全意衝刺事業，以擴大企業範圍全球發展，提升企業競爭力，創造就業機會及創造股東最大利益為目標，就商業總會理事長選舉一案，甚至台北市商業會年底改選一案，無任何意願進行參選。王令麟指出，東森集團以新零售、新媒體為發展核心，面對全球化競爭激烈，要和Facebook、Google、Line等跨國企業在雲端上競爭、打的是世界盃，因此，每天都在和時間賽跑，全心全意衝刺事業，東森集團目前員工人數已將近5000人，若包括東森自然美加盟主、東森天美仕夥伴和東森房屋加盟店東，集團總人數超過1萬5000多人，這背後代表的是上萬員工和其家庭需要照顧。王令麟強調，東森集團2018年營收217億元，獲利23.95億元，今年要挑戰314億元，成長46%，2023年更要達到878億元。（編輯：黃國倫）1080506
台勝科4月營收跌破10億元 創26個月新低,證券,2019/05/06 15:11,https://www.cna.com.tw/news/afe/201905060149.aspx,（中央社記者張建中新竹6日電）半導體矽晶圓廠台勝科4月營收新台幣9.6億元，滑落至10億元之下，創26個月新低。受客戶持續去化庫存影響，台勝科4月業績進一步滑落，營收9.6億元，月減24.2%，也較去年同期減少28.7%，為26個月新低水準。法人指出，台勝科因缺乏長約保障，第1季營運即已受到客戶去化庫存影響，季營收36.42億元，季減13.64%，也較去年同期減少4.61%。隨著客戶去化庫存影響效應進一步增大，法人預期，台勝科第2季業績恐將較第1季再滑落，待客戶庫存有效去化後，下半年營運將可逐步好轉。（編輯：蘇志宗）1080506
台塑四寶4月營收1257億  台化公安定檢年減逾1成,產經,2019/05/06 15:50,https://www.cna.com.tw/news/afe/201905060165.aspx,（中央社記者韋樞台北6日電）台塑四寶公布4月營收合計新台幣1257.59億元，月減3.7%，年減10%；其中台化因工廠公安事故及定檢影響，4月營收289.42億元，月減31.3億元約9.8%，年減12.6%最多。台塑四寶合計4月營收1257.59億元，月減3.7%，年減10 %。前4月合計5102.41億元，年減8.4%。台化營收衰退較多，4月營收289.42億元，月減9.8%，年減12.6%；前4月合計1203.75億元，年減8.9%。台化表示，4月營收比3月衰退31.3億元，主要是受芳香烴3廠(ARO-3)事故，及芳香烴1廠(ARO-1)、SM海豐廠安排定檢影響，衰退9.8%，其中量差減少29.9億元，售價差減少1.4億元。台塑4月合併營收192.09億元，月增2.7%，年減1.8%，累計前4月合併營收722.21億元，年減2%。南亞4月合併營收250.74億元，月增0.4%，年減10.1%，累計前4月合併營收959.95億元，年減12.8%。台塑化4月合併營收525.34億元，月減4.2%，年減11.2%，累計前4月合併營收2216.5億，年減8.1%。（編輯：蘇志宗）1080506
宏達電4月營收5.9億元 再創掛牌來新低,證券,2019/05/06 15:53,https://www.cna.com.tw/news/afe/201905060166.aspx,（中央社記者江明晏台北6日電）宏達電4月營收新台幣5.9億元，再創2002年3月掛牌以來單月營收新低，市場認為，VR新品挹注力道有限，但宏達電仍積極布局VR和區塊鏈，盼在競爭的智慧機市場中突圍。宏達電今天公布4月自結合併營收5.9億元，月減約55%，年減約71%，再創2002年3月掛牌以來單月營收新低，若回溯至掛牌前，也是2000年10月以來單月營收新低，累計1至4月自結合併營收為35.4億元，年減67.52%。宏達電3月營收雖然在VR新品出貨激勵達新台幣13.1億元，較2月營收倍增，但市場推估，出貨力道並未延續，加上宏達電主力新款旗艦機可能會在下半年才發動，導致4月營收不如預期。不過，宏達電持續在VR領域深耕，3月26日於深圳舉辦的VIVE生態大會推出全球首款全六自由度多模式VR一體機設備Vive Focus Plus，售價約新台幣2.5萬元，已在全球25個市場推出，雖然單價高出智慧機，但VR出貨量和智慧機銷售規模還有很大的差距。宏達電日前宣布，與高通Technologies合作，共同針對Qualcomm Technologies的XR一體機與5G智慧型手機的參考設計，可讓HTC Vive為智慧型手機OEM廠商打造出整套XR解決方案，推動整個XR生態系統加速發展。宏達電也在區塊鏈市場加碼布局，HTC才獲美國商業雜誌Forbes評選為2019全球50大引領區塊鏈企業（Blockchain 50 2019）；HTC也宣布加入全新創立的區塊鏈創投基金PROOF OF CAPITAL，將投資並打造區塊鏈生態圈。展望後續，宏達電今年旗艦機目前暫無消息，市場推估可能要在下半年才發動，但瞄準5G商機，宏達電5G產品Smart hub會率先上陣，今年區塊鏈手機HTC Exodus 1已出貨、下半年將有第2代區塊鏈手機推出，都將力拚成為貢獻營收的另一股動能，後續能否扭轉營收下滑頹勢，市場將持續關注。（編輯：張均懋）1080506
製造業上市櫃公司去年營收16.9兆 5年新高,產經,2019/05/06 15:56,https://www.cna.com.tw/news/afe/201905060167.aspx,（中央社記者蔡芃敏台北6日電）經濟部統計處今天指出，製造業上市櫃公司去年個體營收淨額為新台幣16.9兆元，稅後淨利為1兆5148億元，兩者均為近5年新高。經濟部統計處發布產業經濟統計簡訊，統整每年有營運的製造業上市櫃公司計共1124家，不含KY股及TDR。統計處表示，製造業上市櫃公司去年個體營收淨額為新台幣16.9兆元，為近5年新高，年增2.5%，連續2年正成長。統計處副處長王淑娟說，以各類別來看，電腦電子產品及光學製品業營收淨額為8.6兆元，年減1.1%；電子零組件業3.7兆元，年增2.0%，主要因去年上半年半導體高階製程產能佳；化學材料業、石油及煤製品業受惠國際油價較2017年上漲，使營收分別成長11.4%及23.2%；基本金屬業則受惠鋼鐵價格上漲，帶動營收年增12.5%。統計處指出，製造業上市櫃公司稅後淨利為1兆5148億元，也是5年新高，年增1.4%，淨利率9%，較106年略減0.1個百分點。王淑娟說，電子零組件業稅後淨利為6084億元最高，年減2.1%，淨利率16.3%，較2017年減0.7個百分點，主因中國面板產能增加，但全球需求未隨之成長，供大於求，導致面板價格下跌，面板廠獲利大減；化學材料業、石油及煤製品業則受油價下跌以及美中貿易戰影響，導致獲利縮小，淨利率分別為19%及7.9%，較106年減少1.7及減5個百分點。王淑娟說，除了營收、獲利外，研發支出及固定資產投資也很重要，主要是廠商研發支出攸關未來競爭力，而固定資產投資則是積蓄未來生產動能。製造業上市櫃公司去年研發支出為4262億元，為近5年新高，年增3.4%。其中，以電子零組件業占58%居首，其次為電腦電子產品及光學製品業近3成。研發支出以台積電投入849億元居首，占整體製造業研發支出近2成，聯發科投入264億元居次，群創投入113億元排名第3。製造業上市櫃公司去年固定資產投資7為386億元，為近5年新高，年增4.5%，其中電子零組件業投資5411億元，占整體製造業73.3%，年增1.0%；固定資產投資前3大公司分別為台積電、群創以及友達。（編輯：林沂鋒）1080506
