標題,分類,時間,網址,內文
川普：中國銷美2000億美元商品關稅再調升 貿易談判不能重來,產經,2019/05/06 18:15,https://www.cna.com.tw/news/firstnews/201905060004.aspx,（中央社記者江今葉華盛頓5日專電）就在外界以為美中貿易談判進入尾聲之際，美國總統川普今天推文，拒絕中國重新談判的要求，並宣布自10日起，中國銷美價值2000億美元非高科技商品的懲罰性關稅稅率將從10%調高至25%。美國財政部長梅努欽（Steven Mnuchin）與貿易代表萊特海澤（Robert Lighthizer）日前在北京與中國國務院副總理劉鶴舉行一天會談，希望終結兩國去年以來的貿易戰。劉鶴本週也將赴華府繼續會談。梅努欽會後表示，與中國貿易談判代表在北京完成「成果豐碩」的會談。美國媒體報導，美中已接近達成貿易協議，甚至有消息人士透露，「可能」在10日前就會宣布達成美中貿易協議。就在外界預期談判即將結束之際，川普今天中午突然推文表示，過去10個月來，中國高達500億美元的高科技商品已向美國支付25%關稅，其他2000億美元商品也被課徵10%懲罰性關稅，中國向美國支付的這些關稅，是美國經濟取得重大成果的部分原因。川普接著表示，這些已經被課徵10%懲罰性關稅的商品，從10日起稅率將提高到25%。他還預告，中國仍有3250億美元出口到美國的其餘商品尚未被課徵關稅，不久後也將被課徵25%懲罰性關稅。川普指出，這些支付給美國的關稅對商品成本影響不大，主要是由中國承擔。他在推文的結尾說，與中國的貿易協商仍持續進行，但進度「太慢了」，因為中國試圖重新談判。他最後說：「不行！」（No！）（編輯：陳彥鈞）1080506
多空交雜 法人：台股恐高檔整理,證券,2019/05/06 08:25,https://www.cna.com.tw/news/afe/201905060012.aspx,（中央社記者韋樞台北6日電）台股上週受惠電子股帶領，指數逼近11100點，本週陸續有大型企業法說登場、4月營收公布，以及美國加徵中國貨品25%關稅，法人指出，都將影響本週行情，台股恐高檔量縮整理。台股3日電子股領軍，站穩萬一關卡，收在11096點，直逼11100點；而4日早上收盤的美股更因就業數據亮麗，失業率寫下49年以來最低紀錄，激勵美股道瓊工業指數終場上漲197.16點，或0.75%，收在26504.95點，那斯達克指數創上漲127.224點，或1.58%，收在8163. 996點。法人指出，本週台股面臨諸多變數，其中上市櫃公司首季財報和4月營收均將於近日公布；大陸五一長假之後是否如往年一樣漲多跌少；更重要的是外界以為美中貿易談判進入尾聲之際，美國總統川普今天推文，由於中國試圖重新協商，談判牛步，宣布週五（10日）起，對2000億美元中國商品的懲罰性關稅將調高至25%，後續效應值得觀察。另外，電子業界普遍有共識，半導體產業景氣將於上半年落底，業者期待下半年景氣可望好轉。法人觀察，電子各族群都在輪漲。隨著台積電與聯發科等半導體大廠已陸續召開法說會，公布第1季財報；華碩法說會將於7日登場，下游系統廠將是新焦點。另外，法人提醒，5月12日母親節即將來臨，包括百貨、餐飲、旅遊、飯店、美容護膚、保健品、網購與電商業紛紛祭出優惠爭食商機，相關個股均屬母親節概念股，題材是否升溫，值得注意。（編輯：鄭雪文）1080506
台股開盤跌90.94點,證券,2019/05/06 09:03,https://www.cna.com.tw/news/afe/201905060016.aspx,（中央社台北6日電）台北股市今天開盤跌90.94點，加權股價指數為11005.36點，成交金額新台幣32.67億元。 1080506
新台幣開盤貶2.3分 為30.930元,產經,2019/05/06 09:03,https://www.cna.com.tw/news/afe/201905060017.aspx,（中央社台北6日電）台北外匯市場新台幣兌美元匯率今天以30.930元開盤，貶2.3分。新台幣兌美元開盤交易區間為30.940元至30.930元。1080506
瑞昱4月營收創新高 法人估第2季有望寫新紀錄,證券,2019/05/06 09:14,https://www.cna.com.tw/news/afe/201905060019.aspx,（中央社記者張建中新竹6日電）網通晶片廠瑞昱4月業績表現亮麗，營收達新台幣48.72億元，改寫歷史新高紀錄。受惠市場動能依然強勁，瑞昱4月營收攀高至48.72億元，月增8.4%，也較去年同期成長29.8%，並超越1月創下的46.62億元單月業績歷史最高紀錄。法人預期，瑞昱第2季在新網通標案、電視與藍牙無線耳機等產品需求熱絡帶動下，季營收可望較第1季成長7%至9%，將刷新單季業績歷史新高紀錄。瑞昱今年總營收將可突破500億元，法人預期，瑞昱今年營收有機會成長2成水準，除電視與藍牙晶片產品外，無線網路晶片也將是推升瑞昱業績續創歷史新高的主要動力之一。（編輯：郭萍英）1080506
川普威脅加碼關稅 傳中國考慮取消貿易談判,產經,2019/05/06 09:43,https://www.cna.com.tw/news/firstnews/201905060021.aspx,（中央社紐約5日綜合外電報導）美國總統川普矢言調高中國商品關稅後，「華爾街日報」今天引述消息來源報導，中國考慮取消國務院副總理劉鶴赴美參與8日展開的新一輪貿易會談。華爾街日報引述匿名人士的話報導，北京對川普揚言對中國徵收新貿易關稅感到意外，而中國不想在威脅下進行談判。就在外界以為美中貿易談判進入尾聲之際，川普突然發推文說，與中國的貿易協商持續中，但進度太過緩慢，10日起將調高價值2000億美元中輸美商品的關稅稅率至25%。川普還預告，中國仍有3250億美元的輸美商品尚未被課徵關稅，不久後也將被課徵25%懲罰性關稅。川普指出，這些支付給美國的關稅對商品成本影響不大，主要是由中國承擔。（譯者：陳昱婷/核稿：蔡佳敏）1080506
大立光4月營收太亮眼 股價逆勢大漲,證券,2019/05/06 09:46,https://www.cna.com.tw/news/afe/201905060022.aspx,（中央社記者韓婷婷台北6日電）大立光受惠非蘋陣營手機鏡頭拉貨，4月營收衝破50億元關卡，年增44%，月增28%，超乎預期，激勵今天股價逆勢開高走高，早盤大漲逾4%。大立光今天以4720元上漲45元開出後，買盤湧入，推升股價一路走高，開盤半小時，股價最高來到4900元，漲幅超過4%。大立光4月營收奮力跳上新台幣50.09億元，年增44%，月增28%，大幅超越法人預估的5%至10%，非蘋客戶新機熱銷，讓一向在第3季旺季才會見到的「5字頭」，提前在淡季見到。大立光預估5月營收不會比4月差。法人表示，從大立光4月營收表現看來，非蘋客戶新機上市效益顯著外，蘋果iPhone庫存消化應已近尾聲，中國降價刺激需求也有一定挹注；大立光近幾年積極努力分散客戶，縮小上下半年淡旺季差距的策略已開始發威，讓旺季效應提前在第2季開跑。法人普遍預期，大立光第2季營收獲利都將強過首季，且考量下半年兩款蘋果新iPhone採3鏡頭、1款採雙鏡頭，新規格將使得鏡頭用量較去年的3款iPhone多出6成，就算悲觀假設iPhone出貨下降20%，鏡頭市場規模還是會年增30%至40%，顯現大立光的優勢地位。第3季開始除了蘋果進入新機拉貨期外，非蘋陣營也將有新一波的新機上市，法人預估大立光5月維持4月相當水準，已經提前進入過去旺季水準，6月分蘋果iPhone將啟動新機拉貨潮，營運持續增溫可期。（編輯：鄭雪文）1080506
傳黃秋蓮接鴻海董事長 錢媽媽助郭台銘打下江山,產經,2019/05/06 10:23,https://www.cna.com.tw/news/firstnews/201905060024.aspx,（中央社記者鍾榮峰台北6日電）鴻海董事長郭台銘參選總統將「淡出江湖」，傳出財務重臣黃秋蓮將接班董事長。黃秋蓮從鴻海草創到富可敵國，45年協助郭台銘打下江山，她更是鴻海集團財務投資的關鍵人物。知情人士向中央社記者透露，鴻海集團高層接班態勢逐漸明朗，郭台銘因參選總統，將不會擔任鴻海董事長，郭台銘將退居第二線，可能擔任集團總裁一職。至於新任董事長規劃，知情人士透露，以往郭台銘出任鴻海董事長並兼任總經理的治理方式，將有所改變，新任鴻海董事長規劃由財務重臣黃秋蓮出任，這也意味著黃秋蓮將被提名為鴻海新任董事候選人之一。黃秋蓮目前擔任鴻海集團副總裁暨集團總財務長，主導鴻海旗下負責財務會計的J次集團。鴻海集團內部員工稱黃秋蓮為「錢媽媽」，她是鴻海集團重要的財務大臣，鴻海大大小小的投資案，需要她簽字才能過關。黃秋蓮更主掌鴻海在全球各地大型投資案的關鍵資金調度。鴻海內部人流傳一句話，郭台銘蓋章，未必拿得到錢；黃秋蓮蓋章，一定拿得到錢。她在鴻海集團的重要性可見一斑。鴻海從1974年2月草創，與郭台銘亡妻林淑如有親戚關係的黃秋蓮，當時就與林淑如一同協助郭台銘管理財務，訂單忙時，黃秋蓮也曾與作業員一起趕貨。從當時新台幣30萬元的鴻海塑料起家、到目前鴻海集團和關聯企業超過6兆元的龐大規模，期間多數幹部主管來來去去，只有黃秋蓮屹立不搖，伴隨郭台銘從創業發跡到富可敵國，歷時長達45年。每當郭台銘在全球各地出席簽約合作儀式時，幾乎都可以看到黃秋蓮在旁作陪的身影。當郭台銘在中國大陸各地拜會中央和地方官員同時，黃秋蓮也幾乎沒有缺席。投資界人士說，只要看到黃秋蓮陪郭台銘出現，代表這個投資案或是合作案就底定了。根據鴻海年報，鴻海集團關係企業超過800多家，其中起碼75家是黃秋蓮掛名董事長或是首席董事一職。鴻海集團重要的轉投資機構例如寶鑫國際投資、鴻景國際投資、鴻棋國際投資、鴻元國際投資等，黃秋蓮都擔任董事長，這些投資公司也掌管鴻海集團旗下主要子公司。黃秋蓮透過這些轉投資機構，也間接掌控集團主要子公司和孫公司的營運。儘管黃秋蓮在鴻海集團內部位高權重，深獲郭台銘信任，但她與同樣在鴻海集團擔任要職的丈夫游象富，行事作風低調，不輕易對外發言或表示意見。她除了在歷年鴻海股東會上默默運籌調度外，2017年也曾在鴻海年度嘉年華活動上一同與次集團員工在舞台上表演，難得顯露輕鬆愉快的心情。（編輯：郭萍英）1080506
中美貿易談判傳生變 陸股大跌,證券,2019/05/06 09:55,https://www.cna.com.tw/news/afe/201905060025.aspx,（中央社記者翟思嘉上海6日電）中美貿易談判出現變數，陸股今天開盤雙雙大跌，並持續下探。上海證券交易所綜合股價指數開盤報點2984.73，跌3.04％，失守3000點大關；深圳證券交易所成份股價指數開盤報點9289.74，跌3.98％。至截稿前，兩市跌深近5％。美國總統川普今天在推特發文稱，由於中國試圖重新協商，談判牛步，宣布週五（10日）起，對2000億美元中國商品的懲罰性關稅將調高至25%。美國財政部長梅努欽（Steven Mnuchin）與貿易代表萊特海澤（Robert Lighthizer）日前在北京與中國國務院副總理劉鶴舉行一天會談，希望終結兩國去年以來的貿易戰。劉鶴原本預計週三將率團赴華府繼續會談，但有外媒報導稱中國考慮取消貿談。（編輯：翟思嘉/沈朋達）1080506
中美貿易再起爭端 港股下挫700點,證券,2019/05/06 10:02,https://www.cna.com.tw/news/afe/201905060026.aspx,（中央社記者張謙香港6日電）受到美國方面突然向中國產品增收關稅的消息衝擊，香港股市今早暴跌，港股早上9時30分開盤後，恆指下跌超過700點。截至9時40分，恆指下跌770點，主要成分股大都下挫，其中以陸企股跌幅最大。(編輯:沈朋達)1080506
川普再提高中國關稅 經長：預期台商加速回流,產經,2019/05/06 10:14,https://www.cna.com.tw/news/afe/201905060028.aspx,（中央社記者廖禹揚台北6日電）美國總統川普不滿與中國協商牛步，宣布10日起對2000億美元產品課徵懲罰性關稅提高至25%；經濟部長沈榮津今天表示，關稅提高一定會對在大陸投資台商造成影響，預期會加速回流台灣。美中持續進行貿易協商，川普在美國時間5日推文表示，中國試圖重新談判，造成進度緩慢；川普透過推文宣布，目前已被課徵10%懲罰性關稅的商品，10日起稅率將提高到25%，他預告，尚未被課額外關稅的3250億美元商品，不久之後也將被課徵25%懲罰性關稅。沈榮津今天列席立法院經委會，會前受訪就此議題表示，若美國對中國的懲罰性關稅提高到25%，生產品項在這2000億美元範圍內的在大陸投資台商，一定會受到影響；沈榮津也說，美國此次措施預期對台商回流台灣會有加速效果。沈榮津並指出，過去台灣跟大陸產品都是在談性價比，但自從美中貿易戰開打，還有華為、中興等事件，「資安」也成為一大重點，這波台商回流可以看到資通訊產業相關廠商回來得特別多又快，「因為高階伺服器在大陸生產，國際大廠一定有疑慮、有信賴問題，可以看到這就是給台灣的機會。」至於台商快速回流，經濟部能否保證供電穩定，沈榮津強調，穩定供電是經濟部業務的重中之重，台電會做好兩大工作，包括工程計畫如期如質管控，以及大修機組歲修期程管控，也要做好平時的機組運轉、維護保養。（編輯：郭萍英）1080506
美中貿易磋商恐破局 人民幣重貶,產經,2019/05/06 10:16,https://www.cna.com.tw/news/afe/201905060029.aspx,（中央社台北6日電）受到美中貿易磋商恐破局的衝擊，人民幣兌美元匯率今天重貶。離岸人民幣失守6.82關口，報6.8201，一日內貶值逾600點，創2016年1月以來最大跌幅，較5月4日凌晨收盤累計下跌逾850點。根據中國人民銀行（央行）官網，中國外匯交易中心授權公布人民幣匯率中間價公告，人民幣中間價報6.7344，下調58點。人行上周五將人民幣中間價定在6.7671元，下調0.9%，幅度創兩年來最大。綜合陸媒報導，在岸人民幣兌美元開盤報6.7880，較上周五夜盤收盤價6.7350跌530點。今天早盤，富時中國A50指數期貨開盤跌3.37%，跌幅隨後迅速擴大至4.2%。（編輯：楊昇儒/沈朋達）1080506
美中貿易談判若破局 台經院：對台非完全負面,產經,2019/05/06 10:13,https://www.cna.com.tw/news/afe/201905060030.aspx,（中央社記者潘姿羽台北6日電）美國總統川普宣布10日起，對2000億美元中國商品的懲罰性關稅將調高至25%；中經院學者憂心，若談判破裂，全球經濟將急速惡化；台經院學者則指出，這對台灣並非完全負面。美中貿易談判進入尾聲，外界原本樂觀預期將取得進展，市場的觀望氛圍也逐漸淡化，然而川普5日推文表示，由於中國試圖重新協商，談判牛步，10日起，對2000億美元中國商品的懲罰性關稅將調高至25%。川普並指出，與中國的貿易協商持續進行，但因中國試圖重新談判，導致進度緩慢，「沒門！（NO!）」。中華經濟研究院副院長王健全對於美中貿易談判的重大轉折，他表示，川普這次訂出提高關稅的時間點，並非馬上實施，不排除是高壓的談判手段，要求中國進行結構改革。王健全進一步指出，下一步得觀察中國的反應，如果中國沒有退讓，貿易戰全面開打，美國經濟可能從高點往下走，中國加快下行速度，歐洲持續走弱，全球經濟原本已處比較脆弱的狀態，接下來會急速惡化，台灣也會受到衝擊。台灣經濟研究院景氣預測中心主任孫明德則分析，美中貿易談判破裂可能影響全球景氣回溫的腳步，但對台灣不見得完全是負面因素，因為有轉單效應、加速廠商回台等效果，可以緊急提供一些經濟的支撐動力。孫明德表示，假如美中貿易談判到此破裂，除了近期正在回溫的各國領先指標，以及出口表現遭遇逆風，對於剛回復信心的廠商來說，也將面臨新的衝擊，原本各界預期下半年景氣回溫的樂觀情緒勢必受到影響，景氣回溫腳步會變慢或停止。不過對於台灣來說，可能會使更多台商興起返台投資的想法，孫明德指出，今年已有新台幣逾2000億元的廠商投資計畫回到台灣，美中貿易協商假如全面破裂，甚至關稅範圍波及電子零組件及資通訊產品，下半年可能更會有更大規模的台商投資潮，因此即使短期內出口受到影響，台商返台投資將可為下半年緊急提供一定的支撐動力。另外，孫明德也分析，占台灣出口比重10%的資通訊產品產業，也將擴大透過台灣直接出口美國，這類產品出口數據在今年的1到3月已經有兩位數的成長，若美中貿易戰持續擴大，預期這部分的出口數據將會持續增加。川普在談判的收尾階段，提出要增加關稅的想法，孫明德認為，應該是一種談判策略的考量，希望對方在最後的重大議題上讓步，但對於風平浪靜已久的金融市場來說，這項消息出乎市場意料，可能會讓各國的金融市場產生震盪，特別是跟貿易相關的東亞各國，將會首當其衝。（編輯：鄭雪文）1080506
鴻海富智康估第1季虧21.3億 較同期大幅收斂,證券,2019/05/06 10:17,https://www.cna.com.tw/news/afe/201905060031.aspx,（中央社記者鍾榮峰台北6日電）鴻海旗下富智康預期第1季虧損6900萬美元（約合新台幣21.3億元），較去年同期大幅收斂，並預估今年上半年虧損將低於去年同期。富智康（FIH Mobile Limited）預估，到今年3月31日的第1季合併營收約30.44億美元，較去年同期31.9億美元減少4.5%，第1季虧損預估約6900萬美元，較去年同期1.259億美元大幅收斂。展望今年上半年，富智康預期上半年虧損規模將低於去年同期虧損3.48億美元。富智康指出，集團對成本持續嚴格控制，預估上半年營運開支將減少，預估第1季營運開支約9700萬美元，較去年同期1.55億美元大幅減少。富智康並預期今年上半年其他收入可望增加，預估第1季其他收入約5600萬美元，較去年同期1700萬美元增加。展望今年，富智康表示今年持續面對2017年底到2018年的挑戰狀況，集團毛利率持續受壓，不過今年壓力可望紓緩。此外今年1月起富智康已經終止物流和銷售業務，相關業務的銷售收入將會消失，不過這也減少今年第1季銷售開支超過93.5%，富智康日前預期，今年不會因部分上市公司投資的公平總值變動而產生重大虧損，調整投資策略，聚焦5G及人工智慧、建立手機生態系統整合。（編輯：楊凱翔）1080506
韓國瑜喊話 沈榮津：自經區是大陸貨要進來,產經,2019/05/06 14:06,https://www.cna.com.tw/news/afe/201905060032.aspx,（中央社記者廖禹揚台北6日電）高雄市長韓國瑜向中央喊話，希望自經區設在高雄。經濟部長沈榮津今天表示，自經區是大陸貨要進來，是很嚴肅且要注意的問題；自經區若要做就要全面，並非針對某個區域。高雄市長韓國瑜5日下午透過臉書開直播談自由經濟示範區，兩度向行政院喊話，希望如果行政院願意選一個點來做自經區，拜託就選高雄。沈榮津今天列席立法院經委會，會前受訪對此表示，韓國瑜提到的關鍵是希望「貨能出去、錢能進來」，但自經區是「大陸貨要進來」，這是很嚴肅的問題，要注意一下。沈榮津表示，就如同行政院長蘇貞昌所說，台商在美中貿易戰開打後加速回台，且前瞻基礎建設計畫執行率超前，應加速準備好基礎建設、打好經濟基礎，並做好國內產業保護，若要做自經區就要全面，而不是針對某個區域。對於國民黨立委曾銘宗指出現在已經開放99.9%中國大陸工業產品及原物料進口，沈榮津也澄清，工業產品目前開放85%，其他未開放的15%可透過專案進口，但提出專案申請時會有管理機制，會考量國安、是否衝擊產業等問題。（編輯：楊玫寧）1080506
九暘第1季每股賺0.39元 創34季高,證券,2019/05/06 10:18,https://www.cna.com.tw/news/afe/201905060034.aspx,（中央社記者張建中新竹6日電）網通晶片廠九暘電子第1季營運轉虧為盈，每股純益新台幣0.39元，為34季新高水準。九暘近年深耕利基型及工規通訊網路產品的IC市場，只是本業營運遲遲無法擺脫虧損窘境，去年營業損失6425萬元，稅後淨損8512萬元，每股虧損1.03元。九暘今年來本業營運依然未見好轉，第1季營收1.79億元，年減15.53%，營業損失2046萬元，不過，在業外收入挹注下，第1季整體營運轉虧為盈，稅後淨利3223萬元，每股純益0.39元，為34季新高。在市場買盤積極湧入帶動下，九暘今天不畏大盤重挫，股價表現強勁，早盤即強攻漲停，達7.15元，漲幅達10%。（編輯：鄭雪文）1080506
創業家策略聯盟奏效 4月營收年增6.52%,證券,2019/05/06 10:53,https://www.cna.com.tw/news/afe/201905060041.aspx,（中央社記者吳家豪台北6日電）電商業者創業家兄弟受惠於人工智慧技術與策略聯盟，2019年4月合併營收新台幣3.8億元，年增6.52%；旗下B2B2C平台松果購物4月交易額再創歷史新高，年增率超過130%。累計今年1到4月，創業家兄弟營收達15.24億元，較去年同期減少6.32%。創業家兄弟發布新聞稿表示，4月持續掌握人工智慧（AI）與大數據的技術，挑選高性價比商品，加上連續幾波虛實整合的跨界策略結盟，以及針對「輕裝潢風」與「消暑商機」分別推出專區，均為4月營收帶來成長動能。創業家兄弟旗下B2B2C（企業對企業對消費者）松果購物4月受惠於戶外活動及母親節檔期商機，加上多元異業結盟合作，挹注4月交易額創成立以來歷史新高，年增率超過130%。創業家兄弟總經理廖家欣表示，4月生活市集先攜手共享電動機車業者WeMo Scooter搶攻虛實整合商機，共同推動綠色循環經濟；接著與Global Mall環球購物中心聯手，以線上串聯線下購物體驗，期望擴大更多元化的市場版圖。展望5月，創業家兄弟指出，將延續母親節的節慶買氣、布局端午節商機，並推出旗下平台「生活市集」的自有品牌專區。松果購物將迎接週年慶，強化引流導客及增進品牌能見度，為5月營運加持。（編輯：楊凱翔）1080506
美中貿易再生波瀾台股急跌  法人：靜觀中國回應,證券,2019/05/06 11:03,https://www.cna.com.tw/news/afe/201905060044.aspx,（中央社記者韋樞台北6日電）美中貿易談判再生波瀾，美國總統川普不滿談判緩慢，推文表達10日起調高中國進口貨品關稅。亞股早盤全數大跌，台股早盤大跌近200點。法人建議靜觀中國回應，適度調節持股。就在外界以為美中貿易談判進入尾聲之際，美國總統川普推文，由於中國試圖重新協商，談判牛步，宣布週五（10日）起，對2000億美元中國商品的懲罰性關稅將調高至25%。川普推文表示，過去10個月來，中國高達500億美元的高科技商品已向美國支付25%額外關稅，其他2000億美元商品也被課徵10%懲罰性關稅，這些關稅是美國取得巨大經濟成果的部分因素。亞股一早受此消息驚嚇，幾乎全數大跌，僅日、韓、馬來西亞股市跌幅不及1%；台股開低走低，開盤未久急挫至盤中低點10903點，不但跌破11000點大關，月線10942點也失守，成交量急增。盤面類股以半導體股跌勢較大，台積電領跌，盤中最低258元，跌幅2.64%；鴻海最低85.2元，跌幅3.4%；惟大立光四月營收飛越50億元，反而開高走高，最高達4900元，漲幅4.81%。法人表示，川普突然在中國副總理劉鶴赴美之前拋出震撼彈，符合川普向來的談判策略，施壓中國迫使接受美國的條件，但接下來中國如何接招，影響市場走向，若中國表示延緩赴美談判時間，市場將會遭受較大壓力；若中國按既定行程，則表示中國有接招的準備，市場壓力相對小。法人指出，由於突如其來利空，造成台股今天高檔急跌，破月線10942點，建議投資人靜觀其變，觀察中國如何接招和回應；同時調整手中股票配置比例，若某些個股跌幅逾越大盤，就有調節必要。（編輯：郭萍英）1080506
