標題,分類,時間,網址,內文
佐登去年每股賺逾9元 持續深耕美容產業,證券,2019/03/20 18:01,https://www.cna.com.tw/news/afe/201903200161.aspx,（中央社記者韓婷婷台北20日電）佐登-KY年獲利繳出歷史新高數字，每股盈達9.02元，展望今年，執行長陳佳琦表示，今年將持續深化美容產業鏈，提升門市效益及會員數，並加大醫美營運規模，整體營運將維持成長態勢。佐登從2017年開始布局轉型，啟動營運與品牌升級計畫，重新整理策略部署，深化消費者需求的美容產業鏈，服務範疇從「生活美容」拓展到「醫學美容」領域，加上直營店大幅成長，推動2018年營收及獲利同步創下歷史新高。稅後盈餘新台幣5.28億元，年增190%，每股盈餘（EPS）9.02元。展望今年，陳佳琦表示，今年營運重點除了持續加大研發能量外，將積極提升大陸門市單店效益及會員數，再來就是門市及醫美中心拓展，營運持續成長是基本目標。陳佳琦表示，去年透過併店與調整銷售模式，整併大陸加盟店轉為直營店，有效會員大幅成長至18萬人，透過深化會員需求與提供專屬貼心服務，以課程升級與彈性勾兌方式，將療程與產品占比逐漸調整為6比4。課程勾兌部分也開始與醫美診所合作，會員可依皮膚保養需求的調整，將原有購買療程更換為其他升級療程，同時在生美、醫美療程與療程與產品中進行轉換輪替搭配，有效提升會員滿意度與黏著度，具體展現獲利成效。在研發部份，陳佳琦指出，持續與產學合作，設定「一年一發明獎、一專利、一特殊商品」研發目標，目前已規劃3年研發及中長期發展計畫，同時啟動跨國合作，積極參與國際展與獎項，提升研發與產品力；且為落實產學合作與人才培育計畫，目前已與40所高中職、大學進行合作。通路開發部分，佐登將採取虛實通路並進，包括兩岸電商，台灣藥妝店、寶雅店中店等，增加品牌能見度及來客數，同時全力拓展國際通路，參加全球指標性美容展，拓展國際市場與大陸區域授權代理與ODM業務。另外，將透過直營、加盟、大陸區域授權代理，門市家數目標達到台灣160家、大陸545家、馬來西亞18家、大陸醫美院所5家，合計共728家。醫學美容中心去年第1家營運即呈現獲利，今年將開始在廣州、廈門、武漢、成都、長沙、北京等大城拓點，增加5家醫美中心，涵蓋中國大陸華東、華中、華北、華南及西南區域，展開新營運模式。（編輯：張均懋）1080320
台積電攀5個月新高價 台股創波段高,證券,2019/03/20 14:12,https://www.cna.com.tw/news/afe/201903200164.aspx,（中央社記者張建中台北20日電）台股開高震盪收高，終場收在10551.56點，再創波段新高；台積電股價走揚，收在新台幣242元，創5個多月新高價，是推升台股走高的一大動力。加權指數今天收在10551.56點，漲39.24點，漲幅約0.37%，成交值1186.67億元。傳統產業股普遍走揚，其中，離岸風電概念股世紀鋼與大成鋼股價走勢強勁，同步大漲逾4%，帶動整體鋼鐵類股指數漲1%，表現最強。水泥與塑膠類股表現相對疲弱，同步小跌。電子股方面，股王大立光開高震盪走低，終場收在4695元，跌25元，另一光學鏡頭廠玉晶光股價同步走跌，收在344元，跌9元，影響光學類股指數跌0.32%。晶圓代工龍頭廠台積電股價表現相對強勢，震盪收高，終場收在242元，漲1.5元，並創5個多月新高價，帶動半導體類股指數漲0.54%，連帶推升整體電子類股指數漲0.41%。環球晶決議每股配息25元，台勝科也將配息9元，殖利率都逾8%，在高殖利率激勵下，環球晶等半導體矽晶圓股價齊揚，環球晶收漲5元，台勝科漲6.5元，環球晶母公司中美晶股價隨著走高。分析師王兆立表示，台股短期可能延續震盪走勢，以個股表現為主；美中貿易戰協商情況仍將是市場關注重點。（編輯：郭萍英）1080320
黃國昌質疑華映補貼陸企 顧立雄：3週內提報告,產經,2019/03/20 14:17,https://www.cna.com.tw/news/afe/201903200168.aspx,（中央社記者邱柏勝、潘智義台北20日電）立委黃國昌質疑，華映對中國子公司華映科技承諾保證獲利10%，等於拿台灣股東的錢補貼陸企，且年報也未揭露，損害台灣投資人權益，金管會主委顧立雄表示，3週內會提出調查報告。針對黃國昌所提質疑，華映今天表示，對華映科技的收益保證事項並未違法，歡迎主管機關調查，以利澄清真相。中華映管因財務危機，向法院聲請重整，日前更公布重訊，宣布裁員2500人，以台灣銀行為首的聯貸銀行團也與華映債務協商中，目前聯貸授信餘額仍有近新台幣70億元。時代力量立委黃國昌今天在立法院財政委員會上提出質疑指出，華映對中國子公司華映科技提出投資報酬保證，保證年收益10%，但這部分並未在華映2010年的重訊上清楚說明，僅說「相關承諾事項尚稱公允，對公司營運、股東權益及財務報表無明顯影響」。黃國昌說，2010年中國深交所就已經公告，把華映對華映科技的承諾事項鉅細靡遺寫清楚，但證期局到2017年才要求華映說明。華映指出，目前已喪失對華映科技的經營權，至於先前對華映科技的業績保證，是每年保證收益率為淨資產的10%，前提是要有正常出貨。對華映科技的收益保證事項並未違法，歡迎主管機關調查，以利澄清真相。不過，華映目前尚欠華映科技貨款，華映科技已公告，於2018年12月29日在福建省高級人民法院提起訴訟，請求中華映管公司子公司華映百慕達支付人民幣19.14億元（約折合新台幣87億元）。華映重申，轉投資中國大陸華映科技持股仍為26.37%，是最大股東，但因辭去董事長及董事職務，已喪失對其控制力。顧立雄表示，金管會會針對華映對華映科技的承諾事項進行了解。目前華映與華映科技在訴訟中，華映表示遭求償的機率不高，但金管會會再進一步了解情況；其次將了解華映是否已喪失對華映科技的控制力，最後是確認華映的資訊揭露是否充足。顧立雄也承諾，3週內將提出調查報告。（編輯：張均懋）1080320
等待聯準會政策決議 日股收紅,證券,2019/03/20 14:24,https://www.cna.com.tw/news/afe/201903200171.aspx,（中央社東京20日綜合外電報導）在晶片類股領漲下，日本股市今天收高。投資人等待美國聯邦準備理事會（Fed）今天稍晚公布貨幣政策會議結果。日經225指數收盤小漲42.07點或0.20%，收21608.92點。東證一部指數上漲4.16點或0.26%，收1614.39點。（譯者：張正芊/核稿：蔡佳敏）1080320
雙子星案疑涉中資 經濟部：投審會3月無法排審,產經,2019/03/20 14:32,https://www.cna.com.tw/news/afe/201903200174.aspx,（中央社記者廖禹揚台北20日電）雙子星開發案陷入中資疑雲，經濟部投審會已將相關資料送請相關單位審查，但目前仍未收齊意見，立法院也要求審核完竣前要先專案報告，雙子星案確定無法在3月排審。經濟部官員表示，3月聯審會議時間尚未排定，但會在下週召開，雙子星案目前仍有3、4個單位未回覆意見，加上今天立法院經濟委員會通過臨時提案，此案審核完竣前，應與陸委會、國安局、外交部等相關單位，至經委會專案報告，因此確定趕不上3月議程。高達新台幣600億元的雙子星開發案，歷經6次招標，去年底確定由香港商南海發展集團獲最優申請人資格，台北市捷運局原預計今年3月底與廠商簽約，不過南海發展母公司南海控股向經濟部投審會提出的申請案仍在審查。台北市長柯文哲先前多次批評投審會效率不彰，投審會回應，此案投資人於1月25日送件，但3月4日才備齊申請資料，投審會考量時效性，早就將資料先送請台北市政府、大陸委員會、國家安全局等相關單位審查，但目前仍未取得所有意見回覆，無法排入會議議程。時代力量立委徐永明今天在立法院經濟委員會質詢經濟部長沈榮津，南海先前也投資陽信銀行，若現在懷疑涉及中資，陽信案是否也該重新審視。投審會執行秘書張銘斌說明，南海對台投資資金是否含有中國中央匯金，仍需再釐清，並表示會連同陽信案一併檢核。沈榮津表示，投審會是跨部會機制，包括國安單位、陸委會、金管會等，現在有新的事證，就要重新確認。（編輯：王永志）1080320
南山人壽片面變更契約損保戶權益 金管會4月開罰,產經,2019/03/20 14:36,https://www.cna.com.tw/news/afe/201903200176.aspx,（中央社記者邱柏勝台北20日電）南山人壽片面變更保費收取方式，但未徵得保戶同意，導致部分保戶的保單停效或自動墊繳保費，損害保戶權益。金管會主委顧立雄表示，已請南山人壽陳述意見，處分書將於4月出爐。南山人壽原本有15萬件保單，保費是由公司派專人收取，但南山人壽在2017年底大砍130名收費員，並改由保戶自行繳納保費，有保戶因未注意繳費方式變更未繳保費，導致保單超過繳費期60天後停效，或自動從客戶的保單價值準備金（保價金）墊繳保費。據統計，南山人壽片面變更保費收取方式後，共造成200多件保單停效、2000多件保價金墊繳。民進黨立委江永昌今天在立法院財政委員會質詢顧立雄，認為南山人壽此舉有損保戶權益，要求金管會依保險法有礙健全經營之虞，對南山人壽開罰。顧立雄回應，目前已請南山人壽陳述意見，預計4月處分書出爐。而根據南山人壽日前回應，依據契約條款規定，已寄發相關繳費提醒通知給保戶。對於繳費管道調整，南山人壽為維護保戶權益，已規劃完善的相關配套措施，並由專人聯繫提醒保戶繳費。但若有少數案件因繳費管道調整，未注意繳費事宜以致保單受影響，會全力協助保戶完成繳費事宜，並恢復保單效力。不過，保險局官員強調，南山人壽請客戶勾選保費收取方式，並依此方式收費，就成為契約的一部分，南山人壽若要變更收費方式，必須取得客戶同意，不能強制，否則就是損害客戶權益。保險局官員說，南山人壽片面變更保險契約事項，已違反契約約定，且保戶因公司未派員收費導致未繳保費，這屬於南山責任，保單不能因此失效或停效，也不能向保戶收取保價金墊付的利息。（編輯:李信寬）1080320
程泰擬配息3元 殖利率約5.46%,證券,2019/03/20 14:50,https://www.cna.com.tw/news/afe/201903200182.aspx,（中央社記者鍾榮峰台北20日電）工具機大廠程泰去年每股賺5.41元，擬盈餘分配現金股利每股3元，盈餘配發率約55.4%，若以今天收盤價54.9元計算，現金殖利率約5.46%；程泰擬於6月14日召開股東會。程泰去年合併營收新台幣83.82億元，較前年75.78億元成長10.6%，去年合併毛利率23.58%，較前年25.17%微減1.59個百分點，去年合併營業利益7.95億元，合併營益率9.48%，較前年10.11%微減0.63個百分點。程泰去年歸屬母公司業主淨利5.97億元，較前年3.79億元增加57.2%，去年每股稅後純益（EPS）5.41元，優於前年EPS 3.44元。法人指出，程泰去年獲利和每股純益來到3年高點。觀察在手訂單規模，法人表示，程泰目前在手訂單超過新台幣10億元。展望今年營運，法人預估，程泰集團今年營運目標力拚較去年小幅成長，業績有機會超過85億元，衝歷年新高。從市場比重來看，目前中國大陸市場占程泰整體業績比重近3成，美洲市場占比約1成多，歐洲市場占比近2成，日本市場占比約5%，中東市場占比約8%到9%。（編輯：張均懋）1080320
三大法人買超台股52.84億元,證券,2019/03/20 15:04,https://www.cna.com.tw/news/afe/201903200188.aspx,（中央社台北20日電）台股今天漲39.24點，收在10551.56點，成交值新台幣1186.67億元。三大法人外資及陸資買超、投信買超、自營商賣超，合計買超新台幣52.84億元。自營商賣超4.55億元，投信買超1.44億元，外資及陸資買超55.95億元。三大法人合計買超52.84億元。分析師王兆立表示，台股短期可能延續震盪走勢，以個股表現為主；美中貿易戰協商情況仍將是市場關注重點。1080320
促台商回流 陳美伶：加碼國發基金滿足需求,產經,2019/03/20 15:09,https://www.cna.com.tw/news/afe/201903200192.aspx,（中央社記者潘姿羽台北20日電）為協助台商順利返台投資，國發基金匡列新台幣200億元助企業融資，國發會主委陳美伶今天表示，企業需求已超過200億元，國發基金將加碼，「需求到哪裡，我們就提供到哪裡。」行政院端出的「歡迎台商回台投資行動方案」，從滿足用地需求、充裕產業人力、協助快速融資、穩定供應水電、稅務專屬服務等5大策略著手，而在協助快速融資方面，由行政院國發基金匡列200億元額度，委由銀行以自有資金辦理專案貸款，協助廠商取得興建廠房及設施、購置機器設備及中期營運週轉金等，貸款利率不超過郵政儲金2年期定期儲金掛牌利率加年息0.5%機動計息。陳美伶今天出席三三會時接受媒體訪問表示，目前台商回來台灣投資的情形非常熱烈，國發基金原本匡列200億元作為利息補貼，現在金額已經不夠了，未來會依台商的需求擴增範圍，需求多少，就會滿足多少，沒有設定上限，希望台商不用擔心，歡迎回來投資。她說，只要企業投資需要融資，有多少需求，政府就會滿足；適用條件方面，政府也會滾動檢討，如果企業認為部分條件太嚴格，只要具體提出，就會提到跨部會會議討論有無改善空間。三三會上，企業界屢屢提到台灣應該設立自由經濟示範區，以利國際化，陳美伶重申3點立場，第一是政策應該全國適用，第二是台灣經濟自由度已經非常高，第三，台灣之所以沒辦法進入區域整合，不是能力不夠，而是政治因素，特別是來自中國的阻撓，讓台灣沒辦法加入區域整合，因此，這本質不是經濟議題，而是政治問題。不過，對於國民黨提出的「自由貿易經濟特區特別條例草案」，陳美伶表示，待實際看到草案內容後，會提出國發會的看法。（編輯：郭萍英）1080320
美時與富士製藥交叉投資 私募價訂125.5元,證券,2019/03/20 15:28,https://www.cna.com.tw/news/afe/201903200196.aspx,（中央社記者韓婷婷台北20日電）美時製藥今天與日本富士製藥共同宣布簽署投資與商業合作計劃，將透過私募進行交叉持股，美時私募價格訂定在125.5元。為深化亞洲佈局，美時於董事會中決議以每股新台幣125.5元的價格私募現金增資引進策略投資人富士製藥，富士將以2000萬美元（合新台幣約6.17億元或22.25億日圓）認購並持有美時2.0%的股權，而美時也將以2000萬美元取得富士約3.9%的股權。美時表示，這項交易將強化美時與富士公司在日本及亞洲的商業布局，雙方正積極洽談產品線交換的機會，並承諾攜手為亞洲病患開發、製造更多特殊學名藥產品以擴大綜效。美時董事長魏斯曼(Robert Wessman)表示，富士擁有豐富的研發資源，與富士攜手深耕亞洲市場將有助於區域布局。富士則看中美時在口服抗癌與特殊學名藥領域的研發與製造能力，希望透過雙方交叉投資進行長期商業合作，擴大市場。（編輯：鄭雪文）1080320
央行21日理監事會 國泰估利率不變,產經,2019/03/20 15:43,https://www.cna.com.tw/news/afe/201903200206.aspx,（中央社記者邱柏勝台北20日電）央行明天將召開第1季理監事會，國泰金控預期，央行利率將維持不變。且有5大變數影響今年經濟成長，包含美中貿易、聯準會利率政策態度、中國經濟、英國脫歐風險，及台灣的總統大選。國泰金控今天舉辦2019年第1季台灣經濟氣候暨金融情勢發表會。國泰台大產學團隊成員、中央大學經濟系教授徐之強提及，今年初以來，美中貿易戰風險暫獲舒緩，加上主要央行貨幣政策傾向轉趨寬鬆，全球主要股市也出現反彈，皆舒緩台灣原本一度緊縮的金融情勢。展望2019年，徐之強預期，全球經濟成長動能持續疲弱，成長的下行風險仍未消除，且台灣領先指標持續下滑，並低於長期趨勢水準，因此預期台灣第1季經濟成長動能相對保守，並研判3至6月經濟氣候，仍可能出現代表景氣轉弱的「陰」，但出現「雨」的平均機率降至10%以下，因此未來景氣動向，有機會稍加改善。國泰金控預期，2019年台灣經濟成長率為2.2%，央行在3月將維持利率不變，且升息的可能性已明顯降低，甚至低於今年降息的可能性，且今年全年維持利率不變的機率也相當高。整體而言，受惠外部風險暫獲舒緩，研判第2季前，台灣整體金融情勢可望回穩，不致有緊縮壓力。國泰金控認為，今年有5大變數影響台灣經濟成長，首先是美中貿易戰，國泰金控表示，美國與中國貿易談判雖暫緩解，但惡化風險依舊存在，仍需關注。此外，聯準會雖然放緩升息步伐，但仍未完全放棄升息，其與市場預期的落差，恐造成金融情勢短期動盪。第三個變數是中國經濟，雖然中國持續推出較為寬鬆的財政與貨幣政策，但實際效果仍待觀察。第四是歐洲經濟情況，國泰金控表示，今年德國成長動能偏弱，且目前仍無法輕忽英國脫歐風險。最後，則是國內總統大選接近，財經與兩岸政策的爭辯將更白熱化，也將牽動台灣經濟成長表現。（編輯：楊凱翔）1080320
掌握中小型股趨勢 富櫃200指數27日登場,證券,2019/03/20 15:59,https://www.cna.com.tw/news/afe/201903200212.aspx,（中央社記者韓婷婷台北20日電）櫃檯買賣中心總經理李愛玲表示，3月27日將正式發布「富櫃200指數」，其成分股市值涵蓋率7成、成交值涵蓋率更高達9成，指數基期點數設定為5000點，可更貼近櫃買市場交易狀況。李愛玲表示，「富櫃200指數」挑選具流動性且市值規模最大的200檔上櫃股票做為成分股，扣除無法在市場上流通的股份，以市值佔70%，流通量佔90%來篩選，其中半導體、生技、電子產業為大宗，可更貼近櫃買市場交易狀況，相當適合作為追蹤櫃買市場表現的工具。此外，富櫃200指數以5000點作為基期點數，波動的跳動相對較大，較具吸引力，漲跌趨勢更為明顯，可望成為觀察台灣中小型股票漲跌的新指標。李愛玲表示，櫃買中心已洽商期交所合作事宜，並積極鼓勵業者發行以富櫃200指數或以其為基礎發展各式主題型指數為連結標的權證、指數投資證券（ETN）或指數股票型基金（ETF）等金融商品。預計將先發行指數期貨商品，首波將與群益金鼎、凱基、元富、富邦、元大、兆豐等6家證券商簽訂指數授權契約，發行權證以及ETN等商品，未來也會與投信業者推動發行ETF商品。（編輯：鄭雪文）1080320
北市青創計畫徵件 釋出萬華青年公宅19戶,產經,2019/03/20 16:01,https://www.cna.com.tw/news/afe/201903200214.aspx,（中央社記者劉建邦台北20日電）台北市都發局說，即日起，透過青年創新回饋計畫徵件，釋出萬華區青年一區公宅共19戶，並推出安心樂租網，民眾可上網搜尋各局處推出平價住宅等資訊。北市府都市發展局今天舉辦「萬華區青年一期公共住宅-青年創新回饋計畫徵件記者會」。局長黃景茂表示，青年一期公宅的「青年創新回饋計畫」即日起開跑，共釋出19戶，希望透過年輕人活力、創新，在公宅舉辦相關活動，讓老中青住戶可一起參與。都發局資料顯示，位在萬華區青年路186號、188號的青年一期公宅，總計273戶，包含套房170戶、一房型13戶、二房型60戶、三房型30戶，月租金從新台幣8100元至1萬9800元。都發局表示，「青年創新回饋計畫」的青年一期公宅，以社區經營為主題，分成社區活動類、策畫經營類、人際網絡類，符合入住公宅資格的市民就可申請，提案經審查、評選後，可免抽籤入住。都發局也宣布「安心樂租網」今天正式上線。黃景茂說，安心樂租網整合各局處轄管各類型出租住宅資訊，像是都發局公宅、社會住宅包租代管計畫，捷運局的捷運聯開宅，社會局的老人住宅、婦女中途之家，財政局的都更住宅、眷舍，有租屋需求，且符合申請資格的市民可透過樂租網搜尋適合住宅。都發局表示，「青年創新回饋計畫」是指提供一般戶10% 戶數，讓符合一般住戶申請條件青年，免抽籤，提出社會回饋提案方式，並透過徵選機制，獲得入住機會，希望藉由提案青年回饋社區過程，搭起公宅與社區間的互動橋樑。（編輯：李亨山）1080320
新台幣升0.5分 收30.833元,產經,2019/03/20 16:05,https://www.cna.com.tw/news/afe/201903200216.aspx,（中央社台北20日電）台北外匯市場新台幣兌美元今天收盤收30.833元，升0.5分，成交金額4.25億美元。新台幣兌美元今天開盤價為30.85元，最高30.808元、最低30.850元。1080320
2月外銷訂單連4黑 年減10.9%,產經,2019/03/20 16:08,https://www.cna.com.tw/news/afe/201903200218.aspx,（中央社記者廖禹揚台北20日電）經濟部統計處今天公布2月外銷訂單金額289億美元，年減10.9%，連續第4個月負成長，減幅比原預估的年減1.4%至4.5%更高。今年景氣普遍看淡，加上智慧型手機需求疲弱，外銷訂單表現不如去年亮眼，去年11月外銷訂單翻黑至今已連續4個月負成長，繼去年12月外銷訂單更大幅年減10.5%，今年2月又大減10.9%。展望未來，第1季原本就是傳統的銷售淡季，不過，近期國際原物料價格有止跌回穩跡象，加上美中貿易談判持續進行，有助全球經濟回穩，傳統貨品接單可望逐漸恢復，但是各國貿易保護措施，仍是必須密切觀察的不確定因素。（編輯：楊凱翔）1080320
資誠：台灣企業領袖擔憂議題 貿易衝突居首,產經,2019/03/20 16:08,https://www.cna.com.tw/news/afe/201903200219.aspx,（中央社記者潘姿羽台北20日電）資誠今天發布台灣企業領袖調查報告，結果顯示，台灣企業領袖最擔憂的前3大威脅依序為貿易衝突、地緣政治不確定、政策不確定性；為了因應貿易變局，有4成企業將調整供應鏈及採購策略。資誠聯合會計師事務所今天發布「2019資誠台灣企業領袖調查報告」，相較於去年企業領袖關注「恐怖主義、氣候變遷」等社會性議題，今年最擔憂的前5大威脅，依序為「貿易衝突、地緣政治的不確定性、政策不確定性、匯率不穩定、保護主義」，皆與企業自身營運表現直接相關。資誠分析，儘管中美貿易停戰期延長，結果仍存在未知數；此外，近期包括美國與歐盟的農產品貿易爭議升溫、美日貿易談判可能在4月重新啟動，以及美國擬終止印度和土耳其的關稅優惠待遇等議題，都讓「貿易衝突」成為企業領袖揮之不去的首要威脅。面對貿易變局，資誠也進一步調查台灣企業領袖的因應方式，有40%表示將「調整供應鏈和採購策略」，「將成長重心轉移到其他市場」也有39%，「將生產轉移到其他地區」則達29%。至於台灣企業領袖眼中的重要海外市場，資誠調查顯示，有75%企業領袖將中國視為影響整體成長最重要的國家，美國的重要性則2018年的59%下降至52%，值得注意的是，越南的重要性從9%增至18%，首度超越德國的14%，成為台灣企業領袖眼中第4重要的市場。「2019資誠台灣企業領袖調查報告」執行期間為2018年10月至12月，由資誠聯合會計師事務所合夥人以面訪方式以及委託山水民意研究公司（Focus Survey Research）進行電話及網路問卷調查，完成245份量化問卷，並針對12名台灣企業領袖與專家學者進行深度訪談。（編輯：蘇志宗）1080320
