標題,分類,時間,網址,內文
美貿易代表財長下週返北京 川普：談判非常順利,產經,2019/03/20 07:34,https://www.cna.com.tw/news/afe/201903200009.aspx,（中央社華盛頓19日綜合外電報導）媒體報導，美國貿易代表萊特海澤和財政部長梅努欽下週將重返北京，與中國官員舉行新回合會談。美國總統川普今天表示，美中貿易談判進行得「非常順利」。華爾街日報引述美國政府官員的話報導，萊特海澤（Robert Lighthizer）和梅努欽（Steven Mnuchin）預料下周將前往北京，與中國副總理劉鶴會談，劉鶴則將於隔周回訪華盛頓。根據華爾街日報報導，美中貿易談判已進入最後階段，目標是在4月底前達成協議。最近幾週，美中談判的動力似乎放緩，雙方恢復穿梭外交，是協商取得進展的跡象。美國高階政府官員今天也告訴路透社和法新社，梅努欽和萊特海澤下周將重返北京。川普在白宮與巴西總統波索納洛（Jair Bolsonaro）的聯合記者會尾聲，回答記者的高聲提問時表示：「與中國的談判進行得非常順利。」但他未進一步說明。（譯者：陳政一）1080320
無畏脫歐亂流等待Fed會議結果 歐股收高,證券,2019/03/20 04:37,https://www.cna.com.tw/news/afe/201903200010.aspx,（中央社倫敦19日綜合外電報導）在投資人面對更混亂的英國脫歐情況，以及等待美國聯邦準備理事會（Fed）的最新政策會議結果之際，歐洲主要股市今天收高。英國下議院議長貝爾考（John Bercow）昨天援引一項400多年歷史的議事規則，指首相梅伊不能送相同議案重複表決，讓梅伊想趕在20日前再將脫歐協議交國會表決的計畫觸礁。不過官方數據顯示英國失業率降至44年來新低3.9%，且薪資上揚幅度超過通貨膨脹率，抵銷脫歐挫折的影響，英鎊走堅，倫敦股市上揚。倫敦FTSE 100指數上漲0.3%，收在7324.00。法蘭克福DAX 30指數上揚1.1%，收在11788.41。巴黎CAC 40指數上漲0.2%，收在5425.90。（譯者：陳政一）1080320
美中貿易談判傳出相互矛盾報導 美股平盤作收,證券,2019/03/20 08:20,https://www.cna.com.tw/news/afe/201903200011.aspx,（中央社紐約19日綜合外電報導）由於投資人靜候美國聯邦準備理事會（Fed）為期兩天的決策會議結果，以及傳出相互矛盾美中貿易談判報導，華爾街股市今天幾乎以平盤作收。華爾街股市今天大部分時間都走高，但後來彭博報導美中貿易談判出現緊張，可能不利達成廣泛協議，盤勢急轉直下。不過媒體後來報導，美國貿易代表萊特海澤和財政部長梅努欽下周將重返北京，與中國官員舉行新回合會談。美國總統川普也表示，美中貿易談判進行得「非常順利」。華爾街日報引述美國政府官員的話報導，萊特海澤（Robert Lighthizer）和梅努欽（Steven Mnuchin）預料下周將前往北京，與中國副總理劉鶴會談，劉鶴則將於隔周回訪華盛頓。根據華爾街日報報導，美中貿易談判已進入最後階段，目標是在4月底前達成協議。最近幾週，美中談判的動力似乎放緩，雙方恢復穿梭外交，是協商取得進展的跡象。，根據分析，聯準會結束今年第2場貨幣政策會議時，幾乎不可能宣布調升利率，原因是全球經濟成長走軟，決策官員全都曾承諾，這回將暫停火力不升息。由於今年來美國經濟成長減速，通貨膨脹仍溫和，經濟學家還預期，聯準會官員將把他們預測今年的升息次數，由去年12月預期的2次再度調降。道瓊工業指數終場小跌26.72點，或0.1%，收在25887.38點；標準普爾500指數微跌0.37點，或0.01%，收在2832.57點。以科技股為主的那斯達克指數小漲9.47點，或0.12%，收在7723.95點。（譯者：陳政一）1080320
美國增產抵銷油國減產 國際油價漲跌互見,產經,2019/03/20 08:21,https://www.cna.com.tw/news/afe/201903200012.aspx,（中央社紐約19日綜合外電報導）儘管沙烏地阿拉伯為首的主要石油生產國同意減產，繼續共同支撐原油價格，以及美國對石油生產國伊朗和委內瑞拉實施制裁，美國產量卻不斷增加，國際油價今天漲跌互見。紐約市場西德州中級原油4月期貨價格下跌0.07%，報每桶59.05美元。倫敦市場北海布倫特原油5月期貨價格上漲0.19%，報每桶67.67美元。（譯者：陳政一）1080320
美中拚4月達成貿易協議 華府憂北京立場轉硬,產經,2019/03/20 07:46,https://www.cna.com.tw/news/firstnews/201903200013.aspx,（中央社記者尹俊傑紐約19日專電）美中計劃下週展開新一輪貿易談判，力拚4月底前達成協議。美國總統川普今天對談判進展表示樂觀，但美方談判代表憂心，北京抗拒華府提出的多項要求，立場有轉硬跡象。華爾街日報引述川普政府官員說法報導，美國貿易代表萊特海澤（Robert Lighthizer）與財政部長梅努欽（Steven Mnuchin）預計下週飛往北京，與中國首席談判代表、國務院副總理劉鶴會面，劉鶴將於隔週率團訪問華府。美中貿易談判接近尾聲，但萊特海澤上週說雙方仍待解決「重大」問題，意味川普幾乎不可能在3月底前和中國國家主席習近平會面，宣布兩國達成化解貿易戰的協議。美方曾表明，無論北京承諾增購多少美國貨品與服務，美中貿易協議都必須解決商業機密與智慧財產權盜竊問題。報導引述匿名消息人士透露，美中鎖定4月底前達成貿易協議，比雙方原先規劃晚了一個月。川普2月底在越南和北韓領導人金正恩談判觸礁，北京擔心美中若沒有在「川習會」前敲定貿易協議，川普可能當面逼習近平接受對中方不利的協議。美中代表以英文磋商協議文本，中方需要時間翻譯，劉鶴也須徵詢中共高層同意，這些因素都拖延可望在佛州舉行的「川習會」。另一癥結在於美中如何取消去年對彼此貨品加徵的關稅。美方希望視中國履行承諾情況逐步取消，北京則希望華府迅速取消對中國貨品加徵的關稅。美方談判代表將關稅分成兩類，較願意取消去年9月對2000億美元中國貨品加徵的10%關稅，希望保留去年7至8月對500億美元中國貨品加徵的25%關稅。加徵25%關稅的用意，是依白宮計算補償中國強迫技術轉移對美國企業造成的傷害。據報導，美中希望貿易協議包含美國大幅增加對中國出口，中方承諾加強保護智慧財產權、停止施壓美國企業將技術轉移給中國合作夥伴、減少補貼國有企業。川普今天在白宮與巴西總統波索納洛（Jair Bolsonaro）舉行聯合記者會期間，回應在場媒體高聲提問時說：「與中國的談判進展非常順利。」美中貿易戰牽動全球金融市場行情，今年以來，川普多次對雙方化解貿易摩擦表達樂觀，提振投資人信心，美股表現亮眼。但彭博引述知情人士說法報導，中國官員同意修改智慧財產權保護政策後，川普政府未保證取消對中國貨品加徵的關稅，北京談判立場出現轉硬跡象。知情人士說，北京不再承諾保護製藥業資料，未提出加強專利連結制度的計畫詳情，拒絕在資料服務議題上讓步，並爭取在貿易協議中添加字句，以確保相關規則符合中國法律。據報導，美國貿易代表署（USTR）日前將意見送達中方談判代表，嘗試釐清中國智慧財產權保護修訂提案字句引發的疑慮。部分美方官員認為中方承諾縮水是談判策略。萊特海澤身邊的人士否認中方官員收回先前提出的承諾。一名掌握談判進展的中方官員說，美中持續談判，過程中本來就會討價還價。（編輯：陳政一）1080320
費半強漲 法人估台股震盪偏多,證券,2019/03/20 08:19,https://www.cna.com.tw/news/afe/201903200020.aspx,（中央社記者張建中台北20日電）美股漲跌互見，道瓊工業指數小跌26.72點，費城半導體指數表現相對強勁，漲18.58點，漲幅達1.34%。法人認為，隨著台幣轉強，外資熱錢湧入，台股將震盪偏多。受美中貿易談判傳出現緊張影響，美股走勢震盪。道瓊工業指數收跌26.72點，跌幅0.1%；標準普爾500指數跌0.37點，跌幅0.01%；那斯達克指數漲9.47點，漲幅0.12%；費城半導體指數漲18.58點，漲幅1.34%。國內外產業訊息方面，半導體矽晶圓廠環球晶去年營收與獲利同創歷史新高紀錄，每股純益新台幣31.18元，每股將配發25元現金股息，同創歷史新高，以19日收盤價308.5元計，殖利率達8.1%。興富發去年每股純益6.01元，每股將配發3.5元現金股息，以19日收盤價48.9元計，殖利率約7.16%。尚凡去年每股純益13.48元，終結近3年虧損，董事長張家銘表示，今年將聚焦在投資報酬率較高的市場，以衝高獲利為首要目標。法人看好尚凡今年每股純益可望再創高。中租-KY去年首度賺逾1個股本，達新台幣10.37元，董事長陳鳳龍表示，今年整體業務維持雙位數成長，台灣估成長10%，大陸及東協成長20%。（編輯：趙蔚蘭）1080320
華固：商廠辦供需失衡 今明年推4大案,產經,2019/03/20 08:21,https://www.cna.com.tw/news/afe/201903200022.aspx,（中央社記者韋樞台北20日電）華固建設董事長鍾榮昌認為住宅和辦公空間供給失衡，未來幾年台灣亟需商辦或廠辦大樓，華固今明兩年破天荒推動4大商辦案，估計挹注2021年到2022年營運。近年大台北地區商辦或廠辦大樓的需求大於供給，難得有一個A級的商辦，幾乎短時間內都會滿租。鍾榮昌表示，華固當年從台北內湖科學園區興建商辦起家，後來在大台北精華地段興建豪宅，現在由於商辦或廠辦亟缺，華固現在的推案策略要因應市場變化，商辦和廠辦要多於住宅案。鍾榮昌指出，過去雙北市有很多土地都用於興建豪宅或住宅，現在才發現有些住宅不易銷售，但商辦或廠辦大樓空間反而不夠用，形成供給失衡，因此現在新的商辦或廠辦大樓多半向外圍區域發展。鍾榮昌說，華固手上待推案的商辦或廠辦大樓有4大案，分別是正在興建中的大直「亞太置地」商辦案、今年第4季動工的士林科技園區案和內湖5期潭美商辦案。另外，19日以新台幣20億3613萬元向4位自然人及歌林開發股份有限公司買下原為歌林購物中心的新北市新莊區建國段267等地號4筆土地，預計明年第2季動工的廠辦案。華固建設總經理洪嘉昇表示，大直「亞太置地」商辦案總銷80億元，預計2020年可完工；士林科技園區案總銷約15億元，內湖5期潭美案總銷30億元，預計2021年完工；新莊廠辦案總銷60億元，預計2022年完工。顯示華固未來數年都有完工個案等著供應市場。相對商辦或廠辦大樓有4個，住宅案反而只有2個。洪嘉昇說，包括台北市石牌的「華固翡儷」總銷50億元，以及內湖5期潭美住宅案總銷60億元，均於2022年完工交屋。至於今年入帳的3大住宅案包括「華固樂慕」、「華固新代田」、「華固名鑄」等合計總銷約160億元。（編輯：張均懋）1080320
新台幣開盤貶1.2分 為30.85元,產經,2019/03/20 09:03,https://www.cna.com.tw/news/afe/201903200028.aspx,（中央社台北20日電）台北外匯市場新台幣兌美元匯率今天以30.85元開盤，貶1.2分。1080320
台股開盤漲16.98點,證券,2019/03/20 09:03,https://www.cna.com.tw/news/afe/201903200029.aspx,（中央社台北20日電）台北股市今天開盤漲16.98點，加權股價指數為10529.3點，成交金額新台幣14.95億元。1080320
環球晶台勝科股息殖利率逾8% 股價齊揚,證券,2019/03/20 09:30,https://www.cna.com.tw/news/afe/201903200033.aspx,（中央社記者張建中新竹20日電）半導體矽晶圓廠環球晶與台勝科去年獲利同創歷史新高，並都採取高配息政策，殖利率逾8%，激勵兩公司今天股價同步走揚。半導體矽晶圓市場供不應求，產品價格調漲，環球晶與台勝科去年營運同步繳出亮麗成績單，營收與獲利同創歷史新高紀錄，環球晶去年每股純益高達新台幣31.18元，台勝科每股純益9.41元。環球晶與台勝科也都採取高配息政策，環球晶每股將配發25元現金股息，以19日收盤價308.5元計，殖利率達8.1%；台勝科每股將配發9元現金股息，以19日收盤價111.5元計，殖利率也達8.07%。環球晶與台勝科今天在市場買盤積極湧入帶動下，股價同步走高，環球晶盤中一度達321元，大漲12.5元，漲幅4.05%；台勝科股價一度達117元，漲5.5元，漲幅4.93%。另一半導體矽晶圓廠合晶(6182)今天股價也有不錯表現，盤中一度達37.3元，漲0.85元，漲幅2.33%。（編輯：郭萍英）1080320
全智科傳內線交易 欣銓早盤股價整理,證券,2019/03/20 09:38,https://www.cna.com.tw/news/afe/201903200035.aspx,（中央社記者鍾榮峰台北20日電）IC晶圓測試廠欣銓先前收購全智科，傳出全智科內部人涉嫌內線交易，欣銓今天早盤股價整理，來到29.05元，小跌0.51%。媒體報導，調查局台北市調查處發現，欣銓先前溢價方式併購全智科，全智科內部人涉嫌在重大訊息公告前，事先集資買進全智科股票，待利多消息釋出再出脫賺取價差，不法獲利估計近千萬元，涉及內線交易罪。欣銓今天早盤股價整理，來到29.05元，小跌0.51%。欣銓和全智科在2017年3月下旬分別通過現金對價的股份轉換案，轉換價格每股新台幣24元，欣銓取得全智科100%股權，全智科之後也終止上市。欣銓主要業務為晶圓測試及成品測試。全智科主要業務為晶圓測試、成品測試及測試技術開發服務。欣銓去年合併營收84.44億元，較前年78.6億元增加7.4%；去年歸屬母公司業主淨利15.49億元，較前年12.77億元增加21.3%，去年每股稅後盈餘3.31元，優於前年EPS 2.73元。去年營收、獲利和每股純益，均創歷史新高。展望今年欣銓看佳下半年，今年可望逐季好轉，持續擴大發展電動車、通訊、5G等領域應用。（編輯：王永志）1080320
國泰金調查：股市樂觀情緒與風險偏好連2升,產經,2019/03/20 10:57,https://www.cna.com.tw/news/afe/201903200041.aspx,（中央社記者邱柏勝台北20日電）國泰金控公布3月國民經濟信心調查結果，受美中貿易談判展望樂觀，聯準會政策態度偏鴿等因素影響，民眾股市樂觀情緒及風險偏好指數連2個月彈升，各創2017年12月及2018年4月以來高點。國泰金控表示，國發會日前公布最新景氣對策信號，從代表低迷的藍燈回升到黃藍燈，但是景氣領先、同時指標持續下跌，加上2月製造業採購經理人指數仍處在50以下的萎縮區間，顯示景氣成長動能仍弱。不過，由於美中雙方在貿易相關議題上朝向正面發展，3月的景氣現況樂觀指數與景氣展望樂觀指數連2個月同步走升，且升幅擴大，顯示民眾經濟信心回升。國泰金控表示，民眾對於未來6個月的就業展望信心持續上揚，對於薪資展望樂觀指數也已經連續4個月處在正值。在經濟信心與就業市場信心的支撐下，民眾消費意願同步回溫，其中大額消費意願指數2.2，連續2個月處在代表樂觀的正值。另外，國泰金控表示，雖然OECD（經濟合作暨發展組織）下調全球經濟展望，3月調查結果顯示，民眾對於今年台灣經濟成長率的平均預期值依舊維持在2.2%，認為可能會跌破2%的比例也續降至26%。在通膨方面，認為明年通貨膨脹率會超過1.0%的民眾僅有42.1%，平均通膨預期值也降至1.0%，略高於主計總處預測值0.73%。在民眾對股市展望方面，國泰金控指出，美、中貿易談判持續偏正面方向發展，加上美國聯準會政策態度轉偏向寬鬆，及英國硬脫歐風險下降，帶動台股跟隨全球股市回升，使得民眾的股市樂觀情緒及風險偏好指數連2個月彈升，各來到-12.7及-3.6的水準，分別為2017年12月及2018年4月以來的高點。（編輯：張均懋）1080320
選後電價漲不漲 沈榮津：尊重審議委員會決定,產經,2019/03/20 10:21,https://www.cna.com.tw/news/afe/201903200042.aspx,（中央社記者廖禹揚台北20日電）經濟部日前宣布4月起電價不調整，外界關心是否會在選後一次漲回，經濟部長沈榮津今天表示，還是要尊重電價費率審議委員會決定，「不是政府說了算」。經濟部18日宣布4月起電價不調整，連續第2次凍漲，外界關心台電虧損問題，經濟部長沈榮津今天列席立法院經濟委員會前受訪表示，台電累計虧損是過去凍漲造成，新政府上任後，在有累計虧損狀況下，電價公式都給予合理利潤5%，沒有讓台電虧損，這是事實。至於2020總統大選後電價是否調漲，沈榮津說，電價主要遵照國際油價走勢而定，目前專家分析走勢下滑，電價漲價壓力低，選後電價是否可能調漲，同樣由審議委員會決定。能源政策對電價影響一直是外界關注議題，對於是否可能重啟核電，沈榮津重申，使用核電就必須嚴肅面對核廢料問題。沈榮津說，近期總質詢告一段落，差不多該開始拜訪各縣市政府，看看如何合作拚經濟，其中也包括新北市長侯友宜，核一除役所需的乾式貯存場發照問題屆時也會是討論項目之一。至於外界認為價格「太高」的離岸風電，沈榮津也重申，離岸風電發展有一定程序，躉購與競價不能混為一談；而丹麥、英國、德國等歐洲國家花了約38年以新台幣5.8元至6元價格購買離岸風電，才進入競價，台灣去年遴選完馬上進行競價，競價得標風場將在2025年併網，等於只花6年就買到2.2元到2.5元的離岸風電。（編輯：趙蔚蘭）1080320
新光鋼配現金股利1.5元  接獲淡江大橋供料單,產經,2019/03/20 10:02,https://www.cna.com.tw/news/afe/201903200043.aspx,（中央社記者韋樞台北20日電）鋼鐵下游裁剪加工業新光鋼去年EPS為3.17元，今年每股配現金1.5元，少於去年配發的2元。新光鋼表示，業務單位已拿到淡江大橋某工程標3萬公噸鋼板供料單，預計第4季出貨。新光鋼每股配現金1.5元，以19日收盤的33.9元計算，殖利率4.42%，預計今年股東常會6月11日於新光鋼觀音廠內舉行。新光鋼表示，去年全年合併營收新台幣88.4億元，年增5.9%，稅後盈餘10億元，年減0.07%，每股稅後盈餘(EPS) 3.17元，少於2017年的3.49元。主要是去年第4季鋼鐵價格滑落，業內產生跌價損失，業外損失則來自於與世紀鋼構的綜合損益較去年第1、2季略差所致。新光鋼指出，今年第2季中鋼公司開出漲盤，相對下游的裁剪加工業的價格會比較好，有助第2季營運；若是以長單來看，新光鋼接獲淡江大橋某一工程段的鋼料訂單，預計今年第4季出貨約3萬公噸鋼板予營造商。另外，新光鋼為風電業世紀鋼構的供應商，新光鋼已購進新生產設備，預計第2季試生產，第3季正式生產，年產能近萬公噸，主要供應水下基礎鋼管樁。新光鋼股價近日站穩33元之上，今天開低走低，盤中最低33.15元，跌幅2.21%，成交量約2000張。（編輯：郭萍英）1080320
新台幣早盤貶轉升1.9分,產經,2019/03/20 10:19,https://www.cna.com.tw/news/afe/201903200048.aspx,（中央社台北20日電）台北外匯市場新台幣兌美元匯率今天以30.85元開盤，貶1.2分；10時15分來到30.819元，升1.9分。截至10時15分，新台幣兌美元最高30.815元、最低30.85元。1080320
環球晶每股配息25元 中美晶估入帳55.68億元,證券,2019/03/20 10:40,https://www.cna.com.tw/news/afe/201903200055.aspx,（中央社記者張建中新竹20日電）環球晶去年度盈餘每股將配發新台幣25元現金股息，母公司中美晶估計將有多達55.68億元股息入帳，約中美晶0.95個股本。受惠半導體矽晶圓市場供不應求，產品價格調漲，環球晶去年營運表現亮麗，營收與獲利同創歷史新高紀錄，歸屬母公司淨利達136.31億元，每股純益31.18元，每股將配發25元現金股息。中美晶持有環球晶2.22億餘股，持股比重達50.93%，去年將依比例認列69.42億元獲利，貢獻中美晶超過1個資本額，每股貢獻11.84元獲利。中美晶也將有55.68億元環球晶現金股息入帳，將支撐中美晶得維持穩定配息一大關鍵。（編輯：郭萍英）1080320
壽險業國外投資比重高 央行：台灣低利非主因,產經,2019/03/20 10:49,https://www.cna.com.tw/news/afe/201903200056.aspx,（中央社記者邱柏勝台北20日電）金管會表示，台灣長期低利環境是壽險業赴國外投資原因之一。對此央行副總裁嚴宗大表示，除美國公債外，其他國家公債殖利率也相當低，但台灣壽險業國外投資比重仍是全球最高。去年保險業匯損新台幣2323億元，創歷史新高，引發外界關注，也成立委關切議題。金融監督管理委員會主委顧立雄今天赴立法院財政委員會，就「如何強化保險業國外投資匯兌風險控管」進行專題報告，嚴宗大也列席備詢。中國國民黨立委賴士葆詢問，金管會在專案報告中提及，自民國90年降息以來，除97年金融海嘯前升息至3%以上，長期處於低利率環境，導致保險業資金有尋求國外報酬率較高投資標的的需求，似乎暗指央行長期維持低利率，是造成壽險業不得不赴國外投資的原因。對此嚴宗大表示，去年因美國10年期公債殖利率上揚，導致台美公債利差擴大，但若與其他國家相比，法國10年期公債殖利率僅0.4%、德國0.09%、荷蘭0.18%，瑞士甚至是負0.36%，日本則是負0.05%，相比之下，台灣10年期公債殖利率不算特別低。但台灣壽險業海外投資比重，仍是全球最高。顧立雄表示，壽險業有國外投資的需求，但保險公司招攬商品時，也需注意投報率是否過高，若對消費者宣告的投報率太高，投資就得放到更高報酬率的標的，因此他認為，保險公司在做保險商品的定價時，也必須要注意。（編輯：林興盟）1080320
外資喊買欣興 股價大漲逾4年半新高,證券,2019/03/20 11:04,https://www.cna.com.tw/news/afe/201903200062.aspx,（中央社記者江明晏台北20日電）外資看好IC載板大廠欣興受惠ABF基板的需求成長，將挹注獲利大增，給予「買進」評等與37元目標價，激勵欣興今天股價大漲逾5%，創超過4年半的波段高點。亞系外資看好IC載板大廠欣興，受惠網路技術升級，ABF基板需求不斷成長，因嚴格的產能擴張和價格上漲，將推升獲利成長，給予「買進」評等與37元的目標價。亞系外資並預估，市場對ABF基板的需求將推動欣興2018至2020年的獲利成長，預估期間欣興EPS將有46%的年複合率成長。激勵欣興今天股價續揚，盤中高點來到29.35元，漲幅逾5%，並爆出4.8萬張大量，股價更創2014年8月以來的高點。外資預估，2019年ABF僅占欣興銷售額的26%，卻能貢獻51%毛利表現。預估欣興2018年的毛利率將從19%上升至2019年、2020年的25%、26%，主因來自ABF持續上漲、且客戶組合更好及利用率提升。（編輯：郭萍英）1080320
