標題,分類,時間,網址,內文
正隆砸20億高雄建廠 擬進軍越南家用紙市場,產經,2019/09/08 22:46,https://www.cna.com.tw/news/afe/201909080071.aspx,（中央社記者韋樞台北8日電）正隆紙業今天舉行60週年嘉年華會，正隆總經理蔡東和表示，正隆現階段營運以越南為重心，平陽造紙廠第1期稼動率已達75%，年底可達90%，正隆同時規劃進軍越南家用紙市場。正隆紙業今天在新北市板橋區新北市民廣場舉行「正隆60。愛不紙息」環保嘉年華會。新北市長侯友宜致詞表示，正隆在新北市60年帶動繁榮，也造就台灣不一樣的紙業；正隆紙廠在國內的年產量200萬公噸，國外有100萬公噸，正隆在海外擴廠不斷前走，影響力不斷擴大，這就是台灣的精神指標。侯友宜感謝正隆每年回收台灣廢紙180萬公噸，且同仁們不斷淨山淨灘，做足了環保工作，還認養新北市民廣場東西兩側的公共廁所，提供「蒲公英」不砍樹環保衛生紙，讓環境永續從生活開始。蔡東和會後接受記者訪問指出，越南是正隆營運成長動能主力市場，正隆早年向越南政府申請到平陽造紙廠5期年產105萬公噸工業用紙的建設執照，除了基礎建設外，第1期年產30萬公噸的工業用紙已從去年底起運轉，目前稼動率75%，今年底會達到90%，同時正隆著手建設第2期工程，預計年產35萬公噸工業用紙，廠區將於2021年第4季完工。蔡東和表示，越南第2期到第5期生產將包括造紙、紙器和家用紙，擴廠期程為10年。其中家用紙市場是正隆很有興趣進軍之處，由於越南家用紙目前均為當地廠商生產，國際大廠尚未進駐，正隆正在研究當地市場消費習慣。正隆研究團隊表示，越南家用紙每年人均消費量約1.1公斤至1.2公斤，且越南人喜歡舶來品名稱，因此要順口又好記，因此未來究竟要用正隆家用紙的高、中、低價哪一種產品進軍，還要再研究。蔡東和說，除了平陽造紙廠的第2期擴建工程進行中；另外在北越的北江省設立新的越南第4座紙器廠，這座紙器廠也是從較小產量的3級造紙廠開始運轉，未來視越南的經濟和訂單增長再逐步擴大到1級廠；至於台灣方面則預計投資新台幣20.8億元在高雄燕巢新造智慧化紙器廠，增設複瓦機、印製等設備，投資期到2022年。依正隆的規劃，台灣正隆營運占比2/3，中國已降至1/4，主要供應內銷為主；越南正隆造紙廠在年底1期稼動率達9成後，貢獻越南營運占比逐步增加到18%到19%。（編輯：趙蔚蘭）1080908
台灣精品盃電競賽馬國登場 盼提升科技品牌知名度,產經,2019/09/08 12:46,https://www.cna.com.tw/news/afe/201909080073.aspx,（中央社記者郭朝河吉隆坡8日專電）由台灣貿易推廣單位及經濟部推動的台灣精品專案，7日在馬來西亞舉辦台灣精品盃電競賽，除了比賽外，參賽者也能體驗最新台灣筆電產品，提升台灣科技品牌知名度。台灣貿易推廣單位今天發表聲明說，台灣精品盃電競賽（TEEC）昨天於雪蘭莪州八打靈再也廣場Battle Arena舉辦，現場聚集狂熱的馬來西亞電競粉絲，一同見證台灣精品電競LAN預選賽最終回合。這次活動吸引31支隊伍，爭取進入台灣精品電競賽總決賽比賽資格，以期贏取總值13萬令吉（約新台幣97萬元）總獎金獎品。這項電競賽事旨在拉近台灣與東盟青年的距離，參賽者可以親身體驗最新的台灣筆電產品外，現場特別展出功能強大的ROG Strix SCAR III G531遊戲筆電的操作。台灣精品盃電競總決賽將於10月11日至13日，在吉隆坡時代廣場購物中心舉行。預選賽將以CS：GO、DotA2和League of Legends一較高下，各自項目的獲勝隊伍都將可贏得1萬令吉獎金。而榮獲CS：GO冠軍寶座的優勝團隊則將獲得前往台灣的套裝行程，屆時與泰國、菲律賓和印度、台灣的高手進行一場國際友誼賽。台灣精品瞄準馬來西亞（新台幣）200億元的電競市場與全國1400萬名電競族群，藉由「電競」這個共同語言，開創另類外交，趁勢提高台灣品牌形象。根據電競研究分析公司Newzoo研究調查顯示，新南向國家具有龐大電競商機，東南亞是全球電競產業最高速成長的地區，高達22%的成長幅度。而馬國政府近年大力發展電競，2015年起將電競列入正式體育項目，並於2018年建立首座電競體育館，立志成為亞洲電競中心。（編輯：陳永昌）1080908
美中重啟談判助攻股市 法人：5G概念股看旺,證券,2019/09/08 16:59,https://www.cna.com.tw/news/afe/201909080135.aspx,（中央社記者韋樞台北8日電）國際股市歡迎美中重啟貿易談判，美股大漲，推升台股上週連3紅帶量越季線，外資近1週買超更逾300億元。法人指出，大陸扶植5G手機成長，加快關鍵零組件研發，台廠可望受惠。安聯台灣科技基金經理人廖哲宏表示，美中10月將在華府舉行新一輪貿易談判，投資人樂觀以對，美股大漲，提振台股帶量上攻，近3個交易日大漲逾200點，外資近1週更買超逾新台幣300億元，買超力道明顯加大。廖哲宏指出，觀察現階段終端需求基本面未見明顯回溫，在不確定因素上，又有貿易稅增加壓抑需求，值得密切關注；不過，台灣電子廠受惠華為與中國品牌轉單效益，獲利逆勢成長，2020年又有5G手機滲透率拉高的題材，有望挹注相關成長力道。廖哲宏說，半導體等庫存水位於第2季見到改善，伺服器近期也出現短期庫存訂單回補。另根據經濟部外貿局統計，今年前7月通訊、自行車、醫療器材、體育用品等8產業出口在美中貿易戰下逆勢成長，轉單效益顯現。安聯台灣智慧基金經理人鍾安綾表示，貿易戰帶來的轉單及備胎轉正胎效應，持續發酵。以華為Mate20 X5G teardown為例，部分關鍵零組件已由華為自製，去美國化進度明顯優於預期，後市不容小覷。鍾安綾表示，華為自製能力快速升級，顯示中國政府發展基礎建設的力道，全力扶植5G手機規格升級，有助相關關鍵零組件的研發進度，以及終端需求的增溫。日盛日盛基金經理人張亞瑋表示，投資人可留意股價基期低、伺服器、5G、AI及手機等產業趨勢股。全球半導體庫存持續去化，有利下游回補庫存，回補力道偏溫和，5G相關需求帶頭成長；貿易戰雖影響中國科技產業進展速度，但也間接加速中國去美國化的決心，台灣廠商包含晶片、功率放大器、射頻等零組件長線可望受惠。（編輯：鄭雪文）1080908
央行利率料將連13凍 專家揭3大因素無降息理由,產經,2019/09/08 17:58,https://www.cna.com.tw/news/afe/201909080163.aspx,（中央社記者潘姿羽台北8日電）央行將於19日召開第3季理監事會，市場估利率連13凍，專家認為，台灣經濟基本面有撐、資金充裕，且降息可能造成新台幣貶值壓力，不利於當前以內需為引擎的經濟模式，「找不到降息的理由」。全球央行吹起降息風，歐洲央行、美國聯準會9月中旬接力開會，市場押注歐美央行都將以「預防性降息」來應對全球經濟不確定性。富邦金控首席經濟學家羅瑋表示，美國聯準會去年升息4次，有點「過度升息」，如今美國消費力道還算穩，但8月製造業採購經理人指數（PMI）已跌破50%榮枯線，是項警訊，歐洲經濟也非常不妙，製造業疲軟；總體而言，歐美央行降息，是因為他們確實看到一些負面訊息。台灣的中央銀行預計於9月19日召開第3季理監事會，外界預期央行會維持一貫地穩健作法，利率按兵不動；羅瑋分析台灣經濟情勢後，向中央社記者表示，台灣目前找不到降息的理由。羅瑋表示，從經濟及資金2大層面來考量，台灣經濟表現相當穩健，據主計總處最新經濟預測，今年還有2%以上的成長率，且物價成長溫和，資金方面，資金充裕且台灣利率已處低檔；不論是經濟面或是金融面都相當穩健，沒有降息的迫切性。台經院所長吳孟道點出另一個思考角度，他指出，台灣今年的經濟成長動能主要來自內需，政府也大力鼓勵台商回台投資，此時若降息，可能造成新台幣貶值壓力，拉升廠商進口設備成本，加上經濟基本面短期並無隱憂，推測央行第3季並不會降息。（編輯：蘇志宗）1080908
土耳其台灣商會 黃美琦將任新會長,產經,2019/09/09 10:59,https://www.cna.com.tw/news/afe/201909080195.aspx,（中央社記者何宏儒伊斯坦堡8日專電）土耳其台灣商會通過新任理監事名單，決議由黃美琦、陳靚嬬為新任正、副會長，明年上任。現任會長馮芷玲指出，許多台灣業者表達布局土耳其興趣，盼台商會力量更強大。土耳其台灣商會昨天在伊斯坦堡馬爾馬拉島（Marmara Island）召開第10屆第2次理監事會議，通過第11屆理監事及正、副會長名單，馮芷玲今天下午在會員大會中宣布。通過的名單包括新任會長黃美琦、副會長陳靚嬬、常務副會長阮明欽、監事金迎鋒及趙洪潤、理事林榮堂、胡光中、周如意、馮芷玲、吳依真、鄭霈糧、張家蘭、江萍。馮芷玲在會員大會中指出，任內向土耳其專利商標局（Turk Patent ve Marka Kurumu）正式註冊土耳其台灣商會（TTCC）商標。她表示，過去兩年有許多台灣業者展現投資土耳其的興趣，任內已接待包括不銹鋼、科技和傳產等產業諸多台商，相信未來將有更多台資企業布局土耳其，期盼台商會力量更強大。駐土耳其代表處經濟組組長曾寶郎、秘書陳韋慈、伊斯坦堡台灣貿易中心主任陳明澤出席理監事會議及會員大會。土耳其台灣商會現有32位會員，第11屆理監事將自2020年1月上任。（編輯：周永捷）1080908
