標題,分類,時間,網址,內文
5G發展不畏貿易戰 台灣半導體廠受惠可期,產經,2019/09/01 09:54,https://www.cna.com.tw/news/afe/201909010021.aspx,（中央社記者張建中新竹1日電）美中貿易戰持續延燒，雖然可能對全球經濟及產業景氣添增變數，不過，各國紛紛加速5G發展，中國廠商「去美化」，台積電等多家台灣半導體廠可望從中受惠。美國針對中國銷美的3000億美元商品加徵10%關稅提高至15%，部分自9月1日起上路。法人指出，未來只能期待美中貿易談判能有正面消息，能讓關稅大戰提早結束，或是改課較少的關稅。在產業方面，據台積電觀察，美、中、日、韓等國家紛紛加速5G發展，5G與高效運算客戶2020年對5奈米製程需求強勁，台積電為此決定加速5奈米製程產能建置，今年資本支出金額將高於原訂的100億至110億美元規模。手機晶片廠聯發科也認為，全球5G市場狀況較3個月或6個月前樂觀，預期2020年全球5G手機可望達1.4億套規模。聯發科本身對市占率有高度期待，法人也看好聯發科5G智慧手機晶片產品可望有不錯發展，預期2020年將出貨2200萬套，2021年出貨量將進一步倍數增加至8700萬套規模。除5G商機外，中國廠商在歷經華為事件及美中貿易戰的威脅後，「去美化」趨勢成形，也讓不少台灣半導體廠受惠中國客戶轉單，金氧半場效電晶體（MOSFET）廠杰力指出，中國半導體自給率僅21%，是台廠填補缺口的機會。射頻（RF）晶片廠立積第3季營運便可望受惠中國客戶轉單效益，法人預期，立積第3季營收有機會季增2成水準，並改寫歷史新高紀錄。矽智財（IP）廠力旺也表示，在中國的商務有相當大進展，已有14奈米客戶產品設計定案（tape out），成功導入中國最大IC設計廠的安全監控產品領域。除美中貿易戰外，日韓貿易戰也讓部分台灣半導體廠有機會受惠，面板驅動IC廠聯詠指出，中國主動式有機發光二極體（AMOLED）廠的產品可望加速獲得品牌廠採用，將連帶有利聯詠AMOLED驅動IC出貨。（編輯：張良知/楊凱翔）1080901
台廠赴陸設12吋晶圓廠 上半年虧近百億元,證券,2019/09/01 10:51,https://www.cna.com.tw/news/afe/201909010033.aspx,（中央社記者張建中新竹1日電）台積電、聯電與力晶陸續前往中國大陸設置12吋晶圓廠，目前都還未達經濟規模，營運全數虧損。據統計，今年上半年合計虧損近新台幣100億元。瞄準中國大陸市場快速成長商機，台灣晶圓代工廠紛紛前往中國大陸投資12吋晶圓廠；其中，聯電是最早前進中國大陸設置12吋晶圓廠的廠商，位於廈門的12吋廠聯芯早於2016年第4季便導入量產。力晶位於合肥的12吋廠晶合隨後於2017年10月量產，台積電位於南京的12吋廠於2018年10月量產。聯芯目前月產能1.8萬片，以28奈米製程為主；晶合月產能約1.5萬至2萬片，以90奈米製程技術為主，主要生產面板驅動IC。台積電南京廠製程技術最先進，達16奈米，月產能約1.2萬片。台積電南京廠、聯芯與晶合都還未達經濟規模，目前營運全數虧損，據台積電、聯電與力晶財報資料顯示，台積電南京廠上半年虧損22.92億元，聯芯虧損52.34億元，晶合虧損23.09億元，合計虧損98.35億元。據台積電規劃，南京12吋廠今年底月產能將擴增至1.5萬片，明年將達到月產能2萬片的初步目標。晶合月產能最大可達4萬片規模，不過，將視市場實際需求擴產。聯芯則以月產能2.5萬片為初期目標，據內部估計，月產能若達到2.5萬片規模，便有機會轉虧為盈，只是目前尚無擴產至2.5萬片的具體時間表。（編輯：林淑媛）1080901
台積電大手筆攬才 在職者有條件加發2個月薪資,證券,2019/09/01 11:50,https://www.cna.com.tw/news/afe/201909010066.aspx,（中央社記者張建中新竹1日電）台積電今天舉辦新竹招募面試會，有近300名求職者參與面談。台積電表示，目前在職者在收到聘書40天內且在年底前報到加入營運與產品組織的工程師，將加發2個月薪資。因應人工智慧（AI）與5G世代來臨，台積電持續積極投入各種先進及特殊製程開發，並預計至今年底前招募3000名以上新血加入，職缺包括半導體設備工程師、製程工程師、研發工程師及IC設計工程師等。台積電共舉辦3場招募面試會，8月25日已完成台中場的招募面試，今天舉辦新竹場，估計有近300名求職者參與面談，台南場次將於9月8日登場。台積電晶圓廠營運資深副總經理王建光表示，面對世界級的競爭，台積電全力以赴，相信只要勇於挑戰，認真做好每一件事，就有成功的機會。台積電提供多元職涯發展的工作環境，歡迎各方好手，帶著開創與冒險的精神，加入台積電。為吸引人才加入，台積電指出，凡是目前在職者在收到聘書40天內且在年底前報到加入營運與產品組織的工程師，台積電另會加發2個月薪資作為鼓勵。（編輯：楊凱翔）1080901
台股不悲觀 貿易戰仍是觀察重點,證券,2019/09/01 18:32,https://www.cna.com.tw/news/afe/201909010077.aspx,（中央社記者張建中台北1日電）台股上週震盪劇烈，指數先蹲後跳，漲79.94點，週線連2紅，法人認為，台股整體籌碼面中性偏多，短線有轉強跡象，盤勢並不悲觀，只是美中貿易戰後續發展仍待觀察。過去一週投資市場情緒深受美中貿易戰左右，隨著貿易戰局勢由嚴峻轉為和緩，外資8月30日買超新台幣153.09億元，激勵台股大漲155.62點，收在10618.05點，外資近一週賣超縮至100億元以下，台股指數上週漲79.94點，週線連2紅。美股因經濟數據好壞參半，上週五漲跌互見。道瓊工業指數漲41.03點，漲幅0.16%；標準普爾500指數漲1.88點，漲幅0.06%；那斯達克指數跌10.511點，跌幅0.13%。日盛首選基金經理人楊遠瀚表示，經濟數據短期雖下滑，但美國聯邦準備理事會（Fed）與歐盟可能採取資金寬鬆政策刺激經濟，加上旺季拉貨，對盤勢應不用太悲觀。只是目前指數水位高，且外資近期賣壓較集中在權值股，楊遠瀚認為，中小型股應較有表現空間，5G族群將是盤面較受關注的焦點。安聯台灣科技基金經理人廖哲宏表示，受惠中國電信業者積極布局5G，5G市場中長期成長可期，預期2020年5G對科技供應鏈的貢獻將更大，也將是驅動半導體成長的主要動能之一。因美中貿易戰仍將牽動金融市場，後續發展將是市場關注重點，楊遠瀚指出，Fed於9月是否降息，美債殖利率與人民幣走勢也都是短期盤勢觀察要點。（編輯：楊凱翔）1080901
經濟部赴馬國辦投資攬才會  盼吸引企業投資,產經,2019/09/01 12:41,https://www.cna.com.tw/news/afe/201909010078.aspx,（中央社記者郭朝河吉隆坡1日專電）經濟部投資業務處日前在吉隆坡舉行投資及攬才說明會，邀請馬國製造商聯合會（FMM）、台馬經貿協會、馬國留台聯總、馬國台商總會等團體代表出席，希望吸引企業赴台投資。駐馬來西亞台北經濟文化辦事處今天發布新聞稿表示，投資及攬才說明會於8月29日晚上舉辦，活動歷時約2小時30分，獲企業熱烈迴響，期待能善用政府政策利多，擴大在台投資，以強化企業競爭力。經濟部投資業務處副處長章遠智表示，本次籌組投資攬才團訪問馬來西亞的目的，就是希望可以藉此吸引台商以及華商赴台投資，並且善用政府所提供的攬才服務，以促進在馬台商及華商對台灣產業商機、投資政策與攬才管道的了解。他表示，這次投資攬才團直接到馬來西亞多媒體大學辦理校園徵才活動，並拜訪國立馬來西亞大學、拉曼大學、馬來西亞留台聯總等馬國重要單位，直接建立雙方的攬才合作關係。駐馬代表洪慧珠致詞表示，「新南向政策」推動以來，台灣與馬來西亞在貿易、投資、科技、文化與教育等各層面進行了廣泛的交流合作，台灣與馬來西亞的雙邊關係也在貿易、投資、教育及觀光等四大方面有亮麗表現。她指出，台灣經濟發展的成功因素之一即為培養優秀人才，其中也包含很多來自海外的學子，而馬來西亞是最明顯的例子。人才培育與交流即為馬來西亞在新南向政策中最具亮點的成果，現今畢業的馬來西亞留台校友已超過6萬人，台馬雙邊的教育合作交流更為緊密；觀光方面，2018年馬來西亞約有52萬餘人到台灣旅遊。她也透露，台馬經貿與投資關係非常密切，馬國為台灣第7大貿易夥伴，第8大出口國及第7大進口國，今年上半年雙邊貿易額已達96.9億美元，又有2.9%的成長，台灣為馬來西亞累計外人投資第4大國，僅次於日本、美國及新加坡。（編輯：林憬屏）1080901
毅嘉8月營收減3% 9月可望回升,證券,2019/09/01 18:30,https://www.cna.com.tw/news/afe/201909010166.aspx,（中央社記者張建中新竹1日電）手機零組件廠毅嘉科技自結8月合併營收新台幣5.31億元，月減3%，為近3個月新低水準。毅嘉預期，9月業績可望回升。毅嘉指出，8月軟板產品營收3.85億元，月減4.7%，機構整合元件產品營收1.49億元，較7月增加4.9%；車載產品拉貨速度趨緩是影響8月整體營收滑落的主因。展望未來，毅嘉預期，隨著新機種量產，9月營收可望回升。法人預期，毅嘉整體第3季營收將可突破16億元，表現將可優於第2季的15.81億元水準，延續逐季攀升趨勢。（編輯：蘇志宗）1080901
