標題,分類,時間,網址,內文
林百里：拚AI美中歐爭霸 台灣經濟成長不可缺,產經,2019/09/18 18:21,https://www.cna.com.tw/news/afe/201909180251.aspx,（中央社記者潘智義台北18日電）廣達電腦董事長林百里表示，人工智慧（AI）由美國領跑，中國超車，歐洲緊追，但很難有一家公司獨大，壟斷整個市場。林百里今天在台北舉行的2019國際半導體展演講時指出，美國在AI人才、研究、發展、硬體領先，但在應用、資料方面卻是中國跑在前面。國際知名的9大企業，包括Google、微軟（Microsoft）、亞馬遜（amazon）、臉書（Facebook）、IBM、Apple、百度、阿里巴巴、騰訊都積極朝向雲端發展。他以開玩笑的方式指出，現在談未來60年的產業發展，有很多的事無法預知，畢竟60年後自己都不知道在哪裡，甚至還要靠科幻小說惡補，現在才能分析未來60年的人工智慧發展，但台灣一定要發展AI產業。他評估，台灣發展AI產業，到2035年國內生產毛額（GDP）成長率可達3.6%，但若無AI恐怕只剩1.9%。他說，人工智慧應搭配真人的智慧發展，否則只會徒勞無功，從電腦、雲端計算到AI解決方案，都必定如此，未來也將更重視個人隱私，其實現在的使用者已意識到自我隱私的重要。他表示，傳聞中國有一個網站為吸引人，提出「你把你的臉刷一下，照一張相」，放進網站的系統，即可把自己變成任何電影的男主角或女主角。這個網站一開始上架，就吸引幾千萬人去使用，但當有人警告網站可能把使用者的臉做其他用途時，網站馬上乏人問津。林百里指出，人工智慧產業近年才快速發展，相信還有很多的機會，成長空間還很大。（編輯：蘇志宗）1080918
南山人壽杜英宗停職2年 顧立雄點出3大缺失,產經,2019/09/18 19:41,https://www.cna.com.tw/news/afe/201909180265.aspx,（中央社記者劉姵呈台北18日電）南山人壽境界系統出包致保戶權益受損，金管會重罰3000萬元外，令董事長杜英宗須停職2年，為史上第2位遭停職的保險業董事長。金管會主委顧立雄今天指出杜英宗的強勢領導文化，在公司治理方面有3大缺失。南山人壽去年9月上線的境界系統不斷出包，金融監督管理委員會保險局局長施瓊華昨天親自主持記者會，經過第三方驗證後，將對南山人壽境界系統問題重罰3000萬，也下令停辦投資型保單業務，且董事長杜英宗停職2年，停職期間也不得領取任何形式的報酬及福利。針對媒體提問停職南山壽董事長杜英宗2年，卻不是解職的考量，金管會主委顧立雄今天出席活動受訪表示，杜英宗在公司治理方面有3大缺失，第一，年初時變更收取保費制度方面，沒有尊重公司法務部門的建議；第二，相關投資部門的決策，有過於個人主觀的判斷；第三，核心系統的更新，沒有尊重外部專業與內部看法與建議。顧立雄直言，「我覺得人各有所長，也許杜董事長在財務的面很好，但在公司治理這一塊，我們想要看一看，沒有他的這2年，南山的公司治理如何來進行。」顧立雄也強調，公司治理並不能從一個「強勢的領導人」或是「專業經理人」來判斷好與壞，他覺得各有所長，只是他認為，杜英宗在職的期間，從一開始的採購決策到風險控管等，都沒有處理好，因此他認為在改善的這段時間，杜董事長先不要插手，給南山2年的時間來看看。顧立雄說，「我希望南山在這2年，形塑一個沒有杜董事長在的文化」，他強調他不並不是覺得100%認定杜英宗在或不在的好與壞，而是他認為，在杜英宗不在的期間，南山可以從原本強勢的領導文化再嘗試出一個新的文化。他重申，「我並沒有說不要他回來，因此我給他2年的時間，看南山之後怎麼經營」，顧立雄說，像是能改變他的領導作風、更尊重專業等，而這2年的時間南山也會受到金管會高度監理。此外，媒體提問大股東要不要負責，顧立雄也表示，監理機關要看的是公司經營階層的事情，這個案子就是某種程度上來講，其審計委員會跟董事會的功能並沒有有效的發揮。對於南山工會質疑金管會裁罰速度太慢，顧立雄說，主管機關的考量不是針對個人的裁罰，而是要針對根本的問題去解決，像是南山人壽這麼大的一間公司，保戶這麼多，要怎麼讓這些保戶受到保障，要去改善與處理。即使今天已經處分了，但後續還是有新進來的保單，要如何讓保戶的權益不受損害，才是根本。（編輯：黃國倫）1080918
iPhone 11週五開賣 電信業祭優惠招徠果粉,產經,2019/09/18 18:27,https://www.cna.com.tw/news/afe/201909180266.aspx,（中央社記者江明晏台北18日電）蘋果發表iPhone 11系列3款新機，台灣納入首波開賣國家，將於20日正式開賣，國內各大電信業者當天上午都將舉辦首賣儀式，並祭出相關優惠招手果粉。蘋果日前發表iPhone 11、iPhone 11 Pro、iPhone11 Pro Max共3款新機，20日正式開賣，5大電信商均積極備戰，將在當天上午舉辦首賣儀式。中華電信表示，將於20日上午8時在台北信義威秀服務中心，舉辦「iPhone 11全機型首賣會」，為回饋忠實果粉，中華電信表示，今年首度於開賣會現場贈送3600元優惠券給前100名排隊的果粉。民眾只要於2019年10月31日前持優惠券至中華電信門市購買iPhone 11全機型任一款、Apple Watch Series 5 GPS版，或上述機型與AirPods無線充電盒版合購，皆可再享3600元購機優惠，無論新申辦、攜碼、續約購機，或5年以上客戶購買單機均適用。遠傳電信將於20日上午8時起正式開賣iPhone 11/iPhone 11 Pro/iPhone 11 Pro Max及Apple Watch Series 5 GPS版本，受果粉青睞的綠色、紫色及夜幕綠3種新色，遠傳門市也現貨供應。開賣當天遠傳「信義威秀門市」特別推出加碼早鳥禮活動，凡申辦999以上資費搭配iPhone 11系列的消費者，將可直接免費帶走最新AirPods 2，限量100名。此外，新北市、桃園市、台中市、台南市及高雄市6家指定直營門市也同步提供加碼早鳥禮。台灣大哥大同步於全台北、中、南共4家旗艦門市舉行開賣活動，大方送出50個AirPods 2。為了滿足果粉「無痛換機」的需求，台灣大在開賣日同步祭出「好價在」專案，消費者在合約期間，可擁有手機保險，換機時，無論外觀刮痕、掉漆，皆保證以50%的價格回收，堪稱是iPhone手機史上「終極抗跌」的解決方案。台灣大表示，消費者換機的速度趨緩，手機使用年限愈來愈長，由於手機仍可正常使用，到要換新機時，舊機的回收價格下跌幅度就會愈大，以去年上市的iPhone Xs Max 256G為例，各業者今年以2萬5000元回收，與上市時5萬2900元相較，一年就跌至47%。亞太電信商請策略合作夥伴萊爾富超商，提供此次預購排隊前3名的用戶，以1分鐘時間在便利商店內瘋狂掃貨，掃貨的費用全數由亞太電信買單，並安排專人將全新手機iPhone 11送達活動現場進行交機儀式，現場同時會公布萊爾富會員專屬的亞太電信iPhone 11購機優惠。台灣之星今天宣布將於20日在台北市信義區Neo19前廣場舉辦「iPhone 11開賣活動」，台灣之星現場加碼送出前20名，不用登記、免抽獎即可取得「月租999 iPhone 11不用錢」的中獎資格，早上8時起開始發送號碼牌，數量有限，自21名起，可享Yahoo奇摩購物金2000元。（編輯：張均懋）1080918
用行動力支持 沈榮津：台積電2奈米廠環評順利,產經,2019/09/18 18:01,https://www.cna.com.tw/news/afe/201909180268.aspx,（中央社記者鍾榮峰台北18日電）經濟部長沈榮津今天表示，台積電（2330）2奈米廠環評還算順利，行政團隊會用行動力支持產業。台積電董事長劉德音今天下午出席國際半導體展科技智庫領袖高峰會，他在會中說，台積電5奈米製程已經準備生產，明年將快速成長，明年研發重心將是3奈米，2奈米也在研究中，看到許多新的創意。沈榮津隨後主持論壇，探討台灣高科技產業的下個60年時表示，行政院長蘇貞昌曾去台積電關心5奈米建廠、3奈米規劃與2奈米廠環評進度。沈榮津說，台積電2奈米廠環評還算順利，行政團隊會用行動力支持產業，提供優質投資環境，在人才等方面也都會協助。劉德音表示，謝謝政府對台積電的支持，自沈榮津保證台積電不會有用電的問題之後，日前經詢問半導體同業，發現人才問題是半導體業最大的問題。劉德音說，學生確實不夠，受專業教育的半導體人才不夠，因為研究預算不夠，教授也不夠，只能做某些半導體研究，希望政府能夠增加半導體基礎研究的動能。全世界情勢正在改變，很多國家都將發展半導體列為重要策略，劉德音表示，台灣半導體唯一生存之道是技術領先，台灣要繼續發展，須增加基礎研究，並要引進國外人才，增加納人才的廣度。（編輯：紀淑芳）1080918
鴻海焦點回歸基本面  亞系外資評等維持買進,證券,2019/09/18 17:59,https://www.cna.com.tw/news/afe/201909180272.aspx,（中央社記者吳家豪台北18日電）亞系外資認為，蘋果代工廠鴻海創辦人郭台銘決定不參與2020連署競選總統，將讓投資人關注焦點回歸基本面，加上iPhone新機買氣佳，維持鴻海買進評等和目標價105元。鴻海股價今天多數時間在盤下整理，終場收在74.4元，下跌0.27%，成交量逾3.3萬張。亞系外資發布研究報告表示，郭台銘今年4月宣布有意角逐2020年總統大選以來，已造成鴻海股價波動，因為市場對郭台銘可能參選的影響有不同看法；但亞系外資認為影響有限，除了鴻海新設的營運委員會已順利接棒之外，郭持股9.65%仍是鴻海最大股東，也還擔任董事會成員，應會參與有關鴻海長期發展的重要決策。隨著郭台銘決定不參與2020總統大選，亞系外資認為，市場對於鴻海缺少郭台銘掌舵的疑慮也跟著消除，預期投資人關注焦點將回歸公司基本面。亞系外資也說，蘋果今年發表的3款新iPhone價格較去年降低或持平，為史上首見；經過去年第4季到今年第1季的出貨下修後，自從今年3月以來，市場對2019年iPhone整體出貨量的預估已穩定在1.85億支左右。近期新iPhone的市場氛圍轉佳，亞系外資認為將帶動組裝代工廠的獲利，原因在於外觀設計變化有限、學習曲線將縮短，且組裝代工廠已從8月初開始拉高產量，而鴻海的營收組合橫跨所有iPhone新機種，將有更好機會受惠於下半年iPhone出貨旺季，維持鴻海「買進」投資評等與目標價105元。（編輯：李信寬）1080918
等待聯準會利率決議 亞股收盤漲跌互見,證券,2019/09/18 18:22,https://www.cna.com.tw/news/afe/201909180285.aspx,（中央社香港18日綜合外電報導）亞洲股市今天收盤走勢分歧，投資人注意力轉向美國聯邦準備理事會（Fed）今天稍晚將宣布的重要貨幣政策決定，同時對沙烏地阿拉伯石油設施遭攻擊後的中東情勢發展保持警戒。由於投資人預期，為緩和美中貿易戰造成全球多數經濟體成長減緩惡化，聯準會帶頭的各國中央銀行將轉向更寬鬆的貨幣政策，全球股市本月多數時間應聲走揚。萬達（OANDA）資深市場分析師海利（Jeffrey Halley）表示：「全球市場普遍認為，（聯準會）降息25個基點已成定局。投資人將密切關注的是（政策宣布）30分鐘後的記者會，以更清楚知道聯準會是否已轉向明確的寬鬆趨勢。」海利還說：「由於（聯準會政策委員會）將無法忽視全球其他地區集結的暴風烏雲最終將開始在美國降雨，因此（政策立場）從中立轉向寬鬆的可能性將高漲。」亞股交易商今天採取謹慎態度，導致股價難以攀升。香港股市今天收盤小跌0.1%，東京股市終止連10漲收低0.2%，雪梨股市也收跌0.2%，威靈頓股市收挫0.9%，新加坡股市收低0.5%，馬尼拉、曼谷和吉隆坡股市全收黑。不過，上海股市今天收高0.3%，首爾股市收漲0.4%，台北股市上揚0.5%，孟買和雅加達股市也收紅。（譯者：張正芊/核稿：劉學源）1080918
南山人壽境界之亂 顧立雄令年底前提改善方案,產經,2019/09/18 19:07,https://www.cna.com.tw/news/afe/201909180305.aspx,（中央社記者劉姵呈台北18日電）金管會重罰南山人壽境界系統問題3000萬元，創金融業史上單年度最高罰鍰紀錄。主委顧立雄今天表示，因新舊系統沒有平行測試，導致耗費龐大人工方式做檢測，要求南山年底前提出改善方案。南山人壽2014年啟動「境界成就計畫」，將系統專案委託給國際軟體大廠思愛普（SAP），取代舊有核心資訊系統；不過新系統自去年9月上線以來不斷出問題，期間至少有15.2萬張保單受影響，甚至到8月底止，還有超過1000張投資型保單發生下錯單，無法抓出明確帳目的狀況。金融監督管理委員會主委顧立雄今天表示，「我們給南山要在4個月內再去做評估，之後提出解決改善方案，如何導入後不致出錯，驗證系統的可行性，進一步看後續根本性的解決」。顧立雄直言，南山從一開始系統更新、風險控管與採購的作業都有問題，這麼大的核心系統交給SAP，但事實上SAP並沒有做過類似這樣的經驗。顧立雄說，即使SAP沒有做過這樣的保險系統，也應該從小規模做起，再逐步擴大，等於每做一次更新，應該就要做平行的測試，而且要先當長時間驗證沒有出問題才合理，但事實上完全沒有。顧立雄表示，南山甚至把整個舊系統換掉且關閉資料，如果舊系統還在，還可以拿來驗證新系統，不然都不知道哪個地方出錯，「南山給我的通報單，幾乎每幾天都要接一次，就像說今天又有客戶反映，投資型保單哪個地方下單錯了、單位錯了、金額錯了。」顧立雄繼續說，南山原本設想的是「全自動操作」的概念，但事實上就是做不到，導致常常還要回去做人工檢測；且不但是回溯過去看有問題，在新系統中有新的保單進來，又發生錯誤；最後等於要一直耗費人工的方式去做檢測，人工付出相當龐大，整個資訊系統是「疲於奔命」。至於保戶也關心新系統還在執行，要怎麼樣才能遏止不再出錯；顧立雄表示，金管會有要求南山提出解決方案，就是從核心的系統裡面，去作改善。他說，因為投資型保單比較複雜，不像傳統保單，出錯的機率太高了，但新的投資型保單一直進入，會沒辦法確保保戶的權益，沒辦法準確運作下單的金額跟單位，所以才會下達命令說要停止新的保單進來，直到系統沒有錯誤才能有新的進去。媒體追問，還需要多久的時間，保戶才能不用擔心，顧立雄表示，監理機關要給的是時限，要經過第三方驗證再賣新的投資型保單；從8月底開始，給與南山4個月的時間，差不多年底提出改善方案，完成評估。他也強調，系統改善是給南山4個月的時間，不過失效的投資型保單，正在逐一檢視進行中。如此一來，南山人壽去年向櫃買中心提出興櫃登錄申請，但因為保險業淨值比要求不得低於6.5%，淨值比不符新標準，在今年4月時遭退件；不過6月底淨值比已拉高到7.1%，現在卻因為境界系統問題遭金管會重罰，且要提出改善解決方案，短期內要再拚申請興櫃，恐怕難有進度。金管會保險局昨天表示，經過第三方驗證後，將對南山人壽境界系統問題重罰新台幣3000萬元，且董事長杜英宗停職2年，期間不得領取任何形式的報酬及福利；統計今年以來，南山人壽已吃上7張罰單，案情包括辦理保險業務違反保險法相關規定及個資保護法、擅自變更保單繳費方式、經理人涉嫌炒股等重大缺失，合計遭罰5460萬元。（編輯：張均懋）1080918
台綜院電力景氣指數  估8月經濟成長率2.3%,產經,2019/09/18 19:14,https://www.cna.com.tw/news/afe/201909180306.aspx,（中央社記者吳柏緯台北18日電）台灣綜合研究院今天指出，8月受台商回流且適逢出口旺季，經濟成長率預估值為2.3%。台灣綜合研究院結合台電公司各行各業的高壓以上電力售電量與自用發電設備自用發電量數據，反映國內9成的經濟生產活動，以此推估國內每月經濟成長數據並建構電力景氣指數（EPI），解讀台灣經濟景氣狀況。台綜院表示，8月份受台商回台投資與產能回流，持續帶動內需動能，又適逢出口旺季加乘貿易轉單效果，出口表現不差。不過同時也受到國際政經情勢紛擾多變，經濟前景不確定性攀高，整體外在環境對台灣而言同時存在風險與機會。台綜院指出，8月的整體電力景氣指數燈號呈現綠燈，經濟成長表現較7月份微幅下修0.1個百分點，成長率預估值為2.3%。台綜院表示，製造業依舊維持整體表現偏弱，但業別間存在明顯差異的態勢。主要產業中，半導體製造業受惠於高階消費性電子新品備貨需求，帶動積體電路出口成長，比起去年同期的用電量成長超過5%，電力景氣燈號為穩定的綠燈；化學材料製造業與機械設備製造業則因出口訂單表現與生產指數持續下滑，電力景氣燈號呈現低迷的藍燈；鋼鐵業仍受制於貿易保護措施，出口持續縮減，電力景氣燈號維持黃藍燈。台綜院指出，美中貿易爭端紛擾有望逐漸沉澱，但主要國家經濟展望放緩，全球經濟前景仍不樂觀。8月份的台灣經濟雖有出口旺季與備貨需求兩大正向因素加持，但各業別的成長表現差異大，第3季經濟成長表現持穩徘徊於2.3%至2.4%之間。（編輯：蘇志宗）1080918
震盪偏升 新台幣收盤升值3.5分,產經,2019/09/18 19:19,https://www.cna.com.tw/news/afe/201909180307.aspx,（中央社記者吳佳蓉台北18日電）今天新台幣走勢震盪偏升，外資匯入力道略勝投信、進口商美元買盤，新台幣兌美元終場以31.0元作收，升值3.5分；台北及元太外匯經紀公司總成交量15.205億美元。外匯交易員表示，今天匯市呈現「兩方對作」，一方面，市場預估美國聯準會（Fed）週四召開利率會議將降息1碼，看好後續資金行情，外資仍偏向匯入，同時，擔心美元再跌，出口商趁機進場拋匯，皆支撐新台幣朝升值方向前進。外匯交易員說，另一方面，進口商及投信今天也進場買匯，撿便宜美元，惟在外資匯入力道略勝一籌情形下，僅抑制部分新台幣增幅，使整體匯價呈現區間震盪偏升。展望後市，外匯交易員認為，短線將看Fed會議結果，降息幅度應該會如外界預期，沒有什麼驚喜，市場關注的是Fed對未來利率政策及景氣的看法，以從中尋找未來操作方向；在Fed會議結果出爐前，預估明天新台幣將呈現區間盤整格局。新台幣兌美元今天以31.030元開出，盤中最高30.957元、最低31.035元。（編輯：黃國倫）1080918
外資大買180億元  法人：看好台股續創高先卡位,證券,2019/09/18 19:21,https://www.cna.com.tw/news/afe/201909180308.aspx,（中央社記者韋樞台北18日電）外資於美國聯準會（Fed）開會前在台股連10買，今天買超近180億元，買超前3大為台積電、大立光和台灣50。法人表示，外資看好台積電和大立光前景；且聯準會降息與否均有利資金推升台股而先卡位。台股今天漲54.95點，收10929.45點，成交值新台幣1284.17億元，3大法人中自營商賣超45.48億元，投信賣超1.66億元，外資及陸資買超179.44億元。證交所統計，今天外資大買前3名股票為台積電（2330）2萬6751張、大立光（3008）688張、台灣50（0050）1萬2986張；以金額論，買超台積電71億6362萬元，買超大立光28億4968萬元，買超台灣50 11億196萬元，合計多達111億1526萬元。不過以外資買超前10檔個股中，光是金融股就多達5檔，分別是中信金（2891）、新光金（2888）、台新金（2887）、玉山金（2884）、合庫金（5880）等。股市資深分析師林成蔭表示，不論這次聯準會是否降息，對市場來說都是利多。若降息1碼，代表部分資金會從美國流向他國資本市場，帶動他國股市、匯市齊升；若是不降息，代表美國並不看壞經濟前景，有利產業前景，對全球經濟來說具有指標性作用。林成蔭指出，國際局勢趨於和緩，市場較願意由債轉股，增加風險性資產和新興市場股票，而台灣在新興市場股市中向來名列前茅，且台股8月最新統計殖利率高達4.32%，外資寧可選擇殖利率高，股市又穩健的資本市場，台股就是較佳標的。林成蔭分析，外資今天大買台積電和大立光，主要是看好iPhone 11系列手機銷售不差，且台積電7奈米製程訂單很滿；而多鏡頭更是未來的趨勢，有利光學股；而買台灣50則與看好台股指數未來在利多推升下，有望挑戰更高點而先進場買進。至於外資擁抱金融股，林成蔭認為，金融股的殖利率不錯，從金融股持股逾5年以上者多半是大型的退休基金、主權基金和外資自營商等，看中金融股流動性強，殖利率又好，符合外資對流動性佳、穩健配股和獲利的需求而持續買進。（編輯：李信寬）1080918
攻600億烘焙商機 全聯挑戰2020年成全台最大通路,產經,2019/09/18 19:21,https://www.cna.com.tw/news/afe/201909180309.aspx,（中央社記者蔡芃敏大阪18日電）全聯搶攻白金商機，旗下麵包廠將在11月啟用，每天將生產25萬顆冷凍麵團，全聯表示，現烤麵包將在明年底導入全台近千間門市，有望成為全台最大現烤麵包通路。看好台灣烘焙業1年有新台幣600億元商機，全聯展現進攻市場決心，繼去年砸下約8億元買下白木屋股權，今年2月又與日本H2O RETAILING株式會社合資成立「全聯阪急麵包公司」。全聯指出，自購入白木屋股權、購買設備及廠房，至今已經砸下約15億元投入烘焙市場。截至8月，全聯已有113間門市販售現烤麵包商品，全聯旗下的白木屋廠房將在11月啟用，2條產線每天將可生產25萬顆冷凍麵團，全聯表示，全台約千家門市將在2020年底前全數販售麵包，屆時將成為全台最大現烤麵包通路。全聯烘焙業績今年前7月達8700萬元，銷售超過324萬個麵包。全聯表示，從日本進口冷凍麵團、原料，但麵包均價才30元，至今還是「賣一賠一」，不過，希望現烤麵包能成為門市「帶路雞」，帶動消費者上門頻率、拉長停留時間，而麵包香氣也能替門市氛圍加分。據統計，相較一般門市，販售現烤麵包門市來客增加約2成。全聯也說，麵包目前已有100種口味，其中，像是熱賣第一名超過20萬顆的「丹麥菠蘿麵包」，就是台灣研發後紅到日本的商品。除了全力搶進平價麵包市場，白木屋烘培廠預留了2條生產線，全聯營運長蔡篤昌表示，將視消費者接受度及需求，再調整銷售策略，不排除販賣高單價、手工麵包。（編輯：張均懋）1080918
