標題,分類,時間,網址,內文
貿易戰陰影籠罩四小龍 台經濟逆勢上修新加坡零成長,產經,2019/09/08 10:24,https://www.cna.com.tw/news/firstnews/201909080018.aspx,（中央社記者潘姿羽台北8日電）美中貿易戰是今年經濟最大的下行風險，亞洲四小龍表現各異，據IHS Markit最新預測，2019年台灣、南韓經濟成長率分別為2.0%、1.4%，香港、新加坡均不到1%，四小龍走勢分歧，產業結構不同是主因。美國總統川普揮舞著「美國優先」的大旗，指責中國長期以不公平貿易，扼殺美國的經濟利益，並在去年點燃美中貿易戰火，如今局勢愈演愈烈，關稅戰規模已全面擴大至5500億美元的中國輸美商品。國際貨幣基金（IMF）日前報告指出，美中貿易戰不只威脅全球展望，也對其他國家產生重大的負面擴散作用。兩頭大象打架，周邊鄰居難免遭殃，若就IHS Markit公布的亞洲四小龍2019年經濟表現，成長力道多有減緩，但台灣、南韓仍有1%至2%的成長率，香港、新加坡則相當低迷。台灣重回亞洲四小龍之首 第二季GDP成長2.40%值得注意的是，儘管美中貿易戰帶來極大的不確定性，台灣主計總處8月中旬逆勢上修2019年經濟成長率至2.46%，較原預測值高了0.27個百分點；政府也主動報喜，台灣第2季經濟成長率2.40%，高居亞洲四小龍之冠。主計總處官員說明，四小龍表現各異，產業結構是最大主因，台灣、南韓的製造業具備高端技術實力，即便貿易戰帶來景氣下行風險，實質需求減緩，製造業的能量仍可支撐一定程度的經濟成長。此外，台灣過去20多年，製造業大量外移，使得國內生產、投資動能趨弱，經濟成長率漸漸低於全球經濟成長率。美中貿易戰促成廠商回台擴增產能，官員指出，除了半導體產業持續投資先進製程，愈來愈多的台商返台投資，把原本在國外的生產、投資拉回國內，強化了經濟體質，這個「從無到有」的力道，抵銷部分負面影響，讓台灣經濟得以在四小龍有較亮眼的表現。四小龍各有難題 經濟競賽詭譎多變台灣在台商回流及轉單效應挹注下，大幅上修經濟成長率，但幾家歡樂幾家愁，南韓受日韓貿易戰所苦，香港則因反送中抗議影響，金融市場信心潰散。工研院產科國際所副組長陳志強指出，台灣及南韓主要經濟成長動能都來自製造業，韓國主力產品相對台灣多元，有汽車、DRAM、手機等，但除了美中貿易戰，更深受日韓貿易戰所苦；由於關鍵中間材料靠日本供給，儘管韓國可以自己生產，或向其他國家採購，但替代產品的良率是一大問題，若影響終端產品的穩定性，也會連帶傷害品牌形象。陳志強形容，日本限制關鍵半導體原料出口南韓，這招是「打蛇打7寸」，韓國實體經濟及信心都受到打擊，加重經濟下行壓力。至於服務業發展興盛的新加坡、香港，彭博報導，法國興業銀行（Societe Generale）駐香港大中華區經濟學家蜜雪兒．林（Michelle Lam）分析，香港和南韓都有各自問題，影響到國內需求和貿易，而新加坡經濟成長兩大動力－能源業和金融服務業，雙雙感受到貿易戰的影響。陳志強指出，香港以觀光、金融等服務業為主，外資比例又高，但為期數月的反送中抗議使得香港局勢動盪，投資信心潰逃，加上資金流動的速度非常快，因此他對於香港不到1%的經濟成長率，並不感到意外。新加坡方面，官方公布的第2季經濟成長率僅剩0.1%，幾近零成長；新加坡政府8月更表示，預期2019年經濟成長下修至零到1%，相較上次預測成長1.5%到2.5%，呈現巨幅滑落。台灣經濟研究院院長張建一分析，新加坡經濟幾近零成長，除了美中貿易戰帶來的衝擊，與中國經貿關係緊密，也讓新加坡難以獨善其身。星展集團則指出，嚴峻的全球經濟形勢，加上美中貿易戰，都使新加坡經濟成長趨緩，進而導致低通膨，如今產出缺口愈來愈不利，預估未來數月，整體通膨將會明顯低於預期。總體而言，台灣今年經濟成長率固然是亞洲四小龍之首，陳志強提醒，真正的衝擊是最後一波涵蓋手機、筆電的關稅清單，之前都是信心影響，這波會是直接衝擊，台灣必須審慎因應，不可掉以輕心。（編輯：林孟汝）1080908
台灣今年經濟保2無虞 學者：明年挑戰才開始,產經,2019/09/08 09:36,https://www.cna.com.tw/news/afe/201909080019.aspx,（中央社記者潘姿羽台北8日電）美中貿易戰的陰影壟罩全球，台灣在轉單效應及台商回流挹注下，今年經濟成長率仍有2.46%，不過學者示警，明年真正的挑戰才開始，除了貿易戰全面展開，台商回流是否能確實落地也是關鍵。中央研究院經濟所研究員簡錦漢分析，美中貿易戰帶來2大影響，一是對全球包含台灣，造成景氣下行的壓力，二是促成台商回流，增加民間投資，並帶來轉單效應；短期而言，今年的正面影響會略多一些，但明年貿易戰的衝擊慢慢擴大，台灣經濟將面臨更多變數。「過去一年只是前哨戰」，簡錦漢指出，儘管2018年就爆發美中貿易戰，時至今日，美中雙方都還在一來一往的試探，不過美國12月15日將對中國輸美的智慧型手機、筆電、玩具等商品加徵關稅，電子產品被捲入後，台灣受到的衝擊會更直接，負面效果明年可能會慢慢發酵。政府端出歡迎台商回台投資方案，協助廠商規避貿易戰火，據經濟部統計，截至4日止已有129家廠商、累計投資金額逾新台幣5767億元，可望挹注經濟成長動能，並帶來5萬609個本國就業機會。中華經濟研究院助理研究員陳馨蕙認為，迎來大批的投資潮對台灣是好事，但如果只是全盤通用的方案，沒有針對特別產業提出更細緻的作法，形同「兄弟登山各自努力」。陳馨蕙以中國深圳為例，原本也是個代工城市，但隨著土地、人力愈來愈貴，環保標準趨於嚴苛，政府盤點出最有競爭優勢的產業如金融、高科技、現代物流，接著活絡重點產業、端出補助，是轉型成功的案例，「把子彈用在最有優勢的地方」。台灣今年受惠於轉單效應及台商回流，經濟成長率得以逆勢上修。不過陳馨蕙指出，訪問廠商的過程中，業者多表示，當前的轉單效應很多是急單、短單，「不是長久生意」；面對國際諸多不確定性，政府更應思考，在資源有限的情況下，要怎麼留住產業，甚至讓產業發展配合台灣人口老化等各種結構問題，帶動整個社會經濟向前邁進。簡錦漢則指出，經濟部公布的台商回流金額還沒實質兌現，政府須加把勁排除各種投資障礙，並讓環評、土地取得等流程走的更順暢，才能確保台商真的在台灣落地；此外，台商將高階產能拉回台灣後，「人才」將是另一個嚴峻的課題。簡錦漢表示，台灣薪資水準長期偏低，導致人才外流，產業界必須意識到這個問題，給出更好的薪資待遇，「要有取捨，產業發展不能沒有人才」。（編輯：林孟汝）1080908
房地產投資心法 詹正田跟著政府腳步走,產經,2019/09/08 10:26,https://www.cna.com.tw/news/afe/201909080027.aspx,（中央社記者韋樞台北8日電）加工絲廠宜進紡織近年積極買房獵地，董事長詹正田大手筆砸百億元進軍南港、汐止，投資眼光精準。他投資房地產的心法是，跟著政府腳步走就對了。從2017年下半年起，宜進紡織陸續公告聯合子公司光明絲織、億東纖維、大田國際開發公司等集團力量，共投資約10筆商用不動產交易，其中8筆都是在台北市南港區和新北市汐止區，且大多數買的都是廠辦大樓。另外有1筆為耗費19億元買進大東紡織台中後火車站的近萬坪土地和8500餘坪舊廠房；以及耗費5億元買下忠孝東路4段延吉街口的商辦大樓14樓整層535坪。宜進紡織協理張恆嘉估算，從2017年下半年至今，集團購買商用不動產的金額高達新台幣93億元。張恆嘉透露，宜進集團投資這些商用不動產，除了一筆南港成功路1640坪土地是自建總部辦公大樓外，其餘都是長期出租增加集團穩定收益。其中以6.1億元購進的南港軟體園區一棟6樓整層廠辦，採取售後回租方式，換算投資報酬率高達3.1%，比銀行定存利率好太多。令人好奇的是，為何詹正田都選擇買進南港、汐止一帶的商用不動產。張恆嘉觀察指出，詹正田買房地產有一個重要的心法就是「跟著政府的腳步走」。詹正田看中政府近年來規劃「東區門戶計畫」，是從台北市的信義計畫區一路到內湖科學園區，再到南港汐止一帶，不但有高鐵延伸，還有南港展覽館2館的新建，加上兩條捷運交會，未來勢必吸引更多企業進駐。他舉例，8月底剛取得的一棟26樓樓層，已經與一家生技業者談妥長達10年的租約，房租每3年上調3%，租約收益非常穩定。張恆嘉說，從這幾年觀察詹正田投資房地產的哲學，就是要投資交通便利的地段，雖然價格高，但出租容易，可發揮保值效果；反之若是地段不佳，即使再便宜，他也不會去投資。（編輯：鄭雪文）1080908
越南投資有隱憂  在地化是成功關鍵,產經,2019/09/08 12:26,https://www.cna.com.tw/news/afe/201909080050.aspx,美中貿易戰火下台商（中央社記者潘智義、韋樞台北8日電）美中貿易戰加速外商投資越南，墊高當地勞工薪資及土地取得成本，投資多年的台商分析，除了成本因素外，勞動力供需、文化隔閡也是隱憂，在地化更是經營管理的成功關鍵。中國大陸工資、地價上漲、環保要求加嚴等因素，許多台商早已陸續轉移到越南，美中貿易戰引爆後，凸顯越南與多國簽定自由貿易協定，擁有減免關稅的優勢，掀起新一波的投資熱潮。不過越南今非昔比，已非當年的處女地，工資和地價飛漲外，部分越南勞工在台灣企業的適應力不佳，多次罷工事件及台塑越南河靜鋼廠建廠期間的排華事件，廠區人員遭受攻擊、業者被越南政府重罰的情況記憶猶新。紡織成衣業是台商在越南投資的主力產業之一，成衣大廠聚陽董事長周理平表示，美中貿易戰的關稅壓力，讓想去越南投資的產業明顯增加，特別是從中國大陸快速遷移過來。越南地理位置好，加上勞工水準較高，而越南政府與多國簽訂優惠政策，更吸引外資進駐設廠。但在投資設廠越南多年後，周理平嗅到越南成本快速上升的隱憂。他指出，短期內越南是聚陽產能最高的地區，占比達37%，印尼占33%，柬埔寨20%，其餘才是非洲與中國。聚陽每年總產能成長以10%為目標，但越南將保持在5%，成長力道會放緩，印尼會是未來產能提升的主力地區。聚陽研究團隊分析，越南的基本工資2016年曾上漲10%到15%，這兩年約上漲7%到9%；估計在美中貿易戰因素下，各產業湧進越南投資設廠，2020年基本工資漲幅可能會更高。研究團隊指出，全越南平均每月工資約150美元到180美元，但聚陽給付含加班費和保險費的月薪約300美元到360美元，雖然僅是中國勞工工資的一半，但以每年工資上調10%的速度，很快就會追上中國的工資水準；如同2009年後中國大陸醞釀工資全面上漲的氛圍，許多工廠遷往越南，若干年後可能又要從越南往外遷。布料及成衣大廠儒鴻財務長羅仁傑也指出，越南政府近年每年都會上調基本工資6%到10%，若要爭取素質較佳的工人，薪資調幅再比政府規定多加至少5%，並要負擔社會保險及提存退休金等。至於廠房土地價格，也從十幾年前每平方公尺約10餘美元，漲至目前的80美元到100美元。周理平分析，紡織成衣業使用人力較多，越南似乎有點過熱，可以預見未來會發生缺工、搶勞工現象，非常不利成衣業；在人力需求大於供給下，員工素質會下降，但土地價格、廠房、物流、勞工薪資與物價都在上漲，估計未來成長速度和規模會趨緩，不如考慮加重印尼或柬埔寨的布局。主要生產加工絲及織布業的力麗集團也曾經想在越南設廠，供應布料給下游成衣廠。力麗集團副總經理陳漢卿分析，南越已有日、韓電子廠和工具機業者進駐，薪水比紡織業好，勞力密集的紡織業再到南越設廠會面臨成本高且招工不易的困境。力麗集團也曾赴中越考察，陳漢卿說，中越的土地和人工相對便宜，但缺乏紡織產業聚落，產品外送要靠火車或海運，火車速度非常慢，港口腹地小，先天條件不適合。台灣製鞋產業布局越南時間已超過20年，運動鞋代工廠豐泰企業自1996年就已到越南設廠，目前是豐泰最大的生產基地，占集團整體出貨量52%。豐泰越南廠的廠長不是台幹，而是越南人，這是重用當地人、凝聚向心力及在地化的具體實現。深耕越南逾20年的豐泰表示，不論台灣本土的工廠，還是中國、越南、印度、印尼的工廠都需要力求深耕，在地化經營只有一步一腳印，融入當地文化，才能成功帶領勞工為公司貢獻。豐泰指出，越南廠曾經因為當地物價波動太大，主動提供勞工伙食加給，薪資方面也會定期評估，適時加薪，才能照顧好勞工的基本生活，提升對公司的向心力。同樣是運動鞋代工大廠的寶成工業，為避免生產線過度集中在中國大陸，也早在1994年建立越南生產基地。面對美中貿易戰廠商急赴越南設廠，帶動越南勞工成本上調，寶成直言，與20幾年前的製造環境相比，不僅是越南，包括中國大陸及印尼等地的土地建廠成本、勞工成本均持續增加。儘管勞動及土地成本不斷提高，寶成強調，跨國經營總會面臨更加複雜的變數及挑戰，必須理解與熟悉當地法令規定，克服語言文化的隔閡。寶成透過長時間的磨合及學習成長，建立適合在地經營的管理模式，也在越南同奈投資設立綠建築幼稚園區，希望能照顧員工家庭，讓員工安心工作。相對於製鞋、紡織產業的持續深耕擴產，科技廠卻有不同的態度，評估上更多了整體產業供應鏈的考量。筆記型電腦代工大廠仁寶在2007年一度赴越南建廠，之後因當地的勞工條件與需求有明顯落差而閒置多年。這次因美中貿易戰造成大陸輸美產品關稅大幅拉升，仁寶於2018年下半年立即重新啟動越南廠，生產網通產品，擔起銷美的重任，且獲得不錯成效；在美國將筆電納入加徵關稅名單後，仁寶也規劃筆電明年轉由越南廠生產出貨。部分台商認為，目前越南的整體狀況仍然適合新的投資，畢竟越南經濟起飛的時間較慢，還容得下新的投資。此外，東南亞國家的法治精神還在進步中，人治色彩仍重，很多廠商都有「看不見的成本」要支出。在越南長年投資的業者建議，在尊重當地政府、制度及風俗習慣的原則下，業者須熟悉當地法令規定，與員工建立通暢的溝通管道，建立適合在地經營的管理模式，才能避免文化隔閡或觀念不同所造成的衝突，影響企業正常營運。（編輯：張良知）1080908
躲貿易戰火出逃中國 越南會是熱門關鍵字嗎,產經,2019/09/08 12:17,https://www.cna.com.tw/news/firstnews/201909080051.aspx,美中貿易戰火下台商（中央社記者吳柏緯河內8日電）美中貿易戰加溫，為了躲避高昂關稅，過去一年以來，越來越多原本在中國投資的台商與中國本地企業，「逃亡」到越南北部躲避戰火。由於工資與土地價格比南越便宜，在越南政府的政策引導下，電子業與製造業的產業聚落完整，加上距離中國市場較近，又有優良的港口，遷移與進出口較為便利，北越因此成為避險首選。不少廠商的廠房、機器還沒到，訂單就先轉過來。大量訂單湧入，一時之間，在外人眼裡，「去越南」成為了一個熱門的關鍵字，也是在戰火下生存的最佳手段。只不過對於長久扎根在越南的台商而言，卻高興不太起來。在川普接下來真正要對越南祭出可能的關稅制裁之前，劇烈的投資環境變動、不斷堆高的成本，在獲得貿易戰的紅利之前，他們已逐步被推向必須做出決斷的十字路口。台商的內心話 受害比受益多「坦白說，在地的台商，受害的比受益的人更多」，談起美中貿易戰，越南台灣商會聯合總會會長沈憲煜有感而發的對中央社記者說。沈憲煜口中的「受害」，是受美中貿易戰而不合理堆高的工資與土地成本，以及新近業者大舉進入的競爭。「受益」，則是指新來的訂單。他並不諱言，隨著美中貿易戰開打，確實也有許多訂單從中國移轉到越南，但是能不能吃得下來卻是另外一回事。沈憲煜以自己的印刷包裝工廠為例，過去一年確實接了一些從中國轉來的單，但是大概也只成長3%到5%，再多就沒有辦法了。「長久扎根在越南的台商，早就有完整的供應鏈與合作夥伴，短時間內這麼大量的單轉進來，根本吃不下來。怎麼可能為了要接美中貿易戰轉來的單，把經營了十幾、二十年的客戶趕走，這不可能。而且也不可能在沒有訂單的情況下，擴廠或是加開生產線，等不知道什麼時候會來的美中貿易戰訂單。」這並不是沈憲煜個人的感受，而是越南台商普遍的心聲。越南第一精密工業業務副理曾創愉印象很深刻，去年下半年開始，收到許多過去沒有接觸過的貿易商與業者的來信，希望可以把原本在中國的單轉過來。「這種單我們基本上不會接」，曾創愉坦白說，他們的考量有3點，首先，大量的單進來，原本的生產線根本無法負荷；其次，這些新客戶需求量不夠大，而且要求的產品規格都不一樣，將會大幅提升製造成本。第三則是，這些新客戶的終端客戶，本來就已經是越南第一精密工業的客戶了，因此不可能承接。製造業與電子業，或許可以仰賴自動化增加產能，多多少少吃下一些訂單，但是仰賴密集勞力的製鞋業，就沒辦法這樣了。要搶訂單，就必須加開生產線，要加開生產線，首要任務是聘請足夠的人力，人力增加，隨之而來的就是成本大幅提升。「加開一條生產線，做這個不知道什麼時候會被停掉的單，光成本就不划算，更不要說後續可能影響企業的布局」。一位在製鞋業任職的台商幹部告訴記者，這樣炒短線的單確實在短時間內可以造成投資蓬勃的假象，但是這波熱潮過了之後呢？新進業者來到越南是要避險還是要生根，恐怕才是這波貿易戰需要關注的。其實在美中貿易戰開打之前，連年上升的越南人工成本已經成為在地台商必須正視的問題，而貿易戰開打後更多的不確定因素也牽動著這群台商對未來布局；更別提川普下一波關稅制裁可能就要對越南出手。「接下來該往哪裡去」，成為許多越南台商關心、討論的話題。越南市場過熱 思考開拓新市場「越南的製鞋業，頂多再撐10到12年，現在不開始布局就來不及了」，越南今立塑膠總經理謝明輝很早就嗅到市場變動，早在2010年時就隨著客戶的腳步到印尼設廠。謝明輝分析，製鞋業的供應鏈非常周密，不太可能只有一家業者獨自移動，而是必須整個上下游廠商一起移動，才有意義。他進一步表示，雖然目前印尼的產能不到越南1/3，但是基於分散風險與企業布局，這是必須要走的路。越南台灣商會副會長羅世良有相同看法。他觀察，台商的投資方式多是在當地購買土地、建廠房，與以承租為主的日、韓企業不一樣，要遷移前都會顧慮比較多，幾乎都是到最後一刻才走。雖然遷移並不是那麼容易，但是面對現在瞬息萬變的國際局勢，「如果只有一個基地，被封殺就玩完了」。羅世良舉例，近年他們的公司也到墨西哥布局，目前在中國、越南與墨西哥都有基地。「高單價、不好生產與原物料需求大的產品由中國生產；需要人力的產線就移到越南；出口到北美洲的產品，就在墨西哥生產。」近年，當越來越多企業將目光移向越南的時候，包含謝明輝在內的越南與泰國台商，已經開始尋覓下一個布局國家了，映入眼簾的是位在西邊的緬甸。謝明輝分析，現在的緬甸就像25年前的越南，許多的投資制度並不完善，而且產業鏈也沒有建立，加上過去緬甸禁止外資企業投資，必須以內資的方式投資，確實是投資的阻礙。然而緬甸政府提供3到7年不等的免稅優惠，加上緬甸的人口紅利，還是具有一定的吸引力，現在已有一些台商先去卡位了。謝明輝說，過去6年間，東南亞的台商至少3度組團，拜訪緬甸的政府部門，遊說放寬相關投資政策。若是加上私下的考察團，次數至少有8、9次，這顯示台商對於越南市場的興趣與迫切渴望。現階段對台商而言，越南仍有很大吸引力，謝明輝認為，政府的投資優惠、政策引導以及與許多國家簽訂FTA，都是越南的優勢，不過利潤逐漸被壓縮也是事實；「我不會放棄越南這個市場，但是如果要永續經營，就必須去開拓新市場，正如23年前來到越南一樣」。（編輯：林淑媛）1080908
