標題,分類,時間,網址,內文
投信：投資陸股選新不選舊  聚焦大消費類股,證券,2018/10/04 13:25,https://www.cna.com.tw/news/afe/201810040149.aspx,（中央社記者田裕斌台北4日電）根據投信統計，近10年中國大陸十一長假之後，陸股漲多跌少，收假後5日和後20日上漲機率皆達8成，且多能一路旺到年底。摩根投信表示，近期A股雖適逢黃金週休市，但A股有可能被納入富時指數的資金面利多，加上正值第4季傳統旺季，皆讓陸股更具想像空間。摩根中國雙息平衡基金經理人應迦得指出，中國大陸坐擁13億的人口紅利，隨著近年經濟實力快速崛起，民眾消費力道也與時俱進，並於長假期間明顯增溫，境內海量的出遊人潮為運輸業、零售業和餐飲業帶來龐大消費商機，提振相關企業業績之餘，也連動股市表現繳出好成績，這從過去10年上證指數在十一黃金週後漲幅可見一斑。應迦得指出，中國大陸官方近年持續致力於經濟轉型升級，期許能從工業大國轉型為以服務業為主導的新格局，特別是自去年中共十九大會議後，施政重點由過往著重經濟增長，到當前要務為「提高美好生活需要」，反映現階段中國大陸消費重點不再僅侷限於食品衣服，而是進一步擴展到休閒娛樂、健康服務和出門旅遊等方面的新體驗。看好強勁內需將持續引領中國大陸經濟結構調整，應迦得認為，現階段投資陸股應該選新不選舊，像是聚焦持續擴張，且成長爆發力看俏的大消費相關類股，包括食品飲料、餐飲旅遊、醫藥、家電和網路服務等相關投資機會。不過，應迦得表示，短線美中貿易衝突懸而未決，導致全球貿易緊張風險升高，加上內部金融去槓桿與貨幣收緊政策增添經濟下行隱憂，確實都讓中國大陸投資存在部分風險點，投資人即便看好陸股，依舊不可輕忽潛在波動風險。（編輯：蘇志宗）1071004
股匯雙跌 台股重挫145點失守10800點,證券,2018/10/04 14:16,https://www.cna.com.tw/news/firstnews/201810040158.aspx,（中央社記者張建中台北4日電）美元指數走強，台北股匯市雙跌，台股加權指數終場大跌145.03點，不僅摜破10829點年線關卡，並失守10800點關卡。加權指數今天收在10718.91點，跌145.03點，跌幅約1.33%，成交值新台幣1097.6億元。隨著美元指數攀高，一度達96.12，朝前波高點96.98邁進，新台幣今天走貶，新台幣兌美元中午暫收30.775元，貶1.05角，引發市場疑慮，憂心資金恐將回流美國。台股市值最大的台積電首當其衝，淪為外資提款機，股價開低走低，終場收在254元，跌6元，跌幅約2.3%。鴻海股價同樣表現疲弱，收在76.2元，跌1.6元，跌幅也達2.06%；其餘聯電與聯發科等大型股股價也都走跌，影響電子類股指數大跌1.79%。傳統產業股也普遍走跌，包括台泥、統一、南亞、遠東新與台塑化等權值股股價同步下挫，連帶影響大盤指數重挫。分析師王兆立表示，美元指數後續走向是一重要觀察指標，若突破前波高點，外資恐將持續賣超台股，不利台股未來表現，美元指數若未突破前波高點，可將外資賣超視為短期情況，台股不排除有機會收復年線關卡。（編輯：黃國倫）1071004（中央社台北4日電）台北股市今天開低走低，收盤大跌145.03點，為10718.91點，跌幅1.33%，成交金額新台幣1097.60億元。加權指數開盤為10826.19點，盤中最高10826.19點，最低10707.76點；不含金融股指數8993.68點，跌136.82點。八大類股漲跌幅：泥窯股跌1.12%、食品股跌2.62%、塑化股跌0.46%、紡織股跌0.9%、機電股跌1.78%、造紙股跌0.2%、營建股跌0.32%、金融股跌0.32%。委買張數1171萬1679張，委賣張數717萬6933張，成交張數416萬5415張。收盤時上漲187家，下跌638家，持平96家。成交量前5名個股為元太台灣50反1、元大滬深300正2、旺宏、聯電、中信金。漲幅前5名個股為海悅、云辰、正峰新、世紀鋼、統懋。跌幅前5名個股為旺宏、隴華、天瀚、國泰中國A50正2估、全新。1071004
全球拚招商  經部瞄準研發創新案源,產經,2018/10/04 13:57,https://www.cna.com.tw/news/afe/201810040163.aspx,（中央社記者廖禹揚台北4日電）2018年台灣全球招商論壇8日登場，會中將邀請23家歐美日等國外商簽署投資意向書（LOI），經濟部表示，今年主要瞄準5+2產業創新、有研發需求、從未在台投資等「新案源」。根據經濟部投資業務處統計，今年1到8月新台幣5億元以上投資案總金額已超過新台幣1.7兆元，年增31.54%，其中國內投資1.4兆元，年增28.46%，僑外投資3000億元，年增47.78%，表現亮眼。經濟部8日將舉辦全球招商論壇，會中將與23家來自歐美日等國外商簽署LOI，產業別涵蓋5+2產業創新領域、半導體相關、觀光休閒及批發零售等，其中以日商為最大宗，其次為美國、歐洲，以及泰國、新加坡等新南向國家。去年全球招商論壇簽署LOI金額達1063億元，今年是否可能再成長，經濟部政務次長龔明鑫說明，今年案源較去年不同，主要目標是開發新廠商，未計入既有廠商擴大投資案，因此總金額與去年相比可能持平。龔明鑫進一步舉例，有些半導體投資案不一定投資在製造端，而是偏向研發端，投資規模較小，但對台灣產業升級相當重要。經濟部積極招商，投資處、招商中心與駐外單位全面動員，投資處副處長陳秀全表示，除透過全球24個駐外單位宣傳台灣投資環境，也主動尋找當地案源，例如有在台灣營運、但尚無投資計畫的公司，並瞄準在台灣已設立公司的全球1000大企業一一拜會，這次簽署LOI的廠商中，就有部分來自全球1000大企業。今年全球招商論壇以「連結台灣，投資台灣，耀眼台灣」為主題，邀請產學界就人工智慧、自駕車、智慧製造等議題討論趨勢與投資台灣商機，現場並邀集台北市、新北市、桃園市、新竹縣、台中市、彰化縣、嘉義市、台南市、高雄市、屏東縣、宜蘭縣等11縣市設置招商攤位，提供廠商即時諮詢服務。（編輯：李信寬）1071004
美中恐爆全面貿易戰 摩根大通砍陸股投資評等,證券,2018/10/04 13:57,https://www.cna.com.tw/news/afe/201810040164.aspx,（中央社紐約3日綜合外電報導）摩根大通集團（JPMorgan Chase & Co.）今天調降中國股市投資評等，理由是美國和中國這兩個世界頂尖經濟體明年可能爆發「全面貿易戰」，成為最新一家不再看多陸股的券商。馬丁斯（Pedro Martins Junior）、巴特瑞（Rajiv Batra）和塔瓦利亞（Sanaya Tavaria）等摩根大通策略師在報告中表示，隨著華府擴大對中國商品加徵關稅、美元走堅、人民幣續貶，美中貿易衝突有增無減，因此對中國股市的投資評等由「加碼」（overweight）降至中性（neutral）。陸股本週適逢十一假期休市一週，規模49億美元的安碩中國大型股指數股票型基金（iShares China Large-Cap ETF）在紐約跌至2週低點。摩根大通對陸股看法轉趨謹慎，加入今年稍早已採取類似行動的摩根士丹利（Morgan Stanley）、野村控股（Nomura Holdings Inc.）和傑富瑞集團（Jefferies Group）等公司的行列。摩根大通雖調降MSCI中國指數（MSCI China Index）的目標和財測，但預測年底前指數將反彈至85點，較昨天收盤價彈漲8.9%。MSCI中國指數已自1月創下的高點回跌24%。摩根大通策略師在報告中表示：「我們2019年的最新基本假設是爆發全面性貿易戰。目前沒有明確的跡象顯示美中對峙情況短期內有緩和跡象。」華府和北京之間的緊張上週升高，川普政府對價值2000億美元輸美中國商品加徵10%關稅，習近平政府也對價值600億美元美國商品祭出關稅報復，外界期盼雙方貿易爭端盡快化解的希望因此泡湯。根據摩根大通，儘管如此，新興市場利空出盡的漲勢可能不會受到影響。摩根大通指出，兩位數的獲利成長、資產類配置偏低，加上低於已開發市場的股市本益比等因素可能刺激近期漲勢。摩根大通下修中國明年經濟成長，由之前預估的6.2%調降至6.1%。摩根大通的策略師表示，不計入反制措施下，這場貿易戰將導致經濟成長往下掉1個百分點。摩根大通策略師在報告中寫道：「加徵關稅壓縮中國製造商的獲利空間，造成投資誘因和人員招募減少，使得人們收入減少，反過頭來打擊消費。」（譯者：劉淑琴/核稿：蔡佳敏）1071004
10月電子期金融期齊跌,證券,2018/10/04 14:07,https://www.cna.com.tw/news/afe/201810040166.aspx,（中央社台北4日電）台北股市今天下跌145.03點，收10718.91點。10月電子期收424.80點，下跌8.50點，逆價差1.6點；10月金融期收1289點，下跌6.60點，逆價差3.52點。10月電子期以424.80點作收，下跌8.50點，成交4975口。11月電子期以424.60點作收，下跌8.60點，成交201口。電子現貨下跌7.77點，以426.40點作收；10月電子期貨與現貨相較，逆價差1.6點。10月金融期貨以1289點作收，下跌6.60點，成交2018口。11月金融期以1288.80點作收，下跌5.80點，成交69口。金融現貨以1292.52點作收，下跌4.12點；10月金融期貨與現貨相較，逆價差3.52點。實際收盤價以期交所公告為準。1071004
10月台指期跌160點,證券,2018/10/04 14:07,https://www.cna.com.tw/news/afe/201810040167.aspx,（中央社台北4日電）台北股市今天終場跌145.03點，收10718.91點。10月台指期以10694點作收，下跌160點，與現貨相較，逆價差24.91點。台灣期貨交易所為近2個月指數期貨契約訂定開盤參考價為，10月期貨10854點、11月期貨10844點。台股今天終場跌145.03點，收10718.91點，成交金額新台幣1097.60億元。10月台指期貨以10694點作收，跌160點，成交15萬9905口；11月期貨以10689點作收，跌155點，成交4483口。實際收盤價格以期交所公告為準。1071004
王品壯大中餐版圖  享鴨新品牌問世,產經,2018/10/04 14:21,https://www.cna.com.tw/news/afe/201810040173.aspx,（中央社記者江明晏台北4日電）王品近年跨足中餐領域，今天正式推出新品牌「享鴨」，為旗下第3個泛中餐自創品牌，預計年底前再推出以醜蔬果為號召的新品牌「丰禾日麗」。王品近年推出新品牌腳步積極，也跨足中餐領域，今天正式推出新品牌「享鴨」，主打「功夫烤鴨」，成為兩岸第25個品牌，也是繼「麻佬大」、「青花驕」後成為王品旗下第3個泛中餐自創品牌，享鴨事業處李威進經理今天受訪時指出，烤鴨與麻辣鍋都是中菜聚餐集客力最強的產品，接受者多，但市面上缺乏少人數3至4人用餐的商業模式，平均客單600元至650元，並提供2、4、6人三種組合餐，首月營業額目標新台幣300萬元。「享鴨」首店落腳台北東區二樓街邊店，與品田牧場、聚共組Power Center複合式商店，占地224坪，其中享鴨占100坪、100個座位。李威進表示，未來展店會以都會住商混合區街邊店為首要開發方向，先以北部地區為主，再往中、南部地區發展，盼最快明年能再展第二店。王品推出Power Center複合式商店，目前已有3個據點，預計年底前會再拓展1個複合式商店，將集合2個以上的品牌展店，複製新型態商業模式，希望在部分設備與人力共用的利基下，更有效管控成本。今年12月，王品也將有以醜蔬果為號召的新品牌「丰禾日麗」問世，推廣食材不浪費，也將成為旗下第4個泛中餐自創品牌。王品預計會在台北東興路再開一間複合商店據點，集合禾樂跟麻佬大2個品牌。（編輯：黃國倫）1071004
台積電攜手微軟 攻雲端商機,產經,2018/10/04 14:22,https://www.cna.com.tw/news/afe/201810040174.aspx,（中央社記者江明晏台北4日電）台積電今天於2018年開放創新平台生態論壇，發布兩項與微軟合作的計畫，推出「開放創新平台虛擬設計環境」及宣布成立 OIP雲端聯盟，盼為半導體產業帶來高效率的晶片設計環境。微軟今天發布新聞稿表示，台積電正式推出的「開放創新平台虛擬設計環境」(OIP VDE)，提供半導體客戶在安全的雲端平台上設計晶片。OIP VDE 在彈性的雲端架構上導入台積電的「開放創新平台」 (OIP) 設計架構，此為台積電和 OIP 設計生態夥伴，與微軟等雲端供應商三方聯手打造的成果，提供系統單晶片雲端設計環境。微軟 Azure 硬體基礎架構總經理工程師威德(Kushagra Vaid)表示，微軟、台積電和益華電腦(Cadence) 三強聯手，協助新創晶片設計公司 SiFive運用台積電全新 OIP VDE 推出完整的系統單晶片(SoC)設計。OIP VDE 是布署在微軟 Azure 上，且由益華電腦雲端代管設計方案提供的服務。建立在 Azure 上的OIP VDE 能以使用模式來支援跨企業、跨地域設計團隊，幫助半導體產業成功發展。台積電今天也宣布成立 OIP 雲端聯盟 (OIP Cloud Alliance)，微軟不僅是創始成員之一，同時也獲頒年度雲端最佳夥伴獎項。微軟與台積電的合作已經在Azure 上完成支援數位電路設計 RTL-to-GDSII 及Soc邏輯框架(Schematic Capture) 設計和設計流程的驗證。（編輯：楊玫寧）1071004
自由貿易港區擬擴大免稅 國內外廠商皆適用,產經,2018/10/04 14:24,https://www.cna.com.tw/news/afe/201810040175.aspx,（中央社記者顧荃台北4日電）行政院會今天通過「自由貿易港區設置管理條例」及「國際機場園區發展條例」修正草案，未來立院通過後，自貿港區內不論是國內或國外廠商，也不論產品外銷或內銷，均可100%免稅。交通部次長王國材上午出席行政院院會後記者會時表示，過去為了招商，對外國營利事業有特殊免稅規定，但為了貿易公平，修法將國內與國外廠商標準統一，並將過去限制銷售國內產品僅10%免稅的規定取消，向國際租稅公平趨勢看齊。草案規定，免稅適用對象從外國營利事業，修正為營利事業在中華民國境內僅從事準備或輔助性質的活動者；免稅行為將原本的儲存及簡易加工，修正為採購、輸入、儲存或運送；免稅範圍由銷售國外100%免稅、國內僅10%免稅，修正為內銷與外銷均可100%免稅，大陸地區營利事業也適用。為保障原核准案件權益，草案也規定過渡條款，107年底前申請核准案件適用原規定，最長可至110年底；108年（含）後核准案件，適用新修正規定。另外，草案中簡易加工免稅優惠雖被刪除，但其中3項（貼標、包裝、區分級別等）因屬儲存、運送及交付一環，將可認定屬儲存範疇而繼續享有免稅。交通部表示，本次修法符合歐盟共同合作的需求，也因應國際上租稅公平的稅務發展趨勢，完善自由港區營利事業所得稅制度。評估修法後對自由港區發展影響不大，另透過優惠項目、比例調整及所得稅法配套措施，預期將有助於促進自由港區發展成為貨物儲轉中心。（編輯：林沂鋒）1071004
日豐田攜手軟銀成立新公司 提供叫車服務,產經,2018/10/04 14:45,https://www.cna.com.tw/news/afe/201810040185.aspx,（中央社東京4日綜合外電報導）日本豐田汽車今天跟軟體銀行集團宣布，雙方將在與自動駕駛技術等相關的新型態服務方面合作，並共同出資成立公司；雙方也會在使用自動駕駛車輛的叫車服務等領域共同努力。日本經濟新聞報導，豐田與軟銀下午舉行記者會宣布，雙方共同出資成立的公司名稱叫MONET Technologies，將在2018年度中開始相關業務。軟銀出資比率為50.25%、豐田出資比率49.75%。MONET Technologies除了以提供企業為主的叫車服務，也預定提供數據分析服務等。日本放送協會（NHK）報導，到2020年代中期，MONET Technologies將使用目前豐田正在研發的自動駕駛的下一世代電動車，提供宅配及接送服務等。日本產經新聞報導，豐田汽車和行動通訊大廠軟體銀行，今天決定在下一世代的汽車技術進行合作。雙方將在共乘及自動駕駛等領域合作，共同出資設立公司。這是豐田與軟銀的首度合作。有關汽車發展，「從擁有到共有」的趨勢愈來愈明顯，而在自動駕駛車輛的研發方面，由於美國資訊科技大廠加入，讓競爭環境起了很大的變化。汽車及行動通訊的雙雄攜手，在新服務的核心技術包括資科通訊等方面，能打下好的基礎，有助提高國際競爭力。（譯者：黃名璽/核稿：蔡佳敏）1071004
三大法人賣超台股144.56億元,證券,2018/10/04 15:01,https://www.cna.com.tw/news/afe/201810040194.aspx,（中央社台北4日電）台股今天跌145.03點，收在10718.91點，成交值新台幣1097.60億元。三大法人外資及陸資、投信和自營商同步賣超，合計賣超新台幣144.56億元。自營商賣超7.79億元，投信賣超6.84億元，外資及陸資賣超129.93億元。三大法人合計賣超144.56億元。分析師王兆立表示，美元指數後續走向是一重要觀察指標，若突破前波高點，外資恐將持續賣超台股，不利台股未來表現，美元指數若未突破前波高點，可將外資賣超視為短期情況，台股不排除有機會收復年線關卡。1071004
陳金德：農舍配置規定各界見解不同 籲註銷,產經,2018/10/04 15:34,https://www.cna.com.tw/news/afe/201810040207.aspx,（中央社記者沈如峰宜蘭縣4日電）宜蘭縣代理縣長陳金德今天說，農委會規定農舍要「臨界、臨路」作法不專業又愚蠢，監察院也認定有疑義，呼籲農委會註銷「農舍經營計畫書」格式，由內政部制定新規定。農舍用地的配置是否一定要臨界、臨路，近來爭議不斷。監察院昨天發布新聞稿指出，根據監察委員仉桂美、李月德調查報告，宜蘭縣政府農舍發照浮濫，又對農委會「農舍應『臨界、臨路』興建」的函示，另定作業要點擅自放寬，要求縣府檢討改進，並請農委會督導及對法制爭議檢討。監委說，宜縣府於104年4月訂頒「宜蘭縣興建農舍申請人資格條件及農舍建築審查辦法」（現已廢止），率先規定農舍應「臨界、臨路」興建，試圖遏止農舍氾濫；農委會也在104年10月函頒「興建農舍經營計畫書」格式，明定農舍應「臨界、臨路」興建。不過，監委指出，宜縣府於107年2月1日公告實施的「宜蘭縣農業用地申請興建農舍審查作業要點」，卻反其道而行，其中第5點第2項規定「（農舍）以矩形配置於農地之地界線側及臨接道路，『或』其他不影響農業生產環境及農村發展之適當位置」，擅自放寬農委會函示規定，已違反上級機關法令規定。陳金德今天表示，宜蘭縣農業用地申請興建農舍審查作業要點是否放寬，農委會曾在民國104年函釋，「有關興建農舍經營計畫書格式業經本會邀集相關單位研商訂定，並提供審查參考原則供縣府參考，縣府得依轄內農業生產環境條件、區域特色、自治規定及個案情形予以審查。」不過，根據這份監察院的調查報告，農委會卻在接受監察院調查時表示，「農舍經營計畫書」格式，既是依農舍興建辦法訂定，是農舍興建的審查要件，對地方政府自具有拘束力，因此地方政府於審查申請農舍案件時，自應遵循中央訂定的法令辦理。陳金德認為，農委會針對「農舍經營計畫書」格式前後解釋反覆不一，讓地方政府無所適從。此外，在這份監察院的調查報告中，監察委員也曾詢問法務部相關人員意見，並在報告中指出，「關於農舍用地應矩形配置於農地的地界線及臨接道路等規定，如係申請興建農舍的審查要件或許可條件，因其內容已涉及人民權利之限制，不應規定於『農舍經營計畫書』中，而應依農發條例第18條第5項授權規定，於農業用地興建農舍辦法中規定較為妥適。」陳金德說，農舍必須蓋在「臨界、臨路」作法，限制人民權利，法務部也認同；「臨界、臨路」的作法只是行政指導，也逾越法律授權，農民可以不依循。此外，農委會的規定既不專業又愚蠢，要怎麼蓋房子、如何配置應是內政部的專業，呼籲農委會主委林聰賢趁機趕快註銷「農舍經營計畫書」格式，由內政部會商農委會制定新的規定。他表示，過去因為修改「臨界、臨路」作法，被外界罵了半年多，如今監察院公布的調查報告與法務部的見解都認定「臨界、臨路」有疑義，他符合農地農用的做法如今終於「沉冤得雪」，事理至明，宜蘭縣目前的作法合理，也不致於讓農舍蓋在田中央，會繼續走下去。宜蘭縣在雪山隧道通車後，衍生農舍相關問題。陳金德上任後，曾於今年2月推翻相關規定，彈性放寬農舍用地矩形配置，並認為農舍用地矩形配置除應遵循農委會的要求之外，也可在不影響農業生產環境及農村發展之下，尋求適當位置，且限配置於臨路地界線起縱深40%範圍內，也就是說農舍配置可不用「臨界、臨路」。他的做法屢屢與農委會意見不同，引發討論。（編輯：李錫璋）1071004
華新科9月營收再衝新高 第3季創單季新高,證券,2018/10/04 15:36,https://www.cna.com.tw/news/afe/201810040208.aspx,（中央社記者鍾榮峰台北4日電）被動元件廠華新科自結9月合併營收新台幣62.93億元，再創歷年單月新高；第3季營收也創單季新高。華新科持續布局車用和5G產品。華新科自結9月合併營收62.93億元，較8月61.55億元成長2.25%，比去年同期20.71億元大增203.78%。華新科指出，9月營收主要受到日系客戶轉單增加影響。華新科第3季自結合併營收179.56億元，較第2季113.84億元大增57.7%，創歷史單季新高。累計今年前9月自結合併營收359.9億元，較去年同期156.76億元大增129.59%。日本媒體日前報導，因應電動車和iPhone的積層陶瓷電容（MLCC）需求，日本村田製作所（Murata）計畫在日本建立新廠，並且改造在日本和菲律賓的既有廠房。法人分析，這將有助提升華新科等台廠轉單效應。汽車電子應用帶動車用MLCC需求成長趨勢，勝過供應成長，使得整體MLCC市況緊俏，產品價格上揚。汽車電子化以及自動駕駛的設計趨勢，是帶動車用MLCC需求龐大的主因。展望被動元件應用市況，華新科日前指出，聯網車用級被動元件供應將持續吃緊，5G和週邊應用需求將明顯成長，全球被動元件供給持續受限設備交期、原材料以及有限的產業人才，在MLCC產品尤其明顯。在產品組合部分，華新科持續提升車用MLCC、車用晶片電阻、5G天線和射頻RF元件解決方案，拓展供應電感器和射頻解決方案。（編輯：鄭雪文）1071004
