標題,分類,時間,網址,內文
義大利赤字報告後 歐股溫和上漲,產經,2018/10/04 00:58,https://www.cna.com.tw/news/afe/201810040004.aspx,（中央社倫敦3日綜合外電報導）義大利暗示將會尋求減緩在預算上跟歐洲聯盟間的歧見後，華爾街和歐洲股巿今天加入歐元溫和回升的行列。上述歧見引發歐元區爆發另一起危機的疑慮。倫敦FTSE 100指數漲35.73點或0.48%，以7510.28點作收。巴黎CAC 40指數漲23.51點或0.43%，收在5491.40點。法蘭克福DAX 30指數因德國統一日而休巿。（譯者：何宏儒）1071004
金融股領漲美股收紅 道瓊續創新高,產經,2018/10/04 05:01,https://www.cna.com.tw/news/afe/201810040010.aspx,（中央社紐約3日綜合外電報導）美國經濟數據助長美國公債殖利率，推升金融股，華爾街股巿今天上漲，道瓊工業指數連續第2個交易日收盤創新高。道瓊工業指數漲54.45點或0.20%，收在26828.39點。那斯達克指數漲25.54點或0.32%，以8025.09點作收。標準普爾指數漲2.08點或0.07%，收2925.51點。（譯者：何宏儒）1071004
伊朗供應下降蓋過美庫存成長 油價創4年高點,產經,2018/10/04 07:44,https://www.cna.com.tw/news/afe/201810040016.aspx,（中央社紐約3日綜合外電報導）巿場聚焦美國制裁伊朗，這個因素蓋過美國原油庫存創今年單週最大增幅，以及沙烏地阿拉伯和俄羅斯增產的報導，倫敦北海布倫特原油價格今天來到4年高點，以上漲將近2%作收。紐約商品交易所11月交割的西德州中級原油漲1.18美元，以每桶76.41美元作收。倫敦英國洲際歐洲期貨交易所12月交割的北海布倫特原油漲1.49美元，收在每桶86.29美元。（譯者：何宏儒）1071004
美股道瓊再創新高 台股估區間震盪,證券,2018/10/04 08:03,https://www.cna.com.tw/news/afe/201810040018.aspx,（中央社記者張建中台北4日電）美股走揚，道瓊工業指數再創新高，法人認為，台股上檔有壓力，下檔有支撐，短線仍將維持區間震盪走勢。美國經濟數據助長公債殖利率，推升金融股，道瓊工業指數終場漲54.45點，漲幅0.2%，收在26828.39點，連續2個交易日收盤創新高；標準普爾500指數漲2.08點，漲幅0.07%；那斯達克指數漲25.54點，漲幅0.32%。產業訊息方面，純網銀即將在11月開放申請，國家隊率先宣布成立籌備處，包括中華電信、兆豐金控旗下兆豐銀行、新光金控及全聯實業共同擔任發起策略股東。兩大美系外資對國巨營運前景看法不同調，其中一家外資認為，日本和韓國積層陶瓷電容(MLCC)廠商致力車用領域，國巨可望受惠。另一家外資認為，第4季中國市場需求恐將趨緩，國巨業績可能下滑。觸控晶片廠義隆電第3季業績逐月攀高，季營收達新台幣24.84億元，超越原訂的23.6億至24.2億元目標，季增18%，並創歷史新高。動態隨機存取記憶體(DRAM)廠南亞科第3季業績未能如預期續創歷史新高，第3季營收243.74億元，較第2季不增反減，季減0.88%。（編輯：楊玫寧）1071004
宏達電深耕VR體驗 看旺遊樂園業績翻倍,產經,2018/10/04 08:28,https://www.cna.com.tw/news/afe/201810040022.aspx,（中央社記者江明晏台北4日電）宏達電深耕VR市場，看好遊樂園VR體驗繼亞洲後，近來在歐美地區備受青睞，力拚業績翻倍。同時認為商業、醫療保健和教育都是VR重要領域，也拓展藝術、文化、社交的VR應用。HTC Viveport 總經理斯丁伯(Rikard Steiber)近期接受美國電玩媒體GameDaily採訪時表示，Viveport訂閱和Viveport Arcade業務讓開發者獲得兩種獲利來源，某些開發者會專為Arcade遊樂園構建獨特的設計。他表示，VR遊樂園體驗最初是在亞洲比較蓬勃發展，但近來在歐美地區也有備受青睞的趨勢，認為HTC VR業務在中國和亞洲的崛起，實際上也正在美國和西方世界發生，並會在這個業務上翻倍。看好遊樂場和遊樂園營運商的數量成長強勁，HTC致力幫助開發者透過這個市場進行宣傳並從中獲利。此外，斯丁伯認為，VR要獲得大規模採用可能還需要等一段時間，但售價只是另一個考量的因素，消費者已可以根據設備提供的功能良莠做進一步的評估。認為VR設備定價可能會像任何科技產品一樣下降，但如果你要的是黃金標準的高規格產品，會有優質科技產品的優質價格點出現。他進一步說，Vive Pro雖售價稍高，但它更傾向於企業應用和其他領域。商業、醫療保健和教育都是VR可以產生影響力的領域，教育同時也是一個可以幫助擴大VR技術應用的領域。HTC正致力於拓展VR在藝術和文化方面的應用，並會拓展到更多領域，例如音樂體驗遊戲、VR社交應用等。（編輯：黃國倫）1071004
義大利向歐盟低頭 調降赤字目標,產經,2018/10/04 08:47,https://www.cna.com.tw/news/afe/201810040026.aspx,（中央社羅馬3日綜合外電報導）義大利民粹政府今天向歐洲聯盟（EU）壓力低頭，調降預算赤字目標，以安撫市場不安心理。義大利政府上週宣布，未來3年財政赤字將設定為國內生產毛額（GDP）的2.4%，不但招致歐盟譴責，也引發投資人憂心義大利龐大的債務恐越滾越大。總理孔蒂（Giuseppe Conte）今天讓步表示，義大利現在計劃將2020年赤字目標降至2.1%，2021年降至1.8%。孔蒂之前矢言加速削減政府債務，義大利公共債務已達GDP的131%，為歐元區內第二高，僅次於希臘。財政部長特里亞（ Giovanni Tria）之前也表示，義大利視削減公共債務為「基本」，2019年後，財政赤字將縮減。這意味著羅馬政府立場大轉彎，義大利副總理薩爾維尼（Matteo Salvini）昨天揚言對歐盟執委會主席榮科（Jean-Claude Juncker）尋求損害賠償，他指控榮科批評義大利預算計畫，嚇跑投資人。義大利公債殖利率近日來飆高，擔心的投資人要求更高的利率才願意持有公債，提高義大利在國際市場的借貸成本。義大利10年期公債和德國同期公債間的利差1日攀至1個月來最高。兩者利差被視為持有義大利公債增加的風險，是市場關注的指標。（譯者：劉淑琴/核稿：徐睿承）1071004
新台幣開盤貶6分 為30.730元,產經,2018/10/04 09:02,https://www.cna.com.tw/news/afe/201810040029.aspx,（中央社台北4日電）台北外匯市場新台幣兌美元匯率今天以30.730元開盤，貶6分。新台幣兌美元開盤交易區間為30.730元至30.755元。1071004
台股開盤跌37.75點,證券,2018/10/04 09:04,https://www.cna.com.tw/news/afe/201810040030.aspx,（中央社台北4日電）台北股市今天開盤跌37.75點，加權股價指數為10826.19點，成交金額新台幣13.31億元。1071004
西勝垂直整合見效 第3季營收創歷史新高,證券,2018/10/04 09:15,https://www.cna.com.tw/news/afe/201810040032.aspx,（中央社記者韓婷婷台北4日電）筆電（NB）電池模組廠西勝受惠垂直整合效益顯現，加上旺季效應加持，第3季單季營收衝上新台幣7.82億元，季增12%，創下歷史新高。西勝公告9月合併營收新台幣2.63億元，單月營收較去年同期成長7.38%，較8月略減1.17%；第3季單季營收7.82億元，刷新單季最高紀錄；累計1至9月營收20.32億元，年增61.6%。西勝表示，受惠於NB旺季效應、垂直整合見效，9月營收維持高檔。展望第4季，NB新機種出貨比重拉高，ODM 出貨量也穩定增加，對營運將有顯著貢獻。西勝為全球最大NB電池芯供應商LG Chem的主要代工廠，產能占LG Chem的6成以上，西勝的終端客戶還有HP、Dell、Acer今年上半年全球市占率均提高，推動西勝出貨量排名躍升至第2位。在商用換機潮的刺激下，NB電池模組需求穩定增長，新機種報價亦跟著上調，推動營收逐步攀升。根據TrendForce筆記型電腦出貨報告顯示，全球NB出貨量在2017年止跌回升到1.647億台，今年上半年出貨量再成長0.8%到7835萬台。西勝表示，近年積極進行垂直整合與拓展ODM業務，推動營收規模持續增長。其中，ODM布局以電動工具、掃地機器人、UPS等電池模組為主，接單穩定成長，期待未來ODM業務比重穩健拉升。（編輯：黃國倫）1071004
新台幣早盤重貶1角,產經,2018/10/04 09:55,https://www.cna.com.tw/news/firstnews/201810040037.aspx,（中央社台北4日電）台北外匯市場新台幣兌美元匯率今天以30.730元開盤，貶6分；9時15分來到30.770元，貶1角。截至9時27分，新台幣兌美元最高30.730元、最低30.774元。1071004
中國十一長假 市場疲軟太陽能產品報價平穩,產經,2018/10/04 09:45,https://www.cna.com.tw/news/afe/201810040042.aspx,（中央社記者張建中新竹4日電）受中國十一長假效應影響，本週太陽能產品報價變化不大，市調機構集邦科技預期，下週隨著中國廠商返工後，產品報價將會有較大變化。據集邦科技調查，中國海外市場單晶與多晶矽晶圓本週現貨價都較上週持平表現。太陽能電池方面，多晶電池現貨價同樣較上週持平，單晶電池現貨價則相對弱勢，跌3.7%，高效單晶電池現貨價也跌1.9%。集邦科技表示，因中國長假影響，市場需求疲弱，中國海外的矽晶圓市場雖有交易，但價格並無波動，多晶電池報價也持平表現。集邦科技預期，下週隨著中國廠商返工後，產品報價將會有較大變化，供應鏈多期待中國十一長假後市場需求可望回溫，市場能否充足供應，須視上游多晶矽供給狀況而定。（編輯：蘇志宗）1071004
楊金龍：金融帳淨流出與資金外逃無關,產經,2018/10/04 09:49,https://www.cna.com.tw/news/afe/201810040045.aspx,（中央社記者邱柏勝台北4日電）央行總裁楊金龍今天在立法院重申，金融帳淨流出與資金外逃「一點關係都沒有」，主因是經常帳順差，而壽險資金流出或外資流入，都不會影響金融帳淨流出或流入。楊金龍今天列席立法院財政委員會進行業務報告並備詢。民進黨立委吳秉叡問，美中貿易戰開打至今，是否影響台灣經濟，對台灣貨幣政策的影響性為何，此外，美國持續升息，導致資金往美國移動，對新台幣有何影響。楊金龍答詢時表示，央行會密切注意美中貿易摩擦對於全球經貿的影響，貨幣政策會採取適當因應措施。針對美國升息，楊金龍則說，台灣流動性非常充沛，到目前為止，美國升息對台灣尚未造成太大的影響。吳秉叡進一步問，近期外界相當關切國際收支金融帳淨流出問題，媒體更解讀為是資金外逃，究竟金融帳淨流出代表什麼意思，是否可用深入淺出的方式對外界說明。楊金龍答覆說，金融帳淨流出主因是經常帳順差，而經常帳順差一定會導致金融帳淨流出，至於壽險資金流出，或者外資流入，都不會影響國際收支金融帳的淨流入或淨流出，與資金外逃一點關係也沒有。（編輯：楊玫寧）1071004
愛爾蘭調查臉書遭駭 歐盟最高可罰近500億元,產經,2018/10/04 09:56,https://www.cna.com.tw/news/afe/201810040047.aspx,（中央社都柏林3日綜合外電報導）臉書遭駭影響5000萬個帳號，愛爾蘭資料保護委員會（DPC）今天展開調查，成為歐盟最新的隱私保障法案第一個考驗。依歐盟新法規，最高可罰近500億元新台幣。這項調查是針對臉書公司（Facebook Inc.）9月28日坦承帳戶個資遭入侵。臉書表示，在9月間駭客利用程式漏洞，取得方法進入臉書用戶的帳號。愛爾蘭資料保護委員會發言人在一項聲明中表示，DPC今天展開對臉書資料遭駭事件的調查。聲明指出：「特別是調查針對臉書公司是否盡到義務遵守歐盟的『一般資料保護規則』（GDPR），在過程中採取適當措施確保個人資料安全。」歐盟的一般資料保護規則修正案自今年5月生效實施，愛爾蘭這項調查將成為第一個重大考驗。依照GDPR規定，若企業或組識在處理個資時未遵守嚴格標準，將受到歐盟主管單位裁決重罰。未遵守GDPR規定，對企業組織罰款最高可達全球年營收額的4%，也即理論上臉書可能面臨14億歐元（約新台幣497億元）重罰，這是根據臉書2017年營收352億歐元計算。但歐盟保護隱私部門高階官員表示，由於臉書公司有遵守規定，在72小時內通知資料遭駭，因此臉書可能不會面臨最大額度的罰款。歐盟主管司法和消費者事務執行委員喬霍瓦（Vera Jourova）告訴記者，這是可能受較低懲罰的原因之一。不過，僅就理論上來說。（譯者：紀錦玲/核稿：徐睿承）1071004
歐盟負債攀升 英國脫歐分手費恐比預期高,產經,2018/10/04 10:05,https://www.cna.com.tw/news/afe/201810040050.aspx,"（中央社布魯塞爾4日綜合外電報導）今天出爐的數據顯示，歐洲聯盟（EU）負債在年金和財務擔保費用增加帶動下攀升，英國脫歐後要付給歐盟的分手費恐比預期高。根據英國3月和歐盟夥伴達成的初步協議，英國承諾脫歐後仍將分擔歐盟負債，直到2020年底。倫敦當局在和布魯塞爾達成初步財政協議時，曾預估分手費總計達390億英鎊（約506.6億美元）。但這項最新數據顯示，歐盟債務攀升，這樣的趨勢恐導致英國必須分擔的金額更多。歐洲審計院（European Court of Auditors, ECA）今天公布報告表示，歐盟2017年的年金負債由之前預估的672億歐元，攀升至731億歐元（842.9億美元）。歐盟的共同預算是由成員國依各自經濟產出比例出資。歐洲審計院主席李納（Klaus-Heiner Lehne）表示，目前無法計算出英國的最終費用，隨著英國明年3月脫歐前的分手談判進入關鍵階段，雙方的協議條件和財務數字恐會再變。（譯者：劉淑琴/核稿：蔡佳敏）1071004"
虛擬通貨主管機關  楊金龍表態央行不適合,產經,2018/10/04 10:20,https://www.cna.com.tw/news/afe/201810040055.aspx,（中央社記者邱柏勝台北4日電）虛擬通貨主管機關應歸屬哪個部會，央行總裁楊金龍今天首度明確表態，直言不贊成央行擔任虛擬通貨主管機關，主因「沒有著力點」，至於是否由金管會擔任主管機關，由金管會評估。民進黨籍立委余宛如日前曾邀請國發會、金管會、央行三大財經部會與民間業者座談，討論虛擬通貨的主管機關應由哪個部會來擔任，但當時並無結論。楊金龍今天列席立法院財政委員會進行業務報告並備詢，國民黨籍立委曾銘宗詢問，是否贊成央行擔任虛擬通貨主管機關。對此，楊金龍今天首度明確表態，強調不贊成由央行擔任虛擬通貨主管機關，因為「央行沒有著力點」。曾銘宗追問，央行是否贊成由金管會擔任虛擬通貨主管機關，楊金龍回答，這應該由金管會自行評估。而從央行的業務報告中，也可看出央行對虛擬通貨仍抱持觀望態度，主因目前虛擬通貨的規模仍遠低於其他資產，且不具備現行貨幣體制的信任機制。若無法解決這兩大問題，虛擬通貨便無法成為廣被接受的支付工具。（編輯：黃國倫）1071004
南韓9月底外匯存底4030億美元創新高,產經,2018/10/04 10:22,https://www.cna.com.tw/news/afe/201810040056.aspx,（中央社記者姜遠珍首爾4日專電）韓國銀行（南韓中央銀行）今天公佈數據顯示，截至9月底，南韓外匯存底較8月底增加18.7億美元，為4030億美元，創新高。南韓聯合新聞通訊社報導，至9月底，南韓外匯存底資產中，有價證券較8月底增加27.9億美元，為3756.3億美元、國際貨幣基金（IMF）特別提款權（SDR）減少2000萬美元，為35.1億美元、預存款減少9億美元，為171.5億美元、IMF儲備部分提款權餘額為19.1億美元、黃金儲備與8月底相同，為47.9億美元。報導指出，截至8月底，南韓外匯存底在全球排第8，中國以3兆1097億美元居冠，日本為1兆2593億美元、瑞士為8001億美元分列其後。（編輯：廖漢原）1071004
電子股入旺季 投信看好AI等6大產業,產經,2018/10/04 10:46,https://www.cna.com.tw/news/afe/201810040064.aspx,（中央社記者田裕斌台北4日電）台股今年以來表現在新興市場中相對硬挺，投信今天表示，第4季是電子股慱統旺季，看好包括AI、雲端運算、伺服器、電動車、電競、及汽車電子等產業。野村投信國內股票投資部主管姚郁如表示，全球景氣持續正向發展，目前主要經濟體採購經理人指數（PMI）維持50以上，國際貨幣基金（IMF）預估，2019年全球經濟成長值為3.9%，台灣景氣可望受惠全球景氣復甦趨勢，出口成長並帶動國內投資及消費，從過去經驗來看，台灣出口成長與美國製造業ISM指數相關性大，在美國經濟持續暢旺下，出口將維持成長趨勢。目前須持續關注的變數就是貿易戰，雖然以雙方貿易條件來看，中國大陸略微處於劣勢，但在適度調整財政以及匯率政策下，台灣企業若能在緩衝期間將出口商品移至東南亞或是從台灣出口，可望降低影響程度。姚郁如指出，近期國際大事對台股的影響有限，以土耳其的貨幣危機為例，由於土耳其並非國際主要出口市場，且新興市場的經常性赤字除了土耳其以外多有改善，對台股的負面影響不大，從價值面來看，目前台股本益比約位於長期均值14倍，股價淨值比約為1.8倍，評價合理未過高。姚郁如表示，第4季為科技股傳統旺季，加上科技股有多種新應用興起，長期需求保持樂觀，2018下半年科技股相關企業獲利預估年增率為17.1%，AI、雲端、伺服器、電動車及汽車電子都是看好產業，預計盈餘成長仍由科技股帶動；值得留意的是，傳產中部分原物料以及金融類股亦見成長動能，非科技股中，包括金融以及受惠於中國大陸去產能及環保政策等類股亦可加以留意。（編輯：蘇志宗）1071004
白宮經濟顧問：美中可12月重啟貿易談判,產經,2018/10/04 10:53,https://www.cna.com.tw/news/afe/201810040065.aspx,（中央社華盛頓3日綜合外電報導）白宮經濟顧問柯德洛（Larry Kudlow）表示，美中貿易談判可於雙邊經濟決策者12月在布宜諾斯艾利斯的20國集團（Group of 20）召開會議時重啟。「華爾街日報」報導，美國國家經濟會議（NEC）主席柯德洛在華盛頓一個債券產業大會裡指出，目前尚無重啟貿易談判的正式計畫，但只要雙方想認真對話，美國官員已準備好談判。CNBC報導，柯德洛表示美國總統川普可能於今年稍晚在阿根廷布宜諾斯艾利斯的G20會議時，與中國國家主席習近平會晤。美國與加拿大在9月30日達成新貿易協定，取代原先的北美自貿協定（NAFTA）。柯德洛被問到新協定對美中貿易衝突有何意涵時說：「這向中國傳達重要訊號，即我們打算就貿易進行談判，且北美團結一致。」柯德洛另表示，美中達成協議為時尚早。他說：「與中國方面，短期間還不會有立即成果。我想會有討論進行，但我不會說會有立即成果。」他還指出，川普對與中國貿易談判進展並不滿意。川普政府最新一輪對2000億美元輸美中國貨品加徵10%關稅的舉措上星期生效。川普在9月17日的聲明時指出，這波關稅將於明年1月1日時上調至25%。（譯者：陳亦偉/核稿：蔡佳敏）1071004
iPhone XS雙機銷售受矚 市調滲透率有玄機,產經,2018/10/04 10:55,https://www.cna.com.tw/news/afe/201810040067.aspx,（中央社記者鍾榮峰台北4日電）蘋果iPhone XS雙機銷售各界關注。分析機構調查指出，iPhone XS和iPhone XS Max新機首個星期開賣滲透率，比去年iPhone 8系列多出45%。行動數據分析公司Flurry Analytics從9月21日到9月27日，分析美國市場行動裝置應用軟體的啟用狀況，進一步推測iPhone XS和iPhone XS Max新機開賣首個星期在美國市場的銷售情況。調查分析，9月21日到9月27日開賣首週期間，iPhone XS和iPhone XS Max占美國市場整體iPhone滲透率約1.1%，去年iPhone 8系列開賣首週，占美國市場整體iPhone滲透率約0.76%。iPhone XS和iPhone XS Max新機開賣首週占美國市場iPhone的比重，相較於去年iPhone 8和8 Plus開賣首週占美國市場iPhone的比重，多出45%。調查指出，去年蘋果採取策略是先推出價格相對較低的iPhone 8和8 Plus、再推出價格相對較高的iPhone X，今年蘋果先推出價格較高的iPhone XS和iPhone XS Max、再推出價格較低的iPhone XR。今年購買者先行採購價格較高的iPhone新機種。從營收來分析，調查推測，今年上市首週iPhone XS和iPhone XS Max的營收比去年iPhone 8系列和iPhone X多出7%。調查預期，iPhone XS和iPhone XS Max銷售的強勁態勢，可延續整個季節旺季，10月下旬還有iPhone XR推出助攻。不過調查也顯示，9月21日到9月27日期間，iPhone7在美國市場整體iPhone滲透率達到15.4%，位居第一，排名第二的iPhone 7 Plus滲透率也有12.73%。蘋果於9月21日正式開賣包括5.8吋OLED版iPhone XS以及6.5吋的iPhone XS Max。蘋果另外一款6.1吋LCD版iPhone XR將於10月26日開賣。創投公司Loup Ventures分析師孟斯特（Gene Munster）日前調查顯示，iPhone XS Max需求預估可能會超過歷史上的iPhone Plus系列，將帶動2019會計年度iPhone平均銷售價格（ASP）來到791美元。Piper Jaffray的模型預測2019會計年度iPhone XR占iPhone比重有機會提升到36%，預期2019會計年度iPhone的ASP可提升到780美元。（編輯：黃國倫）1071004
迪士尼擬結合21世紀福斯 公平會點頭,產經,2018/10/04 10:56,https://www.cna.com.tw/news/afe/201810040068.aspx,"（中央社記者潘姿羽台北4日電）公平交易委員會委員會議通過，迪士尼與21世紀福斯公司結合案，因結合後並沒有顯著的限制競爭疑慮，決議不禁止結合。公平會表示，迪士尼（The Walt Disney Company）擬透過參與結合事業間的合併，取得21世紀福斯公司（Twenty-First Century Fox, Inc.）全部股份，並直接或間接控制其業務經營或人事任免，符合公平交易法規範的結合型態與申報標準，因此結合案須向公平會申報。公平會經過評估，認為此案結合後，參與結合事業在國內電影片發行市場合併占有率排名維持第一，不過國內電影片主要發行商本來就以美商居多，迪士尼與21世紀福斯結合後，未來還是需要面對國內外電影片發行商的共同競爭，加上國內電影映演業不乏大型且具有經驗的連鎖影城業者，這些業者還是可保有選擇交易對象、放映電影類型及放映檔期的機會。另外，公平會認為，對於國內電影製作業者而言，除了本次的參與結合事業，還是保有選擇與其他國內外電影片發行商交易的機會；而且21世紀福斯公司在本次結合行為完成之前，將分割部分頻道給其他事業，因此結合後，參與結合事業在衛星廣播電視節目供應市場的占有率反而會下降，且尚有眾多衛星廣播電視節目供應業者與參與結合事業競爭。總體而言，公平會認為，此案結合後不會提高潛在競爭者的參進障礙，也不致於對國內電影片發行及衛星廣播電視節目供應等市場競爭程度產生實質減損的效果，因此判定此結合案並無顯著的限制競爭疑慮，因此不禁止結合。（編輯：李信寬）1071004"
