標題,分類,時間,網址,內文
台股重挫失守年線 被動元件三巨頭抗跌,證券,2018/10/04 11:14,https://www.cna.com.tw/news/afe/201810040074.aspx,（中央社記者鍾榮峰台北4日電）台股盤中重挫逾140點，年線失守，被動元件族群相對抗跌，國巨、華新科及禾伸堂漲幅逾1%。台股今天盤中重挫逾140點，大盤失守10800點大關、以及年線約10829點。相較之下被動元件抗跌，國巨盤中來到457.5元，漲1.4%，華新科來到208.5元，漲1.7%，禾伸堂來到132元，漲1.9%。美系外資法人日前報告指出，日本和韓國積層陶瓷電容（MLCC）廠商積極鎖定車用領域發展，預期國巨在傳統型MLCC領域可望受惠。全球MLCC市況持續供不應求，歐系外資法人日前預估韓國SEMCO和國巨是主要受惠者，國巨已與主要OEM廠簽訂長約，10月起可貢獻業績。國巨是全球最大晶片電阻（R-chip）製造商，也是全球第3大MLCC製造商。法人指出，國巨未來2年持續擴充MLCC產能，預估今年底MLCC月產能可到500億顆，2019年底月產能可到600億顆，2020年底月產能可到700億顆。華新科日前指出，聯網車用級被動元件供應將持續吃緊，5G和週邊應用需求將明顯成長，全球被動元件供給持續受限設備交期、原材料以及有限的產業人才，在MLCC產品尤其明顯。在產品組合部分，華新科持續提升車用MLCC、車用晶片電阻、5G天線和射頻RF元件解決方案，拓展供應電感器和射頻解決方案。在客戶部分，華新科積極聚焦日本重點客戶的滲透率。（編輯：黃國倫）1071004
美數據報喜 美元兌日圓升至11個月高點,產經,2018/10/04 11:18,https://www.cna.com.tw/news/afe/201810040079.aspx,（中央社東京4日綜合外電報導）美元兌日圓匯價今天攀抵11個月高點，兌其它貨幣也呈現走高，主要因美國最新公布的經濟數據報喜，加上聯邦準備理事會（Fed）主席鮑爾的最新評論被市場解讀為升息立場強硬。路透社報導，美元延續前一夜升值走勢，兌日圓匯價來到1美元兌114.55日圓，創2017年11月以來高點。聯準會主席鮑爾（Jerome Powell）昨天表示，美國「強勁的」經濟持續成長，聯準會可能升息至預估的「中性」水準之上，增添美元多頭氣勢。此外，經濟數據報喜也對美元帶來激勵，美國供應管理協會（(ISM）9月非製造業指數大幅攀升至61.6，來到1997年8月以來最高。最新公布的ADP全美就業報告也顯示，9月民間就業新增23萬人，創2月以來最大增幅。瑞穗證券（Mizuho Securities）首席外匯策略師山本雅文（Masafumi Yamamoto）說：「美元表現亮麗，加上週五（5日）非農業就業報告公布前，長期公債殖利率攀升，美元可望觸及115.00關卡。」山本說：「川普政府的注意力可能轉向美元，抑制美元升值走勢。不過，美元升勢放緩可能只是一時性，因為川普政府實際上已容許美元在現有經濟政策下走強。」美國總統川普曾多次對美元走堅表達不滿。衡量美元兌一籃子6種主要貨幣走勢的美元指數來到96.065。美元指數前夜攀抵96.116的6週高點。歐元兌美元則持平在1歐元兌1.1477美元。歐元昨天一度攀抵1.1594，主要因媒體披露，義大利計劃調降未來3年預算赤字目標。（譯者：劉淑琴/核稿：徐睿承）1071004
楊金龍：人民幣占外匯存底比重未達5%,產經,2018/10/04 11:27,https://www.cna.com.tw/news/afe/201810040082.aspx,（中央社記者邱柏勝台北4日電）央行總裁楊金龍今天在立法院透露，人民幣占央行外匯存底「不到5%」。他並表示，若未來人民幣持續貶值，央行就有可能在外匯存底部位做某些調整，「有人說如果貶值，就是撿便宜」。楊金龍今天列席立法院財政委員會進行業務報告並備詢，國民黨立委費鴻泰問，美中貿易占愈演愈烈，人民幣近期兌美元重貶，央行外匯存底中的人民幣占比約多少？楊金龍答詢表示，人民幣占外匯存底比重「不到5%」。而根據外界估算，央行外匯存底以美元占比約8成最高，其次是歐元的近1成，人民幣排行第3。楊金龍今天首度透露，人民幣在外匯存底占比僅不到5%，如果外界估算屬實，日圓、英鎊、澳幣占比更低。費鴻泰追問，央行未來外匯存底會增持美元、還是人民幣？楊金龍表示，若未來人民幣持續貶值，央行就有可能在外匯存底部位做某些調整，「有人說如果貶值，就是撿便宜」。（編輯：林沂鋒）1071004
商研院：商業服務業景氣第4季下降明年回升,產經,2018/10/04 11:30,https://www.cna.com.tw/news/afe/201810040085.aspx,（中央社記者潘姿羽台北4日電）商業發展研究院今天發布商業服務業景氣預測，指出台灣的商業服務業景氣今年第4季將下降，不過明年第1季便可回升，景氣呈「盤旋之局」，籲政府應端出景氣激勵措施。商研院今天舉辦景氣預測說明記者會，商研院董事長許添財指出，從商業服務業領先指標、同時指標來看，可以預見，台灣商業服務業將在今年第4季止升轉降，而後於明年1、2月連續回升。許添財分析，這意味台灣商業服務業這波景氣從去年5月復甦以來，並在今年8月恢復長期趨勢水準後，卻沒有辦法加速爬升，僅呈現盤旋之局，這代表刺激景氣措施只宜加強、不宜停頓，才能確保明年景氣可以持續復甦。許添財表示，這波景氣復甦有幾個特性，復甦非常緩慢、力道非常不足、走勢相當具有波動性，主因是不同部門的走勢不一，金融面的市場動能較強，批發零售業溫和復甦、運輸倉儲穩定復甦，不動產及住宅服務仍持續衰退，就業市場表現最弱。商業服務業景氣呈現盤旋格局，許添財認為，短期沒有衰退的危機，但也不能就這樣順應局勢，政府應該祭出景氣激勵措施，努力提振有效需求，才能穩住景氣復甦的趨勢。許添財也提醒，2000年以來，台灣經濟成長遲緩的主因是服務業，因為台灣服務業成長慢、投資也少很多，而且2008年金融海嘯後，基本面還是未能有效修復，導致如今商業服務業的體質已經相當脆弱，是政府必須注意的地方。（編輯：黃國倫）1071004
汽油下週估漲0.4元  95無鉛恐逼近32元大關,產經,2018/10/04 11:43,https://www.cna.com.tw/news/afe/201810040090.aspx,（中央社記者蔡芃敏台北4日電）國際油價走揚，8日起汽、柴油每公升估各調漲0.4、0.5元，加上本週已調漲0.5元，兩週內汽、柴油油價分別共調漲0.9、1元，95無鉛汽油每公升恐逼近32元大關，創近4年新高。如依預估，92無鉛汽油每公升30.4元、95無鉛汽油每公升31.9元、98無鉛汽油每公升33.9元、超級柴油每公升28.7元。實際調幅待中油7日中午12時公布。本週國際油價持續走揚，市場估計委內瑞拉原油產量續降，且美國11月將禁運伊朗石油，原油期貨市場買氣帶動現貨市場價位高漲，倫敦北海布倫特原油價格來到4年高點。依中油浮動油價公式計算，預估8日起汽、柴油價格每公升約各調漲1.0、1.1元。不過，啟動油價平穩機制調整後，中油每公升汽柴油估吸收0.6元，汽柴油價實際約各調漲0.4、0.5元。若依預估調漲油價，95無鉛汽油每公升為31.9元，逼近32元大關及2014年10月13日的32.4元高價，創4年來新高。以汽車50公升油箱為例計算，加滿95無鉛汽油，民眾每次要多支出20元。依中油官網，累算至10月3日的指標原油價格7D3B週均價為83.28美元，較上週80.44元上漲2.84美元，新台幣兌美元匯率為30.631元。（編輯：林孟汝）1071004
聯準會主席：升息最終可能達制約經濟成長水準,產經,2018/10/04 12:00,https://www.cna.com.tw/news/afe/201810040105.aspx,（中央社華盛頓3日綜合外電報導）美國聯邦準備理事會（Fed）主席鮑爾（Jerome Powell）說，聯準會最終可能將利率上調至開始制約經濟成長的水準，但距離尚遠。彭博報導，鮑爾今天出席「大西洋月刊」（The Atlantic）和阿斯本研究所（Aspen Institute）在華盛頓主辦的活動時說，「利率仍屬寬鬆，但我們正逐漸走向中性水準」，也就是不阻礙、也不刺激經濟成長，「利率可能超過中性水準，但我們目前距離中性可能還很遠」。聯準會上週宣布今年以來第3次升息，將基準利率調升一碼至2.0%到2.25%區間。從那時起，美國股市看俏，股價創新高，美國10年期公債殖利率也觸及2011年來最高點。根據聯準會上週政策會議後官方公布的利率預測中值，決策者將長期中性利率定在3%。更新後的點陣圖預測，在明年年底前，利率將略高於此一水準。鮑爾說：「在操之過急和操之過緩之間實際可行的方法是逐步行動。」鮑爾在一週內第4次公開發言中，重申他對美國經濟的樂觀評估，在此之前，他說美國經濟處於穩定低通膨伴隨極低失業率的「非常時期」。他今天說，美國「經濟形勢非常正面，我們正努力維持擴張，保持低失業率並堅持通膨目標」。「沒理由認為這個周期不能維持相當長一段時間。」（譯者：劉文瑜/核稿：徐睿承）1071004
新台幣午盤貶1.05角 暫收30.775元,產經,2018/10/04 12:05,https://www.cna.com.tw/news/afe/201810040108.aspx,（中央社台北4日電）台北外匯市場新台幣兌美元今天中午暫收30.775元，貶1.05角，成交金額6.32億美元。新台幣兌美元今天開盤價為30.730元，早盤最高30.730元、最低30.775元。1071004
西門町藥妝一級戰區 漢中街250公尺8家搶市,產經,2018/10/04 12:06,https://www.cna.com.tw/news/afe/201810040109.aspx,（中央社記者潘智義台北4日電）中信房屋調查，西門商圈藥妝店密集，不含百貨專櫃，光是藥妝店及美妝品牌專賣的街邊店面就有20間，西門町漢中街一帶，短短約250公尺距離就開了8間藥妝店、美妝專賣店。中信房屋說，西門商圈藥妝店品牌橫跨台灣、日本及韓國，不僅開在對面彼此打對台，也開在隔壁互相競爭。漢中街及峨眉街口，日韓品牌就開在對面互別苗頭，西門町甚至有知名藥妝店更是打出24小時營業，西門町儼然成為各國美妝及藥妝店的一級戰區。內政部的統計資料，雖然中國大陸來台觀光旅客人數從2014年的333萬人次，跌至2017年的198萬人次，人數掉了4成，個人旅遊人數，則是由2014年的119萬人次，跌至2017年的105萬人次，跌11%。依照交通部統計，來自日本、韓國、港澳的觀光旅客人數則是持續成長。中信房屋表示，西門町是國內外自由行旅客喜歡到訪之處，美妝及藥妝更是觀光客來台必買的商品之一，加上本地旅客想買藥妝品也會到此，因此吸引美妝及藥妝店業者紛紛前來卡位展店。中信房屋行銷企劃部呂佳音表示，在西門町漢中街、成都路一帶，接近捷運站附近的店面，一樓的店面租金每坪約在新台幣1.5萬元到2.2萬元之間，店租高昂加上一店難求，1樓店面坪數通常不大，大坪數的空間難尋，承租方可連同樓上層或是地下室一起承租，一方面補足店面坪數需求，另一方面也可以減少租金負擔。（編輯：蘇志宗）1071004
5G在2020年釋照  NCC：時程沒有延宕問題,產經,2018/10/04 12:08,https://www.cna.com.tw/news/afe/201810040110.aspx,（中央社記者朱則瑋台北4日電）NCC主委詹婷怡今天表示，預計年底前會完成5G頻譜整備的工作，清出頻段並決定執照數量，目標要在2020年釋照，一直都在積極整合中，時程上沒有延宕或轉趨保守的問題。國家通訊傳播委員會主委詹婷怡今天列席立法院交通委員會議並備詢，民進黨籍立委林俊憲、陳明文、陳素月、親民黨籍立委李鴻鈞等人皆關心5G釋照議題。林俊憲表示，NCC對於5G釋照態度是不是趨於保守，電信相關業者也因為投資成本的關係態度同樣保守；陳明文則指出，現在4G已經無法滿足國人需求，大家期待新的5G技術可以盡快上路，社會都很期待，到底時程如何，每家電信業者可分到多少頻段，NCC應該加速把頻段清出來，推動釋照工作。陳素月則質疑，之前NCC曾說5G規劃在2019釋照，2020商轉，現在時程又改變延宕，是不是政策轉彎或是NCC態度轉趨保守，還是遇到了何種困難；李鴻鈞認為，現在不少國家都已經著手開始進行5G釋照工作，NCC除了要加緊腳步，也要思考這些4G電業廠商投資到底有無回收，可否有足夠資金進行5G基礎建設。NCC主委詹婷怡說，NCC從沒有說出確切5G釋照時程，因為一切都需要看頻譜整備情形和需求面而定，也因此沒有延宕和態度轉趨保守的問題，一一直都在積極整合當中，NCC目前正在整備階段，其中在最熱門的5G中頻段上，已整備出頻寬約200MHz，至於全部要釋出多少張執照及頻段，今年底前會明確化。詹婷怡說，完成整備工作，目標要在2020年進行第一階段5G釋照，至於商轉的話還需要建設時間，時程上還不確定。她指出，對於5G應用，不同的電信業者的確有自己的想法，但5G利害關係人不只是電信業者，而是攸關相關應用產業及經濟發展，很多產業需要靠通訊技術轉型升級，進行新的應用及服務，電信業者面對5G時代來臨，也應思考營運模式轉型，而非單純靠語音收費來獲利。（編輯：林沂鋒）1071004
豐田與軟銀合作 開拓自駕領域服務,產經,2018/10/04 12:40,https://www.cna.com.tw/news/afe/201810040127.aspx,（中央社記者楊明珠東京4日專電）豐田汽車公司與軟體銀行公司（軟銀）將在自動駕駛汽車技術方面等的行動服務上合作，下午兩家公司社長將召開聯合記者會說明合資開設新公司一事。豐田（Toyota）與軟銀（SoftBank）今天下午1時半（台灣時間12時半）在東京舉行聯合記者會，豐田社長豐田章男與軟銀董事長兼社長孫正義出席記者會，說明是兩家公司首度合作創立新事業的內容。日本經濟新聞報導，豐田將與軟銀合資開設公司，瞄準以自駕車運輸人或物品的行動服務商機。軟銀先前已出資國際知名的汽車服務共享公司，豐田與軟銀聯手後，汽車新技術與服務方面的合縱連橫，競爭勢必更為激烈。（編輯：屈享平）1071004
宇瞻打進博弈供應鏈 液晶面板取代機械式機台,證券,2018/10/04 12:56,https://www.cna.com.tw/news/afe/201810040132.aspx,（中央社記者張建中新竹4日電）記憶體模組廠宇瞻深耕博弈市場有成，成功打進全球前3大博弈設備廠供應鏈。為進一步擴展博弈市場，宇瞻9日將參加在美國舉辦的全球博弈展，將展示包括工規固態硬碟等一系列博弈設備儲存方案。宇瞻指出，順應高畫質4K/8K液晶面板博弈設備取代傳統機械式博弈機台趨勢，旗下3D TLC儲存型快閃記憶體（NAND Flash）固態硬碟，可處理各類高畫質影音效果。宇瞻表示，旗下TCG Opal 2.0是為博弈機台打造的高層級資安防護機制的儲存解決方案，為用戶量身設計不同階層的使用權限，在各使用權限下，可作資料讀寫、密碼設定與指令修改等操作設定。針對吃角子老虎類型的博弈機台，宇瞻推出內建CoreLife技術的固態硬碟，讀寫速度可比一般固態硬碟快1倍，寫入抹除次數也倍增，可提升產品耐受度，延長產品壽命。（編輯：蘇志宗）1071004
美國商機日 懷俄明州長盼與台建立長期連結,產經,2018/10/04 14:16,https://www.cna.com.tw/news/afe/201810040134.aspx,（中央社記者廖禹揚台北4日電）美國懷俄明州州長米麥特今天出席2018年美國商機日活動，對於美中貿易戰是否影響與台灣關係，米麥特表示，仍希望與台灣建立長期連結與合作，創造更多經貿及教育上的合作機會。經濟部國際貿易局與中華民國對外貿易發展協會今天舉辦2018年美國商機日，邀請到美國6個州12家買主來台參加一對一貿易洽談，米麥特（Matthew Mead）也親自到場簡介懷俄明州投資環境與商機。米麥特在會後接受訪問時，媒體問及美中貿易戰對台美關係影響，米麥特表示，雖然無法針對整體政策回覆，但就懷俄明州州長立場來說，還是希望跟台灣建議長期連結與合作，為在台灣的懷俄明州人民爭取更多商業及教育上的機會。米麥特認為，除了國家之間的合作，州本身也應該要有自己的商業政策，才可能促進更緊密的合作關係。經濟部常務次長王美花表示，台灣與美國長期以來維持良好關係，不只是經貿，還有文化、教育等層面，擁有許多共同價值，藉由每年舉辦的美國商機日，可以促成更多相互投資、交易，維持良好民間關係。外貿協會副董事長莊碩漢也在開幕致詞時呼籲台美簽署雙邊貿易協定，期盼台美之間貿易與投資並進，強化雙邊連結，進而促進國內產業升級。美國是台灣第2大貿易夥伴，去年台美貿易總額達671.8億美元，今年上半年雙邊貿易總額達348.1億美元，年增8%；美國商機日已連續第7年舉辦，根據外貿協會資料，今年採購品項包括機械設備及零組件、資通訊、智慧家居用品、生技醫療、五金及手工具、食品、汽配及電動車等產業，以製造商居多，顯見台灣供應鏈優勢。（編輯：林沂鋒）1071004
大成鋼併美製鋁廠 股價先跌後漲,證券,2018/10/04 12:58,https://www.cna.com.tw/news/afe/201810040135.aspx,"（中央社記者潘智義台北4日電）大成鋼2日暫停交易，並宣布併購美鋁旗下製鋁廠，同步掌握美國通路、製造、進口鋁市場，更可避開美中貿易衝突，但3日股價不領情，大跌7.72%，今天走揚。大成鋼股價自波段低點，7月30日盤中最低37.55元起漲，至10月1日收盤價53.1元，漲幅高達41.4%。雖然大成鋼在10月2日暫停交易，宣布併購美鋁旗下製鋁廠利多，但10月3日股價不漲反跌，收在49元，大跌7.72%，今天盤中來到51元，上漲4.08%。大成鋼2日宣布，董事會通過子公司TA CHEN INTERNATIONAL, INC.透過新設100%子公司TCI TEXARKANA ,INC.以現金3.5億美元，取得美國鋁業旗下ARCONIC INC. 100%持有子公司ALUMAX MILL PRODUCTS,INC.製鋁廠全部資產。大成鋼表示，美國總統川普以「貿易擴張法232條款」對進口鋁加徵10%關稅，所有業者都面臨同樣的狀況，影響相對不大；但美國去年11月指控中國向美傾銷鋁產品，祭出的制裁後，幾乎等同讓中國大陸生產的鋁品無法銷美，因此分散進口鋁來源，以及併購美國製鋁廠是最有效的對策。（編輯：黃國倫）1071004"
新光三越南西週年慶開跑 首日業績拚4.8億,產經,2018/10/04 14:16,https://www.cna.com.tw/news/afe/201810040143.aspx,（中央社記者蔡芃敏台北4日電）新光三越南西店週年慶於今天開跑，一早吸引上千名民眾排隊搶購，開店才10分鐘，卡友滿額禮的5台iPhone XR就已全數送出，首日業績上看新台幣4.8億元。各家百貨週年慶陸續開跑，新光三越南西店於今天登場，即便是上班日，一早仍吸引上千人排隊。新光三越南西店行銷經理李香萩受訪表示，首日開店人潮估較去年成長一成，全店人潮上看吸引10萬人。李香萩表示，新光三越南西店週年慶首日營業額估計達4.8億元，而全檔期估帶來20.5億元營業額，佔南西店全年營業額24%、成長約2%。今年週年慶推出全館8折起、化妝品9折起、內睡衣8折起等折扣，另外新光三越南西店祭出卡友滿額禮，單日消費滿新台幣100萬元可獲得iPhone XR 64G一台。李香萩表示，開店才10分鐘，5台iPhone就已全數送出。李香萩表示，南西店整體銷售結構，美妝及保養品約占3到4成，服裝約占4到5成，家用及3C產品則是約為一成。今年彩妝及保養品仍是週年慶熱賣商品，李香萩表示，頂級保養品為這次週年慶保養品類主力，預購金額最高。至於彩妝品部分，底妝為今年熱門商品，以粉底液及氣墊粉餅最受歡迎。另外，今年家用及3C產品業績也成長，電玩類商品因遊戲主機銷售佳，帶動遊戲片業績。環境家電如空氣清淨機、吸塵器等，也因品牌推出新機提升銷售額。「誠品生活南西」於9月20日試營運，被問及是否影響業績，李香萩則說，誠品帶來不同客層，會吸引更多來客、讓商圈共榮。（編輯：黃國倫）1071004
撇草包經濟學污名 立委建議央行效法中研院,產經,2018/10/04 13:24,https://www.cna.com.tw/news/afe/201810040147.aspx,（中央社記者邱柏勝台北4日電）央行理事陳旭昇日前為文批評央行政策是「草包族經濟學」，引發外界議論。立委劉建國建議，央行總裁楊金龍可效法中研院日前出版的「研之有物」一書，用市井小民用語解釋艱澀議題。央行新任理事陳旭昇日前在部落格為文指出，楊金龍日前說明國際收支金融帳淨流出議題，利用恆等式來說明因果關係，是不折不扣的「草包族經濟學」。楊金龍今天列席立法院財政委員會並備詢，會中多名立委針對此議題詢問看法。國民黨立委賴士葆問楊金龍，央行內部理事對央行政策放炮，「明顯是在批評你」，若是前總裁彭淮南，一定強力回擊，「但你相對很客氣」，且多名教授都認為，央行匯率政策是阻升不阻貶，楊金龍如何回應？楊金龍表示，社會本來就有不同的意見，陳旭昇是台大經濟系教授，又是央行理事，「他有他自己的看法，我們會持續與他溝通」。他表示，陳旭昇認為科學要有實事求是的精神，政策的建立需要有嚴謹的研究才提出，「這我也非常認同」，但央行提出政策也是非常嚴謹。至於新台幣匯率本來就是有升有貶，央行阻升不阻貶，實務上很難發生。民進黨立委劉建國則說，中央研究院近期出了一本書，叫做「研之有物」，強調用鄉民說書般的白話文，讓一些枯燥無味的議題變得更親民有趣。因此央行未來對外說明政策，應該效法中研院，用貼近民眾的用語，讓民眾了解艱澀的政策議題，「我會把這本書送給你」。（編輯：林沂鋒）1071004
資金擁抱生技族群 類股逆勢上漲,證券,2018/10/04 13:25,https://www.cna.com.tw/news/afe/201810040148.aspx,（中央社記者韓婷婷台北4日電）美中貿易戰火持續延燒，資金轉向較不受干擾的生技族群，成為台股避風港，位處相對低檔的生技類股四處點火，上櫃生技指數今天漲幅一度在0.7%上下，呈現價量齊揚走勢。美國NBI生技指數自2年低點上來漲幅超過5成，最近已逼近3年前高點，今年來國際生技股表現亮眼，反觀台灣OTC生技指數，今天早盤維持在136點左右震盪，仍處於5年來低點，走勢落後。低基期、籌碼乾淨加上選舉將至政策面偏多預期等優勢，在美中貿易戰餘波盪漾之際，讓生技股成資金面避風港，近來在各種利多訊息點火激勵下，股價多有反應，吸引人氣逐步增溫。今天上櫃生技類股指數截至12時25分止，來到136.66點，漲幅0.51%，成交比重突破20%。上市生技指數也維持在68.69點平盤上下震盪，相對大盤重跌逾百點，仍具支撐力道。生技類股今天表現相對其他類股亮眼，潤泰集團旗下中裕、浩鼎漲幅都在4%以上，泰福-KY今天也在平盤之上震盪；獲得長單的科妍在短線修正後今天重啟漲勢，漲幅也在4%以上。中天旗下醣基生醫主要核心技術「醣體均相化」通過美國專利商標局核可，可望讓醣基的醣重組技術平台躍上世界級的視野，今天在利多訊息激勵下，強飆逾16%，股價早盤最高來到39.62元。另外具題材的達邦蛋白、基亞、瑞基盤中均亮燈漲停，醣聯、泰博、聿新科漲幅一度超過6%；近來相當強勢的康友-KY持續強勢上揚，早盤漲幅也在1%以上，最高來到492元。（編輯：楊玫寧）1071004
