標題,分類,時間,網址,內文
武漢肺炎疫情波及 宸鴻2月營收月減13%,證券,2020/03/06 17:55,https://www.cna.com.tw/news/afe/202003060310.aspx,（中央社記者潘智義台北6日電）蘋果觸控面板廠供應商鴻今天公布2月自結合併營收為新台幣82.1億元，較前1月95.3億元減少13.9%，較去年同期84.2億元減少2.5%。宸鴻指出，2月營收減少主因武漢肺炎疫情影響出貨，雖然廈門受疫情影響小，復工狀況良好，但包括上游材料供應鏈，及下游客戶運輸限制等因素，影響出貨約2至3成，盼3月降至2成以內。對於武漢肺炎疫情影響出貨，宸鴻先前在法人說明會解釋，因第1季屬於淡季，以復工狀況來看，其實已足以滿足客戶全部的出貨需求，只因實際產出仍需考量上游供料，以及下游組裝，還有運輸出貨的問題，所以影響出貨。另外，宸鴻指出，面對主要客戶產品轉換，營收有下滑疑慮，所以藉由大幅提升平板電腦觸控產品市占率，來消除客戶產品線調整對營收影響。宸鴻積極投入奈米銀觸控面板，規劃今年全年資本支出40億元，主要就是用在奈米銀組裝貼合設備，以及面板模組（LCM）設備。（編輯：蘇志宗）1090306
武漢肺炎疫情衝擊 IDC：台灣智慧手機恐衰退9.4%,產經,2020/03/06 17:58,https://www.cna.com.tw/news/afe/202003060312.aspx,（中央社記者張建中新竹6日電）武漢肺炎疫情延燒，資訊科技諮詢機構國際數據資訊（IDC）全面調降台灣個人運算裝置市場預測，預估今年智慧手機市場恐衰退9.4%，遠低於原先預估的成長4.9%。IDC統計，2019年台灣智慧手機市場約645萬台，年減12.6%，主因換機週期拉長，以及消費者觀望5G手機發展。IDC原先預期2020年台灣市場將因更多具價格競爭力的4G新機，以及5G服務開台後帶動中、高階手機將啟動新一波換機潮，為歷經4年衰退的智慧手機市場帶來成長動力。但自2019年11月國家通訊傳播委員會（NCC）公告各家手機廠須簽定正確標示台灣名稱切結書以來，陸續影響中國大陸廠商新機進貨狀況，IDC表示，如今又有武漢肺炎疫情蔓延，工廠生產狀況不明朗而影響出貨。IDC預估，今年台灣智慧手機市場恐將進一步滑落至584萬台，將較去年減少9.4%，低於原先預估的成長4.9%。IDC同時預估，今年台灣平板電腦市場將下滑13.9%，顯示器市場下滑5.2%，個人電腦也將下滑4.3%。（編輯：楊玫寧）1090306
疫情影響物價有限 外送平台加持2月外食費續揚,產經,2020/03/06 18:03,https://www.cna.com.tw/news/afe/202003060317.aspx,（中央社記者潘姿羽台北6日電）主計總處今天公布2月消費者物價指數（CPI）年減0.21%，不過負成長關鍵是農曆春節的季節性因素，疫情影響相對有限；主計總處官員也指出，在外送平台加持之下，2月外食費續揚，年增1.44%。主計總處綜合統計處專門委員邱淑純說明，2月部分項目確實有反映2019年新型冠狀病毒（COVID-19，俗稱武漢肺炎）的影響，但對整體CPI的影響程度相當有限。儘管疫情衝擊消費信心，餐飲業叫苦連天，直言營收大受影響，不過邱淑純表示，以涵蓋便當、飲料、速食、小吃等項目的外食費而言，2月仍年增1.44%，與上月相比也微幅上揚。邱淑純表示，主計總處查價時，僅發現少數飲料店有促銷活動，大多數商家沒有因此降價促銷，或許業者還在觀望中；另一方面，由於外送平台盛行，民眾不出門也能下單餐飲，再由外送平台派員送到家裡，也有助於減少對民間消費、餐飲業的衝擊。另一方面，從部分重要民生物資CPI變化，也可稍微看出疫情的影響。邱淑純表示，2月衣服清潔劑、沐浴用品CPI分別年增2.47%、2.44%，漲幅均較上月擴大，主因是這兩項目群都包含民眾會購買的防疫物資，衣服清潔劑包含漂白水，沐浴用品則涵蓋洗手乳，CPI漲幅擴大是受到民眾積極採買防疫用品，商品優惠減少所致。（編輯：楊凱翔）1090306
廣豐9日停牌 外傳與併購有關,證券,2020/03/06 18:12,https://www.cna.com.tw/news/afe/202003060320.aspx,（中央社記者潘羿菁台北6日電）近年轉型資產開發商的廣豐，今天發布重訊指出，有重大訊息將公布，因此下週一（9日）停牌一天，由於廣豐今年1月內部才剛成立併購特別委員會，這次停牌讓外界聯想與併購有關。廣豐成立於1968年為歷史悠久紡織廠，創辦人為賀膺才，發跡於台北迪化街，以毛巾事業起家，不過隨著大陸毛巾崛起並傾銷台灣，擠壓到廣豐生存空間，為力圖永續經營，公司從2001年啟動轉型計畫，設立子公司寶豐資產管理公司，積極開拓資產開發。2018年廣豐針對桃園八德舊廠變更地目成功後，朝向住宅與商場建設，推出廣豐花園一、二與三期建案，以及廣豐新天地綜合商場，受惠於住宅銷售認列收益，帶動2016年稅後淨利高達新台幣11.35億元，創下歷年新高紀錄。廣豐新天地綜合商場於2017年1月正式啟用，營收占比高達8成，成為主要來源，因此去年籌備新館興建計畫，預計興建地下2層地上8層，總樓地板面積約2160坪新購物空間，增加可出租面積及營收來源。近年廣豐獲利偏向穩定，2017年、2018年度稅後淨利約2億多元，整體營運進入平穩階段，再加上，廣豐今年1月董事會通過「併購特別委員會組織規程」，並且成立併購特別委員會，成立僅3個月內就宣布停牌，讓外界聯想停牌與併購一事有關聯。（編輯：鄭雪文）1090306
台中亞緻大飯店收攤  市府將督促勞資協商,產經,2020/03/06 18:18,https://www.cna.com.tw/news/afe/202003060323.aspx,（中央社記者郝雪卿台中6日電）台中亞緻大飯店將營業到8日為止，台中市勞工局今天表示，將主動組團前往進行大量解僱訪視，並督促資方積極與勞工進行勞資自治協商，後續視勞資協商結果協助求職。勞工局表示，台中亞緻大飯店約有195名員工，飯店代表說明臨時接獲公司董事會通知，台中分公司即將結束營業，會遵循通報流程及法規辦理相關事宜。勞工局指出，將主動組團前往進行大量解僱訪視，並督促資方積極與勞工進行勞資自治協商，後續會視其勞資協商結果，予以協助求職，若短期無法順利就業，將協助請領最長6個月的失業給付，或推介參加職業訓練，協助請領最長6個月的職業訓練生活津貼。勞工局表示，也將掌握飯店資遣勞工時間，依「就業服務法」規定，資遣勞工10天前應向勞工局辦理資遣通報，勞工局將於接獲資遣通報員工名單後，交由台中市就業服務處針對需協助就業者辦理求職登記，媒合適當職缺，並依個別需求提供各項就業促進措施，如履歷健診、職業適性診斷等，協助被資遣員工在短期內順利轉職。員工若有生活困難情形，勞工局表示，可向勞工局勞工權益基金尋求資源協助，符合資格者，每人每次補助1個月基本工資，最長補助2個月。（編輯：謝雅竹）1090306
世芯去年獲利創新高 每股賺7.2元,證券,2020/03/06 18:28,https://www.cna.com.tw/news/afe/202003060333.aspx,（中央社記者張建中新竹6日電）IC設計服務廠世芯-KY去年獲利亮麗，稅後淨利新台幣4.33億元，改寫歷史新高紀錄，每股純益7.2元，預計每股配發3.56846277元現金股息。世芯-KY下午舉行線上法人說明會，公布去年營運結果。受惠中國客戶處理器產品出貨強勁，世芯-KY去年營收攀高至43.31億元，年增25.5%。隨著設計營收比重攀升，世芯-KY去年獲利同步攀高，稅後淨利4.33億元，年增68.4%，並創下歷史新高紀錄，每股純益7.2元。世芯-KY董事會決議每股配發3.56846277元現金股息，若以今天收盤價240元計，殖利率約1.48%。展望未來，世芯-KY表示，雖然武漢肺炎疫情蔓延，美中貿易戰緊張情況不定，不過，目前中國客戶仍未下修今年處理器訂單的預估量，預期今年出貨量可望持續放大。世芯-KY指出，目前在中國、北美與中東市場都有數項7奈米設計案進行中，預期7奈米將成為設計案的主流製程。（編輯：鄭雪文）1090306
上市公司延遲公告去年財報 3/27前申請,證券,2020/03/06 18:39,https://www.cna.com.tw/news/afe/202003060338.aspx,（中央社記者潘智義台北6日電）台灣證券交易所今天宣布，上市公司若因新型冠狀病毒疫情，無法在3月底前如期公告申報108年度財務報告，應於3月27日前向證期局申請延期，並掌握3時機發布重大訊息。證交所表示，上市公司若無法如期公告申報108年度財務報告（包括合併資產負債表、合併綜合損益表、合併權益變動表及合併現金流量表），應經董事會通過預計展延時限、具體辦理時程，並須洽會計師表示合理性意見，檢附相關文件，向金融監督管理委員會證券期貨局申請核准。申請延期公告申報108年度財務報告上市公司應於下列3個時點發布重大訊息，以使投資人知悉其延期公告申報財報原因、相關時程規劃、自結財報數、與會計師查核數差異等資訊。第一，申請公司應於董事會通過向主管機關申請延期公告申報108年度財務報告時發布重大訊息，並同時提供可供投資人查閱自結4大財務報表的網站路徑，例如公司網站等。第二，申請公司應於取得主管機關准駁結果時發布重大訊息。第三，申請公司應於證期局核准後，經董事會通過108年度財務報告時發布重大訊息，並說明會計師查核數與先前公告自結數有無差異及差異原因等。證交所將於公開資訊觀測站上設置108年度財務報告延期公告申報專區，內容包括申請公司名稱、董事會通過申請財報延期公告申報日期、預計展延時限、主關機關准駁情形及完成財務報告公告申報日期等資訊，以使投資人完整知悉相關資訊。（編輯：林孟汝）1090306
外資落跑 股匯齊跌新台幣終止連7升,產經,2020/03/06 18:45,https://www.cna.com.tw/news/afe/202003060342.aspx,（中央社記者潘姿羽台北6日電）武漢肺炎疫情持續升溫，美股道瓊收盤重挫近千點，在恐慌情緒驅使之下，外資今天上演大逃殺，台股重挫193.01點，新台幣也無力守住2字頭，終止連7升，收盤收30.040元，貶值8分。匯銀人士表示，疫情蔓延至歐美國家，且確診病例數持續攀升，使得市場信心上上下下，股匯隨之重挫，近日美股就出現這樣的戲碼，宛如「一日天堂、一日地獄」。受到美股大跌近千點影響，台股今天開低震盪收黑，大跌近200點，且外資賣超台股達新台幣288億元，加權指數終場收在11321.81點，一舉灌破季線與半年線支撐，多方僅能守住年線。匯市方面，外資呈現雙向操作，新台幣兌美元以30.050元開盤，早盤稍作震盪後，便一路走貶，但因美元買盤進場，帶來些許支撐力道，盤中最低30.050元，收盤則收在30.040元，貶值8分，台北及元太外匯市場總成交金額為15.75億美元，周線仍連2紅。匯銀人士分析，市場資金相當寬鬆，但因疫情發展沒人說得準，各國股匯市也隨著疫情狀況大起大落，一有負面消息，資金馬上撤離；不過台灣至少疫情控制尚算穩定，不論台股或是新台幣，都相對抗跌，具有支撐力道。（編輯：楊凱翔）1090306
武漢肺炎疫情衝擊 亞德客-KY 2月營收月減4成,證券,2020/03/06 18:48,https://www.cna.com.tw/news/afe/202003060345.aspx,（中央社記者鍾榮峰台北6日電）受武漢肺炎疫情影響，氣動元件廠亞德客-KY自結2月合併營收新台幣5.32億元，月減40%，是48個月以來單月低點。亞德客-KY自結2月合併營收5.32億元，較1月8.89億元大減40.11%，比去年同期7.29億元衰退27.03%。法人指出，亞德客-KY 2月營收是2016年3月以來單月低點。公司指出，受中國大陸武漢肺炎疫情影響，考量配合所在地政府防疫政策，以及提供員工較健康安全工作環境，同時確保公司營運效率，決定大陸各子公司開工日期延後到2月17日，使得2月工作天數大幅減少。累計今年前2月亞德客-KY自結合併營收14.21億元，較去年同期19.01億元減少25.24%。亞德客-KY在中國主要子公司包括寧波亞德客自動化工業、廣東亞德客自動化工業、亞德客（中國）有限公司、亞德客（江蘇）自動化工業、廣東亞德客智能裝備、福建亞德客智能裝備、亞德客（天津）智能科技有限公司等。觀察氣動元件在中國產能進展，本土法人報告指出，在電子業應用帶動下，氣動元件日廠SMC第1季訂單季增，儘管有武漢肺炎疫情影響，中國客戶目前並未取消訂單。在產能恢復進展方面，報告指出，SMC稼動率超過50%。不過部分中國客戶要求遞延出貨。報告預期，庫存回補需求將在第2季開始出現，也就是資本支出週期帶動的訂單復甦，可望刺激客戶補充零組件庫存，自動化零組件急單可望在第2季出現，帶動包括亞德客-KY在氣動元件營運優於預期。展望亞德客-KY今年營運，法人預期，在新產品和新客戶帶動下，今年業績成長幅度可較業界平均10%幅度佳，其中線性滑軌貢獻比重可大幅增加，預估今年業績可望站上新台幣175億元。在市占率擴大以及資本支出上升週期支撐下，今年亞德客-KY獲利可望較去年成長35%以上，每股純益有機會超過19.5元，挑戰歷史新高。目前中國大陸占亞德客-KY整體業績比重達9成多，亞德客-KY主要競爭對手包括SMC、Festo和其他中國大陸廠商、台廠和韓廠等。SMC、亞德客-KY和Festo在中國大陸氣動元件市場占有率約65%。（編輯：楊玫寧）1090306
返工率續拉升 玉晶光估3月營收優2月,證券,2020/03/06 18:57,https://www.cna.com.tw/news/afe/202003060353.aspx,（中央社記者韓婷婷台北6日電）光學鏡頭廠玉晶光（3406）受武漢肺炎疫情延後復工影響，2月營收新台幣6.93億元，月減29.34%，但仍為歷年同期次高，年增215%，預期3月工作天數回到正常，營收應會優於2月。玉晶光大陸廈門廠受到疫情影響，延後至2月10日復工，加上初期返工率較低，導致2月單月營收較1月下滑，不過因春節因素，相較去年同期大幅增加215%；累計前2月營收16.75億元，年增159.16%。展望後勢，隨著返工率持續拉升已超過8成，加上工作天數較正常，預期3月營收將高於2月，整體第1季營收仍將呈現高成長態勢。玉晶光為蘋果鏡頭第2供應商，外資法人認為，前2月整體營運可維持高成長，主要受到多鏡頭趨勢，加上供應蘋果iPhone手機鏡頭，從原本的前鏡頭擴增到後鏡頭。外資法人看好多鏡頭趨勢下，玉晶光長期結構成長趨勢不變，預估今年下半年可望成為新iPhone全新飛時測距（ToF）鏡頭主要供應商。另外，玉晶光在驗證新款7片式廣角鏡頭的進度符合預期，可望成為第二供應商，加上玉晶光今年預計擴產約20%至30%計畫不變，短線雖受到疫情影響及面臨終端需求下修的風險，但長期結構成長動能依舊可期。（編輯：林孟汝）1090306
客戶授信負面資料 證券與銀行3/31起可跨業查詢,證券,2020/03/06 18:58,https://www.cna.com.tw/news/afe/202003060354.aspx,（中央社記者潘智義台北6日電）台灣證券交易所今天宣布，推動證券及銀行跨業查詢客戶授信負面信用資料案，訂於今年3月31日實施。證交所表示，配合金管會政策，證交所與聯徵中心、證券商公會、銀行公會及櫃買中心攜手合作，研議推動跨證券業及銀行業的客戶負面信用資料交換查詢案，金管會核定，證交所及聯徵中心同步自3月31日上線實施。證交所說明，以往證券商只能透過證交所的聯合徵信系統，查詢投資人是否在證券市場有違約紀錄，但無法得知是否在銀行有無違約。反之，銀行也僅能透過聯徵中心查詢客戶於金融機構的違約紀錄，無法得知客戶在證券商的信用狀況。因此，在跨業別的負面授信資料無法交換情形下，將增加證券商及銀行的授信風險。經過協議及電腦系統功能修正與資訊連線測試，自今年3月31日起，將透過證交所及聯徵中心電腦系統介接，證券商及銀行將能分別透過雙方系統查到客戶是否在他業有授信違約紀錄，以強化授信業務風險控管。證交所特別提醒，證券商及銀行在查詢資料時，必須先取得客戶同意，且證券商僅限辦理信用交易業務、證券業務借貸款項、不限用途款項借貸的授信相關業務才能查詢，辦理客戶普通交易開戶並不能查詢該項資料。（編輯：蘇志宗）1090306
武漢肺炎全球疫情加劇 亞股全面重挫,證券,2020/03/06 19:37,https://www.cna.com.tw/news/afe/202003060359.aspx,（中央社香港6日綜合外電報導）全球武漢肺炎疫情持續惡化，亞洲股市今天收盤全面重挫，東京、雪梨、香港和首爾股市跌幅都超過2%。分析師並警告，疫情危機引發的市場震盪，很可能還會持續一段時間。儘管多國政府與中央銀行已經或準備祭出刺激經濟措施，但武漢肺炎疫情還在全球迅速蔓延，死亡人數也不斷增加，持續對各國經濟帶來壓力，並引發全球經濟可能落入衰退的疑慮。目前至少已有85國出現武漢肺炎感染病例，全球確診人數累計近10萬。在疫情還見不到盡頭之下，投資人正在逃離股市等風險較高資產，轉入黃金與日圓等避險資產。信評機構標準普爾（S&P）今天警告，疫情危機恐令亞太地區今年國內生產毛額（GDP）減少2110億美元（約新台幣6兆3000億元），全年經濟成長率恐僅4%，這將是金融危機以來最低紀錄。亞洲股市今天收盤全倒。東京股市收挫2.7%，上海股市收跌1.2%，香港股市收挫2.3%，雪梨股市收跌2.8%，首爾股市收挫2.2%，台灣、新加坡、曼谷、威靈頓和馬尼拉股市收盤跌幅也都超過1.5%。（譯者：陳家倫/核稿：張正芊）1090306
台資中國工廠多已啟動  湖北產線11日復工,產經,2020/03/06 19:18,https://www.cna.com.tw/news/afe/202003060363.aspx,（中央社記者潘羿菁台北6日電）武漢肺炎疫情打亂開工節奏，目前電子零組件、造紙、製鞋業等在中國的多數工廠已開工，湖北產線則要等到本月11日，而啟動的工廠受限物流與人流，至今未達全產能，但3月稼動率有望漸入佳境。全球最大iPhone組裝廠鴻海，廠區範圍遍及廣東、佛山、江蘇昆山與河南等，其中，深圳龍華廠與河南鄭州廠為蘋果供應鏈指標廠區，董事長劉揚偉3日首度對外說明，中國大陸廠區復工比例目前已超過季節性需求50%，依目前進度，3月底前應可恢復季節性正常產能。至於原先外界認為，印刷電路板產業可能成為疫情重災區，欣興日前公告，位於蘇州群策科技2月10日復工，聯能科技深圳公司也在隔天取得開工許可，緊接著，昆山的鼎鑫電子與欣興同泰科技，一併在2月15日開工，唯獨湖北黃石廠區要等待交通與人員流通管制解除。不過同為印刷電路板的定穎則說，湖北黃石廠現有人員繼續以7成稼動率產出，等待當地政府通知復工後，再從現有的7成產出往上增加；至於全球PCB龍頭臻鼎-KY旗下大陸廠區，估計3月整體復工率可達85%以上。全球製鞋大廠的寶成表示，位於大陸多數工廠已於2月17日起復工，唯獨湖北產線需等到3月11日才能復工。台灣三大造紙廠的榮成，位於中國大陸產能占比高達7成，目前位於昆山的榮成環科已在2月25日復工，位於浙江4座紙器廠以及平湖、無錫2座造紙廠也在2月底、3月初開工，疫情最嚴重的湖北造紙廠與紙器廠遵照當地政府規定，3月11日開工。正隆則說，位於上海、昆山、青島、蘇州、漳州、成都與開封等工廠，2月17日起全數開工，但由於下游客戶開工速度仍偏慢，3月起正隆稼動率才有機會拉升至80%。而台泥與亞泥同樣在2月下旬陸續開工，亞泥湖北工廠也要到3月11日才能復工，台泥表示，儘管開工，但由於營造工地人員並未全部到位，市場尚未起來，台泥稼動率不見得能快速提升。（編輯：鄭雪文）1090306
武漢肺炎疫情引發恐慌 歐股開盤重挫逾3%,證券,2020/03/06 19:26,https://www.cna.com.tw/news/afe/202003060367.aspx,（中央社倫敦6日綜合外電報導）由於投資人對武漢肺炎疫情及全球經濟成長預料將受重創愈感恐慌，歐洲股市今天延續昨天沉重跌勢，主要股市開盤下挫約3.5%。其中巴黎股市重挫3.9%、法蘭克福與米蘭股市皆挫跌3.7%，馬德里股市重挫3.4%，倫敦股市挫低3.3%。（譯者：楊昭彥/核稿：張正芊）1090306
投資台灣方案報捷 逼近9000億元大關,產經,2020/03/06 19:46,https://www.cna.com.tw/news/afe/202003060375.aspx,（中央社記者蔡芃敏台北6日電）經濟部今天通過6家中小企業擴大投資新台幣19億元，經濟部表示，投資台灣3大方案已吸引投資8978億元，預估2週後便可突破9000億元大關，後續尚有76家企業排隊待審。經濟部今天發布新聞稿表示，投資台灣事務所再通過6家中小企業擴大投資共19億元，「中小企業加速投資行動方案」已通過162家中小企業投資約746億元，帶來6951個本國就業機會。經濟部統計，投資台灣3大方案已帶動385家企業投資約8978億元，預估創造7萬4563個本國就業機會。投資台灣事務所發言人何坤松表示，經濟部持續審查三大投資方案，預估總投資額在1、2週內便可突破9000億元大關，後續尚有76家企業排隊待審。另外，經濟部也加強防疫，針對申請的業者改採視訊說明投資計畫、相關簡報，讓業者免於奔波，減少接觸風險。南台彩藝為因應全球工業智能化趨勢，預計斥資超過8億元把現有2座印刷廠整併至台南科技工業園區，可新增國內32個就業機會，並將添購智能化機械設備以提升印刷技術，並建立新型態商業模式，使生產與銷售端連結，實現印刷行業網路平台化願景。誠泰科技擅於生產與銷售環保型熱熔膠及自黏式防水膜廠商，將投入逾1億元與招募13名本國人才，在南科高雄園區新建廠房，導入智慧化功能產線，並積極研發環保防水材料技術，未來新廠規劃量產環保型防水材料。騵大科技規劃投入逾1億在台南新營增設能資源再利用廠，致力開發綠色製程、創新技術及智慧技術，將有效整合製程，以節省能源及成本提升產能，朝向達成零廢棄物、二氧化碳零排放的永續發展目標，預計可創造45個工作機會。德冠企業專營純鋁、鋁合金等特殊板料及線材，也是政府「國艦國造」政策生力軍，現更積極爭取加入離岸風電運輸船零件供應鏈團隊，布局參與綠能相關產業。德冠企業將投資逾1億元在高雄市和發產業園區建設新廠，預計招募20位本國人力，朝自動化、智慧化邁進。興隆興工業專營大型零部件製造，由於台中市太平區舊廠不敷使用，為了提升電子、自動化設備及高階精密產品營業占比，決定斥資近6億元在嘉義大埔美精密園區新廠增設產線，同時引進專為離岸風機業務量身打造的特大型加工機台，解決台灣機台太小、風機水下基礎地基限於國外製造的困境。估將可帶來64個本國就業機會。昭侒水產以創新生技養殖為目標，採用科學養殖新技術，將斥資逾1億元在屏東佳冬鄉新建防疫型室內智慧化養殖場，增設智慧化養殖及監控設備，運用智慧感測裝置強化各項養殖環境條件，以數位管理突破現有養殖技術缺陷。也將利用太陽能提供養殖設施綠色能源，推動傳統養殖業轉型發展綠色新農業，預估可帶來16個本國就業機會。（編輯：鄭雪文）1090306
