標題,分類,時間,網址,內文
武漢肺炎延燒 歐洲3大股市收盤跌幅逾1.5%,證券,2020/03/06 02:43,https://www.cna.com.tw/news/afe/202003060013.aspx,（中央社倫敦5日綜合外電報導）歐洲3大股市今天收黑，跌幅均超過1.5%，肇因於投資人把焦點集中在武漢肺炎在中國以外地區的快速擴散，以及疫情對航空業營運產生的更多衝擊。英國倫敦FTSE 100指數下挫110.16點，跌幅1.62%，收在6705.43點。德國法蘭克福DAX 30指數下跌182.97點，跌幅1.51%，收在11944.72點。巴黎CAC 40指數挫跌103.79點，跌幅1.90%，收在5361.10點。（譯者：徐崇哲）1090306
武漢肺炎陰影釀災 美股道瓊指數收盤狂跌近千點,證券,2020/03/06 05:32,https://www.cna.com.tw/news/firstnews/202003060019.aspx,（中央社紐約5日綜合外電報導）華爾街股市今天再度賣壓沉重，恢復下探趨勢，道瓊指數收盤重挫近千點，金融市場憂心2019年冠狀病毒疾病（COVID-19，武漢肺炎）會讓美國經濟筆直墜入衰退。道瓊工業指數終場大跌969.58點，跌幅3.58%，收在26121.28點。標準普爾500指數終場重挫106.18點，跌幅3.39%，收在3023.94點。以科技股為主的那斯達克綜合指數終場下挫279.49點，跌幅3.10%，收在8738.59點。（譯者：徐崇哲）1090306
俄羅斯是否大幅減產未定 油價跌至3年低點,產經,2020/03/06 05:48,https://www.cna.com.tw/news/afe/202003060020.aspx,（中央社紐約5日綜合外電報導）俄羅斯是否同意石油輸出國家組織（OPEC）建議大幅減產仍具不確定性，布倫特原油價格今天下挫，自2017年7月以來首次跌破每桶50美元。倫敦市場北海布倫特原油的5月期貨價格下跌1.14美元，收在每桶49.99美元。紐約市場西德州中級原油的4月期貨價格下挫88美分，收在每桶45.90美元。（譯者：徐睿承）1090306
武漢肺炎陰影糾纏  美股拉回道瓊重挫969點,證券,2020/03/06 07:35,https://www.cna.com.tw/news/firstnews/202003060024.aspx,（中央社記者尹俊傑紐約5日專電）美股本週震盪加劇，道瓊指數今天在運輸類股拖累下重挫969點，一反昨天飆漲逾千點的走勢。武漢肺炎疫情蔓延，擔憂經濟的投資人搶進美債避險，促使美債殖利率再創新低。美股開低走低，午盤賣壓加重，道瓊工業指數一度大跌近1150點，終場重挫969.58點，跌幅3.58%，收在26121.28點。標準普爾500指數下挫106.18點，跌幅3.39%，收在3023.94點。以科技股為主的那斯達克綜合指數下跌279.49點，跌幅3.1%，收在8738.59點。標普500指數11大類股全面收黑，近4個交易日漲跌幅都超過2%，創2011年8月歐債危機衝擊金融市場行情以來最長紀錄。航運與觀光相關類股在2019年冠狀病毒疾病（COVID-19，俗稱武漢肺炎）疫情蔓延後飽受打擊，今天再度淪為投資人「提款機」。全美3大航空股走勢淒慘，美國航空集團（American Airlines）與聯合航空控股（United Airlines Holdings）跌幅都超過13%，達美航空（Delta Air Lines）股價也重挫7.2%。隨著多艘郵輪淪為武漢肺炎疫情重災區，郵輪業者股價持續下探，挪威郵輪控股（Norwegian Cruise Line Holdings）與皇家加勒比遊輪（Royal Caribbean Cruises）分別大跌13.4%、16.3%。科技股同樣賣壓沉重，蘋果公司（Apple）股價下挫3.2%，臉書（Facebook）與Google母公司Alphabet跌幅分別達3.4%、4.8%。費城半導體指數下挫3.1%，昨天猛漲4.94%的氣勢盡失。台積電美國存託憑證（ADR）下跌2.4%。武漢肺炎疫情威脅全球經濟，投資人如坐針氈，導致美股2月中旬登上歷史高點後迅速拉回，3大指數上週跌幅都超過10%，創2008年全球金融海嘯爆發以來最糟表現。本週美股盤勢有如坐雲霄飛車。隨著聯邦準備理事會（Fed）降息預期升溫，道瓊指數2日飆漲1293點，創史上最大單日漲點。聯準會為支撐經濟，3日宣布調降基準利率2碼（0.5個百分點），近12年來首度緊急降息，反而放大投資人憂慮，道瓊指數當天重挫785點。前美國副總統拜登（Joe Biden）成為民主黨總統初選「超級星期二」大贏家，氣勢壓過左派色彩濃厚的聯邦參議員桑德斯（Bernie Sanders），華爾街投資人歡騰，刺激道瓊指數4日飆漲1173點。但美股今天再度掉頭拉回，凸顯武漢肺炎陰影徘徊不去。武漢肺炎自中國向外蔓延，全球確診病例突破9萬例，逾3000人喪命，義大利、韓國等重要經濟體疫情不斷惡化，美國也拉起警報。加州昨天出現首例武漢肺炎死亡案例，官方宣布進入緊急狀態；紐約州加快病毒篩檢，確診病例一夜之間倍增至22例。股市賣壓沉重，投資人為求避險紛紛湧向相對穩當的政府債券。具指標意義的美國10年期公債價格上漲、殖利率從昨天收盤的0.99%降至0.9%，再創歷史新低，反映投資人持續看壞經濟前景。美債殖利率下滑恐壓縮銀行業獲利空間，拖累銀行股表現。受美債殖利率牽動的房貸利率也跟著滑落，根據美國聯邦住宅貸款抵押公司（Freddie Mac，簡稱房地美），30年期平均房貸利率今天降至3.29%，創歷史新低。最新出爐的經濟數據好壞不一。美國勞工部今天公布，截至2月29日當週，初次申請失業救濟金人數減少3000人至21.6萬人；美國商務部公布，美國1月工廠訂單減少0.5%，減幅大於市場預期。明天出爐的2月官方就業報告預料將牽動美股盤勢。市場預期，美國2月非農業就業人口增加17.5萬人，顯示就業市場尚未受武漢肺炎疫情嚴重衝擊。（編輯：徐崇哲）1090306
道瓊指數重挫969點 台股短線看美股臉色,證券,2020/03/06 08:28,https://www.cna.com.tw/news/afe/202003060028.aspx,（中央社記者潘智義台北6日電）美股本週震盪加劇，道瓊指數收盤重挫969點，一反昨天飆漲逾千點的走勢。法人表示，台股短線還是看美股臉色，至於個股則是看基本面，包含公布去年獲利數字及2月業績。武漢肺炎疫情蔓延，擔憂經濟的投資人搶進美債避險，促使美債殖利率再創新低。美股開低走低，道瓊工業指數一度大跌近1150點，終場重挫969.58點，跌幅3.58%，收在26121.28點。標準普爾500指數下挫106.18點，跌幅3.39%，收在3023.94點。以科技股為主的那斯達克綜合指數下跌279.49點，跌幅3.1%，收在8738.59點。台股昨天上漲122.47點，收在11514.82點，成交值新台幣1438.67億元。三大法人同步買超，合計買超31.98億元，其中自營商買超7.72億元、投信買超14.61億元、外資及陸資買超9.65億元。股王大立光2月受到部分客戶延後復工影響，合併營收下滑至36.73億元，較1月衰退11%，相對去年同期則成長45%，優於預期。大立光預估，3月拉貨動能可望優於2月。金管會主委顧立雄昨天表示，開年第一天台股跌了快700點後，從投資人的狀況來看，沒有像美股大起大落的狀況，雖然700點沒回補，但每一次都隨著疫情變動，產生理性震盪整理格局。宏遠投顧副總經理陳冠升表示，台股短線還是看美股臉色，至於個股則是看基本面，包含公布去年獲利數字及2月業績。業績好，股價剛漲起來且技術面的KD值才見黃金交叉，比較會漲；業績好，但股價已經大漲且KD值較高，可能漲不動。業績不好，股價已大漲，可能回跌。（編輯：黃國倫）1090306
台股開盤跌43.46點,證券,2020/03/06 09:03,https://www.cna.com.tw/news/afe/202003060036.aspx,（中央社台北6日電）台北股市今天開盤跌43.46點，加權股價指數為11471.36點，成交金額新台幣19.92億元。1090306
新台幣開盤貶9分 為30.05元,產經,2020/03/06 09:03,https://www.cna.com.tw/news/afe/202003060037.aspx,（中央社台北6日電）台北外匯市場新台幣兌美元匯率今天以30.05元開盤，貶9分。新台幣兌美元開盤交易區間為29.95元至30.05元。1090306
疫情影響復工2月營收月減4成 鴻海股價跌逾1%,證券,2020/03/06 09:20,https://www.cna.com.tw/news/afe/202003060041.aspx,（中央社記者鍾榮峰台北6日電）中國廠區受武漢肺炎疫情影響復工進度，鴻海自結2月營收創合併報表以來單月低點。鴻海今天早盤股價走弱，最低來到81.3元，下跌1.7%，市值來到新台幣1.12兆元。鴻海自結2月合併營收2174.6億元，較1月3645.66億元減少40.35%，比去年同期2656.33億元下滑18.13%。法人指出鴻海2月營收是合併報表以來單月低點。累計今年前2月鴻海自結合併營收5820.26億元，較去年同期6797.28億元下滑14.37%。觀察中國大陸廠區復工進展，鴻海日前表示中國大陸廠區人力復工比例目前已超過季節性需求50%，依目前進度，3月底前應可恢復季節性正常產能。展望今年第1季四大產品線表現，消費暨智能產品、企業產品和運算產品，業績表現可能較去年第4季下滑15%以上，較去年同期減少15%以上，元件和其他產品可能季減15%以上，較去年同期減少10%以上。展望上半年，鴻海預期今年上半年業績有機會較往年同期持平。武漢肺炎疫情對首季獲利或有部分影響，但影響在可控範圍，不過今年第1季營業利益率可能受到疫情影響。在毛利率改善部分，鴻海重申，集團規劃到2025年毛利率到10%的長期方向目標不變。法人預估，鴻海今年第1季業績可能跌破新台幣兆元大關，較去年第4季下滑約42%左右，今年全年業績可能微幅成長1%到3%區間。（編輯：黃國倫）1090306
台股盤中跌勢擴大 失守11400點關卡,證券,2020/03/06 11:27,https://www.cna.com.tw/news/firstnews/202003060047.aspx,（中央社記者潘智義台北6日電）武漢肺炎疫情歐美國家快速擴散，美股道瓊工業指數收盤重挫969.58點，台股今天走跌，盤中大跌近180點，跌破11400點整數關卡。截至10時32分止，加權指數來到11334.92點，大跌179.9點，成交金額新台幣747.16億元，8大類股全面下跌。晶圓代工龍頭台積電盤中來到315.5元，下跌2.32%。2月營收下滑的股王大立光來到4575元，下跌0.54%。鴻海自結2月營收創公布合併報表以來單月低點，盤中股價來到 80.7元，下跌2.41%。盤中漲停個股主要還是防疫概念股，包括生技股中化生來到44.35元、雃博來到29.8元、億麗來到3.71元、機器設備股氣立來到57.5元。新光投信董事長劉坤錫表示，疫情較慢擴散到歐美國家，所以當地股市的反映也較亞股慢，歐美股市近期相對不穩，投資人仍須關注疫情發展，除此之外，中國大陸產業復工情形也是重要指標。劉坤錫認為，只要中國大陸產業恢復秩序，正常運作，股市表現就可望轉佳，近期上市櫃公司將密集舉行法人說明會，就是歸納產業復工進度的重要參考，只要復工7成，疫情對全球經濟的影響即可縮減，股市也可回穩。他指出，台股長線依然可留意5G概念股，但短線投機須量力而為，畢竟防疫概念股不會天天漲，股價跳動很大，不是一般人可以掌握。至於油價受疫情影響，近來波動加大，對塑化相關股票也有負面影響。美股道瓊指數重挫近千點 台股早盤跌逾百點（中央社記者潘智義台北6日電）武漢肺炎疫情蔓延，不確定因素仍多，美股道瓊指數收盤重挫969點，一反昨天飆漲逾千點的走勢，台股加權指數今天開盤走低，早盤下跌逾百點，一度失守11400點關卡。9時30分左右，加權指數來到11397.01點，下跌117.81點，成交值新台幣359.39億元，8大類股全面下跌，食品類股相對抗跌。大型權值股晶圓代工龍頭台積電早盤來到318元，下跌1.54%。剛公布2月營收下滑的股王大立光在平盤4600元附近游走。鴻海最低來到81元，下跌2%。宏遠投顧副總經理陳冠升表示，雖然台股短線與美股連動，但選股仍應掌握產業長期發展趨勢，電子股仍為首選，人工智慧（AI）、電動車、眼球概念股都可以考慮。陳冠升指出，挑選個股看基本面，股價剛起漲且技術面KD值才見黃金交叉，比較會漲；若股價已經大漲，且KD值較高，可能就漲不動。（編輯：黃國倫）1090306
儒鴻股價早盤跌近3%  市值失守千億,證券,2020/03/06 09:52,https://www.cna.com.tw/news/afe/202003060049.aspx,（中央社記者潘羿菁台北6日電）紡織股王儒鴻昨天公布2019年財報，儘管繳出獲利歷年次高水準，不過今天股價開盤即下挫，早盤跌幅一度接近3%，一口氣跌破360元，公司總市值失守新台幣1000億元大關。儒鴻昨天股價收在367.5元，公司總市值約為1008億元，今天以360元開出，一路下跌至357至358元附近震盪，失守10日均線，也讓公司市值來到982億元，一天內蒸發26億元。儒鴻昨天公布去年度稅後淨利為新台幣42.99億元，儘管無法超越2018年獲利新高水準，也只微幅衰退1.8%，去年獲利動能與前年接近齊平。不過法人認為，原先市場預期去年第4季獲利數字有望成長，不過蒙受匯兌損失，讓第4季呈現營收上升、獲利卻沒跟上的情況，單季毛利率跌破29%，整體獲利表現不如預期。此外，儒鴻將於下週一舉行線上法說會，預料董事長洪鎮海將親自說明展望，市場略帶觀望氣氛，也讓股價呈現震盪。（編輯：黃國倫）1090306
法人：被動元件價格有利供應商 可望延續到第3季,產經,2020/03/06 10:06,https://www.cna.com.tw/news/afe/202003060052.aspx,（中央社記者鍾榮峰台北6日電）被動元件市況備受關注。法人指出，上半年MLCC和晶片電阻價格對供應商有利，可望延續到第3季。中國產線第2季產能利用率將逐步回升至50%到60%。觀察被動元件上半年價格走勢，本土法人報告預期上半年積層陶瓷電容（MLCC）與晶片電阻價格仍對供應商有利，可延續到第3季傳統旺季。報告指出，雖然市場擔憂需求受到疫情影響，不過價格上漲可望抵消出貨減少的效應，供應商仍可提高上半年獲利。觀察產業產能與稼動率，本土法人報告指出，全球多達40%到50%的MLCC產能以及60%到70%的晶片電阻產能位於中國。通路調查顯示，目前武漢肺炎疫情仍造成缺工，中國廠房產能利用率仍多在50%以下。工研院產科國際所指出，被動元件產業在中國大陸生產據點，主要集中在華東（蘇州、南通、滁州）、華南（深圳、肇慶、廈門、東莞）沿海一帶。法人預估，全球前五大MLCC業者產能利用率介於30%到60%之間，2月全球約25%到30%的MLCC產能處於停擺狀態。報告指出，被動元件產能集中在中國，疫情讓去年第4季以來被動元件供給不足的情況更嚴重。預估今年第2季中國產線產能利用率將逐步回升至50%到60%。觀察應用趨勢，報告指出，受惠5G趨勢，單機智慧型手機MLCC採用量將成長26%，目前整體智慧型手機MLCC需求占全球MLCC需求比重約30%，預估到2022年間年複合成長率可到15%。在車用MLCC部分，法人指出MLCC在傳動系統電氣化、先進駕駛輔助系統（ADAS）與LED等汽車應用的單位內容價值，將顯著成長，挹注未來3年被動元件需求。法人指出，目前車用MLCC占全球MLCC需求比重約8%，預估到2022年年複合成長率可到18% 。在晶片電阻與電感元件部分，法人指出，5G智慧型手機的單機搭載量將成長23%，其中高階機種因需要高效能，內容價值成長顯著。外資法人分析，日本廠商占全球MLCC市占率超過一半，達到53%，韓國廠商占比約19%，台灣廠商占比約20%，中國廠商占比僅7%。全球MLCC廠商包括日本村田製作所、韓國SEMCO、台灣國巨、日本太陽誘電、以及TDK、AVX等。另外全球晶片電阻大廠包括國巨、Rohm、KOA、Panasonic、Vishay等，其中國巨市占率達到34%，是全球第一大晶片電阻供應商。（編輯：趙蔚蘭）1090306
美股道瓊指數重挫 台股ETF領先反映,證券,2020/03/06 10:15,https://www.cna.com.tw/news/afe/202003060054.aspx,（中央社記者潘智義台北6日電）美股道瓊工業指數及標普500指數昨天大漲，一度造成連漲多日的標普500指數的反指標富邦VIX盤中下跌，不過收盤仍收紅，已預先反映今天美股重挫。武漢肺炎疫情全球蔓延，美股近日就像洗三溫暖，大跌之後大漲，之後又再大跌，道瓊工業指數一度大跌近1150點，終場重挫969.58點，跌幅3.58%，收在26121.28點。標準普爾500指數下挫106.18點，跌幅3.39%，收在3023.94點。標準普爾500指數的反指標，由美國芝加哥選擇權交易所發行的恐慌指數（VIX），原則上當標準普爾500指數大跌時，投資人心生恐慌，帶動恐慌指數大漲，若標準普爾500指數大漲，則恐慌指數大跌。台股掛牌的指數股票型基金（ETF）富邦VIX以恐慌指數為標的，看空標準普爾500指數，昨天早盤一度下跌，主因反映標準普爾500指數大漲，但隨後富邦VIX翻紅，且收盤上漲1.62%，凸顯法人對今天美股大跌早已有所警覺。富邦VIX在2月19日的收盤價為新台幣2.51元，自2月20日起漲，3月5日收在4.39元，上漲74.9%，若以今天盤中高點4.9元計算，漲幅更達82.13%。今天盤中高點和昨天收盤價相較，大漲11.61%。（編輯：黃國倫）1090306
伺服器市場需求旺 新唐股價一度強漲逾3%,證券,2020/03/06 10:16,https://www.cna.com.tw/news/afe/202003060055.aspx,（中央社記者張建中新竹6日電）伺服器市場需求強勁，伺服器管理晶片廠信驊早盤股價攀高至新台幣1110元，再創歷史新高價，並帶動伺服器遠端管理晶片廠新唐股價同步走高，一度漲逾3%。武漢肺炎疫情延燒，不僅口罩、耳溫槍及額溫槍等相關防疫物資供不應求，同時帶動宅經濟發展，遊戲機需求增加，資料中心伺服器需求也相當強勁。受惠伺服器需求暢旺，除記憶體下半年報價可望走揚，伺服器管理晶片需求也不斷升溫，信驊即因客戶追加訂單，看好今年營收可望成長15%，表現將優於年初預期的10%水準。信驊在市場買盤積極湧入下，5日股價強攻漲停，達1095元，今年早盤延續強勁走勢，達1110元，漲15元，再創歷史新高價。新唐近年在伺服器遠端管理晶片市場也有不錯斬獲，成功打進戴爾等大廠供應鏈，市場看好新唐營運可望同步受惠伺服器市場需求成長。此外，新唐預計今年6月完成收購Panasonic旗下半導體事業PSCS，屆時將可跨足影像感測器（CIS）領域，也將可受惠CIS市場供不應求熱況。新唐今天在市場買盤積極湧入下，股價表現強勁，盤中一度達43.35元，漲1.35元，漲幅約3.21%。（編輯：趙蔚蘭）1090306
騰輝-KY2月營收下滑 復工達9成,證券,2020/03/06 10:38,https://www.cna.com.tw/news/afe/202003060065.aspx,（中央社記者江明晏台北6日電）武漢肺炎疫情打亂景氣，銅箔基板（CCL）廠騰輝-KY 2月營收月減9.5%，騰輝指出復工情況已達90%以上，目前產線已全面正常生產，若疫情不再擴散，今年業績不看淡。騰輝-KY公布2月營收新台幣4.02億元，月減9.5%，也比去年同期減少1.41%， 截至2月總營收8.45億元，較去年同期增加2.4%。騰輝-KY指出，2月營收下滑主因是受到武漢肺炎疫情打亂景氣影響，進而影響全球需求，導致公司業績較1月下滑。展望未來，騰輝-KY強調，公司復工情況已達90%以上，目前產線已全面正常生產，客戶短線回補訂單情形開始出現，只要疫情不再擴散，今年業績不會看淡。騰輝-KY專注在軍工航太，國防醫療及工業與汽車散熱領域仍持續成長，近期研發出的高速高頻材料，目前已打入中興5G供應鏈，預計今年營收開始有貢獻。騰輝-KY表示，散熱材料近期取得全球最大的汽車頭燈製造商日本小系認可，是第一家被核可的非日系供應商，已經開始小批量供貨，未來有機會放量。同時，騰輝-KY現階段更積極發展半導體測試材料的認證，目前已經在做最後階段測試，預計今年營運有機會突破。（編輯：黃國倫）1090306
疫情不確定因素干擾 大立光平盤震盪,證券,2020/03/06 10:42,https://www.cna.com.tw/news/afe/202003060067.aspx,（中央社記者韓婷婷台北6日電）大立光2月營收新台幣36.73億元，月減11%，年增45%，表現相對具支撐，不過受武漢肺炎疫情變數大，市場持續受到不確定因素干擾，信心脆弱，大立光今天股價處於平盤上下掙扎。大立光在營收相對具支撐下，今天以小跌15元開出，開盤交易第1個小時，維持在平盤上下狹幅震盪，跌幅在1%以內；在台股三王台積電、大立光及鴻海中表現相對抗跌。大立光2月營收創下歷年同期新高，現階段3月客戶拉貨動能比2月好，但也給了但書，客戶會不會調整還要再觀察。由於疫情發展仍難以評估，不確定因素干擾揮之不去，繼蘋果公司對第1季財測示警後，市場也傳出華為啟動第2波智慧手機砍單，市場持續高度關注疫情對終端市場所造成的衝擊。武漢肺炎疫情衝擊供應鏈生產與終端買氣，根據美系外資出具報告指出，華為已展開第2波智慧型手機砍單，因疫情以及缺乏Google GMS服務，華為開始調整通路庫存，年初華為針對4G手機砍單，本週起華為已開始針對5G手機訂單做出下修。大立光為全球手機鏡頭龍頭廠，通吃蘋果及非蘋陣營訂單，業績表現視為手機市場重要風向球；展望3月，由於市場變化大，大立光表示，「目前3月拉貨動能看起來比2月好，但客戶會不會調整還要再觀察」。大立光2月受到部分客戶延後復工影響，合併營收下滑至36.73億元，月衰退11%，相對去年同期則成長45%，累計前2月合併營收77.78億元，較去年同期成長32%。（編輯：趙蔚蘭）1090306
國巨MLCC月產能穩增 第2季價格看漲3成,證券,2020/03/06 10:52,https://www.cna.com.tw/news/afe/202003060070.aspx,（中央社記者鍾榮峰台北6日電）被動元件大廠國巨在MLCC設備產能穩健擴產，市場人士預估到今年底MLCC月設備產能可到570億顆，第2季MLCC和晶片電阻價格漲幅約3成左右。觀察國巨主要產品設備產能，市場人士指出，國巨目前在積層陶瓷電容（MLCC）每月設備產能約500億顆到550億顆，預估今年年底月設備產能可穩健擴充到570億顆，另外晶片電阻產品月設備產能在1200億顆。從產品價格來看，本土法人報告指出，國巨對MLCC和晶片電阻新價格從3月初生效，小尺寸0402規格的MLCC和晶片電阻價格漲幅約3成。市場人士預估第2季MLCC和晶片電阻價格漲幅約3成左右。全球MLCC廠商包括日本村田製作所、韓國SEMCO、台灣國巨、日本太陽誘電、以及TDK、AVX等。國巨市占率約13%，是全球第三大MLCC供應商。另外全球晶片電阻大廠包括國巨、厚聲、華新科、大毅、風華高科、Rohm、KOA、Panasonic、Vishay等，其中國巨市占率達到34%，是全球第一大晶片電阻供應商。觀察國巨目前稼動率表現，市場人士指出到2月底整體稼動率約35%左右，其中占產能比重7成的中國大陸廠區，平均稼動率約35%，占產能3成的台灣廠區，稼動率約6成到7成。預期到3月整體稼動率可提升到5成。國巨日前指出，兩大產品庫存水位低於30天，供給持續吃緊，儘管需求下滑，但供給和需求之間的缺口擴大，訂單出貨比（BB ratio）超過2。（編輯：黃國倫）1090306
力旺打進三星供應鏈 法人：第1季營收有望創高,證券,2020/03/06 11:07,https://www.cna.com.tw/news/afe/202003060074.aspx,（中央社記者張建中新竹6日電）力旺受惠韓國客戶的28奈米OLED驅動IC量產出貨給三星，2月營收新台幣8390萬元，年增42.44%，為歷年同期新高，法人預期，力旺第1季營收可望創歷史新高。力旺前2月營收3.74億元，年增8.36%，法人指出，韓系客戶的28奈米有機發光二極體（OLED）驅動IC開始量產出貨給三星（Samsung）是主要動能，預期第1季營收有機會達4.1億元，將刷新歷史新高紀錄。除OLED驅動IC效益外，法人看好，力旺美系客戶電源管理晶片需求持續增長，將帶動8吋晶圓出貨成長，力旺今年營運應可恢復成長動能，全年營收可望達17.5億元，將成長超過2成，並改寫歷史新高紀錄。力旺資安相關的PUF已被安謀（ARM）的物聯網平台採用，法人認為，隨著資安議題日趨重要，力旺營運應可水漲船高。（編輯：趙蔚蘭）1090306
