標題,分類,時間,網址,內文
台灣獲豁免得向伊朗購油 經濟部：反映努力成果,產經,2018/11/06 00:00,https://www.cna.com.tw/news/afe/201811060002.aspx,（中央社記者廖禹揚、韋樞台北5日電）美國對伊朗祭出全面性的經濟制裁，但有台灣等8國獲得豁免，可繼續向伊朗購油，經濟部官員表示，台灣列入豁免名單反映了我們（台灣）努力的成果。官員透露，台灣自伊進口油已逐漸減少，但我方仍持續與美方溝通，主要希望美方能了解，台灣幾乎所有能源均依賴進口，尋找替代油源需要更多時間，這次美國終將台灣列入豁免名單，可以說反映了努力說明的成果。官員也說，這次豁免期間只有6個月，為避免在金融、經貿方面被美方認為不符合規範，導致列入黑名單或遭到制裁，未來仍會配合美方措施。針對台灣獲得豁免繼續對伊朗購油，台塑化主管表示，台塑化購買最多的原油來源是沙烏地阿拉伯，由於中東國家買原油必須要訂長期合約，無法在現貨市場購買，因此對台塑化來說，伊朗原油不僅是另一個油源，也可以分散風險，不過，台塑化目前購買伊朗原油比例甚低，只有不到全年購油量的5%。（編輯：陸倩瑤）1071105
川普稱中國願與美達成貿易協議 但須公平,產經,2018/11/06 07:20,https://www.cna.com.tw/news/afe/201811060008.aspx,（中央社華盛頓5日綜合外電報導）美國總統川普今天說，中國對美國造成了經濟損害，但願意在貿易上達成協議，而他也樂於接受公平協議。川普在與支持者進行競選電話會議時說：「我們對他們的2500億美元輸美產品加徵關稅，他們還有很多產品可以讓我們課稅，但他們已經想要達成協議了，因此如果能達成正確的協議，也就是公平的協議，我們會去做，否則我們就不做。」（譯者：張佑之）1071106
投資人觀望美大選 歐股盤勢持穩,證券,2018/11/06 02:42,https://www.cna.com.tw/news/afe/201811060009.aspx,（中央社倫敦5日綜合外電報導）投資人保持謹慎，留意美國即將舉行的期中選舉、美國恢復對伊朗制裁以及義大利的財政隱憂，使得歐美股市今天盤勢持穩。倫敦FTSE 100指數小漲9.72點或0.14%，以7103.84點作收。法蘭克福DAX 30指數溫和下挫24.03點或0.21%，收在11494.96點。巴黎CAC 40指數微跌0.74點或0.01%，收5101.39點。（譯者：張佑之）1071106
金融與能源股領漲 華爾街3大指數多半走高,證券,2018/11/06 05:35,https://www.cna.com.tw/news/afe/201811060013.aspx,（中央社紐約5日綜合外電報導）華爾街金融股和能源股上揚力道蓋過科技股疲軟，美股3大指數今天多半走揚。道瓊工業指數漲升190.87點或0.76%，以25461.70點作收。標準普爾指數攀高15.26點或0.56%，收在2738.32點。科技股那斯達克指數跌28.14點或0.38%，收7328.85點。（譯者：張佑之）1071106
國際油價走跌,產經,2018/11/06 06:09,https://www.cna.com.tw/news/afe/201811060014.aspx,（中央社紐約5日綜合外電報導）美國今天對伊朗石油出口展開制裁，使國際油價走穩，但隨著美國對8國提供暫時豁免，同時伊朗宣稱將突破制裁以繼續售油，油價走軟。紐約商品交易所西德州中級原油12月交割價下挫48美分或0.76%，以每桶62.66美元作收。倫敦北海布倫特原油明年元月交割價下跌17美分或0.23%，收在每桶72.66美元。1071106
貿易戰拖累 歐元區經濟陰霾籠罩,產經,2018/11/06 08:40,https://www.cna.com.tw/news/afe/201811060015.aspx,（中央社記者林育立柏林5日專電）義大利的龐大債務及美國發動貿易戰，為歐元區經濟蒙上陰影，德國公布歐元區第4季景氣指數為6.6，創下2016年以來最低的水準。慕尼黑衣佛研究所（Ifo Institute）訪問各國企業與組織的370名專家後，今天公布歐元區第4季景氣指數為6.6，遠比上一季的19.6還低。這是2016年以來最低的水準。衣佛研究所所長菲斯特（Clemens Fuest）表示，尤其在義大利與西班牙，專家不論對現況還是未來都感到悲觀，法國與德國的景氣展望則相對持平。他還說，各國專家預期，歐元區的出口將受關稅壁壘的衝擊，「歐元區的經濟正走進不安的航道」。德國工商總會（DIHK）訪問全國27000家企業後，今年5月預測年度成長率可達2.2%，上個月也下調到1.8%。德國工商總會執行長萬斯雷本（Martin Wansleben）表示，企業對未來漸趨保守，投資和出口雙雙缺乏動能，「空氣愈來愈稀薄」。他認為，除非貿易戰早點解決，而且英國脫歐後，繼續與歐洲保持原來的緊密關係，景氣才有好轉的可能。（編輯：施燕飛）1071106
美股道指上漲 台股短多有機會延續,證券,2018/11/06 08:19,https://www.cna.com.tw/news/afe/201811060018.aspx,（中央社記者吳家豪台北6日電）美股3大指數今天多半走揚，科技股小跌；法人表示，受到美中貿易戰可望紓解、美股反彈帶動下，台股多頭積極進場搶短，加上成交量逐步放大，台股短多還有機會延續。美國金融股和能源股上揚力道蓋過科技股疲軟，道瓊工業指數上漲190.87點或0.76%，以25461.70點作收；標準普爾指數攀高15.26點或0.56%，收在2738.32點；科技股那斯達克指數跌28.14點或0.38%，收7328.85點。蘋果公司（Apple）年底旺季銷售展望保守，5日蘋概股拖累台股盤中下跌逾百點，傳產股零星表態有撐下，加權指數終場小跌16.78點，收在9889.81點，成交值新台幣1028.80億元。自營商賣超16.73億元，投信賣超4.33億元，外資及陸資買超3.75億元；三大法人合計賣超17.31億元。產業訊息方面，陸媒報導，新款iPhone手機在中國大陸銷售數字遠低於預期，蘋果公司已對製造商富士康、和碩公司砍單10%。光學鏡頭廠大立光公布10月營收新台幣52.10億元，月減6%，年減7%。大立光表示，11月多數客戶都有下修現象，預估營收下滑會較明顯。金屬機殼廠可成公布10月集團合併營收新台幣128.44億元，月增39%，年增3.6%，創下歷年單月新高；今年第3季稅後淨利65.63億元，年減11.2%，每股盈餘8.52元。被動元件廠國巨步入傳統淡季，加上中國十一長假影響工作天數、美中貿易爭端造成大中華區終端客戶需求下降，自結10月合併營收新台幣63.15億元，月減38.4%，創6個月來新低。法人表示，台股短線日K連紅後，市場信心逐漸恢復，加上市場關注的美中貿易戰陸續傳出可望有好結果的訊息，先前短期偏弱氛圍已被扭轉，大盤短多氛圍仍在，可利用震盪時逢低承接，短打第3季財報佳且第4季展望好、具備籌碼面優勢個股。（編輯：楊玫寧）1071106
凱羿-KY布局中國 看旺成長引擎,證券,2018/11/06 08:56,https://www.cna.com.tw/news/afe/201811060021.aspx,（中央社記者江明晏台北6日電）凱羿-KY第3季本業營運回溫，前3季每股盈餘(EPS)達8.63元，看好在中國市場布局逐漸發酵，預計年底前完成3家電視購物通路合作，可望帶動未來新的營運成長動能。凱羿指出，今年下半年起，旗下自有品牌Copper Chef全系列鍋具進軍中國台灣兩岸市場，9月下旬與北京環球、環球巨鯊兩大中國電視購物業者合作推廣銷售，已創下銷售約2萬組的成績，顯示品牌核心價值逐步打入兩岸市場。此外，凱羿透過Copper Chef品牌代言人「吳宗憲」，數次與北京環球、環球巨鯊舉辦銷售直播活動，除了帶動買氣提升，也持續擴大Copper Chef的品牌知名度。未來除了上述二大電視購物業者外，也與中國安徽衛視電視台旗下電視購物平台「安徽佳佳購物」進行合作接洽，預計今年底前再傳佳音。凱羿看好Copper Chef的知名度在中國持續升溫，預期將有新的電視購物平台加入品牌共同銷售行列，過去Copper Chef鍋具組在美國QVC創下單日熱銷逾24.1萬組的佳績，未來將複製成功模式，藉行銷的外溢效應，擴大在中國市場的市占率。凱羿-KY第3季合併營收達新台幣9.41億元，營業淨利1.65億元，淨利歸屬本公司業主1.45億元，每股稅後盈餘（EPS）為2.97元，本業表現較第2季回溫，主要來自於多項新產品出貨暢旺，前3季EPS達8.63元。（編輯：郭萍英）1071106
歐盟日本貿易協議 獲歐洲議會國際貿委會批准,產經,2018/11/06 08:57,https://www.cna.com.tw/news/afe/201811060022.aspx,（中央社布魯塞爾5日綜合外電報導）歐洲聯盟和日本計劃打造全球最大自由貿易區，今天清除一道巨大的障礙，在此同時專門處理貿易的歐洲議會議員支持的經濟夥伴協定（EPA）有望於明年生效。路透社報導，歐洲議會（European Parliament）國際貿易委員會以25票贊成和10票反對，通過經濟夥伴協定。歐洲議會全員將在12月13日進行最後投票。這項協議把占全球國內生產毛額（GDP）約1/3的兩大經濟體歐盟和日本綁在一起，也代表他們反對貿易保護主義。歐盟和日本都與美國貿易關係緊張，也受到美國總統川普對進口鋼鋁製品加徵關稅的影響。日本是12國「跨太平洋夥伴協定」（Trans-Pacific Partnership，TPP）的一員，川普上任第一天就退出TPP，日本因此開始把焦點放在像是歐盟等其他潛在夥伴上。歐盟2016年與美國就跨大西洋貿易及投資夥伴協定（Transatlantic Trade and Investment Partnership，TTIP）的協商凍結後，也開始尋找其他夥伴。今年初與墨西哥重新簽署雙邊自由貿易協定。歐盟和日本簽署的協議將取消針對日產車的10%關稅，以及大部分汽車零件的3%關稅，日本也將取消對歐盟乳酪和葡萄酒分別徵收的30%和15%關稅，並允許歐盟在日本進行公開招標。此外，雙方還承諾開放服務市場，尤其是金融服務、電信、電子商務和交通等領域。（譯者：陳昱婷/核稿：鄭詩韻）1071106
新台幣開盤升1.1分 為30.760元,產經,2018/11/06 09:04,https://www.cna.com.tw/news/afe/201811060023.aspx,（中央社台北6日電）台北外匯市場新台幣兌美元匯率今天以30.760元開盤，升1.1分。1071106
台股開盤跌1.40點,證券,2018/11/06 09:04,https://www.cna.com.tw/news/afe/201811060024.aspx,（中央社台北6日電）台北股市今天開盤跌1.40點，加權股價指數為9888.41點，成交金額新台幣19.03億元。1071106
美暫允續購伊朗原油 台塑化：未來恐重新評估,產經,2018/11/06 09:11,https://www.cna.com.tw/news/afe/201811060025.aspx,（中央社記者韋樞台北6日電）美國對伊朗展開經濟制裁，但台灣等8國可豁免續購伊朗原油。長年向伊朗購油的台塑化推估，日後美國有可能重新評估續購政策並要求遞減。伊朗原油約占台塑化全年購買量少於5%。美國重啟對伊朗制裁，美國國務卿蓬佩奧（Mike Pompeo）、財政部長梅努欽（Steven Mnuchin）宣布豁免名單，包括台灣、中國、印度、南韓、土耳其、義大利、希臘與日本共8國獲准繼續向伊朗購買石油。美國對伊朗制裁，可能導致石油價格進一步上升，進而影響全球經濟。台塑化表示，雖然美國對台灣在內的8國豁免可續購伊朗原油，但世事難料，以前也曾發生過阿拉伯國家禁運石油，所以有可能過一段時間，美國會重新評估續購伊朗原油一事，並要求採購量逐年遞減。另外，台塑化也擔憂，即使美國未限制續購伊朗原油，卻進一步經濟制裁金融系統，購買原油要支付的美元帳款無法匯兌進入伊朗，伊朗原油變成看得到但買不到。台塑化指出，台塑化長年購買伊朗的合約油，對台塑化來說，除了最大油源沙烏地阿拉伯之外，台塑化購買伊朗原油的量不到台塑化全年購買量的5%，比例並不高，但多一個油源國可以分散風險，並非壞事。台塑化說，伊朗原油的油質尚可，但礙於油質和煉油設備間的關係，在煉製過程中無法純粹單一提煉伊朗原油，多少還是要與他國購買的原油摻配混合才能提煉，單靠伊朗原油無法創造出最大的成品油與原油間的利差。但台塑化認為，伊朗原油並非品質不佳，而是最適合台塑化煉油設備，並能創造出最大利差的原油不見得都能買得到，可能也買不到夠多的量，所以還是要分散油源取得足夠的量，對台塑化來說最為安全。（編輯：黃國倫）1071106
聯電護盤擬買30萬張庫藏股 股價開盤漲2.79%,證券,2018/11/06 09:19,https://www.cna.com.tw/news/afe/201811060028.aspx,（中央社記者張建中新竹6日電）晶圓代工廠聯電今天起將買回30萬張庫藏股，股價順利止跌回升，開盤跳空達新台幣11.05元，漲幅約2.79%。為維護公司信用及股東權益，聯電今天起至明年1月5日將買回30萬張庫藏股，買回區間價格每股7.55元至20.8元，這是聯電近3年來第3度實施庫藏股，聯電前2次都買回20萬張庫藏股，執行率100%。聯電實施庫藏股策略奏效，股價順利止跌回升，今天開盤跳空達11.05元，漲0.3元，漲幅約2.79%。聯電因遭美國司法部起訴指控竊取美光商業機密，最高可能面臨200億美元罰金，並有歐系外資調降投資評等至劣於大盤，目標價降至10.8元，5日股價重挫跌停，達10.75元，跌幅達9.66%。（編輯：楊玫寧）1071106
羅麗芬-KY競拍未順利完成 改辦詢價圈購,證券,2018/11/06 09:22,https://www.cna.com.tw/news/afe/201811060029.aspx,（中央社記者韓婷婷台北6日電）羅麗芬-KY初次上市普通股股票承銷案，競價拍賣作業因近日資本市場氣氛不佳，投資人參與率較低，以致未順利完成競拍，今起改辦詢價圈購，每股100至110元。羅麗芬表示，在不影響既定時程情況下， 將以詢價圈購方式進行承銷，詢價圈購期間自11月6日至11月9日，以每股100元至110元間暫定詢價圈購3987張，並於11月7日至11月9日下午3時30分止辦理公開申購，公開申購張數暫定為432張，承銷價於11月12日訂價，11月13日進行公開抽籤，並預計於2018年11月19日正式掛牌上市。羅麗芬為美容護膚品牌，產品全部自行研發、製造，並取得ISO 22716、ISO 14001以及GMPC認證。旗下擁有「葛林若」、「聖迪妮爾」、「黛昂絲」三個臉部保養品品牌，產品透過中國超過50個經銷商、3200家以上終端美容院銷售，滲透率近20%。近年來羅麗芬的業績表現快速成長，2015至2017連續3年營收及獲利皆翻倍，營收分別為新台幣2.1、4.35、8.69億元； EPS分別為0.35、2.38、7.27元。 今年前3季營收9.08億元，超越去年全年，並較去年同期成長77.5%；2018上半年EPS為5.33元。（編輯：黃國倫）1071106
和勤第4季攻中國汽車AM市場 前進東南亞,證券,2018/11/06 09:53,https://www.cna.com.tw/news/afe/201811060033.aspx,（中央社記者鍾榮峰台北6日電）精密沖壓大廠和勤精機第4季跨入中國大陸汽車AM市場，未來台灣中科廠將拓展高階自行車市場業務，並發展東南亞汽車市場。展望第4季，和勤中國大陸江蘇淮安和新廠第4季投入汽車補修市場配零件生產，目前與煞車大廠輝盟啟動多項新產品，預計作為自動化生產示範廠，發展汽車補修市場商機。不過，中國大陸車市整體銷售成長減緩，汽車零件訂單遞延；加上硬碟客戶因產線調整及調節庫存，VCM Plate訂單減量，預計在中國大陸車市與全球硬碟整體市場觀望氣氛影響，和勤第4季營收保守看待。展望未來布局，和勤台灣中科廠將拓展高階自行車市場業務，並發展東南亞汽車市場。和勤台灣中科二林園廠已於9月17日動土，將布建硬碟HDD產線、汽機車與高階自行車零組件產線，預計2020年建成投產。和勤集團在兩岸擴產計畫將按照進度，明年完成新廠房擴建後可望陸續投產，增添集團成長動能。和勤專攻精沖本業，朝向精密鑄造與精密機械加工發展，從精密電子領域庫跨入汽車零件，汽車零件和硬碟機構件占比各約62%和36%，主要生產基地在台灣彰化和中國大陸嘉興。法人指出，和勤是德國VW集團第一階供應商，其他的中國大陸自主品牌車廠客戶，和勤以第二階廠商為主，終端客戶包括上汽、東風、吉利、長安、比亞迪等。和勤自結10月合併營收新台幣1.98億元，較去年同期持平，累計今年前10月自結合併營收21億元，較去年同期17.85億元成長17.69%。（編輯：郭萍英）1071106
統一實業前3季獲利優去年 股價持平,證券,2018/11/06 10:15,https://www.cna.com.tw/news/afe/201811060036.aspx,（中央社記者潘智義台北6日電）統一實業公布第1至第3季合併歸屬於母公司業主淨利新台幣12億5856.6萬元，較去年同期倍增，基本每股盈餘0.80元，但今天盤中股價在平盤價13.15元附近游走。統一實業主要生產鐵皮印花製罐，及其原料鍍製鋼片加工製造。統一實業統計，前3季合併營收268億3677.5萬元，較去年同期增加8.58%。（編輯：郭萍英）1071106
旺季不旺  萬潤第3季獲利腰斬每股0.86元,證券,2018/11/06 10:23,https://www.cna.com.tw/news/afe/201811060038.aspx,（中央社記者張建中新竹6日電）設備廠萬潤第3季營運表現旺季不旺，獲利較第2季腰斬，每股純益為新台幣0.86元。受設備出貨認列減少影響，萬潤第3季營收滑落至5.14億元，季減14.6%，毛利率37.05%，也較第2季下滑6.6個百分點，稅後淨利7207萬元，季減達51.4%，每股純益0.86元。萬潤前3季稅後淨利仍達2.85億元，較去年同期略增9.3%，每股純益3.38元。萬潤10月營收1.25億元，月減25.4%，並為今年單月營收次低水準，法人預期，萬潤整體第4季營收表現仍可望優於去年同期水準，今年總營收將可維持正成長。受下半年營運趨緩影響，萬潤今天股價多在44.15元平盤之下震盪，盤中一度達43.7元，跌0.45元，跌幅約1.02%。（編輯：郭萍英）1071106
蘋果年底財測不如預期 蘋概股持續弱勢打底,證券,2018/11/06 10:27,https://www.cna.com.tw/news/afe/201811060042.aspx,（中央社記者韓婷婷台北6日電）蘋概股近來利空不斷，蘋果公司年底財測不如預期，又傳出新手機銷售欠佳，已對供應鏈砍單10%，衝擊蘋概股持續弱勢打底，股王大立光早盤跌幅逾4%。蘋果公司（Apple）最新公布的季營收與獲利雖創新高，但年底旺季財測不如預期，讓原本市場期待的iPhone XR銷售都轉為保守。另外，蘋果不再公布產品銷量的決定引起市場質疑，2個交易日股價跌掉近10%。受到整體智慧型手機需求疲弱影響，不少客戶見到訂單下修，大立光10月營收新台幣52.1億元，較9月營收衰退6%，較去年同期衰退7%。前10個月累計合併營收427.18億元，較去年同期持平。大立光表示，目前看來11月看法仍與法說會時一樣，預期11月營收將持續下滑。大立光看淡第4季旺季表現，今年高峰已過，衝擊投資人信心，儘管10月及11月營收走下波已事先預告，今天大立光股價依舊弱勢拉回修正，早盤跌幅逾4%，失守3300元，拖累整體蘋概股走勢。遭傳出砍單的鴻海及和碩跌幅在1%至3%間。10月營收繳出歷史新高的可成股價難敵市場悲觀氣氛，開低走低，早盤一度來到271.5元，跌幅超過6%。穩懋昨天強勢攻抵漲停，今天早盤也出現下跌修正，康控-KY由紅翻黑。台積電則由黑翻紅。早盤盤面上蘋概族群有GIS-KY、欣興、臻鼎-KY零星個股力撐紅盤。（編輯：楊玫寧）1071106
預期可成明年展望樂觀 外資評等維持加碼,證券,2018/11/06 10:32,https://www.cna.com.tw/news/afe/201811060043.aspx,（中央社記者吳家豪台北6日電）美系外資表示，金屬機殼廠可成第3季財報亮麗且10月營收創單月新高，反映出堅強執行力，預期對第4季和明年的樂觀展望將帶動近期股價，維持加碼評等和目標價420元。不過，根據陸媒報導，新款iPhone手機在中國大陸銷售數字遠低於預期，蘋果公司（Apple）已對供應鏈砍單10%。今天蘋概股表現弱勢，可成股價下跌15元開出，盤中最低來到271.5元，跌幅超過6%。美系外資出具研究報告表示，可成今年第3季營業利益率33%符合預期，10月營收高達新台幣128億元則高出市場預期14%，主要受惠於9月發表的旗艦級智慧型手機機殼專案順利放量，看好11月營收將進一步提升，推估可成第4季營收將季增62%、年增24%至406億元。美系外資指出，可成預計7日舉行法人說明會，投資人將關注長期業務機會，包括可折疊式手機的金屬邊框設計及相關擴產計畫、未來是否考慮在中國以外地區建廠、看好哪些非消費性電子領域的成長機會。美系外資表示，10月以來可成股價已回檔15%，比大盤跌幅11%更多，主要因為市場擔心iPhone XR等智慧型手機需求不振恐影響可成的成長潛力；但考量可成經營團隊對第4季和2019年的樂觀展望有望帶動近期股價，美系外資維持「加碼」投資評等和目標價420元。國內投顧則保守看待可成，認為未來在蘋果公司對於硬體的重視程度逐漸降低後，可成的iPhone出貨占比增加題材對評價提升將有限，未來觀察重點包括非蘋及非消費性電子客戶發展狀況、手機機殼是否更改設計、如何切入新產品如擴增實境（AR）眼鏡的應用。（編輯：張良知）1071106
台塑四寶下修展望股價走跌 台塑力守100元,證券,2018/11/06 10:34,https://www.cna.com.tw/news/afe/201811060044.aspx,（中央社記者韋樞台北6日電）台塑四寶5日業績說明會釋出訊息，大陸市場需求減緩及美中貿易戰影響下，甚至影響到消費端，第4季營運不妙，辛苦拚成長。今天四寶股價走低。台塑四寶大喊營運不妙，下修第4季營運，今年全年營收和獲利能否再創新高有疑慮。台股開高後翻黑，塑化類股開低走低，盤中下跌1.24%，個股方面台塑四寶下跌，其餘二線塑化廠仍上漲。台塑今天開盤走低，盤中最多下跌2.9%，但仍力守100元大關；南亞走低，盤中最低77.3元，下跌0.9%；台化走勢亦同，盤中最低109.5元，跌幅1.79%；台塑化開高後翻黑，最低來到119元，跌幅2.06%。台塑四寶10月合併營收除台塑月增外，都比9月下滑，合計10月合併營收新台幣1515.29億元，月減0.4%，年增19.6%。四寶前10月合併營收仍有1.46兆元，年增19.7%。美中貿易戰結果未明，明年元旦起有可能課徵範圍擴大、稅率全面提高到25%，進而影響到消費面。南亞董事長吳嘉昭分析，各大經濟組織預測第4季展望保守，市場觀望，且美中貿易戰時間拉長後，課稅範圍擴大，物價變貴，消費者縮手，南亞在大陸生產的產品會轉向歐亞非三洲，南亞會努力將第4季的營運維持和第3季相同，但情況會相當辛苦，估計第4季營收可能會少一點。吳嘉昭舉例，關稅成本墊高，間接削弱消費意願，乙二醇(EG)價格從9月每公噸900美元，10月底跌到800美元，EG價格偏弱。台化副董事長洪福源說，整體大陸的需求不太理想，美中貿易戰結果未明，歐洲的狀況也不好，石化業對市場展望由樂觀轉向保守，目前來看，11月的營運會很辛苦。（編輯：黃國倫）1071106
德微投資亞昕效應發威 股價抬頭,證券,2018/11/06 10:35,https://www.cna.com.tw/news/afe/201811060046.aspx,（中央社記者江明晏台北6日電）德微科技入主亞昕後，透過管理優化與產能整合，推升亞昕營收倍增，同時提前產生獲利，在車用二極體布局帶動下，德微看好明年業績優於今年。德微10月合併營收新台幣1.39億元，受惠入主亞昕合併認列營收，年增率6.85%。累計今年1至10月合併營收為12.5億元，較去年同期成長8.37%。德微今天股價早盤勁揚逾3%，高至36.75元。德微表示，入主亞昕後，透過管理優化與產能整合，推升亞昕營收倍增，同時提前產生獲利，讓德微營收持續維持高成長動能。為進一步提升廠房使用率，德微10月起陸續進行產線調整，規劃將部分製程遷移至桃園廠，並複製自動化智能產線經驗，產線能更有效利用，帶動稼動率逐步提升。（編輯：郭萍英）1071106
新台幣早盤升1.7分,產經,2018/11/06 10:50,https://www.cna.com.tw/news/afe/201811060049.aspx,（中央社台北6日電）台北外匯市場新台幣兌美元匯率今天以30.760元開盤，升1.1分；10時45分來到30.754元，升1.7分。截至10時47分，新台幣兌美元最高30.700元、最低30.760元。1071106
