標題,分類,時間,網址,內文
怕企業評價受損  三菱汽車解除戈恩董事長職務,產經,2018/11/27 14:47,https://www.cna.com.tw/news/afe/201811270004.aspx,（中央社記者楊明珠東京26日專電）日產汽車前董事長戈恩因涉嫌不法遭到逮捕。戈恩也身兼三菱汽車公司董事長，三菱汽車公司今天召開臨時董事會，認為戈恩已無法執行職務，決定解除他的董事長職務。64歲的戈恩（Carlos Ghosn）涉嫌違反日本的金融商品交易法，遭到逮捕。他兼任董事長的日本三菱汽車公司（Mitsubishi Motors Co.）今天下午召開臨時董事會，決定解除戈恩董事長及代表董事的職務。但戈恩仍擁有董事的職務。三菱汽車的最大股東日產汽車（Nissan Motor Co.）本月22日已決定解除戈恩董事長職務。三菱汽車的董事長一職，由三菱汽車執行長（CEO）益子修暫時兼任，直到下次股東大會選出新董事長為止。三菱汽車董事會成員由戈恩、益子修以及三菱重工業的社長宮永俊一等6名社外董事所組成，一共8名。今天的臨時董事會由除了戈恩之外的7人出席，全體開會結果，一致贊成解除戈恩的董事長及代表董事職務。臨時董事會後，益子出現在記者會上。他說，聽到戈恩被逮捕的消息時，覺得很遺憾，但身為三菱汽車的CEO，要考慮到做什麼判斷才是對三菱汽車有利，為了守護股東的利益，解除戈恩的職務是難以避免的，這是很痛苦的決定。益子被媒體問到解除戈恩董事長職務的理由時表示，戈恩目前被羈押，難以執行董事長的義務。益子還說，如果戈恩再繼續擔任董事長一職，有損企業的評價。益子表示，今後會重新檢討公司內部管理以及主管薪酬制度。至於三菱汽車公司是否也發現戈恩有不正行為，益子說目前還在調查，結果會在下個月召開的董事會上做報告。三菱汽車2016年發生燃油數據造假的問題後，經營陷入危機，戈恩身為日產社長兼CEO，決定對三菱汽車出資，主導三菱汽車的經營重建。日產成為三菱汽車的最大股東，2016年12月戈恩當上三菱汽車董事長。目前日產持有三菱汽車34%的股份，法國雷諾汽車持有日產43.4%的股份，日產持有雷諾汽車的15%持股，這3家汽車公司合作進行零件的共有化、研發等，今後這3家公司的資本關係、合作關係該如何調整，將是焦點。益子對媒體表示，三菱汽車還是需要結盟提攜的力量，希望能維持雙贏的關係。日產、三菱、雷諾這3家汽車公司本週內將在荷蘭阿姆斯特丹召開集團會議，3家公司巨頭將討論合作方式等議題。（編輯：林治平）1071126
英國脫歐和義大利預算爭議傳進展 歐股大漲,證券,2018/11/27 02:38,https://www.cna.com.tw/news/afe/201811270006.aspx,（中央社倫敦26日綜合外電報導）歐洲聯盟（EU）批准和英國達成的脫歐協議，加上義大利表示會削減預算赤字，推升歐洲3大股市在本週第一個交易日全面收高。倫敦FTSE 100指數終場勁揚83.14點，漲幅1.20%，以7036.00點作收。法蘭克福DAX 30指數大漲162.03點或1.45%，來到1萬1354.72點。巴黎CAC 40指數漲48.03點或0.97%，收在4994.98點。（譯者：陳宜君）1071127
川普：通用應停止在中國造車 改回美國生產,產經,2018/11/27 05:12,https://www.cna.com.tw/news/afe/201811270009.aspx,（中央社華盛頓26日綜合外電報導）美國總統川普今天接受「華爾街日報」日報訪問時表示，通用汽車公司（General Motors Co.）應停止在中國製造汽車，改為在美國生產。通用汽車今天宣布，將裁減北美地區的數以千計工作人力、減少生產線，並淘汰部分銷售不理想的車款。川普對記者表示，通用汽車決定讓俄亥俄州洛茲鎮（Lordstown）的車廠閒置，令他不悅；通用汽車在俄亥俄州「最好安排其他東西」。川普指出，他已告訴通用汽車執行長巴拉（Mary Barra），該公司今天宣布的消息令他不悅；巴拉對他表示，暫停銷售雪佛蘭（Chevrolet）Cruze車款的決定「和關稅無關」，而是銷售欠佳的緣故。川普說：「（通用汽車應）弄出一款賣得好的車子，然後回來（美國生產）。」（譯者：陳宜君）1071127
油價走穩和川習會將登場 美股同步收高,證券,2018/11/27 07:18,https://www.cna.com.tw/news/afe/201811270013.aspx,（中央社紐約26日綜合外電報導）由於投資人期望，美國總統川普和中國國家主席習近平本週會談時，能化解兩國貿易爭端，加上油價走穩，推升美股3大指數今天同步大漲。那斯達克指數升盤時勁揚142.87點或2.06%，以7081.85點作收。道瓊工業指數飆漲354.29點或1.46%，收在2萬4640.24點。標準普爾500指數40.89點或1.55%，收2673.45點。（譯者：陳宜君）1071127
重挫後技術性反彈 油價大漲近3%,產經,2018/11/27 07:38,https://www.cna.com.tw/news/afe/201811270014.aspx,（中央社倫敦27日綜合外電報導）油價在經歷數週挫跌後，今天出現技術性反彈，大漲近3%。倫敦北海布倫特原油大漲1.68美元，漲幅2.86%，收在每桶60.48美元。紐約商品交易所西德州中級原油也翻揚1.16美元，以每桶51.58美元作收。（譯者：陳宜君）1071127
中鋼明年首季開跌盤 將獎勵下游出貨,產經,2018/11/27 08:23,https://www.cna.com.tw/news/afe/201811270021.aspx,（中央社記者韋樞台北27日電）中鋼公司明年首季內銷鋼品盤價會議，會中決定採彈性多元的穩健盤價，大宗的冷熱軋鋼品調降，並採取特別措施獎勵客戶出貨。中鋼表示，獎勵措施從12月下旬起實施到春節過後。中鋼強調，中鋼是全球首開明年首季盤價的鋼廠，需以實體供需評估為要，審慎訂價以穩定台灣乃至亞洲市場行銷情勢。近期中鋼各項原料成本居高不下，但為了維繫下游產業信心及競爭力，輕減客戶庫存跌價損失，將採行特別措施，協助客戶在元旦/春節假期前後的出貨。中鋼表示，雖然獎勵細節還未訂出，但實施日期大致落在12月下旬到農曆春節過後，這段期間中鋼會視下游客戶提貨量多寡，給予不同程度的獎勵措施，基本上提貨和出貨愈多，獎勵愈豐厚，每公噸會給予一定的金額回饋鼓勵。中鋼指出，中鋼明年首季的鋼板基價維持平盤，不過中鋼的鋼板廠在明年元旦加農曆春節共13天假期會加緊供貨和備貨，主要因應從3月5日到5月29日共80餘天的鋼板廠和加熱爐歲修期間出貨所用，以維持市場一定的價格。（編輯：黃國倫）1071127
美股大漲 台股估壓力為9900點,證券,2018/11/27 08:40,https://www.cna.com.tw/news/afe/201811270024.aspx,（中央社記者江明晏台北27日電）油價走穩和川習會將登場，帶動美股收高，英國脫歐和義大利預算爭議傳進展，激勵歐股大漲。台股26日漲98.06點，投顧表示，台股走勢短線整理，指數壓力為9900點至10000點。投資人樂觀期望美國總統川普和中國國家主席習近平本週會談時，能化解兩國貿易爭端，加上油價走穩，推升美股3大指數26日同步大漲。道瓊工業指數大漲354.29點或1.46%，收在24640.24點。那斯達克指數勁揚142.87點或2.06%，以7081.85點作收。標準普爾500指數上漲40.89點或1.55%，收2673.45點。歐洲聯盟（EU）批准和英國達成的脫歐協議，加上義大利表示會削減預算赤字，推升歐洲3大股市在本週第一個交易日全面收高。台股26日漲98.06點，收在9765.36點，成交值新台幣883.08億元。自營商賣超5.75億元，投信賣超0.12億元，外資及陸資買超51.31億元。三大法人合計買超45.44億元。日盛投顧觀察，台股指數是否能守穩在5日線之上並站回月線，回檔是否量縮或上攻成交量大於20日均量，支撐為9600點至9700點，壓力為9900點至10000點。以技術指標來看，台股短線整理，若以櫃買指數而言，支撐為月線附近，壓力為季線附近，短線偏多整理，近期法人著墨較深的個股包括矽晶圓、IC設計、生技等。（編輯：楊玫寧）1071127
兆豐銀響應危老重建 備妥百億元專案貸款,產經,2018/11/27 08:53,https://www.cna.com.tw/news/afe/201811270028.aspx,（中央社記者田裕斌台北27日電）兆豐金控旗下兆豐銀行響應政府危老重建政策，推出「危險及老舊建築物重建貸款專案」，備妥專案貸款額度新台幣100億元，協助想辦理危老屋重建的民眾取得資金。根據內政部營建署統計，截至今年第2季，台灣地區屋齡超過30年以上戶數約有384萬戶，潛在影響人民居住安全甚鉅。兆豐銀表示，專案貸款除了屋齡逾30年、無電梯、為都市計劃範圍且非歷史建築得依照危老條例申請重建計劃核定的民眾可以申請之外，特別放寬適用本專案的對象，包括得適用地方政府訂有專案（例如簡易都更、防災型都更）對象，亦可比照適用。專案貸款項目包含土地融資貸款、建築融資貸款及週轉金貸款和代償既有債務貸款，可協助貸款對象充分支應於重建時所需資金，並給予優惠的融資成數及利率條件。此外，針對自力重建案件，如個案地點、借款人的資信佳時，最高還可以百分之百貸得重建所需資金，期限最長5年。兆豐銀指出，除了提供重建所需資金，為保障重建期間所有參與重建關係人的權益，也充分結合銀行、金控及其它外部資源，提供客戶包括重建前現有房貸轉貸、重建後分戶貸款、信託管理、營建管理、營建工程保險等全方位一條龍金融服務，讓客戶在重建過程中，不必擔心資金規劃的問題。（編輯：郭萍英）1071127
新台幣開盤貶1.4分 為30.900元,產經,2018/11/27 09:02,https://www.cna.com.tw/news/afe/201811270029.aspx,（中央社台北27日電）台北外匯市場新台幣兌美元匯率今天以30.900元開盤，貶1.4分。新台幣兌美元開盤交易區間為30.900元至30.920元。1071127
台股開盤跌36.41點,證券,2018/11/27 09:03,https://www.cna.com.tw/news/afe/201811270030.aspx,（中央社台北27日電）台北股市今天開盤跌36.41點，加權股價指數為9728.95點，成交金額新台幣14.49億元。1071127
通用汽車擬關閉加拿大一工廠 數百名工人罷工,產經,2018/11/27 09:07,https://www.cna.com.tw/news/afe/201811270031.aspx,（中央社加拿大歐夏瓦26日綜合外電報導）通用汽車表示將關閉興建於1953年、位於加拿大安大略省歐夏瓦（Oshawa）的工廠，數百名汽車工人今天罷工抗議，汽車工會領袖和總理杜魯道也都發聲抗議。美國汽車業巨擘通用汽車（General Motors）先前就宣布要進行大規模重整，裁減15%領薪員工，包括25%管理階層，並關閉全球7家工廠，來節省60億美元，關閉加拿大工廠只是重整的其中一環。包括歐夏瓦工廠和其他兩座汽車與引擎組裝廠、研究中心和加拿大分公司總部在內，通用汽車在加拿大共有2萬3000名員工。關閉歐夏瓦工廠將直接影響負責生產雪佛蘭Impala和凱迪拉克 XTS，以及Silverado和Sierra貨卡的2500多名工人。通用汽車在新聞稿中宣傳「未來轉型」的計畫，新型電動車和自駕車是重點所在。在寒冷的下雨天，歐夏瓦工廠大門外聚集部分人群，阻止卡車運送零件來表達他們的憤怒。加拿大中央政府和安大略省政府2009年曾向通用汽車注資數十億美元，協助繼續營運，抗議民眾認為通用汽車背信忘義。一名為通用汽車效力7年的抗議民眾說：「這就像被打臉一樣。」另名抗議民眾萊特（Karin Wright）說：「我才剛買一台全新的卡車，我有點擔心我的家人。如果通用走了，我不知道會發生什麼事。」她正考慮把房子賣掉和搬家。總理杜魯道（Justin Trudeau）表示，他對通用汽車董事長兼執行長巴拉（Mary Barra）決定2019年12月將停止在歐夏瓦生產汽車「極度失望」。杜魯道說，好幾個世代以來，歐夏瓦工廠和其勞工一直都是為這個社會「盡心盡力的一份子」，他也誓言政府會為勞工家人提供支持。（譯者：陳昱婷/核稿：鄭詩韻）1071127
國泰金調查：明年經濟成長關鍵在政策執行,產經,2018/11/27 09:17,https://www.cna.com.tw/news/afe/201811270034.aspx,（中央社記者田裕斌台北27日電）國泰金控公布最新「國民經濟信心」調查結果，結果顯示有27.3%的民眾認為，影響明年台灣經濟成長的關鍵因素在於「台灣政府的財經政策執行」。另有25.7%的民眾認為「中國大陸經濟大幅下滑」是主要因素，其次為「美國經濟成長趨緩」(17.2%)，顯示民眾認為台灣經濟受中國大陸直接影響的程度大於美國。至於影響台股走勢的主要因素，有36.5%的民眾認為「美股走勢」是最重要影響因素，另有28%的民眾認為「美國升息步調與幅度」也是主要原因，其次則為「台灣經濟成長與企業獲利」的基本面支撐，占25.1%，僅有7.2%民眾認為陸股走勢是主要影響因素，顯示民眾認為台灣股市受美國直接影響的程度大於中國大陸。國泰金表示，最新景氣對策信號分數僅22分，燈號轉為黃藍燈，景氣領先指標續下滑，顯示當前景氣動能擴張力道轉弱，11月的景氣現況樂觀指數持續受到相關經濟數據的影響，明顯下滑至-46.7的水準，創2016年3月以來的新低，所幸景氣展望樂觀指數僅小跌至-32.7，並未跌破今年低點。此外，民眾的就業展望樂觀指數與薪資上漲預期指數也表現疲弱，在經濟信心與就業信心陰影持續壟罩下，大額消費意願指數連續2個月小降至-5.7的水準，須留意明年景氣動能轉弱的風險。根據國泰金調查結果顯示，民眾對明年台灣經濟成長率(GDP)的預期平均值2.2%，較主計總處在8月時首次預測2019年經濟成長率2.55%低，且有28%認為可能會跌破2%；在通膨預期方面，有65.1%的民眾認為明年通貨膨脹率會超過1%，平均通膨預期值為1.1%，則略高於主計總處預測的0.93%。國泰金也指出，市場持續擔憂貿易戰發展、中國大陸成長動能趨緩及台灣製造業採購經理人指數(PMI)回落至50以下的基本面風險，加上iPhone銷量不如預期，美債殖利率走高，近期美股震盪加劇，諸多因素影響台灣股市表現，11月民眾的股市樂觀指數下跌至-36.1，創近3年以來的低點，風險偏好指數也滑落至-15.1，顯示短期民眾信心轉趨謹慎。（編輯：郭萍英）1071127
鴻海轉型邁向工業互聯網 不畏美中貿易戰,產經,2018/11/27 09:26,https://www.cna.com.tw/news/afe/201811270036.aspx,（中央社記者鍾榮峰台北27日電）鴻海有意全面檢討成本，因應未來經濟結構調整。整體觀察，鴻海近2年在集團內外部進行大規模轉型和投資布局，邁向工業互聯網。面對美中貿易戰，鴻海相信爭端能圓滿解決。鴻海擬全面檢討費用支出，集團總裁郭台銘日前指出，包括泛鴻海集團，日本、夏普、群創等大集團在內，都在檢討成本，應付未來經濟結構調整。整體觀察，鴻海近2年在集團內外部進行大規模的轉型和投資布局，從集團內部來看，鴻海積極朝向工業互聯網轉型。郭台銘曾指出，集團必須以跨廠區、國際化的運作規模，開發工業物聯網的實際應用，協助加快集團轉型為科技平台公司。從今年起的未來3年，鴻海集團訂定走向大數據、人工智慧、工業互聯網的「工作年」規劃，以「雲移物大智網＋機器人」為戰略方向，整合工業大數據、雲端智慧、數據安全管控、區塊鏈金融、智慧製造、智慧供應鏈等，藉由六流（訊息流、金流、技術流、人流、物流與過程流）大數據為基礎，邁向萬物聯網的智能社會。在集團內部，去年上半年鴻海建置新的S次集團，宣示深耕半導體領域的企圖心。去年下半年成立新的R次集團，強攻相機鏡頭模組，也布局服務型機器人關鍵零組件。今年1月底鴻海股東臨時會通過旗下工業富聯申請在中國大陸上海A股上市案，6月上旬火速在A股正式上市，代表鴻海集團布局工業互聯網的決心。在發展工業互聯網趨勢下，今年5月鴻海決定辦理現金減資，減資比例約20%，這是鴻海上市以來首次現金減資，一方面龐大股本藉此瘦身、調整資本結構，一方面重新檢視集團整合財務狀況。從集團外部來看，鴻海在2016年8月正式入主夏普（Sharp），啟動夏普的改造計畫，經過1年多的努力，讓夏普轉虧為盈。去年上半年，鴻海也展現布局東芝記憶體（Toshiba Memory）的行動力。去年7月下旬，郭台銘與美國總統川普在白宮共同宣布，鴻海集團將斥資100億美元在美國威斯康辛州打造世界級LCD面板廠，今年6月下旬開始動土，更開啟鴻海集團深耕美國市場的新頁。即便美中貿易戰持續升溫，鴻海對全球經濟未來發展仍保持樂觀，並相信中美貿易爭端能圓滿解決。展望未來，鴻海指出，正運用過去40餘年累計的核心製造技術基礎，積極往工業互聯網應用發展，這項長期的升級推展工作，借助大數據、人工智慧（AI）和自動化發展成果，目前在集團內部推行已初顯成效。鴻海表示，未來將依據全球化布局版圖及區域特點，繼續吸引及培育年青新世代科技人才，增加研發經費，推動最新世代的科技研發和新產品開發。（編輯：楊玫寧）1071127
川普考量對iPhone加徵關稅 鴻海力守70元,證券,2018/11/27 13:26,https://www.cna.com.tw/news/afe/201811270039.aspx,（中央社記者鍾榮峰台北27日電）外媒報導美國總統川普考量對中國進口的蘋果iPhone和筆電加徵10%關稅，鴻海盤中力守70元。鴻海日前指出，相信中美貿易爭端能圓滿解決。華爾街日報（WSJ）和彭博（Bloomberg）引述美國總統川普談話，川普考量對從中國進口的蘋果iPhone和筆記型電腦產品，計畫加徵10%關稅。蘋果iPhone產品主要在中國生產組裝製造，主要合作夥伴鴻海早盤最低來到70.4元，小跌0.8%，力守70元關卡。從市值來看，鴻海盤中市值來到新台幣9759億元，仍在1兆元之下。外資法人26日轉賣超鴻海2012張，今年到11月26日外資法人累計賣超鴻海達114萬9999張，外資持股比例從49.29%降到42.34%。鴻海集團總裁郭台銘日前表示，減少預算每年都在做，只是今年較全面，調整的不是鴻海本身，還包括泛鴻海集團，包括夏普、群創等大集團都在裡面，都在檢討成本，應付未來經濟結構調整。他強調沒有大量裁員計畫，到明年1月前業績都很好。鴻海日前聲明指出，對全球經濟未來發展保持樂觀，並相信中美貿易爭端能圓滿解決。第4季鴻海仍可受惠季節性旺季效應，歐系外資法人日前預估鴻海單季業績可望季增16%到20%區間，有機會超過新台幣1.6兆元，創歷史單季次高，僅較去年同期歷史新高下滑。根據今年3月初蘋果公布前200大供應鏈廠商名單，其中鴻海集團旗下共有27個據點入列。在中國大陸，鴻海集團富士康製造組裝蘋果產品的地點，包括廣東深圳龍華廠區、深圳觀瀾科技園區、廣東佛山、廣東中山、江蘇昆山、河南鄭州、河南濟源、河南開封、山西太原、山西晉城、浙江嘉善、河北廊坊以及四川成都等地。此外，富士康在上海松江出口加工區和河南鶴壁市的據點，也列入蘋果前200大供應商。市場人士表示，從蘋果公布鴻海組裝製造蘋果產品的工廠地點來看，鴻海集團旗下關係企業包括鴻富錦精密、富士康精密電子、富士康精密組件、富士康電子工業發展等，都可能是蘋果供應鏈重要據點。（編輯：黃國倫）1071127
新台幣早盤轉升0.9分,產經,2018/11/27 10:10,https://www.cna.com.tw/news/afe/201811270045.aspx,（中央社台北27日電）台北外匯市場新台幣兌美元匯率今天以30.900元開盤，貶1.4分；10時來到30.877元，升0.9分。截至10時7分，新台幣兌美元最高30.873元、最低30.920元。1071127
中鋼開跌盤但不看淡前景 股價小跌,產經,2018/11/27 10:34,https://www.cna.com.tw/news/afe/201811270050.aspx,（中央社記者韋樞台北27日電）中鋼及子公司中鴻26日雙雙調降熱軋產品價格，每公噸均調降新台幣300元，終止連5漲。中鋼分析各主要國家基礎建設不斷，鋼鐵需求不看淡，中鋼、中鴻股價小跌。中鋼調降基價的產品包括冷軋每公噸降400元、熱軋降300元、電磁鋼捲降900元、熱浸鍍鋅鋼捲降300元；鋼板、棒線、電鍍鋅鋼捲平盤。中鴻也同步調降12月盤價熱軋和熱浸鍍鋅產品每公噸300元，冷軋產品降400元，外銷市場則視不同客戶而定。中鋼指出，中國大陸雖遇逆風，經推動強化內需、貨幣寬鬆、穩定匯率等配套後，衝擊較預期和緩，11月底G20美中會議前中國已先釋善意，預期貿易戰風險趨緩。台灣相比中國大陸較不受美國301條款衝擊，又受惠美中貿易轉單效應，出口與工業生產維持成長，企業對台灣與回台投資意願增加，另各項基建／公共工程專案蓄勢待發，成長引擎獲內需加持，經濟穩中趨堅。中鋼說，主要鋼鐵生產國紛紛加大基礎建設力度。中國大陸今年軌道建設預算增至人民幣8000億元，印度政府投入300億美元打造智慧城市；同時世界鋼鐵協會10月16日最新預測來看，明年全球鋼需較4月預估時向上修正3.4%，達16.81億公噸，較今年成長2300萬公噸；今年中國大陸冬季限產範圍與時間均加大加長，供應面可望有正面效益。中鋼也同步祭出獎勵措施，從12月下旬起實施到春節過後，下游客戶提貨和出貨愈多者，獎勵愈多。台股今天開低走低，9700點關卡失守，鋼鐵股早盤跌幅約1%，中鋼股價開低走低，盤中最低23.6元，跌幅1.46%；中鴻開低走低，最低11元，跌幅為2.22%；燁輝守在平盤10.45元。（編輯：郭萍英）1071127
華晶科搭上微軟亞馬遜等大廠 拚轉型契機,產經,2018/11/27 10:38,https://www.cna.com.tw/news/afe/201811270053.aspx,（中央社記者韓婷婷台北27日電）華晶科積極拓展影像解決方案，多年深耕受到國際大廠青睞，相繼爭取到微軟、高通及亞馬遜等國際級大廠合作機會，搶攻物聯網（IoT）、人工智慧（AI）商機，力拚轉機契機。華晶科去年開始獲得高通青睞共同開發搭載QCS605晶片組的VR 360 原型相機後，今年再推出人工智慧商用監控攝影原型機IPC603，持續拓展新應用領域；接著攜手微軟搶進物聯網人工智慧商機。微軟WinHEC Taipei 2108大會上展示最新的Azure物聯網人工智慧（AI)開發套件，提供物聯網視覺解決方案所需的關鍵軟硬體支援，其監控攝影軟硬模組由華晶科合作開發設計。不只高通及微軟，華晶科也加入亞馬遜最新的智慧AI監控AWS雲端平台，提供軟硬整合服務於人工智慧商用監控攝影原型機IPC603。華晶科董事長夏汝文表示，隨著5G、AI、IoT時代來臨，智慧影像辨識會蓬勃發展，華晶科提供軟硬整合於AI camera，結合Amazon Kinesis雲端服務，能安全輕鬆地將影片從連線裝置串流到AWS，以進行邊緣運算及分析。繼全球晶片大廠高通、軟體大廠微軟，再到平台通路巨擘亞馬遜，華晶科迎接AI、IoT時代來臨，在「物聯網、人工智慧之眼」重要領域積極卡位，能否切入真正主流市場，帶動營運新動能，明年將是關鍵的一年。華晶科指出，深耕於數位影像領域已超過20年，近年來積極轉型，除了既有的影像系統產品ODM外，亦提供包含3D感測深度晶片、演算法、影像處理IP授權、雙鏡頭相機模組等解決方案，希望成為全方位智慧視覺解決方案供應商。華晶科表示，迎向物聯網時代，人工智慧崛起，華晶科具備「物聯網之眼」的影像處理技術，同時集結系統整合及演算法能力，是獲得國際級大廠的合作夥伴之一的重要關鍵，未來也會持續拓展業務渠道，提供給系統整合商、品牌廠等技術支援及軟硬體整合服務。（編輯：黃國倫）1071127
