標題,分類,時間,網址,內文
台泥啟動彰濱綠電 20年減碳1977個大安公園,產經,2018/11/06 15:51,https://www.cna.com.tw/news/afe/201811060134.aspx,（中央社記者韋樞台北6日電）台泥集團利用彰濱工業區舊廠區跨足綠能產業，不但一期2MW光電完工併聯，今天啟動二期10.1MW光電建設，未來再添籌設中的21.6 MW陸域風電，未來20年可減碳1977個大安森林公園。台泥集團旗下的綠能事業邁新里程，台泥綠能第一期太陽光電廠2MW完工，今天正式啟動第二期太陽光電廠。彰化縣長魏明谷、台泥企業團董事長張安平、台泥綠能董事長呂克甫及總經理翁吉良共同舉行啟動儀式。根據台泥集團規劃，位於彰濱工業區的台泥綠能第一期光電廠2MW已完工併聯；第二期工程10.1MW，今年10月取得能源局電業籌設許可，預計2019年6月底前完工，預估年發電量達1382萬度，約減排18.8座大安森林公園碳排量。另外，彰濱工業區的風電電廠一期7.2MW，已於今年9月通過電業審查會，預計於2019年6月底前完工，以完成台泥綠能第一張風力發電再生能源發電業執照的里程碑，預估首年發電量1907萬度，約當25.9座大安森林公園碳排減量。位於同區的風電廠二期14.4MW，預計今年底啟動環評，預估首年發電量3813萬度，約當51.9座大安森林公園碳排減量。台泥集團估算，各兩期建設的太陽光電和陸域風電，屆時在彰濱廠區提供綠電共33.7MW，預估20年發電達14億度，等於每年可供應33萬戶家庭用電，總減碳量達77萬公噸，減碳相當於1977座大安森林公園。張安平還透露未來的綠電建設，彰濱廠區創造綠色電力，但廠內還有6公頃的空間準備建立「儲能廠」，才能將綠色能源儲能、備能，源源不絕的「穩定」供電給台電公司；另外，彰濱台泥綠能大樓也將對外開放給機關及教育團體參觀，成為台灣能源轉型以及企業永續的教育基地。（編輯：郭萍英）1071106
台股開低走低跌64.86點 收9824.95點,證券,2018/11/06 13:48,https://www.cna.com.tw/news/afe/201811060143.aspx,（中央社台北6日電）台北股市今天開低走低，收盤跌64.86點，為9824.95點，跌幅0.66%，成交金額新台幣1168.80億元。加權指數開盤為9888.41點，盤中最高9899.97點，最低9782.86點；不含金融股指數8199.48點，跌66.60點。八大類股漲跌幅：泥窯股跌0.48%、食品股跌0.16%、塑化股跌0.53%、紡織股漲0.7%、機電股跌1.09%、造紙股跌0.77%、營建股漲0.52%、金融股漲0.2%。委買張數1256萬5326張，委賣張數797萬4788張，成交張數486萬2318張。收盤時上漲317家，下跌486家，持平110家。成交量前5名個股為聯電、元大滬深300正2、群創、元大台灣50反1、友達。漲幅前5名個股為凱羿-KY、裕豐、宏致、仲琦、陽光能源-DR。跌幅前5名個股為康友-KY、康控-KY、訊芯-KY、嘉聯益、立積。1071106
蘋果背光模組供應商瑞儀逆勢漲,證券,2018/11/06 13:55,https://www.cna.com.tw/news/afe/201811060146.aspx,（中央社記者潘智義台北6日電）蘋果公司財測不如預期，傳出新手機銷售欠佳，多數蘋概股走跌，但蘋果背光模組供應商瑞儀光電今天盤中來到82.3元，大漲5.1%，收80.3元，上漲2.55%。瑞儀自波段低點10月11日盤中低點60.3元起漲，來到11月1日盤中高點84.4元，上漲39.96%。瑞儀前3季淨利歸屬母公司業主新台幣32億5556.4萬元，基本每股盈餘7.00元。瑞儀統計，9月背光板出貨1111.2萬片，其中手機及平板電腦背光板出貨共736.6萬片。（編輯：郭萍英）1071106
11月台指期跌43點,證券,2018/11/06 13:59,https://www.cna.com.tw/news/afe/201811060149.aspx,（中央社台北6日電）台北股市今天終場跌64.86點，收9824.95點。11月台指期以9774點作收，下跌43點，與現貨相較，逆價差50.95點。台灣期貨交易所為近2個月指數期貨契約訂定開盤參考價為，11月期貨9817點、12月期貨9801點。台股今天終場跌64.86點，收9824.95點，成交金額新台幣1168.80億元。11月台指期貨以9774點作收，跌43點，成交12萬2386口；12月期貨以9760點作收，跌41點，成交1573口。實際收盤價格以期交所公告為準。1071106
11月電子期跌 金融期漲,證券,2018/11/06 13:59,https://www.cna.com.tw/news/afe/201811060150.aspx,（中央社台北6日電）台北股市今天下跌64.86點，收9824.95點。11月電子期收387.1點，下跌3.75點，逆價差1.64點；11月金融期收1217點，上漲10.6點，逆價差6.05點。11月電子期以387.1點作收，下跌3.75點，成交3691口。12月電子期以386.3點作收，下跌4.1點，成交285口。電子現貨下跌4.24點，以388.74點作收；11月電子期貨與現貨相較，逆價差1.64點。11月金融期貨以1217點作收，上漲10.6點，成交2169口。12月金融期以1215點作收，上漲9.6點，成交69口。金融現貨以1223.05點作收，上漲2.42點；11月金融期貨與現貨相較，逆價差6.05點。實際收盤價以期交所公告為準。1071106
沃旭陸上變電站統包合約達70億 明年第2季開工,產經,2018/11/06 16:26,https://www.cna.com.tw/news/afe/201811060152.aspx,（中央社記者蔡芃敏台北6日電）丹麥離岸風電開發商沃旭能源今天與台灣汽電共生公司簽署陸上變電站統包合約，合約金額超過新台幣70億元，估將在明年第2季開始動工。沃旭投入開發彰化外海風場，並在今天與台汽電簽署陸上變電站統包合約，將由台汽電全資子公司星能負責建造2座陸上變電站。沃旭能源亞太區董事長暨台灣總經理柏森文（Matthias Bausenwein）表示，陸上變電站是大彰化離岸風場最先動工的項目，並將透過星能向本土下游供應商購買機電設備，創造實質商機，帶動整體產業發展。台汽電董事長張明杰說，在採購機電設備或選擇土工施工廠商時，會以本土廠商優先，以落實沃旭能源本土化的承諾。星能董事長蔡進發表示，預估本土廠商承攬金額會達整體投資的85%，估計能創造本地800到1000個工作機會。蔡進發說，星能會致力提升施工品質及環安衛管理（QHSE），達到與歐洲相同水準，並讓工程能做到零工安事故，用實際執行力證明星能是最佳選擇。沃旭今天與台汽電簽署的合約金額超過70億元，是台灣首個離岸風場陸上變電站的正式合約。另外，星能未來可能的中下游供應商包含華城電機、中興電工和大同公司等共15家公司，也派出代表參與簽約儀式。（編輯：張良知）1071106
台股9800點失而復得 中期盤勢偏空,證券,2018/11/06 14:16,https://www.cna.com.tw/news/afe/201811060158.aspx,（中央社記者吳家豪台北6日電）蘋果概念股今天在大立光領跌下走低，台股一度下跌逾百點、失守9800點，尾盤金融股撐盤，跌勢收斂，收復9800點；投顧認為，台股10月暴跌影響中期均線與指標，盤勢為中空格局。美國科技股下跌，加上新款iPhone傳出銷售不佳，蘋果公司（Apple）對供應鏈砍單10%，今天蘋概股3大指標大立光、鴻海、台積電同步下挫，台股指數盤中最低來到9782.86點，終場收在9824.95點、下跌64.86點，跌幅0.66%，成交值新台幣1168.8億元。電子股跌1.08%，金融股尾盤翻紅、收漲0.2%。股王大立光受到智慧手機市場需求不振影響，第4季營運展望轉淡，遭美系外資調降目標價至2850元，給予「減碼」評等，衝擊股價今天盤中跌破3200元關卡，終場收3220元，下跌6.26%。鴻海失守80元關卡，終場收在77.3元，下跌3.38%；台積電在平盤下震盪，終場收234.5元，下跌0.21%。部分金融股撐盤，富邦金漲1.22%，收49.8元；新光金漲0.49%，收10.2元；國泰金跌0.4%，收49.4元；兆豐金跌0.19%，收26.25元；中信金收平盤20.75元。富邦投顧表示，美中貿易協議傳出醞釀之中，加上台股短期線型未遭到破壞，使得短多逢低進場意願增強，只要大盤不出現暴跌情況，近期10日均線也可望開始翻揚，對於台股挑戰月線反壓將有正面挹注；然而，台股10月出現暴跌，造成中期均線與指標都明顯偏空，所以維持中期盤勢偏空的看法。（編輯：楊玫寧）1071106
三大法人賣超台股69億元,證券,2018/11/06 15:04,https://www.cna.com.tw/news/afe/201811060175.aspx,（中央社台北6日電）台股今天跌64.86點，收在9824.95點，成交值新台幣1168.80億元。三大法人外資及陸資、投信和自營商同步賣超，合計賣超新台幣69億元。自營商賣超20.58億元，投信賣超4.17億元，外資及陸資賣超44.25億元。三大法人合計賣超69億元。富邦投顧表示，美中貿易協議傳出醞釀之中，加上台股短期線型未遭到破壞，使得短多逢低進場意願增強，只要大盤不出現暴跌情況，近期10日均線也可望開始翻揚，對於台股挑戰月線反壓將有正面挹注；然而，台股10月出現暴跌，造成中期均線與指標都明顯偏空，所以維持中期盤勢偏空的看法。1071106
山林水攜手蘇伊士 布局台灣再生水市場,證券,2018/11/06 15:05,https://www.cna.com.tw/news/afe/201811060177.aspx,（中央社記者潘智義台北6日電）山林水環境工程公司今天宣布與法商蘇伊士旗下水務技術與方案公司台灣分公司簽署合作備忘錄，以4年為期，攜手進軍台灣再生水市場。山林水董事長郭淑珍表示，全球極端氣候變遷，缺水危機已成全球共通現象，凸顯出水資源管理的重要性，台灣再生水業務需求也日受重視。山林水與全球領先的蘇伊士同步看好台灣再生水市場，未來將透過強有力再生水處理技術為後盾，結合山林水耕耘已久的台灣市場，將可以建立優勢合作平台，逐步擴大台灣，以及未來中國及東南亞的再生水務市場。山林水總經理吳人傑指出，山林水對工業製程用水分流及回收再利用，已累積相當的技術能量，在觀音工業園區污水處理廠即是採用蘇伊士集團的「智慧水務系統」和「薄膜生物反應器核心技術」，運行至今性能良好。吳人傑說，山林水與蘇伊士集團聯手，除積極實踐綠色工程理念，將建立再生水務專業的軟硬體技術團隊，在台灣共同建立智慧水務與原廠長期薄膜保障服務模式。（編輯：林興盟）1071106
智邦10月營收維持高檔 站穩40億元,證券,2018/11/06 15:10,https://www.cna.com.tw/news/afe/201811060181.aspx,（中央社記者田裕斌台北6日電）智邦科技公告，自結10月合併營收新台幣40.79億元、月增6.56%、年增為41.39%，累計今年1至10月合併營收達341.44億元、年增17.16%。法人表示，智邦受惠於交換器(Switch)市場需求快速成長，第4季營運可望續旺，全年營收挑戰歷史新高有望，明年展望也相對樂觀。法人指出，智邦今年受惠資料中心(Data center)客戶需求快速成長以及電信客戶規格升級需求浮現，順利拉升全年營收創下歷史新高，明年主要成長的契機落在5G基地台建設上，預期電信商在為因應5G上路，勢必得加速資料處理效率與傳輸速度，不排除明年開始就會著手擴大區域性機房專用的交換器升級。智邦在法人說明會中也預期，400G交換器晶片今年第4季供貨就可望恢復正常，明年第2季將量產出貨，明年智邦在新的營運成長動能挹注下，仍是成長可期。（編輯：郭萍英）1071106
美國經濟成長現徵兆 日股收漲,證券,2018/11/06 15:12,https://www.cna.com.tw/news/afe/201811060182.aspx,（中央社東京6日綜合外電報導）在美國期中選舉之前，美國經濟擴張的跡象提振市場情緒，日本股市今天收漲。日經225指數上漲248.76點或1.14%，收22147.75點；東證指數上揚18.96點或1.16%，收1659.35點。汽車股成為東證指數上漲的最大推手。豐田汽車（Toyota Motor Corp.）上調本會計年度財測後，股價應聲攀漲。SMBC日興證券公司（SMBC Nikko Securities Inc.）投資研究和服務部門的松野利彥（Toshihiko Matsuno）說：「美國經濟不弱，就業正在改善，薪資也在成長，這反映在貨幣匯率水準上。」（譯者：陳昱婷/核稿：何宏儒）1071106
台杉培育人才 生醫投資與創業課程開跑,產經,2018/11/06 18:48,https://www.cna.com.tw/news/afe/201811060183.aspx,（中央社記者潘姿羽台北6日電）國家級投資公司台杉不只扮演新創產業投資領頭羊的角色，更致力於培育人才，今天對外宣布創立「台杉青年創業學院」，且第一堂「生醫投資與創業課程」已開跑。為帶動國內投資能量，提升經濟成長動能，政府結合民間力量，成立國家級投資公司，也就是現在的台杉投資管理顧問股份有限公司；台杉去年8月成立至今，已經募集2檔創投基金，第1檔物聯網基金為「水牛1號」，規模新台幣46.5億元，第2檔生技基金「水牛2號」，規模59億元。台杉今天舉辦「生醫投資與創業課程」始業式暨記者會，台杉投資總經理翁嘉盛致詞時表示，台杉作為國家級投資公司，不只要靠投資點火國內的新創動能，更重要的是進行人才培育，這才是讓產業長遠發展的作法，因此台杉將持續舉辦相關課程，希望學員都能成為創投界、新創界的生力軍。經濟部次長龔明鑫則說，部分立委質疑台杉管理費收費標準逾2%過高，但這不僅符合業界慣例，而且超過2%的部分，將用於人才培訓，希望藉由台杉的投資與課程，讓台灣匯聚更大的產業能量。台杉說明，「生醫投資與創業課程」涵蓋投資與創業2大面向，因此金融機構、投資人、新創團隊均可參與，課程內容包含生醫產品開發策略、投資鑑價、新創事業以及商業談判等4大主題，共60小時，並規劃2場跨領域工作坊，以實際案例進行募資、授權談判以及商業策略等實戰演練；此課程才開放報名2天就火速爆滿，並已於11月5日開課。翁嘉盛會後受訪時表示，台杉致力於投資與培育人才，投資方面，物聯網及生技領域已經看了超過300家國內外事業，並投了3家物聯網、2家生技事業，接下來會持續尋找適合標的，投資有助於台灣產業發展的事業。培育人才方面，翁嘉盛也說，「生醫投資與創業課程」只是第一步，接下來會就其他領域繼續舉辦課程，希望打造出很好的創投、新創生態系。（編輯：林孟汝）1071106
藍天打造台北雙子星智慧綠建築 概念曝光,產經,2018/11/06 15:22,https://www.cna.com.tw/news/afe/201811060189.aspx,（中央社記者吳家豪台北6日電）群光智慧綠能大樓今天舉辦媒體公開參訪，首度曝光藍天電腦與宏匯集團為台北雙子星案所規劃的智慧綠建築概念，目標打造「有感覺、會思考、能對話」的台北雙子星大樓。群光智慧綠能大樓於2016年落成啟用，今年6月間受推薦代表台灣角逐2018亞太地區優良智慧綠建築評選，從來自各國的21棟頂尖建築中脫穎而出，獲得設計類最高等級鉑金獎的第一名。群光智慧綠能大樓由群光集團的群光電能公司進行設計規劃，運用獨家研發的IWA智慧建築系統，將能源管理、智慧照明系統、智慧窗簾系統、影像安防系統、停車導引系統以及空調優化系統進行整合。群光集團是藍天電腦董事長許崑泰帶領的4大集團之一，也是藍天電腦與宏匯集團投標台北雙子星案的智慧綠建築執行團隊。許崑泰表示，今年度由群光電能設計規劃的群光智慧綠能大樓獲得亞太區鉑金獎肯定，就代表團隊在智慧綠建築的領域中已具國際一流水準，他希望能將國際頂尖的智慧綠建築技術貢獻在台灣門戶的規劃中，將台北雙子星打造成「有感覺、會思考、能對話」的極致美好建築。群光電能技術長黃中明表示，針對台北雙子星案，群光電能已準備好了，將透過完整系統設計規劃、硬體開發生產、軟體整合應用、工程施工建築及專業的顧問服務，提供高品質與高競爭力的智慧建築系統解決方案。黃中明表示，群光電能以「智慧感知、智慧運算、智慧控制、智慧互動」4大面向為主軸，透過不同類型感測器的布建，賦予建築物視覺能力和環境感知能力，讓建築能夠「感覺」周邊的光線、溫度以及室內人員與空氣狀態。他說，當建築物感知到環境資訊後，可透過大量導入的多元演算法及機器學習，讓建築有能力自己「思考」在不同的環境下，針對室內外光源大小、窗簾高低以及空調強弱應如何互相調控搭配，達到舒適度與節能的最佳平衡。此外，群光電能也設計開發更簡易、友善的人機互動介面，讓人可以透過與建築物的「對話」，享受節能舒適的空間。（編輯：張均懋）1071106
華新科10月營收月減24% 黃金週與貿易戰影響,證券,2018/11/06 15:34,https://www.cna.com.tw/news/afe/201811060195.aspx,（中央社記者鍾榮峰台北6日電）被動元件廠華新科自結10月合併營收新台幣47.72億元，月減24.2%，主要受到中國黃金週和美中貿易戰影響。法人預期，被動元件未來兩季市況趨於保守。華新科自結10月合併營收47.72億元，較9月62.93億元減少24.2%，比去年同期19.11億元成長149.6%。華新科指出，10月營收月減24.2%，主要是受到中國大陸10月初黃金週影響，加上美中貿易戰影響，中國區訂單減少。累計今年前10月華新科自結合併營收407.63億元，較去年同期175.87億元成長131.77%。美系法人報告預期，未來兩季被動元件市況趨於保守，主要是景氣不確定，市場需求下滑、供應鏈庫存調節，預期第4季積層陶瓷電容（MLCC）和晶片電阻拉貨恐季減約25%到35%。華新科今天股價收在跌停板142元。（編輯：林興盟）1071106
美國期中選舉將揭曉  投信設想3狀況給建議,證券,2018/11/06 15:39,https://www.cna.com.tw/news/afe/201811060198.aspx,（中央社記者田裕斌台北6日電）美國期中選舉結果即將揭曉，摩根投信指出，目前美國期中選舉可能出現3種情境，對於美國股匯債市的影響皆不盡相同，也可能進一步引發不同資產走勢分歧。摩根多重收益基金產品經理陳若梅表示，由於民主黨及共和黨在移民、關稅、貿易等政策上相當分歧，選舉結果會明顯影響未來的政策發展，進一步左右股市、債市與美元走向。根據市場對於選舉結果的分析，目前有3套劇本，第一套若結果是眾議院由民主黨當家，參議院由共和黨攻下，預期多數政策將維持目前狀況，獲利等基本面仍是股市表現的依歸，對美國公債殖利率而言可能尚有變數，因為稅改2.0短期未能有結論下，對於預算赤字影響降低，但中長線發展需關注，在匯市部分，因財政赤字擴大方向不變下，不利美元長線走勢。第2套倘若眾議院與參議院都由共和黨拿下，這時美股走勢需觀察隨稅改2.0通過機率增高，是否能帶來進一步激勵的效果，同時留意美國聯邦準備理事會(Fed)貨幣政策方向，債市方面，由於稅改2.0通過機率高，預算赤字可能攀高推升美國公債供給，使得殖利率上檔壓力大，至於美元前景，則因為關稅、制裁、稅改等現有政策延續，推升市場對於美元的需求。第3套劇本則是參眾兩院都是民主黨的天下，陳若梅分析，此時要留意民主黨在健保法案、基礎建設支出等議題上可能影響到的產業，屆時對美股影響將出現產業別走勢不同調，公債市場則因為稅改2.0未能通過，預算赤字受到控制的情況下，能減輕公債供給可能增加帶來的壓力，美元也可望隨美國引起的國際緊張氣氛獲得紓緩，降低市場對美元的需求。陳若梅認為，現在市場氛圍觀望氣氛濃厚，選後走勢也可能隨政策明朗化而有所不同，即使美國總統川普以股票市場表現與美國優先等作為政績，政策也會以支持美國經濟成長動能為目標，但各類資產所受影響分歧，使得投資操作難度大增。（編輯：李信寬）1071106
空巴中國區執行長：中美貿易戰沒有贏家,產經,2018/11/06 15:41,https://www.cna.com.tw/news/afe/201811060199.aspx,（中央社珠海6日綜合外電報導）歐洲的空中巴士公司（Airbus SE）今天表示，不預期會從中國和美國貿易緊張關係中獲取銷售上的意外驚喜，空巴中國區執行長徐崗表示，曠日費時的經濟衝突「沒有贏家」。空巴中國區執行長徐崗表示，這樣的緊張關係使中產階級所得降低，將對航空業成長造成傷害。徐崗在記者會中表示：「我是中國人，我們不喜歡這種貿易戰。在這樣的貿易戰中，沒有人是贏家。」空巴試圖展開推遲許久的對中國出售多達180架飛機的協商，董事會9月曾在中國召開特別會議。（譯者：陳昱婷/核稿：何宏儒）1071106
供過於求 TLC NAND報價月跌逾13%創新高,產經,2018/11/06 15:42,https://www.cna.com.tw/news/afe/201811060200.aspx,（中央社記者張建中新竹6日電）NAND Flash持續供過於求，10月TLC NAND Flash合約價大跌13%至17%，跌幅創歷史新高。市調機構集邦科技預期，後續11月及12月價格恐將進一步走跌。集邦科技分析師葉茂盛表示，今年儲存型快閃記憶體(NAND Flash)市場全年都處於供過於求，隨著筆記型電腦及智慧手機代工廠都已備足庫存，再加上貿易戰及英特爾(Intel)中央處理器缺貨等因素影響，10月各類NAND Flash合約價跌幅同步擴大。據集邦科技調查，單層式(SLC)NAND Flash在10月完成第4季合約價議價後，合約價平均下跌10%至15%。市場主流的三層式(TLC)NAND Flash，在市場對後續需求展望保守下，供應商降價求售，影響10月合約價大跌13%至17%，創史上最大單月跌幅。集邦科技預期，在模組廠備貨需求依然低迷不振下，11月及12月價格恐將進一步走跌。受TLC NAND Flash報價大跌影響，二層式(MLC) NAND Flash合約價同步走跌，集邦科技調查，第4季MLC NAND Flash合約價跌4%至10%。（編輯：林沂鋒）1071106
上銀10月營收年增34% 第4季估較去年同期佳,證券,2018/11/06 15:49,https://www.cna.com.tw/news/afe/201811060204.aspx,（中央社記者鍾榮峰台北6日電）傳動元件大廠上銀自結10月合併營收新台幣26.5億元，月減5.6%，年增34.4%。上銀第4季出貨可比去年同期佳，明年第1季淡季表現，明年會有適度成長。上銀自結10月合併營收26.5億元，較9月28.09億元減少5.68%，比去年同期19.71億元成長34.43%。累計今年前10月自結合併營收253.35億元，較去年同期169.87億元成長49.14%。展望今年第4季到明年第1季營運表現，上銀日前表示，這段期間是重要觀察期，預期整體工具機產業這段期間可能會比較低潮一點。上銀預估第4季出貨會比第3季少一些，但會比去年第4季好，明年第1季淡季表現，第2季可維持今年第2季水準，明年整體保守中看到希望，會有適度成長。法人預估，上銀集團今年業績可望超過新台幣300億元，創歷史新高，今年每股純益挑戰超過18元。展望日本子公司營運表現，上銀預估，今年在日本的業績可接近100億日圓，業績成長接近1倍，今年可望轉虧為盈。上銀在日本明年業績至少成長50%。（編輯：鄭雪文）1071106
新台幣貶1.1分 收30.782元,產經,2018/11/06 16:05,https://www.cna.com.tw/news/afe/201811060211.aspx,（中央社台北6日電）台北外匯市場新台幣兌美元今天收30.782元，貶1.1分，成交金額6.18億美元。新台幣兌美元今天開盤價為30.760元，最高30.700元、最低30.789元。1071106
