標題,分類,時間,網址,內文
華為拉供應鏈赴中國 封測台廠考量現實不受制,證券,2019/02/24 09:12,https://www.cna.com.tw/news/afe/201902240012.aspx,（中央社記者鍾榮峰台北24日電）華為積極遊說供應鏈廠商轉移至中國。整體觀察，台灣半導體封測廠考量高階晶圓代工製程群聚台灣的現實因素，多把高階製程留在台灣，中低階製程布局中國。美中貿易談判進入關鍵的決戰點，不具名半導體產業人士向中央社記者透露，中國網通設備和手機大廠華為（Huawei）從去年第4季開始，積極遊說旗下供應鏈廠商將大部分產能轉移中國，去年12月中旬華為財務長孟晚舟被捕後，華為更加強對供應鏈廠商遊說的力道。另一名不願具名的半導體產業人士向中央社記者表示，華為從今年1月初開始，陸續向供應鏈廠商詢問華為集團旗下海思半導體（Hisilicon）晶片製造大部分產能移往中國的可能性。市場人士指出，美中貿易戰白熱化之前，華為內部就有意積極扶持中國自主製造能力，應用範圍除了手機之外，還包括網通設備、電視、筆記型電腦甚至車用電子等領域。從供應鏈來看，本土投顧及外資法人先前報告分析，台灣有不少廠商與華為有關，包括台積電、大立光、聯發科、日月光投控、鴻海集團、南亞科、欣興電子、景碩、旺宏、聯亞、晶技等。觀察半導體後段專業封測代工（OSAT）供應鏈，華為也與台灣封裝測試廠商積極聯繫。產業人士指出，華為希望相關供應廠商低、中、高階封測產線移往中國，或在中國擴充產能就地生產，作業流程規劃在今年底前完成，部分供應鏈廠商已著手回應華為相關作業計畫。不過考量半導體高階晶圓代工和高階封裝測試產線主要群聚在台灣的現實因素，產業人士指出，受華為詢問的台灣廠商，多數規劃以中國既有產線因應華為需求。以華為旗下海思半導體為例，海思在中國的晶片設計，主要以中低階的通訊設備、基地台、以及穿戴裝置用晶片為主。產業人士指出，華為高階手機和通訊設備用晶片，幾乎都在台灣台積電投片晶圓代工，後段封測由日月光投控旗下矽品或日月光在台灣封測。法人表示，海思晶片後段封測代工廠商，除了矽品和日月光之外，還包括中國的通富微電以及江蘇長電等。台廠在中國封裝測試海思晶片，以蘇州產線為主，例如矽品蘇州廠具備打線封裝和部分覆晶封裝（Flip Chip）產線，京元電在蘇州京隆科技具備晶圓測試能力。市場人士指出，華為也與精測密切聯繫，希望將部分產能轉移到中國。精測在中國據點以上海浦東為主，華為晶片測試研發重心也在上海，精測與華為主要在上海合作。外資法人報告預估，華為占台灣供應鏈廠商直接銷售的比重，大約在低個位數百分點到15%左右不等，其中光通訊元件廠商影響程度相對較高，比重占相關廠商業績比重約15%到20%區間；電子代工服務（EMS）廠相關比重偏低，大約低個位數百分點。（編輯：張良知）1080224
電價漲不漲3月拍板 物價穩定成關鍵,產經,2019/02/24 10:11,https://www.cna.com.tw/news/afe/201902240022.aspx,（中央社記者廖禹揚台北24日電）經濟部將在3月中下旬召開電價費率審議會，依燃料成本估算，電價有調漲空間；會中也將討論5月是否納入夏月電價提案，不過，為恐帶動物價上漲，短期內實施可能性不大。經濟部每年4月及10月根據電價費率審議會決議結果調整電價，目前規劃在3月中下旬召開審議會，官員表示，上週已召開工作小組會議，台電將提出計算電價相關成本及售電量推估，以及5月是否納入夏月電價範圍的參考資料。對於這次會中可能的電價調幅，有審議委員向中央社記者表示，近期國際燃料價格平穩，對電價影響不大；但也有委員認為，目前台灣電價在國際上仍偏低，不利節能減碳及能源效率，不排除調漲可能。知情人士表示，燃煤機組因空污限制運轉等原因必須降低用量，連帶拉升燃氣用量，加上購買太陽光電費用，都是成本上升因素，不過，去年僅運轉半年的核二，今年則會全年供電，有助平抑發電成本，目前台電估算燃料成本略低於去年9月提出成本，但以公式計算，電價仍有調漲空間。去年9月台電估算的燃料價格為原油每桶73到75美元，燃煤每公噸新台幣3113元，原建議調幅達8.21%，但因當時各地水患災情，考量對物價影響，電價費率審議會最後決議不調整電價，會中並同意以電價穩定準備780.9億元吸收台電虧損。根據台電公布財報，台電去年電業虧損140億元，與電價公式中的合理利潤5%有約347億元差距，這次會議中也將討論電價穩定基金提撥金額，如全數撥補，仍有433億元餘裕。此外，因近3年5月氣溫愈發炎熱，去年有委員提議將5月也納入夏月期間，以抑制用電高峰，經濟部官員表示，台電將提供電價試算參考，供審議委員討論。有審議委員認為，若5月負載量真的達到現行夏月（6到9月）水準，也許可以考慮將5月納入夏月，不過，也有委員表示，5月納夏月電價雖然只是一個月的差別，對民眾感受的影響卻相當大，必須參考多面向資料客觀討論，包括過去氣象資料分析及未來預測，確認是否為長期走勢，或只是受到極端氣候影響的短期現象，可能無法在這次會議中做出結論。現行夏月電價為期4個月，電價漲幅除120度以下不漲外，其餘各級距調漲13%至27%不等，以一般住宅夏月平均每戶每月用電420度為例，電費將增115元。（編輯：林孟汝）1080224
華為遊說供應鏈登陸 台灣半導體需防排擠效應,產經,2019/02/24 10:02,https://www.cna.com.tw/news/afe/201902240023.aspx,（中央社記者鍾榮峰台北24日電）華為積極遊說供應鏈轉移中國。整體觀察，台灣半導體產業具有群聚效應，加上人才技術成熟，台灣仍有優勢，不過需留意華為帶動的產線排擠效應，避免台灣產能出現空缺而被取代。美中貿易談判進入關鍵的決戰點，不具名半導體產業人士向中央社記者透露，中國網通和手機大廠華為（Huawei）從去年第4季開始，積極遊說旗下供應鏈廠商將大部分產能轉移中國，去年12月中旬華為財務長孟晚舟被捕後，華為更加強對供應鏈廠商遊說的力道。觀察台灣半導體產業供應鏈，產業人士分析，高階晶圓代工集中在新竹和台南，後段專業封裝測試產能聚集中壢、彰化、高雄等地，且封測產線臨近晶圓代工產線。市場人士指出，產業群聚效應加上台灣半導體人才技術成熟，此外不少台灣廠商已經在中國設立產能據點，多數廠商就近使用當地既有產能，因應華為需求，華為拉攏供應鏈轉移中國的影響程度有限。從政府角度來看，產業人士指出，台灣政府嚴格限制高階晶圓代工產線到中國轉投資，此外儘管台灣政府對於後段專業封測代工轉投資中國並未限制，不過台灣投審會也可能採取嚴審作業，因此台廠與華為的互動程度，台灣政府的態度也具有一定影響力。不過華為積極拉攏供應鏈台廠轉移到中國，需觀察是否對台灣既有的產能產生排擠效應，避免台灣既有的高階產能出現空缺、進而被取代的風險。談到美中貿易戰，產業人士分析，中國補助政策將是談判重點之一，其中中國積極透過補貼政策扶持半導體產業自主，若美國對中國相關補貼政策施以限制壓力，對於台灣半導體產業相對有正面影響。從華為本身來看，另一位半導體產業人士指出，華為內部對於未來5年的營運目標相當積極、自信心高昂，不僅力拚在2020年手機出貨量和市占率超越韓國三星（Samsung）成為世界第一，內部目標更規劃到2024年集團業績突破3000億美元。華為積極布局5G、人工智慧和車用電子的企圖心也非常強烈。對於台灣半導體業者來說，如何與華為保持既有合作關係、又不喪失既有的產業優勢，求得兩全其美，需要業者靈活且智慧的因應策略。（編輯：鄭雪文）1080224
巴菲特股東信不提接班人 夢想大象級併購,產經,2019/02/24 10:41,https://www.cna.com.tw/news/afe/201902240025.aspx,（中央社華盛頓23日綜合外電報導）億萬富翁投資人巴菲特今天發表一年一度的股東信，年高88的他未在信中透露接班人選，還夢想有朝一日進行「大象級」的併購。法新社報導，巴菲特（Warren Buffett）每年寫給股東的信是華爾街人必讀，因為被譽為「奧馬哈先知」的他，每年都會在信中透露對經濟現況的看法與投資商品的智慧。而巴菲特今年在信中表示，他現在朝思暮想的就是要做個「大象級」的併購。「未來幾年，我們希望能把大部分的超額流動性納入波克夏哈薩威（Berkshire Hathaway）會永久擁有的公司。」「但眼前的前景並不好：對於那些擁有良好長期前景的企業來說，價格高得離譜。」巴菲特還是沒說明誰可能接替他，擔任波克夏哈薩威的執行長，但他毫不吝惜地讚許2018年起就接管日常業務的兩位下屬詹恩（Ajit Jain）和阿貝爾（Greg Abel）。他說：「波克夏哈薩威現在管理得比我自己一個人管時還好得多。」（譯者：鄭詩韻/核稿：劉文瑜）1080224
工業富聯傳設燈塔學院 副董事長李傑兼任院長,產經,2019/02/24 13:15,https://www.cna.com.tw/news/afe/201902240074.aspx,（中央社記者鍾榮峰台北24日電）鴻海旗下工業富聯深耕工業大數據。中國媒體報導，工業富聯將建立燈塔學院，培養工業大數據人才，副董事長李傑將任燈塔學院院長一職。中國媒體報導，工業富聯積極布局工業大數據，日前宣布成立燈塔學院，培養工業大數據人才，燈塔學院將是工業互聯網人才培訓基地。燈塔學院將作為工業大數據平台，從高等學校、競賽等社群引入技術人員，藉由教育培訓方式升級人員技能，為專業人才提供實習基地。報導指出，工業富聯副董事長李傑將擔任燈塔學院院長一職。工業富聯也深耕關燈工廠。中國媒體指出，熄燈工廠整合供應鏈智慧決策、表面貼裝智慧製造平台、全自動柔性化裝配產線、人工智慧分檢分流系統和生產大數據決策中心，可讓生產效率提升30%、庫存週期降低15%、也大幅減少生產人力。（編輯：蘇志宗）1080224
台股日線連5紅 資金回溫短多續掌優勢,證券,2019/02/24 15:42,https://www.cna.com.tw/news/afe/201902240105.aspx,（中央社記者鍾榮峰台北24日電）美股收紅，台股22日來到4個多月高點，日線連5紅，週線連2紅。法人表示，國際情勢漸明朗，基本面和資金面持續回溫，短多續掌優勢，可留意外資動向。市場樂觀看待美中貿易談判發展，美股23日收紅，道瓊工業指數連9週週線收紅，是24年以來最長連漲格局。道瓊工業指數終場上漲181.18點，或0.70%，收在26031.81點；標準普爾500指數上漲17.79點，或0.64%，收在2792.67點。以科技股為主的那斯達克指數上漲67.839點，或0.91%，收在7527.547點。台股加權股價指數22日小漲3.39點，收在10322.92點，成交值新台幣1163.79億元。三大法人外資及陸資買超、投信賣超、自營商賣超，合計買超3.58億元。法人指出，台股再度來到逾4個月高點位置，日線連5紅，週線連2紅。「股王條款」施行後，台積電搶得頭香宣布今年改採季配息，市場揣測股王大立光可能也會跟進，不過大立光回應，暫不考慮。KTV業者錢櫃22日與好樂迪宣布合併，錢櫃為存續公司，若合併案順利通過，錢櫃將重新申請上市。央行22日公布去年第4季國際收支，由於去年景氣走緩，加上台股跌破萬點，去年全年經常帳順差金額為4年低點，金融帳連續34季淨流出，且全年外資匯出規模來到7年最大。觀察台股近期盤勢，安聯台灣科技基金經理人廖哲宏表示，受惠國際情勢逐漸明朗，加上基本面和資金面持續回溫，台股近一周漲幅超過2%，明顯優於其他主要股市，表現相對搶眼。其中在基本面，農曆年前訂單出現回溫，成為推動市場大幅上揚的一大主力。觀察類股訂單回溫，廖哲宏指出，主要包括伺服器、PCB上游CCL、高速運算、3鏡頭、IC設計，以及5G基地台相關概念股或個股。從資金面來看，廖哲宏表示，資金面持續增溫，是推動市場向上的主要力道。國際貨幣政策趨寬鬆，帶動市場資金湧入新興市場，加上外資加持，台股連5天外資累計買超234.03億元，台股資金面持續偏多，短多續掌優勢。觀察台股近期題材，廖哲宏表示，全球行動通訊大會（MWC）將登場，市場聚焦折疊手機、多鏡頭等相關新應用；在5G手機來臨前，多鏡頭趨勢不變，搭配周邊配件，將是今年手機產業的主要亮點。安聯台灣大壩基金經理人蕭惠中指出，受惠需求增溫優於市場預期，蘋概股展望翻多。其他題材可留意電動自行車和出口概念股。觀察近期指標，蕭惠中表示，中小型股持續活蹦亂跳，不論國際情勢、基本面或資金面，持續正向發展，近期可留意急漲後的獲利回吐賣壓、外資動向、美中貿易談判數字、各國央行升息或降息態度轉變等。（編輯：鄭雪文）1080224
富邦金深耕越南市場 未來10年續布局新南向,產經,2019/02/24 15:59,https://www.cna.com.tw/news/afe/201902240109.aspx,（中央社記者鍾榮峰台北24日電）北富銀與富邦產險23日在越南胡志明市舉辦「前進越南十週年」活動，富邦金控董事長蔡明興親自出席。富邦金控深耕越南市場，未來10年新南向持續布局。富邦金控今天發布新聞稿指出，富邦金控旗下台北富邦銀行與富邦產險於2008年相繼於越南設立分行與全資子公司，迄今屆滿十週年。北富銀與富邦產險23日在越南胡志明市舉辦「前進越南十週年」活動，蔡明興親自出席。蔡明興表示，北富銀與富邦產險2008年相繼於越南設立分行與全資子公司，十年來，規模與據點逐漸擴增，北富銀目前在越南已有胡志明市、河內及平陽三家分行，越南富邦產險則在胡志明市、河內、平陽、同奈設有據點。蔡明興表示，越南未來成長空間可期，是富邦金控布局東協市場的重點區域。除了銀行與產險外，富邦人壽也在2011年於越南成立子公司，目前已有11個據點。展望下一個十年，富邦金控將持續響應政府「新南向」政策，深耕越南在地市場。富邦產險在1996年設立越南胡志明市代表處，2008年獲准升格為全外資公司。越南富邦產險2018年簽單保費約新台幣5.8億元，成長率18%，近年維持雙位數穩定成長。北富銀截至2018年底總資產及放款規模居台資銀行排名前3名，淨利成長至新台幣4.5億元，成長達31倍，主要客群為越南台商及越資大型企業，客戶總數達5000戶。未來北富銀將跨足消金版圖，切入個人房信貸等消金業務。（編輯：郭萍英）1080224
春雨來臨稍解渴 新竹水庫進帳多5至6天用水,產經,2019/02/24 18:22,https://www.cna.com.tw/news/afe/201902240149.aspx,（中央社記者廖禹揚台北24日電）今年首波春雨準時到來，為水情吃緊的新竹地區暫時解渴，水利署表示，至今天下午，新竹與鄰近地區水庫進帳320萬噸，約可供新竹地區5至6天用水，降雨並有助減少農業供灌用水。受大陸冷氣團影響，氣象局針對北北基發布大雨特報，且降雨範圍持續擴大，水利署副署長王藝峰向中央社記者表示，這波降雨範圍擴及台中、彰化，有助目前水情稍緊的新竹地區，雖然對水庫蓄水影響不太顯著，但有助抒解農業供灌用水壓力。根據水利署統計，全台水庫預估進帳1037萬噸；主要供應新竹地區用水的寶山及寶二水庫目前蓄水率為27%，提供支援的桃園石門水庫及苗栗永和山水庫蓄水率則分別為51%及34%，4個水庫受惠於這波降雨的預估入流量為320萬噸，以新竹每日用水量56萬噸計算，約等於新竹地區5至6天用水。水利署先前召開水情會議，新竹地區水庫蓄水率偏低，加上未來降雨不確定性高，決定將新竹水情燈號轉為水情稍緊綠燈，新竹科學園區管理局也成立旱災應變小組，加強園區廠商節水力度。王藝峰表示，這次降雨使天氣轉涼，有助節約用水，加上下在平地雨量多，也可減緩從水庫放水供灌的需求，水利署預計26日召開水情會議，會中也將重新檢討新竹灌區供灌水量。王藝峰說，更重要的是，這波降雨代表春雨準時到來，不像去年是「空梅」，根據氣象局預測，這次降雨將持續至今天晚上，後續也期待鋒面能帶來更多降雨。（編輯：林孟汝）1080224
台灣蔬果海外拓銷  新加坡業者談市場導向,產經,2019/02/24 20:27,https://www.cna.com.tw/news/afe/201902240173.aspx,（中央社記者黃自強新加坡24日專電）台灣蔬果如何赴海外市場銷售，新加坡業者郭庭水說，台灣蔬果有競爭優勢，要注重市場導向，特別是生產、銷售與物流一體化流程，而非盲目生產，「種了東西，才找市場」。多年來與台灣農產品有業務往來的新加坡國際食品集團主席郭庭水今天向中央社記者表示，新加坡是貨物進出東南亞的重要樞紐，台星兩國可以合作建立獲核准的農場鑑定機制，讓優質蔬果隨時出口到新加坡市場。他認為，諸如台中、雲林、嘉義、台南、高雄、屏東等農業大縣，可考慮在新加坡設立辦事處，不僅貼近本地商家，深入了解消費習慣，與食品業者或超市建立制度化聯絡管道，再輻射發展到東南亞的泰國、馬來西亞、印尼等周邊國家。郭庭水受訪表示，台灣農特產品要推廣到東南亞國家銷售，當務之急是要以市場為導向，知道自己的市場在哪裡。內銷以外，最適合銷售的地方就是新加坡，主要原因在於新加坡消費力強，品質要求高，又沒有農業，食物全仰賴進口，對台灣農產品非常熟悉。郭庭水認為，台灣如欲外銷質量俱佳的蔬果，要了解市場需求及暢銷的產品，因時、因地制宜，栽種不同蔬果，絕對不是「種了什麼東西，才來找市場」。郭庭水以多年與台灣的業務往來經驗來說，認為台灣對市場操作性不佳，欠缺整體發展策略，有時高麗菜生產過盛，價格低落，有時卻非常昂貴，價格起伏很大，讓台灣蔬果有行無市，淪為「沒有價格的市場」，這樣的農業是不會賺錢的。他說，做農業的人一年四季都一定有固定銷售管道，價格才會高，台灣各縣市雖然相繼赴海外促銷蔬果，但不乏以「季節性因素」居多，也就是「生產過剩才赴海外找市場」的一次性交易。郭庭水認為，一旦交易完成，後續作業就好像放煙火一樣無影蹤，這就是「沒人在做市場分工」。因此，做食品的人一定要有一套管理方法與長遠的思維。另外，台灣第一線務農的人有務農專業，卻不擅長行銷與市場操作機制，導致農民吃虧，他以歐洲普遍運作的從產地以諸如300或500公克小包的包裝模式，直接從產地運抵新加坡等海外市場銷售，就能減少運送過程中再分裝的人力成本與降低產品損耗比率。對於台灣蔬果在新加坡等東南亞海外市場行銷，郭庭水說，台灣不妨利用知名主廚在新加坡餐館介紹如何烹煮台灣蔬果，或出版台灣蔬果食譜，這對推銷絕對有正向的利多。他說，台灣各縣市也可以派代表在新加坡長期蒐集並彙整市場資訊，讓第一線農民掌握第一手資訊，了解何種蔬果在什麼時節符合海外市場需求，這才是有計畫的生產模式。（編輯：郭中翰）1080224
