標題,分類,時間,網址,內文
壓歲錢不用怕亂花 建立正確理財觀念無價,產經,2019/02/04 09:51,https://www.cna.com.tw/news/afe/201902040016.aspx,（中央社記者邱柏勝台北4日電）每逢農曆春節，小朋友最期待領到長輩的壓歲錢，但父母怕小孩亂花，常會代為「保管」紅包。專家建議，父母應以「引導代替阻絕」，提前建立小孩正確理財觀念，或用壓歲錢替小孩建構保障。銀行理財主管表示，學齡前幼童日常生活開銷幾乎都由父母支付，基本上沒有用錢機會。但若他們已經到了可溝通的年紀，當他們領到壓歲錢時，父母先不要急著替他們存起來，應該藉機告訴孩子「儲蓄」的重要性，並帶著他們一起去開戶，讓他們有「這筆錢是屬於他們」的自主權，並讓他們知道儲蓄可以產生利息的概念，不過，理財主管亦表示，父母幫小孩存壓歲錢時，也可以留個一至兩成，讓小孩自己持有，並從「用錢」開始指導理財觀念。首先是協助建立記帳的習慣，當小孩知道自己口袋裡有多少錢，買東西後會剩下多少，他就會慢慢學習量入為出，也會分清楚哪些是自己最想要、最需要購買的東西。「千萬不要怕小孩亂買東西。」理財主管說，這對一般父母來說確實不容易，但這是讓小孩學習資源配置的第一步。「曾有客戶對我說，他有一次終於忍耐住，讓小孩自己去買喜歡的玩具，但後來小孩看上一個更想要的東西，卻因為錢不夠來找他，他便對小孩說，錢被你用完了，所以你要等之後發零用錢、有錢以後才能買。」以後小孩買東西前就會思考：這個東西是我最喜歡的嗎？反而成為一次成功的用錢觀念教育。理財專家也支持這種做法，他表示，既然決定讓孩子自己運用壓歲錢，就應尊重孩子的消費決定，「小孩子因為年輕，可承擔的風險與錯誤較大，即使金錢運用上出了差錯，只要及時改正就好；且從錯誤中學習，印象會更加深刻」。保險業者則建議，小孩一年當中拿到最多錢的時刻，就是春節期間領的壓歲錢，父母可善用這筆錢為小孩建構足夠保障，例如小孩容易感冒生病，甚至住院，此時買「實支實付」醫療險，有助減輕住院、看病時的醫療負擔，「取之於孩子、用之於孩子」。另外，若壓歲錢領得多，可替孩子規劃利變型壽險。保險業者說，利變型壽險與一般壽險的不同之處在於，利變型壽險有「宣告利率」機制，當宣告利率愈高，保單價值準備金累積也會愈快，則保戶就有機會獲得回饋分享金。如此一來，父母不僅為孩子增添一份保障，還可提前替孩子籌措未來的教育基金，一舉數得。（編輯：林孟汝）1080204
嘉聯益傳年節大規模裁員 桃園勞動局開工要查,產經,2019/02/04 13:03,https://www.cna.com.tw/news/firstnews/201902040062.aspx,（中央社記者吳睿騏桃園4日電）蘋果軟板天線供應商嘉聯益驚傳大規模裁員，桃園市政府勞動局今天表示，嘉聯益回報是員工統一填表格引起誤會，並未逼迫員工簽自願離職單，勞動局決定在11日開工後介入調查。媒體報導，蘋果軟板天線供應商嘉聯益科技公司驚傳裁員風波，有員工爆料觀音廠已停工超過2週，資方還逼迫近200名員工在農曆年前簽下自願離職單，意圖規避資遣費，引發員工強烈不滿。勞動局表示，市府接獲嘉聯益資遣通報，分別在1月29日及31日資遣員工36人及23人；對於逼迫員工簽自願離職單的控訴，嘉聯益說，是員工在統一填表作業時，針對離職、退休及資遣3個選項，誤以為公司要求簽自願離職單造成誤會。勞動局目前雖暫時接受嘉聯益公司的說法，但勞動局表示，在11日開工日後仍將派人前往嘉聯益科技公司介入調查，若員工爆料屬實，確有簽署自願離職單，公司未依規定資遣及給付資遣費等情事，市府將依違反勞基法規定重罰。嘉聯益公司除否認大規模裁員及逼迫員工簽自願離職單。嘉聯益公司表示，觀音廠確稼動率確實不高，才會調整人力，並強調正職員工資遣或轉出一定會按照勞基法規定，觀音廠這波資遣員工約20至30人，近期市況不佳，調整人力也是不得已。（編輯：方沛清）1080204
春節詐騙集團不休息 金管會：留意三角詐騙新手法,產經,2019/02/04 11:31,https://www.cna.com.tw/news/afe/201902040063.aspx,（中央社記者邱柏勝台北4日電）農曆春節將屆，各行各業開始放年假，但詐騙集團全年無休，春節前夕更是「趕業績」，利用民眾過節、警戒心鬆懈時詐騙。金管會提醒民眾，小心近年興起的「三角詐騙」，新年才能諸事順心。金管會表示，春節前後通常詐騙案件較多，歹徒除利用詐騙電話、LINE通訊軟體及臉書（Facebook）等方式誆騙民眾交付財物，或以提供退款或解除分期付款為由，引導民眾至自動櫃員機（ATM）進行轉帳。近年也出現新興的詐騙手法，詐騙集團可能利用春節商機進行三角詐騙，一方面假冒賣家，讓不知情的買方將貨款匯入真實賣家帳戶，再向真實賣家宣稱已交付貨款，趁機取走貨物。因此，金管會提醒民眾，春節期間應提高防騙意識，切勿輕信陌生人士來電，且ATM僅能進行轉帳及提款，並無退款及解除分期付款的功能，民眾若接獲疑似詐騙電話或訊息，請勿任意提供個人資料，並請立即撥打165反詐騙專線或110審慎查證。金管會也提醒民眾，從事網路交易需謹慎，應選擇安全有保障的網購平台，交貨方式可採面交或貨到付款方式，且不輕易將個人帳戶及隱私資料提供他人，新的一年才能諸事順心。金管會亦將持續與警政機關合作，保障民眾財產安全。另外，為瞭解春節期間各銀行ATM運作情形，並確保民眾使用ATM如遭遇問題時，金融機構可提供諮詢服務，金管會今天上午9時至10時，分別在台北市、新北市、新竹市、苗栗縣、台中市、彰化縣、台南市、高雄市及金門縣等9縣市，實地抽測金融機構ATM運作情形。金管會指出，經測試10家金融機構分行所設置ATM，除有一家銀行的金門分行ATM無現鈔及客服不順暢，已請銀行儘速改善外，其他被抽測的銀行均能順利提領現金，該ATM所標示的客服電話亦有專人接聽，運作順暢。金管會表示，金融機構於春節期間的金融服務因應措施，包括ATM全年不休息、支付工具不放假、電子銀行不中斷，及金融客服不打烊。由於春節假期較長，金管會也提醒各金融機構，應確保ATM補鈔順暢， 客服及ATM服務不中斷，使民眾安心過好年。（編輯：蘇志宗）1080204
不走全年無休 日迴轉壽司500店面統一公休,產經,2019/02/04 12:27,https://www.cna.com.tw/news/afe/201902040075.aspx,（中央社東京4日綜合外電報導）日本最大平價迴轉壽司業者「壽司郎」（Sushiro）在日本擁有逾500家店面，除了部分在賣場大樓內的店面，其餘約500家店將統一在本月5日和6日公休，暫時告別全年無休營業模式。日本放送協會（NHK）報導，全日本的壽司郎店面幾乎都會在2月5日和6日連休2天，目的是為了營造一個讓員工易於工作的環境。根據壽司郎宣布的內容，除了在賣場大樓的店面外，其他遍布日本約500家分店，都將在2月5日和6日統一公休。壽司郎一直以來都是維持全年無休的營業模式，但員工希望能明訂公休日，總公司因此決定明訂統一的公休日期。總公司為了確保必要人力，未來還會不會再實施統一公休日，將視對顧客造成的影響等來做進一步判斷。壽司郎總公司表示，雖然統一公休會對客人造成不便，但希望此舉能提高員工工作士氣及服務品質。除了壽司郎，日本幾間家庭餐廳業者及連鎖拉麵業者等，已在日本今年的元旦新年期間實施統一公休，讓日本過去一直以來的全年無休營業模式，慢慢出現轉變。（譯者：黃名璽/核稿：蔡佳敏）1080204
跡象顯示美國經濟強勁 日股收高,證券,2019/02/04 14:25,https://www.cna.com.tw/news/afe/201902040096.aspx,（中央社東京4日綜合外電報導）日本東京股市今天收高，受惠於日圓貶值，加上美國就業數據亮眼，市場對美國經濟抱持樂觀預期。日股日經225指數上漲95.38點或0.46%，收20883.77點；東證一部指數上揚16.70點或1.07%，收1581.33點。（譯者：陳昱婷/核稿：蔡佳敏）1080204
