標題,分類,時間,網址,內文
遠距辦公抗武漢肺炎 專家籲企業留意資安風險,產經,2020/02/17 16:28,https://www.cna.com.tw/news/afe/202002170176.aspx,（中央社記者吳佳蓉台北17日電）武漢肺炎傳染力凶猛，遠距辦公成企業維持營運、減輕疫情影響的重要工具，勤業眾信（Deloitte）提醒，別忽略因此所帶來的資安風險，建議確保4大環節，並對技術、流程及人員3面向進行優化。勤業眾信聯合會計師事務所風險諮詢服務副總經理林彥良今天表示，不少企業藉由取消海外出差、取消大型活動、分區分批辦公、部分員工居家辦公等措施降低疫情衝擊，不過，一般居家環境或臨時辦公場所的資安防護措施，無法與既有辦公場所管控相提並論，應正視開放遠端連線帶來的資料被竊取或遭監視風險。林彥良建議企業，應把握4大環節，強化資安，第一，正視網路環境安全問題，開放遠距連線前，應完備開啟外部網路連入稽核軌跡功能、依業務劃分連線網段、暫停或限制高網路流量、限制存取重要資料、嚴格授權等安全機制。第二，強化個人設備資安監控，並進行遠距工作行為監控，以免成為駭客攻擊破口。第三，針對移動設備進行資安管控，降低設備遺失、資料未及時刪除所造成的資料或營業祕密外洩風險。第四，落實遠距工作平台機密保護，加強身分驗證機制與確實保留資料存取軌跡。林彥良認為，面對防疫戰，企業應就技術、流程、人員3方面優化管理思維，以降低遠距辦公資安風險。技術面上，應強化網路監控機制，除防火牆設定裝置或IP限制，也應針對遠距工作流量進行監控、攔截和分析；已建置虛擬專用網路（VPN）的企業，也應檢視是否須建立專有加密通道。林彥良指出，流程面上，要做到多層存取與緊急應變，建議應依據資料機敏等級與緊急程度建立多層次存取機制，並導入跳板機制，例如：限制外部遠端連線僅能連入辦公室網段的中繼主機，或強化身分認證；同時，企業應預先規劃異常事件因應流程，並需強化對外與員工溝通，以兼顧企業營運和資安保護。林彥良說，人員方面，要強化網路安全認知，災難事件發生時，不肖人士可能趁亂發起惡意攻擊，因此，緊急狀況中的安全認知宣導極為重要，企業應培養員工具備保護數據資產、辨識安全威脅和高風險行為的能力。世界衛生組織（WHO）2月11日將武漢肺炎定名為COVID-19（2019年冠狀病毒疾病）。（編輯：趙蔚蘭）1090217
勝麗去年稅前淨利3.47億元 EPS 5.06元,證券,2020/02/17 16:51,https://www.cna.com.tw/news/afe/202002170183.aspx,（中央社記者鍾榮峰台北17日電）車用CMOS影像感測器元件（CIS）封測廠勝麗自結去年第4季稅前淨利新台幣5100萬元，每股稅後純益0.6元，去年全年稅前淨利3.47億元，每股稅後賺5.06元。勝麗表示，1月整體營收仍超過2億元門檻，車用營收比重及出貨量仍持續超過公司整體的7成，綜觀車用訂單持續放量、安控營收緩步回升，預計今年將繼續成長動能。勝麗除了通過歐洲、日本及美國主要大廠客戶嚴格認證審查外，持續開拓其他國際新客源。展望中長期在5G場域逐漸布建完成、先進駕駛輔助系統（ADAS）及自駕車產業將大幅成長，勝麗市占率預估逐步提升，深化車用CIS感測元件領域。同欣電和勝麗在14日股東會分別通過股份轉換案，換股比例是勝麗股東按照持有普通股1股，換發同欣電1.244股，勝麗將成為同欣電100%持有子公司。股份轉換基準日暫定6月30日，完成後勝麗將下櫃。勝麗自結1月合併營收新台幣2.02億元，較去年同期2.15億元減少5.88%。公司指出主要是1月適逢農曆年假部分產線停工，加上武漢肺炎疫情蔓延為配合客戶尚未復工，因此延後出貨。（編輯：趙蔚蘭）1090217
Visa台灣區總經理 3/16起趙麗芳接掌,產經,2020/02/17 16:59,https://www.cna.com.tw/news/afe/202002170188.aspx,（中央社記者劉姵呈台北17日電）信用卡發卡組織Visa今天宣布，自3月16日開始，將任命在資訊科技及金融服務領域擁有20餘年經驗的趙麗芳接掌台灣區總經理要職，提供台灣市場最佳的支付及金流服務。Visa今天發布新聞稿表示，原台灣區總經理麻少華將接任中國區策略專案暨企劃副總裁，協助Visa進入中國市場的專案，公司將任命趙麗芳為新台灣區總經理，負責Visa台灣的業務營運、策略規劃以及領導管理，任期於3月16日正式開始。Visa指出，趙麗芳在加入之前，曾擔任過聯想（Lenovo）全球服務策略暨個人電腦服務副總裁，也於IBM接掌多個高階管理職位，最後職位為全球企業諮詢服務大中華區副總裁兼營運長。趙麗芳也曾任Visa策略專案暨企劃副總裁，在中國策略規劃與市場開放扮演重要的角色；嚴格來說，她在資訊科技及金融服務領域，擁有跨越多國市場、超過20餘年的實戰經驗。趙麗芳出生於台灣，擁有國立台灣大學國際企業系學士學位及國立台灣大學工商管理學碩士學位。Visa表示，過去麻少華帶領Visa台灣業務的14年間，讓數位支付使用率倍增，Visa金融卡使用也更為普及，實體商店感應刷卡交易普及率達到7成，同時，導入Visa代碼化服務、推動Visa全球通匯服務。Visa大中華區總裁于雪莉說，隨著電子、行動支付的興起，未來相信可借重趙麗芳優秀的業務管理能力及對市場的深刻經驗，帶領Visa在數位變革時代下，將台灣營運推向新高峰。（編輯：郭萍英）1090217
開學季網購筆電買氣增3成 電競機成銷售黑馬,產經,2020/02/17 19:56,https://www.cna.com.tw/news/afe/202002170224.aspx,（中央社記者吳家豪台北17日電）電商業者富邦媒今天表示，旗下momo購物網受惠開學3C採買潮，近一個月筆電買氣年增3成，預估開學季3C買氣將成長4成；網路家庭觀察，電競筆電成為開學季銷售黑馬。下週起各級學校陸續開學，筆記型電腦買氣成長。富邦媒觀察近一個月網站上筆電銷售，主要客群為25歲以下及45至49歲年齡層消費者，其中25歲以下大學生族群人數成長4成，替兒女選購開學筆電的家長人數也明顯增加。富邦媒發現，為方便上下課隨身攜帶，具有高度行動性的輕薄款筆電為開學季主要選購趨勢，銷量約占整體筆電6成，熱銷價格帶約落在2萬元至3萬元之間，尤其14吋搭載Intel Core i5處理器及SSD固態硬碟容量的商品最受消費者青睞。網路家庭旗下PChome 24h購物表示，因應開學季到來，今年以來筆電銷量已超越去年同期表現，且帶動筆電周邊的買氣，近年來開學季筆電的採購趨勢仍以14吋、1.4公斤的輕薄款為主。PChome 24h購物進一步分析，近年來電玩商機崛起，為同時滿足課業與娛樂的需求，不少學生開始追求更高效能的筆電，帶動電競筆電銷售占比逐年攀升，已占整體開學筆電銷量40%，讓電競筆電和輕薄筆電雙雙成為市場主流商品。PChome 24h購物也發現，為擁有更好的使用體驗，可輔助筆電使用的周邊商品也成為熱門選擇，包括易於攜帶的無線滑鼠、能調整螢幕角度的散熱架、能防水減壓的筆電包等。（編輯：趙蔚蘭）1090217
電子五哥陸廠陸續復工  產線恢復進度不一,產經,2020/02/17 17:52,https://www.cna.com.tw/news/afe/202002170227.aspx,（中央社記者潘智義台北17日電）武漢肺炎疫情影響陸廠生產步調，筆記型電腦代工5大廠商廣達、仁寶、英業達、緯創、和碩在中國大陸的工廠至今已陸續復工，但因外地員工返廠有自主管理的隔離需求，產能恢復的比重不盡相同。英業達指出，在中國有上海、南京、重慶、南昌廠，主要產能所在的上海廠復工近6成，重慶廠復工比例相對較低，南昌廠原本的產能就不大，主要生產重心還是看上海廠。仁寶表示，昆山廠已在2月10日復工，南京、重慶、成都廠雖然較慢復工，但目前為止也全面復工；至於產能恢復的進度上，目前以農曆春節期間未停工的產線，恢復狀況最好。廣達在中國大陸有上海、常熟、重慶廠，都已陸續復工，因配合各地方政府政策及檢疫措施，實際復工狀況仍待進一步釐清。和碩在中國大陸有昆山、上海、蘇州廠，皆於2月10日全面復工，但各廠區生產線的產能恢復幾成，則不對外公布。緯創表示，中山廠有很多廠區，但已在上週陸續復工；重慶、成都廠近日已全面復工。筆電代工業者指出，多數廠區配合中國大陸當地政策在2月10日陸續復工，而重慶、成都市官方訂出的復工日為2月17日，所有廠區今天也均已全面復工，但生產線實際產能恢復狀況的比例無法揭露。業者低調表示，雖然各廠區全面復工，但也都面臨外地員工返回工廠有自主管理的隔離需求，人員並未全數到位，仍待時間慢慢補足人力需求。至於部分工廠配合客戶出貨需求，春節過年期間有部分產線未停工，因此沒有復工的問題。除了人員返廠的問題外，復工後的上游零組件能否順利供應也是業者關心的問題。一旦庫存上游零組件用完，零組件廠是否能馬上供應，或是交通運輸是否恢復順暢，也都是影響產品能否順利生產及出貨的因素。由於變數仍多，現在很難說復工後產線運作恢復幾成。世界衛生組織（WHO）2月11日將武漢肺炎定名為COVID-19（2019年冠狀病毒疾病）。（編輯：張良知）1090217
防疫需求 業者搶遠距教學與辦公商機,產經,2020/02/17 18:01,https://www.cna.com.tw/news/afe/202002170231.aspx,（中央社記者吳家豪台北17日電）武漢肺炎疫情延燒，大專院校已延後開學，多媒體廠商訊連科技今天宣布免費提供各大專院校使用遠距教學及視訊會議系統；互動資通則已推出遠距辦公及視訊會議解決方案。由於許多國際學生或居家隔離的學生無法如期回到校園上課，訊連推出「U校園防疫專案」，免費提供各大專院校「U簡報」與「U會議」，每校各50套，於防疫期間協助各大專院校快速打造遠距教學平台。訊連「U簡報」可提供500人同時觀看的線上直播，教師端可透過個人電腦，整合簡報、視訊、語音及白板進行課程直播；學生端可使用個人電腦及行動裝置觀看課程直播，並於課程中使用聊天室進行互動。「U會議」的線上會議室可提供100人參與會議，可用來進行小組討論或線上簡報。此外，國內私有雲企業即時通訊廠商互動資通先前已宣布推出「team+私有雲企業協作即時通訊」解決方案，可透過即時訊息溝通、視訊會議、網路電話及應用程式介面（API）串接公司內部E化系統，協助企業快速導入遠距辦公。互動資通創辦人暨董事長郭承翔指出，客戶群中各科技大廠的台灣幹部皆暫緩返回中國，並以不去中國出差為原則；為維持防疫期間正常營運，需居家隔離或申請在家工作的員工，都能透過team+內部溝通協作平台與公司同步作業、即時連繫處理相關業務。世界衛生組織（WHO）2月11日將武漢肺炎定名為COVID-19（2019年冠狀病毒疾病）。（編輯：郭萍英）1090217
中國央行釋寬鬆訊號  滬指創8個月最高單日漲幅,證券,2020/02/17 18:18,https://www.cna.com.tw/news/afe/202002170242.aspx,（中央社記者沈朋達上海17日電）中國人民銀行（中國央行）今天宣布下調中期借貸便利（MLF）利率，受寬鬆訊號激勵，陸股深滬兩市今天雙雙大漲作收，其中滬指更創下自2019年6月以來單日最高漲幅。受到中國人民銀行釋放寬鬆訊號激勵，陸股今天開高走高，深滬兩市收盤皆大漲。路透社報導，滬指創下自2019年6月以來的單日最高漲幅。上海證券交易所綜合股價指數（上證綜指）今天收盤報2983.62點，上漲66.61點，漲幅為2.28%；深圳證券交易所成份股價指數（深證成指）報11241.50點，上漲325.19點，漲幅為2.98%。深滬兩市合共成交人民幣9372.03億元，其中滬指成交3670.14億元，深指成交5701.89億元。盤面上各式類股普遍上漲，其中農業、國防軍工和物流等類股領漲，兩市共超過180檔個股漲停。中國人民銀行今天表示，為對沖逆回購到期等因素的影響，維護銀行體系流動性合理充裕，今天開展人民幣2000億元（約新台幣8600億）中期借貸便利（MLF）操作，期限為一年，MLF由之前的3.25%再下調10個基點，到3.15％。同時，也進行1000億元7天期逆回購操作。（編輯：繆宗翰）1090217
高端：武漢肺炎疫苗 拚下半年人體臨床試驗,證券,2020/02/17 22:21,https://www.cna.com.tw/news/afe/202002170244.aspx,（中央社記者韓婷婷台北17日電）高端疫苗今天宣布已與美國國衛院（NIH）完成合作合約簽署，共同開發武漢肺炎（COVID-19）疫苗，高端表示，預計最快今年上半年完成動物試驗，下半年啟動人體臨床試驗。高端疫苗16日與NIH完成簽約，今天隨即召開記者會宣布，總經理陳燦堅表示，高端疫苗是NIH繼Moderna後第2家合作的公司；美國國衛院將提供其最新研發的武漢肺炎（COVID-19）候選疫苗與相關生物材料，提供高端疫苗在台灣進行動物試驗，以做為評估人體臨床試驗及開發新一代疫苗的重要依據。目前已安排合乎生物安全規範的動物活體實驗室，將開始執行動物試驗。高端疫苗執行副總李思賢表示，此次美國NIH所開發的COVID-19候選疫苗，是採用NIH過去針對SARS、MERS-CoV所建立的冠狀病毒抗原製備平台（基因重組棘蛋白表達系統）進行開發，並藉由過去MERS疫苗的開發經驗，快速建立了COVID-19疫苗製備與動物試驗設計。李思賢指出，美國NIH也正在同步執行各項臨床前試驗，以準備盡速展開人體臨床試驗，美國NIH評估本項產品有機會在今年第2至3季啟動人體臨床試驗。高端疫苗將積極諮詢官方主管機關，力拚今年上半年完成動物試驗，並規劃執行在台灣的人體臨床試驗，以驗證COVID-19候選疫苗的安全性與療效。高端疫苗為美國NIH在亞洲地區的重要防疫與研發夥伴，合作項目包含登革熱疫苗、茲卡疫苗等開發案。陳燦堅表示，基於過去長期合作關係，當新疫情爆發後，雙方立即展開協商，在短短20天內即簽訂合作合約。陳燦堅指出，美國NIH為全球最大型的生物醫學研究機構。NIH旗下的國家過敏和傳染病研究所（NIAID）是全球最重要的公衛研究單位，也是目前全球針對武漢肺炎（COVID-19）疫苗開發速度最快的研發單位。世界衛生組織（WHO）已將武漢肺炎定名為COVID-19（2019年冠狀病毒疾病）。（編輯：黃國倫）1090217
南山對尹崇堯懲處公文 保險局：不符合公司治理,產經,2020/02/17 22:13,https://www.cna.com.tw/news/afe/202002170246.aspx,（中央社記者劉姵呈台北17日電）南山人壽大股東尹衍樑15日親自下令，對副董事長尹崇堯及總經理許妙靜各記一支大過。金管會保險局今天表示，此懲處未依照公司程序處理，不符合公司治理，已發函南山要求說明。去年因「境界」新系統出包遭金融監督管理委員會重罰，並下令暫停投資型保單業務的南山人壽，因連2年業績排名掉至業界第3名，無論是去年的新契約保費收入或今年1月契約保費皆連輸給國泰人壽與富邦人壽。大股東尹衍樑15日親自下令，發出內部懲處公告，各記副董事長尹崇堯及總經理許妙靜一支大過。尹崇堯為南山人壽大股東、潤泰集團總裁尹衍樑獨子，當天內部公告一貼出，隨即震撼南山內部，南山員工們議論紛紛，有人認為是「以儆效尤」，深怕下一波將連累基層員工。南山工會當時也向中央社記者表示，針對大股東直接介入保險公司經營管理，恐嚴重影響保險公司的專業經營，將向金管會反映。據知情人士指出，此懲處並未經過董事會討論決議，因此保險局當天接獲此消息是相當震怒，並立刻發函要求南山作說明。保險局官員今天表示，保險公司要對高層進行懲處，必須經過董事會提案，有一定的作業程序。此外，大股東與董事也必須尊重專業經理團隊，經營團隊也必須善盡職責，遵守公司應有的程序，此懲處明顯不符合公司治理。官員說，已要求南山人壽在本週內要提出此事件的相關說明，以及對於公司治理方面要如何改善，避免再出現相同問題，引發爭議。（編輯：張良知）1090217
新台幣續陷區間整理  尾盤豬羊變色貶0.5分,產經,2020/02/17 18:54,https://www.cna.com.tw/news/afe/202002170257.aspx,（中央社記者潘姿羽台北17日電）市場持續籠罩疫情陰影，今天新台幣匯率續陷區間盤整，開盤後走升，尾盤則上演豬羊變色戲碼，收盤收30.056元，貶值0.5分，台北及元太外匯市場總成交金額11.77億美元。新台幣兌美元今天開盤價為30.055元，最高29.981元、最低30.056元。外匯交易員表示，2019年冠狀病毒疾病（武漢肺炎）仍帶來不確定性，不過台灣在亞洲地區受影響程度相對輕微，使得台灣股匯市較為穩定，但就近日匯市來看，央行往往在尾盤進場調節，有力守30元關卡的味道。外匯交易員也說，最近美元稍強，亞幣則無太大的波動，市場缺乏題材的情況下，近日新台幣都在區間盤整，缺乏新意，未來股匯市發展仍得視疫情變化而定。（編輯：黃國倫）1090217
貿協赴杜拜推廣台灣食品  科威特網紅現身相挺,產經,2020/02/17 19:51,https://www.cna.com.tw/news/afe/202002170266.aspx,（中央社記者吳柏緯台北17日電）中東最大的波灣國際食品展昨天登場，擁有240萬粉絲的科威特網紅阿不都卡苓（Abdul Kareem）現身台灣館，不但品嚐台灣美食，更將心得放上社群網站與粉絲分享。中東與北非地區最大食品專業展「2020年波灣國際食品展」2月16日盛大登場，經濟部貿易局與外貿協會籌組台灣館，包含家會香、宜蘭食品、奇美食品、老楊食品、金車、歐典、幸鑫、太允、黑松及卜立等多家台灣食品與飲料業者共同參與，盼藉由展會敲開中東食品市場的大門。食品展首日，擁有240萬粉絲、多次來台的科威特知名網紅阿不都卡苓，應外貿協會杜拜台貿中心邀請，現身台灣館，不但與參展台灣廠商互動訪談、品嚐台灣美食，更將當天的心得放上社群網站與粉絲分享。貿協表示，盼透過網紅的影響力，將台灣優質食品介紹給當地民眾，提升台灣食品在中東地區知名度。駐杜拜台北商務辦事處處長楊司恭也赴台灣館為廠商加油打氣。貿協說，這次食品展吸引超過4200家各國食品業者參展，預計將吸引10萬人次參觀。（編輯：郭萍英）1090217
投資人不回頭 人民幣存款餘額下探71個月新低,產經,2020/02/17 19:13,https://www.cna.com.tw/news/afe/202002170267.aspx,（中央社記者潘姿羽台北17日電）央行今天公布1月底人民幣存款餘額降至2559.15億元，下探71個月以來最低位，央行官員指出，人民幣投資工具更多元，存款利率走低，資金停泊在人民幣定存的意願自然下降。中央銀行今天發布銀行辦理人民幣業務概況，今年1月整體人民幣存款餘額為人民幣2559.15億元，較上月減少51.18億元，下探2014年3月以來低點。進一步觀察外匯指定銀行（DBU）存款餘額，較上月減少人民幣44.3億元，降至2245.8億元。央行外匯局行委陳婉寧解釋，DBU以法人戶存款餘額減少較顯著，原因包含壽險業匯出人民幣資金做國外投資、電子業匯出支付三角貿易貨款，以及有3檔國際債券新募集發行。至於國際金融業務分行（OBU）存款餘額降至人民幣313.35億元，較上月減少6.88億元，主因是電子業支付三角貿易貨款，以至於存款餘額減少。人民幣存款餘額趨勢逐步走低，陳婉寧分析，人民幣投資工具愈來愈多，投資人為了取得比較好的報酬，會尋求其他投資工具，資金留在存款的機率自然下降。央行提供最新銀行各天期的最高牌告利率，1個月期最高者為板信商銀2.2%，3個月期為兆豐商銀2.4%，6個月期是上海商銀的2.78%，9個月期是日盛商銀2.45%，1年期則為陽信商銀2.65%。陳婉寧直指，1月底時，3個月期還有3%，如今各天期利率全面跌破3%。央行也公布1月人民幣匯款總額為898.06億元，較上月大減人民幣332.42億元，不過陳婉寧表示，這是因為1月適逢農曆春節連假，營業天數減少，商業活動也變少，連帶影響匯款量。至於1月下旬爆發的2019年冠狀病毒疾病（武漢肺炎），導致許多企業復工困難，是否會影響後續人民幣業務，陳婉寧認為，金融業比較早恢復上班，但金融業服務實體產業，在產業復工不全面、實體產業營業活動減少的情況下，金流應該也會受影響。（編輯：黃國倫）1090217
環團質疑三接環評造假 中油：並無不實,產經,2020/02/17 19:23,https://www.cna.com.tw/news/afe/202002170271.aspx,（中央社記者蔡芃敏台北17日電）環團質疑三接環評造假，沒有鑽探資料，呼籲第三天然氣接收站應先停工。中油表示，環評報告均已呈現地質鑽探資料，也通過環評大會審查，內容並無不實。天然氣將逐步成為台灣供電要角，不過，中油第三天然氣接收站案涉及大潭藻礁生態保育，環團反對聲浪不斷。搶救大潭藻礁行動聯盟今天表示，認為中油環評違法、內容造假，質疑觀塘案審查並無鑽探資料，呼籲啟動自然地景審議，三接工程應先停工。中油今天發布新聞稿表示，中油在2018年提交的環現差暨環差報告均已呈現地質鑽探資料，內容並無不實，且相關報告已經通過環評大會審查，環團對中油有誤會。中油進一步說明，「桃園縣觀塘工業區開發計畫」及「桃園縣觀塘工業區工業專用港」已分別於88年及89年通過環評審查，而中油在106年併購東鼎公司並取得開發權益，所提交環差分析報告也納入東鼎先前執行的地質鑽探資料。此外，中油先前已經進行2次海域及地形監測，也曾進行側掃聲納、淺層震測及港域現場試挖等，監測資料含括海床地形及地質，足以研判工業區及工業港地形地質及礁體分布情況。根據中油先前規劃，將如期建置第三液化天然氣接收站，2023年1月時將供應大潭電廠新增燃氣機組天然氣。（編輯：趙蔚蘭）1090217
華紙廣東廠獲開工許可 積極提升產能稼動率,產經,2020/02/17 19:39,https://www.cna.com.tw/news/afe/202002170277.aspx,（中央社記者潘羿菁台北17日電）中華紙漿晚間發布重訊，子公司廣東鼎豐紙業今天獲得當地政府核准復工，目前積極提升產能稼動率，盼盡力彌補延遲復工的營運缺口。另外，為保障員工健康，廣東鼎豐紙業內部已成立防疫工作小組。廣東鼎豐紙業主要生產長纖維紙漿、書寫及印刷用紙，為華紙在中國大陸唯一產線；另一家子公司肇慶鼎豐林業，則是掌握上游原料，負責苗木培育、造林、伐木等加工及運輸。先前廣東廠尚未復工，華紙透過國內花蓮廠、台東廠或高雄廠調度產能。廣東廠今天恢復開工後，全數產能可望到位。至於疫情對紙業整體影響，華紙認為好壞參半，正面加持包括醫療用品紙箱需求提升，以及大家減少出外活動改採外送服務，即食品的紙盒訂單增加；至於在負面衝擊則是預期工業用紙會有遞延現象，目前中國各地工廠陸續開工，產能是否短期內順利恢復，仍需觀察。華紙認為，只要基本面存在，待疫情獲得控制，工業用紙的需求頂多只是遞延而非減少；此外，由於中國競爭對手受到疫情影響，產能遭限制無法出口，也讓華紙近期接獲轉單效應。（編輯：張良知）1090217
