標題,分類,時間,網址,內文
上市公司1月營收年減逾1成 3公司展延申報,證券,2020/02/17 13:15,https://www.cna.com.tw/news/afe/202002170102.aspx,（中央社記者潘智義台北17日電）受農曆春節假期，工作天數減少影響，台灣證券交易所表示，上市公司除3家因嚴重特殊傳染性肺炎事件獲准展延申報1月營收，已申報公司1月營收較去年同期衰退10.73%。證交所指出，本國上市公司866家，及第一上市外國公司75家，除艾美特（開曼）國際公司、開曼東明控股公司、光麗光電科技等3家，因近期嚴重特殊傳染性肺炎事件影響，經金管會核准展延申報期限外，其餘938家已於109年2月15日前完成今年1月營收申報作業。上述3家未申報公司都在中國大陸設廠，且營收來自當地占比頗高，例如艾美特在中國大陸生產小家電，主攻中國大陸內銷市場，受武漢肺炎（2019年冠狀病毒疾病）疫情波及，中國管制工廠開工及對外交通影響，這些公司延後公告1月營收。上市公司1月營收統計顯示，全體上市公司營收總計新台幣2兆4681億元，較去年同期衰退2966億元，減幅10.73%，營收成長公司211家，衰退公司727家。全體上市公司1月營收呈現成長趨勢主要產業為半導體業、觀光事業及資訊服務業，衰退趨勢主要產業為電器電纜業、鋼鐵工業及玻璃陶瓷業。證交所表示，全體上市公司1月營收成長較大產業，半導體業因個別公司受惠手機及高速運算需求動能增強，觀光事業受惠1月適逢春節連假旺季，資訊服務業因個別公司大型專案完成驗收，所以營收較去年1月成長。另外，1月營收衰退較大產業，電器電纜因個別公司的子公司去年同期有建案出售收入，比較基期較高，鋼鐵工業因鋼鐵量價下跌，玻璃陶瓷業因市場景氣低迷，使1月營收較去年1月衰退。（編輯：鄭雪文）1090217
陽明：待中國復工順暢 海運需求可望反彈,產經,2020/02/17 13:35,https://www.cna.com.tw/news/afe/202002170107.aspx,（中央社記者潘羿菁台北17日電）受到武漢肺炎疫情與低硫油政策上路兩大影響，陽明海運董事長謝志堅認為，今年供給與需求可能呈現雙降，不過需求下降為短暫發貨延遲，供給量下降是最為明顯現象，待中國復工逐步到位，海運需求有望反彈。謝志堅引用法國航運諮詢網站Alphaliner今年1月預測數據，全球運輸供給成長約3.5%、需求則是下降2.2%，不過他自己觀察，目前供給量的成長不見得樂觀，主要是低硫油限令今年上路，許多船隻進船廠安裝脫硫器，原本預估安裝期約45天，現已拉長至59天，甚至有17%比重船隻安裝期拖至80天之久，運輸供給都被卡在船廠。此外，原本排定船隻保養的船塢，同樣忙著接單脫硫器造成保修費用大漲，謝志堅預期，在低硫油價格高昂加上保修費用高漲，老舊船隻就被淘汰，「我幾乎可以大膽講，供給量3.5%可能下降」。至於在需求面，主要受到武漢肺炎疫情影響，導致從中國出口貨運量減少，不過謝志堅上週請業務了解評估認為，只要3月中國工廠逐步復工，這些貨量需求都在，只是延遲發貨，整體認為從中國運輸美國約八、九成訂單尚且，並未取消。因此謝志堅預估，需求下降僅是短暫現象，只要復工狀況順利，後續甚至會有急單發貨狀況。目前陽明約有20條船隻規劃加裝脫硫器，預計約在下半年陸續交船，運用高、低硫油價差將減緩成本衝擊。在運價展望，陽明海運業務長張紹豐指出，雖然現階段中國出口運價下跌，但是回程運價有機會調漲，主要是歐美線倉位略顯不足，此外，近期陽明海運剛簽回來的美國線價格不錯，整體對運價不悲觀。世界衛生組織（WHO）2月11日將武漢肺炎定名為COVID-19（2019年冠狀病毒疾病）。（編輯：楊凱翔）1090217
開低收黑 台股跌52.19點,證券,2020/02/17 13:48,https://www.cna.com.tw/news/afe/202002170114.aspx,（中央社台北17日電）台北股市今天開低走低，收盤跌52.19點，為11763.51點，跌幅0.44%，成交金額新台幣1121.12億元加權指數開盤為11770.30點，盤中最高11775.56點，最低11724.82點；不含金融股指數9932.67點，跌51.07點。八大類股漲跌幅：泥窯股跌0.34%、食品股漲0.73%、塑化股跌0.41%、紡織股跌0.17%、機電股跌0.70%、造紙股漲0.38%、營建股跌0.28%、金融股跌0.01%。委買張數1181萬9027張，委賣張數646萬3968張，成交張數412萬5507張。收盤時上漲269家，下跌570家，持平113家。成交量前5名個股為群創、元大S&P原油正2、元大滬深300正2、富邦VIX、友達。漲幅前5名個股為如興、太極、茂矽、富邦媒、敦泰。跌幅前5名個股為明輝-DR、矽力-KY、銘旺科、世芯-KY、誠創。1090217
2月台指期跌40點,證券,2020/02/17 13:58,https://www.cna.com.tw/news/afe/202002170118.aspx,（中央社台北17日電）台北股市今天終場跌52.19點，收11763.51點。2月台指期以11770點作收，下跌40點，與現貨相較，正價差6.49點。台灣期貨交易所為近2個月指數期貨契約訂定開盤參考價為，2月期貨11810點、3月期貨11789點。台股今天終場跌52.19點，收11763.51點，成交金額新台幣1121.12億元。2月台指期貨以11770點作收，跌40點，成交8萬7093口；3月期貨以11751點作收，跌38點，成交7074口。實際收盤價格以期交所公告為準。1090217
2月電子期跌 金融期漲,證券,2020/02/17 14:01,https://www.cna.com.tw/news/afe/202002170121.aspx,（中央社台北17日電）台北股市今天下跌52.19點，收11763.51點。2月電子期收520點，下跌3.50點，逆價差0.02點；2月金融期收1366.60點，上漲2點，逆價差0.12點。2月電子期以520點作收，下跌3.50點，成交2884口。3月電子期以519.45點作收，下跌3.20點，成交349口。電子現貨以520.02點作收，下跌3.82點；2月電子期貨與現貨相較，逆價差0.02點。2月金融期貨以1366.60點作收，上漲2點，成交1100口。3月金融期以1365.40點作收，上漲3點，成交137口。金融現貨以1366.72點作收，下跌0.10點；2月金融期貨與現貨相較，逆價差0.12點。實際收盤價以期交所公告為準。1090217
股王大立光翻紅 台股5日線失而復得,證券,2020/02/17 14:21,https://www.cna.com.tw/news/afe/202002170124.aspx,（中央社記者鍾榮峰台北17日電）台灣本土出現首例武漢肺炎死亡病例，大立光翻紅，台股跌幅收斂，終場下跌52點，5日線失而復得。法人表示，需觀察疫情是否控制及中國供應鏈復工狀況，留意歐美疫情發展。台灣本土出現首例武漢肺炎死亡病例，台股今天早盤一度下跌90點，跌破11800點整數關卡，不過盤中亞股走揚，台股跌幅收斂，遊走5日均線約11761點附近，尾盤金融跌幅收斂，台股5日線失而復得。加權股價指數終場收在11763.51點，下跌52.19點，跌幅0.44%，成交值來到新台幣1121.12億元。電子股下跌0.73%，金融股小跌0.01%。主要電子權值股整理休息，股王大立光尾盤翻紅終場收在4845元，小漲0.52%，晶圓代工龍頭台積電終場收在331.5元，下跌1.04%。鴻海收在83.9元，下跌1.18%。日月光投控收在76.7元，小跌0.9%，聯發科收在398元，下跌1.85%。金控股漲跌互見，國泰金收在41.4元，小跌0.6%，富邦金收在45.95元，小跌0.43%。中信金收在22.95元，小漲0.66%。台新中國通基金經理人魏永祥表示，台股受到疫情影響，多數個股股價修正，評價也來到低檔位置，長線成長趨勢個股投資價值浮現，反而是逢低布局好時機。展望基本面，魏永祥指出，受到疫情影響，台股第1季企業獲利下修難免，不過隨夏季來臨與各國防疫措施加強，預期第2季中期後疫情可獲控制，屆時疫情對供應鏈供給面影響應可降低，遞延需求可出籠，產業發展軌道可恢復正常。觀察台股後市，魏永祥表示，需觀察疫情是否得到控制，留意中國當地疑似與確診人數成長速度是否放緩；其次觀察後續中國供應鏈復工狀況；再者留意中國以外地區等歐美主要消費大國，是否也受到疫情波及，若當地受到疫情影響不大，全球基本消費需求尚可獲得保障，對股市影響也將減低。世界衛生組織（WHO）2月11日將武漢肺炎定名為COVID-19（2019年冠狀病毒疾病）。（編輯：楊凱翔）1090217
對抗新冠狀病毒 台康生技雙主軸助力,產經,2020/02/17 15:26,https://www.cna.com.tw/news/afe/202002170132.aspx,（中央社記者韓婷婷台北17日電）武漢肺炎疫情延燒，台康生技表示，因應2019年冠狀病毒，政府已迅速架構防疫網，且學研界也啟動集結各方抗體及疫苗開發技術，台康生技可以快速提供治療性抗體藥物平台技術，並提供強化疫苗能力的載體蛋白，與國內外合作對抗病毒。蛋白質藥廠台康月初正式接獲日本厚生勞動省授權獨立行政法人醫藥品醫療機器總合機構PMDA（Pharmaceuticals and Medical Devices Agency）的「醫藥品適合性調查結果通知書」，正式成為二岸三地首家由日本官方法規單位GMP查核通過的生物藥製造廠。台康生技總經理劉理成表示，武漢肺炎（2019年冠狀病毒COVID-19）疫情蔓延，政府已迅速架構防疫網，且學研界也啟動集結各方抗體研發、篩選技術及生產平台，可以無縫接續學研開發成果，在5個月內提供治療用抗體進入動物及人體試驗，目前海內外都有合作洽談中。台康生技副總經理張志榮表示，長期對抗2019年冠狀病毒，預防性疫苗開發是目前專家公認，也是國內外積極發展的一個領域。冠狀病毒膜上的醣蛋白或者是合成肽抗原，更是國內外積極探討找出有效疫苗的重要方向。張志榮指出，台康在2年前已成功開發出一載體蛋白CRM197（EG74032），主要應用於感染性疫苗及抗腫瘤疫苗；這類混合疫苗目前已有多項上市產品。目前EG74032已具GMP量產規模，且已供應歐洲、日本、加拿大多家公司及供應美國NIH-VRC（國衛院疫苗研究中心）進行疫苗研發，並也進入人體臨床試驗中。劉理成表示，台康生技對抗新冠狀病毒的技術平台及產品，將可在短時間內提供抗疫的關鍵技術能量，期望能和國內外研究機構及疫苗廠一同開發疫苗或治療藥物，協助政府及病患擺脫疫情陰霾。張志榮表示，台康委託研發製造生產（CDMO）業務從2013年開始展開，2019年年營業收入已達新台幣4億元以上，年增逾4成；今年隨著獲得日本PMDA認證，原本觀望的客戶現在信心度大增，國外廠商詢問度增加，有形無形效益發酵中，對今年的成長動能深具信心。（編輯：林孟汝）
市場擔憂武漢肺炎疫情擴散 日股收黑,證券,2020/02/17 14:41,https://www.cna.com.tw/news/afe/202002170136.aspx,（中央社東京17日綜合外電報導）市場擔心俗稱武漢肺炎的2019年冠狀病毒疾病（COVID-19）疫情在日本國內擴散，加上日本上季經濟創5年多以來最大萎縮幅度，日本東京股市今天收盤下跌。日經225指數下跌164.35點或0.69%，收23523.24點。東證股價指數（TOPIX）下挫15.10點或0.89%，收1687.77點。（譯者：李宛諭/核稿：嚴思祺）1090217
武漢肺炎疫情波及飯店住房餐飲 業者積極突圍,產經,2020/02/17 14:59,https://www.cna.com.tw/news/afe/202002170142.aspx,（中央社記者江明晏台北17日電）武漢肺炎疫情衝擊全球觀光產業，國內上市櫃飯店業的住房率也受到波及，多數飯店趁此整修，也祭出優惠刺激住房率，餐飲部份則增加外送等服務創造營收。武漢肺炎疫情升溫，導致全球觀光人口流動緊縮，國內5星飯店的住房也受到影響，晶華副總經理張筠表示，台北晶華酒店今年2月住房率預估約在6成左右，和往年7至8成的水準相比，確實受到影響，但目前3至5月的住房訂單都還算正常，不過由於疫情變化很大，消費者都還在觀望，後續還要持續觀察。台北晶華酒店先前則宣布，至3月2日止推出「晶安心住房專案」2天1夜新台幣6000元，並且加碼贈送價值超過8000元的抵用券，盼拉抬住房。她表示，台北晶華酒店以日客為主，港澳客在被限制入境後，貢獻已變成零，目前日本客和國旅客成為兩大支柱，晶華也趁此時機進行部分樓層整修，盼調養生息後，迎接疫情落幕後的住房需求。而近年來，餐飲對飯店的貢獻度節節高升，疫情來襲，恐導致宴會市場急凍，晶華指出，餐飲部份影響較小，館內餐廳目前只有包廂商務客等訂單取消或延後，一般家庭聚會狀態如常，情人節餐廳當然還是客滿，而宴會廳則透過外賣和美食外送等途徑，創造額外營收。寒舍集團旗下酒店包含台北喜來登、台北寒舍艾美、寒舍艾麗、礁溪寒沐，4家飯店陸續將旗下餐廳、住宿設施的整修工作，與設備升級計畫提前。寒舍指出，餐廳訂席雖然或有臨時取消，但仍持續有新的訂位電話與臨時前往餐廳的散客；大型宴會目前已有客人選擇延期、取消或減少桌數。面對消費者減少外食的情況，也推出外送、外帶的優惠活動。台北喜來登大飯店與外送平台合作，2月比薩屋義式料理外帶成長約10%至15%。住房方面，順應寒假延長，台北喜來登、礁溪寒沐推出住房優惠，為刺激國人國內旅遊住房，雲朗集團的君品酒店則祭出史上最低房價與月租方案，更推出住雲品即送花蓮飯店一晚，高雄翰品住宿即送等值餐飲，希望讓整體住房受影響幅度較少。六福旅遊集團也首度推出「六福莊十周年慶買一送一」住房專案，內容包含關西六福莊、台北六福萬怡酒店各住一晚，優惠達23折，銷售期間至3月31日止，成功刺激住房率提升。（編輯：郭無患）1090217
三大法人賣超台股48.42億元,證券,2020/02/17 15:00,https://www.cna.com.tw/news/afe/202002170143.aspx,（中央社台北17日電）台股今天跌52.19點，收在11763.51點，成交值新台幣1121.12億元。三大法人外資及陸資、投信賣超，自營商買超，合計賣超新台幣48.42億元。自營商買超7.86億元，投信賣超14.19億元，外資及陸資賣超42.09億元。台新中國通基金經理人魏永祥表示，台股受到武漢肺炎疫情影響，多數個股股價修正，評價也來到低檔位置，長線成長趨勢個股投資價值浮現，反而是逢低布局好時機。世界衛生組織（WHO）2月11日將武漢肺炎定名為COVID-19（2019年冠狀病毒疾病）。1090217
延後對美降息時間點預估 瑞銀：最快落在4月,產經,2020/02/17 15:05,https://www.cna.com.tw/news/afe/202002170144.aspx,（中央社記者吳佳蓉台北17日電）瑞銀（UBS）今天針對美國降息預測發表最新看法，維持今年將降息3次預測，但預估降息時間點將往後延，由原先預測的3月、4月及6月降息，延後至4月、6月及7月三次降息。瑞銀投資銀行全球經濟研究部說明，瑞銀對聯邦公開市場委員會（FOMC）降息的預測主要基於美國聯準會（Fed）對關鍵經濟數據的看法。瑞銀表示，Fed主席鮑爾（Jerome Powell）日前出席國會聽證會時，雖指出經濟下行風險，反映認為上半年經濟可能放緩，但對於經濟情勢仍偏向樂觀，加上近期一些經濟數據表現優於當初想像，因此，預期將不會立刻降息。針對過去一週公布的經濟數據，瑞銀解讀，最新公布的美國零售銷售數據，反映出美國消費已進一步出現放緩，經濟出現下滑跡象，不過，另一方面，初請失業金人數呈現下降，反映製造業的下跌趨勢已觸底，觸底時間點比先前預估的早了7週。至於續請失業金人數則有所下降，但仍居高位，說明最近失業人口的雇傭率低；1月核心CPI季增率上漲0.24%，比預期高出0.04個百分點，略高於趨勢；租金強勁上漲，機票和外宿價格自12月的疲態中反彈。展望未來一週即將公布的經濟數據，瑞銀預測，地區製造業調查結果可能會顯示情況略有改善；樓市資料可能說明建設活動與銷售持平；1月FOMC會議記錄將描繪出1月時美聯儲對經濟活動略更偏鴿派的立場。（編輯：黃國倫）1090217
武漢肺炎衝擊大陸8吋晶圓代工 台廠有機會受惠,產經,2020/02/17 15:11,https://www.cna.com.tw/news/afe/202002170145.aspx,（中央社記者鍾榮峰台北17日電）中國武漢肺炎疫情持續，MIC表示，中國大陸8吋晶圓代工產能占全球比重約14.6%，若疫情擴大，台廠有機會受惠。台系封測業者在中國大陸產能占比小，產能可從台灣廠區因應。觀察中國武漢肺炎疫情對台灣半導體產業影響，資策會產業情報研究所（MIC）表示，從生產面觀察，中國大陸短期內的半導體生產受影響程度輕微，但若疫情延長，原物料和物流影響恐受波及。從晶圓代工和封測來看，MIC表示，台系晶圓代工和封測業者位於中國大陸產能占比小，若疫情持續擴大，損失的產能可從台灣廠區因應。若疫情持續擴大，影響中國大陸晶圓製造生產，MIC表示，由於中國大陸8吋晶圓代工產能占全球比重約14.6%，影響範圍較其他產品線大，台灣晶圓代工業者將有機會受惠。若從整體產業復工狀況來看，MIC指出，目前中國大陸產業復工率仍低，除了湖北省外，其他大部分省分在10日已經復工，不過地方政府對於復工仍有嚴格條件限制，廠商須取得許可後才能復工，在疫區內的員工難以返回工作崗位，臨時招工困難，也影響正常生產。MIC表示，生產據點位於中國大陸且以當地為目標市場的廠商，受疫情影響最大，例如陸系品牌業者包括華為、OPPO和小米等。主要生產據點在台灣的業者，短期有機會受惠轉單效益。從上下游供應鏈來看，MIC分析，主力產線位於中國大陸的高科技電子產業恐受衝擊最大，其中金屬件、塑膠件、或電子零組件等供應商，產線主力仍在中國大陸，系統代工業者也主要在中國大陸生產組裝，短期內估計台灣業者在台生產需求增加，但受限整體供應鏈仍難與中國大陸切割，仍會有零件供應問題。觀察中國大陸半導體產業生產概況，MIC分析，主要以京津環渤海地區、長三角地區、珠三角地區、以及中西部和其他地區為主，這四大產業聚落占中國大陸超過90%以上積體電路企業營運據點。湖北省是被選定為2025中國製造重要發展基地，包括武漢新芯、長江存儲、武漢弘芯等主要半導體廠商落腳，其中長江存儲是中國主要的國產記憶體廠商，不過目前仍處於技術開發階段，產能占全球比重仍低。從晶圓產能來看，MIC分析，中國大陸晶片製造產業約占全球晶圓製造產能的12%，其中約60%的12吋晶圓產能用於生產記憶體，主要廠商包括英特爾（Intel）、SK海力士（SK Hynix）、三星、長江存儲以及長鑫存儲等。8吋產能主要用於晶圓代工，主要廠商包括中芯、華虹、台灣的台積電和聯電等。從半導體封測來看，MIC分析，中國大陸晶片封測產業產值約占全球封測產值比重約24.4%，其中中國大陸廠商包括江蘇長電、天水華天以及通富微電等。世界衛生組織（WHO）2月11日將武漢肺炎定名為COVID-19（2019年冠狀病毒疾病）。（編輯：蘇志宗）1090217
武漢肺炎列法定傳染病 保險局：舊醫療險理賠從寬,產經,2020/02/17 15:17,https://www.cna.com.tw/news/afe/202002170146.aspx,（中央社記者劉姵呈台北17日電）武漢肺炎疫情持續升溫，台灣累計確診案例達20例，不少民眾關心舊的醫療險保單能否理賠。保險局表示，若舊保單將法定傳染病列除外責任，業者會採從寬方式理賠。2019年冠狀病毒疾病疫情持續升溫，台灣衛生福利部疾病管制署已其列為第五類法定傳染病。根據中央流行疫情中心最新宣布，台灣累計至今確診案例已達20例，16日也出現首例死亡確診病例。壽險業者表示，現行大部分醫療險，不論是實支實付型或是日額型，均已將法定傳染病納為保險範圍，可依約理賠，保戶若因確診就醫所衍生相關醫療費用，在保單條款約定的承保範圍內，保險公司應依保單條款約定給付保險金。不過，有許多1998年以前投保的實支實付型醫療險，會將法定傳染病列為除外責任，引發許多民眾關注，若確診2019年冠狀病毒疾病、或是被要求居家隔離，過去買的舊醫療險保單，是否可申請理賠。金融監督管理委員會保險局官員今天表示，若發現手上保單將法定傳染病列為「除外不保項目」，保戶也不要太過擔心，基於有利於被保險人考量，保險局已下令要求各家保險公司要給付慰問金，或採其他從寬方式處理。目前像是國泰人壽、富邦人壽、中國人壽與康健人壽等壽險公司，秉持關懷保戶立場，已陸續公告將「從寬且不主張除外責任」或「從新從優理賠原則」，依照保單條款各項醫療給付項目約定，負保險責任，給予理賠。這些壽險公司也表示，若因確診2019年冠狀病毒疾病而必須入住醫院的「負壓隔離病房」治療，會從寬依加護病房項目給付理賠金，保戶在出院時請醫師於診斷證明書加註入住「負壓隔離病房」的日期即可。基於陪同保戶度過艱困時期，有不少壽險公司也陸續擴大醫療保障，如新光人壽、全球人壽與元大人壽均表示，不論新舊保單，都不主張除外責任，將依保障內容給予理賠。不過，業者提醒，若保戶在染病期間被要求居家檢疫、居家隔離、自主健康管理等，則不屬於理賠範圍內。世界衛生組織（WHO）2月11日將武漢肺炎定名為COVID-19（2019年冠狀病毒疾病）。（編輯：林孟汝）1090217
疫情未降溫旅行社股價腳軟 燦星旅慘跌停,證券,2020/02/17 15:18,https://www.cna.com.tw/news/afe/202002170147.aspx,（中央社記者江明晏台北17日電）新冠肺炎疫情未見降溫，旅行社業者持續面臨市場急凍，今天股價腳軟，雄獅、鳳凰、五福、易飛網及山富全數收跌，傳出求售消息的燦星旅更慘摔跌停。世界衛生組織（WHO）11日將武漢肺炎定名為2019年冠狀病毒疾病（COVID-19）；時序進入2月下旬，新冠肺炎自爆發以來疫情未見降溫，旅行社短期營運首當其衝，雄獅早盤一度下跌2.57%，終場跌幅收斂，收在73.3元，下跌0.95%。五福下跌1.04%，收19元，鳳凰終場下跌1.77%、收36.15元，易飛網終場下跌1.51%、收9.8元。市場傳出，近年營運低迷的燦星旅求售，雖然燦星旅否認此消息，但旗下門市持續精簡已是事實，一路從49間據點砍至17間；業界人士評估，燦星旅門市多在燦坤內，未來若出售也難切割；燦星旅今天股價盤中下殺跌停價5.29元鎖住。旅遊業者私下表示，現在疫情影響肯定是全面性的，不只侷限在中國。台灣出境到東南亞、東北亞和入境台灣的旅遊市場，全面受到衝擊；但業者非常清楚防疫期間旅遊產業當然有「急凍期」，絕對支持政府嚴格的防疫政策，才能盡快縮短陣痛期。部分旅行社業者持樂觀態度表示，「2、3月本來不是傳統旺季，影響不算是很深」。業者認為，中國以外地區旅遊市場將在4月恢復，中國則在第2季復甦，正好銜接母親節出遊和獎勵旅遊、暑期旅遊等旺季，且不排除疫情落幕後，有爆量訂單出現，誰能率先掌握訂單也是旅遊業最重要的事。另有旅行社業者表示，這次受傷最深的應該是那些「專營中國低價團」的小型旅行社，原先就因為政治因素大受影響，現在疫情等於是「雪上加霜」，不排除市場會出現「汰弱留強」的盤整期。（編輯：趙蔚蘭）1090217
新台幣貶0.5分 收30.056元,產經,2020/02/17 16:04,https://www.cna.com.tw/news/afe/202002170168.aspx,（中央社台北17日電）台北外匯市場新台幣兌美元今天收盤收30.056元，貶0.5分，成交金額7.69億美元。新台幣兌美元今天開盤價為30.055元，最高29.981元、最低30.056元。1090217
