標題,分類,時間,網址,內文
義大利政治危機等利空打擊 歐股收黑,證券,2019/08/10 01:09,https://www.cna.com.tw/news/afe/201908100003.aspx,（中央社倫敦9日綜合外電報導）歐洲股市今天下跌，英鎊兌歐元匯率貶創兩年新低，主要因義大利政治危機、英國經濟萎縮，以及美中貿易爭端等利空打擊所致。倫敦FTSE 100指數下跌0.44%，收在7253.85。法蘭克福DAX 30指數下跌1.28%，收在11693.80。巴黎CAC 40指數下跌1.11%，收在5327.92。（譯者：徐睿承）1080810
貿易戰和經濟前景堪慮 美股收黑,證券,2019/08/10 05:03,https://www.cna.com.tw/news/afe/201908100007.aspx,（中央社紐約9日綜合外電報導）在全球經濟前景堪慮之際，投資人對美中貿易爭端感到憂慮，美股今天收黑。道瓊工業指數終場下跌90.75點，或0.34%，收在26287.44點；標準普爾500指數下跌19.44點，或0.66%，收在2918.65點。以科技股為主的那斯達克指數下跌80.015點，或1.00%，收在7959.141點。（譯者：徐睿承）1080810
沙國採取行動穩定市場 油價勁揚,產經,2019/08/10 05:45,https://www.cna.com.tw/news/afe/201908100009.aspx,（中央社紐約9日綜合外電報導）沙烏地阿拉伯採取行動穩定市場，原油價格今天勁揚，漲幅為近一個月以來最大。紐約市場西德州中級原油的9月期貨價格上漲1.96美元，收在每桶54.50美元，為7月10日以來最大漲幅。倫敦市場北海布倫特原油的10月期貨價格上漲1.15美元，收在每桶58.53美元。（譯者：徐睿承）1080810
美股多空激戰週線收黑  貿易戰走向牽動後市,證券,2019/08/10 15:48,https://www.cna.com.tw/news/afe/201908100012.aspx,（中央社記者尹俊傑紐約9日專電）美國總統川普今天暗示美中貿易戰線恐拉長，導致美股收黑，結束上沖下洗的一週。在低接買盤支撐下，3大指數週線跌幅都不到1%，分析認為，美債與人民幣將成美股後市觀察指標。美中上週在上海貿易談判未能突破僵局，北京本週以放任人民幣重貶、暫停增購美國農產品因應川普最新關稅威脅。川普今天上午在白宮向媒體表示，美國尚未準備好和中國達成貿易協議，「我們等著看中國是否履約出席9月的磋商」。除暗示美中預定9月在華府貿易談判存在變數，川普還說，美國不會和遭華府制裁的中國電信設備巨擘華為做生意。不過，福斯財經新聞網（FBN）隨後報導白宮澄清川普發言，指川普的意思是美國政府不採購華為產品。川普表態左右美股走勢，道瓊工業指數早盤最多下挫280點，午盤一度翻紅，終場下跌90.75點，跌幅0.34%，收在26287.44點。標普500指數下挫19.44點，跌幅0.66%，收在2918.65點。以科技股為主的那斯達克綜合指數下跌80.01點，跌幅1%，收在7959.14點。晶片股表現疲弱，費城半導體指數下跌1.8%，台積電美國存託憑證（ADR）下挫1.2%，英特爾（Intel）與美光科技（Micron Technology）股價跌幅都超過2.5%。叫車服務業者優步（Uber）昨天盤後公布財報顯示上季大虧52億美元，今天股價大跌6.8%。隨著美中貿易戰急遽升溫，本週全球股市有如坐雲霄飛車，投資人忐忑不安，資金紛紛湧向黃金與政府債券等避險標的。川普因不滿中國未兌現增購美國農產品的支票，上週揚言9月1日起另對約3000億美元中國輸美貨品加徵10%關稅。人民幣5日貶破7元兌1美元關卡，促使華府宣布中國為匯率操縱國，投資人憂心兩國貿易爭端恐蔓延成貨幣戰。在恐慌氣氛中，道瓊指數5日崩跌767點，創今年最糟單日表現。6日因人民幣匯率止穩、低接買盤支撐股市，道瓊指數勁揚311點，止住連5黑頹勢。7日小跌22點後，道瓊指數8日在科技股領軍下猛漲371點，幾乎完全收復週線失土。這段期間，美股在貿易戰憂慮與聯邦準備理事會（Fed）9月進一步降息的預期心理之間拉扯，多空激烈交戰。道瓊指數本週累計下挫0.75%，標普500與那斯達克指數週線跌幅分別為0.5%、0.6%。與此同時，避險資產行情看俏，國際金價走勢銳不可當，7日突破每盎司1500美元大關，衝上2013年以來最高水準。美國公債也成為投資人避險熱門選擇，殖利率隨價格上漲而走低。備受關注的10年期美債殖利率本週一度跌破1.6%，今天雖回升到1.74%，但與3個月期美債殖利率仍有極大差距，凸顯投資人看壞經濟前景，並預期聯準會將再次降息支撐經濟。美股揮別動盪的一週，但因美中貿易與貨幣戰前景混沌不明，金融市場短期內恐難恢復穩定。眼見人民幣兌美元本週「破7」有助中國出口，白宮貿易顧問納瓦洛（Peter Navarro）今天接受財經媒體CNBC專訪時指控北京操縱匯率，企圖抵銷美方加徵關稅的衝擊，並警告中國如促貶人民幣，華府將「強力還擊」。中國人民銀行（中國央行）本週雖重申將維持人民幣匯率穩定，官方設定的人民幣兌美元中間價仍跟進市場匯率「破7」。投資人緊盯人民幣走勢之際，CNBC報導分析，美債殖利率與人民幣匯率走向將成為美股後市觀察重點。（編輯：王永志）1080810
晶圓代工第3季展望  台積電獨旺,證券,2019/08/10 09:50,https://www.cna.com.tw/news/afe/201908100021.aspx,（中央社記者張建中新竹10日電）晶圓代工業傳統旺季來臨，因全球經濟疲軟，聯電（2303）與世界先進（5347）第3季營運恐將旺季不旺，僅台積電（2330）展望樂觀，業績表現可望維持旺季水準。聯電與世界先進7月業績同步攀高，聯電營收攀升至新台幣137.28億元，創1年來新高；世界先進營收24.93億元，為6個月新高水準。不過，聯電與世界先進對整體第3季營運展望保守，聯電預期，因全球經濟疲軟，客戶將持續管控庫存，恐影響第3季晶圓出貨量僅較第2季小幅增加2%至4%，產品平均售價上揚1%，季營收將季增約3%至5%。世界先進也指出，因經濟成長趨緩，供應鏈庫存水位仍高，客戶需求保守，預期第3季營收將約69億至73億元，將較第2季持平至成長5.5%。相較聯電與世界先進預估第3季旺季營收成長恐不到6%，台積電第3季營運展望樂觀許多，預期季營收將達91億至92億美元，季增18%。智慧手機平台將是推升台積電第3季營運強勁成長的最大動能，其餘高效運算、物聯網及車用等平台銷售也將同步成長。除華為海思儲備庫存需求外，聯發科（2454）行動平台銷售動能依然強勁，超微（AMD）多款7奈米新產品上市，都是支撐台積電第3季營運得以維持旺季水準的助力。（編輯：黃瑞弘）1080810
貿易戰延燒 半導體下半年景氣添變數,證券,2019/08/10 11:29,https://www.cna.com.tw/news/afe/201908100038.aspx,（中央社記者張建中新竹10日電）美中貿易戰持續延燒，為半導體產業下半年旺季景氣添增變數，已有創意與環球晶等半導體廠陸續調降今年營運目標。美中貿易戰發展詭譎多變，雙方6月底達成貿易戰休兵共識，只是美中談判代表7月底在上海會談無結果，美國總統川普突然宣布9月1日對剩餘3000億美元中國輸美商品加徵10%關稅。美國財政部又在人民幣兌美元匯率貶破7元大關後，宣布將中國列為匯率操縱國，川普今天更暗示可能取消原訂9月舉行的新一輪談判，讓美中緊張關係升溫。不過，白宮貿易顧問納瓦洛表示，美國仍打算與中國談判代表舉行新一輪貿易會談。貿易戰持續延燒，為半導體產業景氣添增變數，包括聯電、世界先進、聯詠、創意、台勝科與環球晶等多家半導體廠第3季營運恐受影響，業績表現將旺季不旺。其中，聯詠與創意預期，第3季業績將僅較第2季持平表現；台勝科與環球晶第3季業績更恐較第2季滑落。環球晶表示，國際局勢動盪是半導體產業發展的重要不確定因素，也造成半導體短期需求保守觀望。受客戶需求降溫影響，環球晶7月營收驟降至新台幣44.77億元，月減12.6%，並創17個月新低。環球晶預期，今年營收將僅較去年持平，低於原先預期的微幅成長。創意也因消費市場復甦比預期緩慢影響，加上7奈米設計複雜度提高，部分客戶委託設計時程可能遞延至2020年上半年，預期今年營收恐將下滑2位數百分點，低於原預期的持平表現。後續效應是否進一步擴大，值得觀察。（編輯：郭萍英）1080810
蘋果Q2出貨量下跌 被OPPO擠出三大銷售龍頭,產經,2019/08/10 12:03,https://www.cna.com.tw/news/afe/201908100059.aspx,（中央社舊金山9日綜合外電報導）市場研究機構馬基特公司（IHS Markit）指出，蘋果公司（Apple）上一季被中國企業Oppo擠出前3大銷售寶座，在不斷萎縮的智慧型手機市場失寵。法新社報導，根據馬基特公司本週發布的報告，蘋果全球智慧型手機銷售量跌至第4名，第2季iPhone手機出貨量為3530萬支，略遜於Oppo的3620萬支。馬基特公司統計，市占率高達23%的南韓電子大廠三星（Samsung）仍穩坐智慧型手機龍頭，賣出7510萬支手機，而市占率達18%的中國華為則以5870萬支奪得亞軍。馬基特智慧型手機研究及分析主任洪朱熹（Jusy Hong）在線上貼文中說：「蘋果在出貨量方面持續面臨挑戰，而這個趨勢不太可能在短期內扭轉。」分析師推斷，這家以美國加州為據點的科技巨擘雖然積極推銷iPhone，但相較於價格親民的Android手機，新一代智慧型手機價格「高檔」，就連幾年前的舊型號都要價不斐。市調公司Counterpoint Research、國際數據公司（International Data Corporation）等其他智慧型手機市場追蹤機構則推斷，雖然iPhone第2季出貨量下跌，但蘋果在全球出貨量上仍是季軍。市場追蹤者同時也報告，雖然智慧性手機市場萎縮，並正值美中貿易戰緊張之際，華為出貨量仍上升。身為5G網路領頭羊的華為，因為疑似替中國情資單位開後門，而遭美國總統川普列入黑名單，儘管如此，Counterpoint副研究主任巴札克（Tarun Pathak）在公司市場報告中說：「禁令帶來的效果沒有在這一季轉變成下跌的出貨量，但未來就不會是這個情況。」他說：「華為接著幾季度可能在中國本土市場採取積極手段，並會在那裡出現部分成長，但不足以抵銷海外出貨量下跌。」根據Counterpoint，華為、Oppo、Vivo、小米及Realme等中國企業合計的全球市占率，在第2季達到42%新高。分析師米西拉（Varun Mishra）說：「這些品牌積極往中國外擴張並達到成長，抵銷自家市場飽和的影響。他們的策略及產品組合更符合當地需求及偏好，而這也是他們的主要優勢之一。」（譯者：侯文婷/核稿：張曉雯）1080810
博通併賽門鐵克事業 專家：兼具財務策略效益,證券,2019/08/10 13:51,https://www.cna.com.tw/news/afe/201908100081.aspx,（中央社記者張建中新竹10日電）美國半導體廠博通（Broadcom）宣布以107億美元收購賽門鐵克（Symantec）企業安全事業。工研院產業科技國際策略發展所研究總監楊瑞臨認為，對博通兼具財務與策略效益。博通與賽門鐵克在這宗交易激勵下，股價同步走高，分別漲4.75美元及0.07美元，漲幅1.75%及0.31%，比起那斯達克指數下跌80.015點，跌幅達1%，兩公司股價表現相對強勢。楊瑞臨表示，博通先前曾惡意提議併購手機晶片廠高通（Qualcomm），因白宮以國家安全為由阻擋交易而以失敗收場。博通之後陸續收購博科（Brocade）和組合國際電腦（CA Technologies），如今又要收購賽門鐵克企業安全事業。觀察博通一連串收購動作，高通與博通同為晶片廠，且產品線以消費性的手機晶片為主，與博科、CA與賽門鐵克企業安全事業屬性差異大，楊瑞臨認為，博通的收購行動應以財務面為主要考量，除可挹注營收與獲利外，投資報酬率也是重要評估指標。隨著人工智慧（AI）與5G發展，資訊安全在資通訊產業的重要性將更趨重要，軟體又是重中之重，楊瑞臨說，博通收購賽門鐵克企業安全事業對未來營運發展將兼具策略意義。楊瑞臨表示，博通惡意併購高通遭到挫敗，對博通發展是一重要轉捩點，因為博通之後併購觸角逐步轉向軟體業，發展方向與英特爾（Intel）相似，朝雲端、資料中心邁進。楊瑞臨說，在當前技術發展快速時代，自主研發恐緩不濟急，博通不斷透過併購壯大，台灣廠商或許可以跟進更積極併購，強化競爭力。（編輯：郭萍英）1080810
中國貨幣互換協議挹注 土耳其外匯儲備進補,產經,2019/08/10 13:55,https://www.cna.com.tw/news/afe/201908100082.aspx,（中央社伊斯坦堡9日綜合外電報導）美媒披露，中國人民銀行6月匯給土耳其價值10億美元的資金；這是北京當局在土耳其選舉月的重要時刻，提供土耳其總統艾爾段的最大奧援。美媒根據知情人士的消息報導，這是土耳其和中國自2012年簽訂貨幣互換協議以來，首次從中國取得這麼龐大的資金。北京的資金挹注讓安卡拉得以在伊斯坦堡舉行地方選舉，國際投資人憂心土耳其政治金融動盪之際，充實外匯儲備。德國馬歇爾基金會（German Marshall Fund of the United States）土耳其事務主任恩盧希札契克利（Ozgur Unluhisarcikli）表示，這意味著艾爾段（Recep Tayyip Erdogan）透過和俄羅斯與中國等國家打造夥伴關係，重新調整土耳其的國際關係，有了成果，但這有違土耳其和西方盟國的關係，恐造成和西方盟友的進一步疏離。恩盧希札契克利指出：「這類短期融資來源無法應付土耳其的長期需求。絕對無法取代土耳其和美國及西方國家的長期關係。」儘管如此，來自中國的資金顯示，土耳其在和西方國家陷入空前緊張之際，致力分散外國投資來源的努力，有了成果。財政部長阿爾巴拉克（Berat Albayrak）曾表示，北京是深具潛力的夥伴，土耳其亟欲吸引中國的投資。土耳其和中國7年前簽訂貨幣互換協議，每3年換約。而在今天這筆資金曝光前，中國幾乎從未根據這項協議，提供土耳其資金。（譯者：劉淑琴/核稿：張曉雯）1080810
越南巧聖廟中元普渡  見證台商深根貢獻歷史,產經,2019/08/10 14:23,https://www.cna.com.tw/news/afe/201908100088.aspx,（中央社記者吳柏緯河內10日電）由越南台商集資建造的巧聖廟，今天舉行盛大的中元普渡儀式。僑務諮詢委員楊玉鳳指出，巧聖廟不只是當地台商的信仰中心，也見證台商在越南深耕、奉獻的歷史。平陽省的巧聖廟今天上午舉行一年一度的中元普渡儀式，祈求國泰民安。由於早年赴越南平陽省投資的台商多以木器製造、出口為主，因此，當時建廟時就以木匠之祖「魯班」做為主要祭祀的神祇。談起巧聖廟建立的緣由與歷史，楊玉鳳告訴中央社記者，這與台商在越南長期的貢獻有關。楊玉鳳指出，台商赴越南投資，至今已超過30年，除了經商的本業，也參與地方的活動、建設，甚至在越南遭遇天災時，主動募款賑災，越南許多角落都能看到台商留下的身影。2005年時，當地台商會提出想要建立一座廟宇做為信仰寄託，很快就得到當地政府支持，不但協助找地，相關程序也很快批准，這是一件很不容易的事情。礙於國際情勢，越南與台灣的官方機構無法直接交流，但雙方的民間交流並未因此受阻，反而因為民間機構的交流，在越南人民心中留下許多不錯的印象。楊玉鳳說，各地的台商會雖然都只是民間機構，但是舉辦各式活動時，當地的首長、副首長幾乎都會出席，而且如果有活動等需求，當地政府也都會主動協助。楊玉鳳回憶，現任越南總理阮春福，過去在廣南省擔任省長時，也曾幫忙當地台商會舉辦義診等活動，當時不但安排場地、宣傳，更協助打理許多行政事務。此外，越南遭遇天災襲擊時，當地台商出錢出力，也在越南人民心中留下正面的印象。楊玉鳳表示，越南過去多次受豪雨襲擊造成重大災情，各地台商會都會主動發起募款，並交由總會統一捐贈給相關單位，協助賑災。（編輯：郭萍英）1080810
人民幣兌美元破7 目的顧慮影響一次看懂,產經,2019/08/10 15:37,https://www.cna.com.tw/news/firstnews/201908100091.aspx,（中央社記者吳佳蓉台北10日電）5日人民幣兌美元貶破死守已久的「7元」大關，全球股匯市驚嚇重挫，但隨人民幣貶勢未如預期急遽後，亞幣由貶轉升；人民幣後市如何發展、貿易戰戰線是否延燒至貨幣戰，外銀、學者這樣解讀。不滿美中貿易談判牛步，2日美國總統川普突然在推特上揚言，將於9月1日對剩餘3000億美元中國商品加徵10%關稅，瞬間拉高市場緊張氛圍。隨川普投下變化球，中國也反擊，宣布停止向美國採購農產品；本週更先後鬆手讓人民幣兌美元的在岸、離岸及中間價貶破「7元」重要心理關卡，為2008年金融海嘯以來首現，刺激川普隨即點名將中國列入匯率操縱國。美、中雙方你來我往，引發外界擔憂，中國人行可能促貶人民幣作為對抗美國貿易戰武器，加上今年以來已有不少國家央行態度「轉鴿」，光本週就有印度、泰國、紐西蘭及菲律賓等4央行有降息舉動，更使市場關注，貨幣戰、貨幣競貶是否真會發生。●人民幣兌美元匯價「破7」，中國人行真要「放手」？5日人民幣兌美元在岸及離岸價格雙雙貶破7元兌1美元大關，8日中國外匯管理局公布的人民幣中間價也「破7」，皆為2008年金融海嘯以來首見，挑動全球市場敏感神經。渣打銀行財富管理處投資策略部主管劉家豪認為，觀察本週人民幣中間價雖連日下調，至8日降至7.0039元兌1美元，創逾10年新低，不過，下調幅度接連幾日小於市場預期。根據官方公式，人民幣中間價主要是由前天收盤價、對一籃子貨幣變動情形及「逆週期因子」決定，其中「逆週期因子」屬於中國央行的「政策性調控」手段。劉家豪向中央社記者解釋，6日及7日實際中間價下調幅度，都小於市場根據客觀數據計算的結果，反映中國人行實際上是利用「逆週期因子」，拉回人民幣貶幅，表態雖然不再「守7」，但也無意加速促貶人民幣，也未對匯價「放手」；當市場解讀到上述訊息，人民幣等亞幣即普遍由貶轉升。中經院大陸經濟所所長劉孟俊也認為，雖然人民幣「破7」，但連日以來匯價也暫時僅在7元關卡上下震盪盤旋。雖然市場對「破7」反應劇烈，但對中國人行來說，面對目前情勢，未必需要耗費更多外匯存底，將7元當成底線，反而可消除市場對護盤的心理預期。劉孟俊指出，另一方面，判斷人民幣「破7」偏向中國採取的預防性動作，9月川普若針對剩餘3000億元中國商品加徵10%關稅，還有空間以貶值來因應；不過，根據市場估算，若美國進一步將加徵關稅拉高至25%，人民幣貶值也難抵銷衝擊，長期來看，匯率應不會是化解關稅打擊的主要解方。●人民幣接下來怎麼走，中國人行真可無後顧之憂進行促貶？渣打主管劉家豪預估，人民幣將持續面臨貶值壓力，但會呈現緩貶格局；估算假設美國真的再對剩餘3000億美元中國商品加徵10%關稅，人民幣兌美元貶到7.2至7.25元可抵銷衝擊，假設上述情況發生，人民幣可能緩步朝此價位靠攏。對中國人行來說，人民幣貶太多，進口價格將相對變得太貴，衍伸內需問題，也會造成償還外債壓力升高。中經院學者劉孟俊也指出，因為一些內部壓力，人民幣很難大貶或久貶，首先，中國石油、糧食很高比重都靠進口，人民幣貶太低，立刻會對進口物價、通膨造成走升壓力；其次是，中國短期須償還的外債比重偏高，人民幣貶值，將升高償債成本。劉孟俊表示，中國雖然企業債、地方債、家庭債等債務總計占GDP比重與歐美等國差不多，但實際上很高比重都是在2008年後快速累積的債務，不像歐美國家是長期累積，短期還款壓力更高。累計至2018年底，中國外債餘額達人民幣1兆9652億元，其中，短期債務比重就高達64.7%，加上中國金融系統性風險仍高，都是牽制人民幣難以長期或過度貶值的因素。●人民幣「破7」，多國央行宣布降息，繼貿易戰後，貨幣戰真會開打？台經院景氣預測中心主任孫明德認為，中國人行讓人民幣「破7」，看來警告意味較強，並非放手促貶，反映在本週人民幣匯價，走勢也是由貶轉升。他指出，另一方面，為怕資本外逃或外資縮手，中國一直對外喊話，維持市場信心，加上中國希望能提升人民幣國際化，推動一帶一路，人民幣若一直貶值，市場反而更信仰美元，不利保持人民幣國際地位，綜合判斷認為，人民幣「破7」目的並非要要開啟貨幣戰。孫明德表示，確實今年以來已有近20國央行陸續降息，美國聯準會（Fed）8月1日也預防性降低1碼，但都是考量經濟發展，重點在於自保，拿起的是盾牌，不是為了競貶開戰。他說，貿易戰開打後，全球經貿情勢開始走弱，尤其是出口導向國家，不少經濟數據轉為疲弱，目前看來降息大多是為了以寬鬆貨幣政策，刺激國內經濟，與過去以貶值作為武器，提升出口表現的模式並不相同。（編輯：郭萍英）1080810
法說會旺季來臨 下週逾40家密集登場,證券,2019/08/10 16:13,https://www.cna.com.tw/news/afe/201908100118.aspx,（中央社記者張建中新竹10日電）美中貿易戰升溫，影響台股本週走勢劇烈震盪，預料貿易戰將持續牽動台股後市，此外，下週將有超過40家廠商舉行法人說明會，是否掀起新一波法說會行情值得觀察。台股週五因利奇馬颱風來襲而休市，本週指數跌54.55點，跌幅約0.52%，留下長達314.45點的下影線，4個交易日成交量共新台幣5178億元，低於上週的6518億元。醫材廠鐿鈦與醫療電腦廠醫揚12日將參加櫃買市場業績發表會，為下週法說會旺季揭開序幕。兩公司上半年營運同步繳出不錯成績單，獲利分別增加63%及84%，每股純益5.61及7.65元。液晶顯示器製造廠佳世達9日才決定斥資近20億元參與聚碩及勝品電通私募增資案，分別取得聚碩33%股權及勝品20%股權，強化解決方案軟硬整合實力及優化現有事業，預計12日召開法說會。筆記型電腦代工廠廣達、英業達與工業電腦廠樺漢將同時於13日舉行線上法說會，在美中貿易戰持續延燒下，3公司下半年旺季營運展望備受投資人關注。（編輯：郭萍英）1080810
俄火箭測試爆炸 原能會：加強監控輻射數據,產經,2019/08/10 16:30,https://www.cna.com.tw/news/afe/201908100125.aspx,（中央社記者吳佳蓉台北10日電）俄國北部某軍事基地8日發生火箭爆炸意外，導致北德文斯克市的加馬輻射量激增。原能會表示，已加強監控全台輻射監測站數據變化，目前環境輻射監測值均為正常。俄國北部某軍事基地8日發生火箭發動機測試爆炸意外，造成5名成員喪生外，也導致北德文斯克市（Severodvinsk）的加馬輻射量激增到平常的20倍，時間持續近半小時。對此，行政院原子能委員會輻射防護處今天發出新聞稿表示，會持續密切注意事件發展，核安監管中心及輻射偵測中心，已立即加強監控全國53處即時環境輻射監測站的數據變化，目前國內環境輻射監測值均為正常。原能會輻射防護處指出，俄國鄰近國家的官方單位包括大陸生態環境部、日本原子力規制委員會（NRA）及南韓核能安全與保安委員會（NSSC），至目前也都未發布相關消息，顯示各國環境輻射監測數據也在正常背景值範圍內。原能會輻射防護處說，會高度關注後續發展，未來如確認俄國爆炸案有輻射外洩情形，原能會將立即啟動強化監控機制，並將即時發布輻射監控結果，以利民眾掌握相關最新訊息。（編輯：林孟汝）1080810
