標題,分類,時間,網址,內文
瑞耘今年營運樂觀 法人估可望創歷史新高,證券,2020/01/03 12:46,https://www.cna.com.tw/news/afe/202001030096.aspx,（中央社記者張建中新竹3日電）半導體零組件廠瑞耘今年營運可望有亮麗表現，法人預期，除遞延訂單挹注，接單也有機會擴大，今年營收應可成長超過1成，並將改寫歷史新高紀錄。受半導體廠資本支出趨緩，部分訂單延後認列影響，瑞耘去年營運成長停滯，前11月營收新台幣4.14億元，較前年同期略減2.81%。法人預期，瑞耘在強化產品功能測試平台，並與大客戶美商應用材料深化合作，尤其，台積電積極加碼在台灣投資，將有助瑞耘擴大接單。瑞耘靜電吸盤新產品也開始導入自動搬運系統，將逐步貢獻業績。此外，隨著半導體產業景氣回溫，半導體設備市場需求將同步回升，今年營運成長可期，法人預期，瑞耘今年營收可望成長超過1成，將刷新歷史新高紀錄，每股純益有機會挑戰3.3至3.4元水準。瑞耘今天在市場買盤積極湧入下，股價表現強勁，盤中一度達37.8元，大漲6.78%，並創16個月來新高價。（編輯：鄭雪文）1090103
債務人安心好過年 銀行春節不催收,產經,2020/01/03 12:50,https://www.cna.com.tw/news/afe/202001030101.aspx,（中央社記者劉姵呈台北3日電）年關將至，銀行公會今天宣布，已協調各銀行含委外催收機構在農曆春節連續假期期間，即1月23日至29日停止各項催收作業，讓債務人可以安心過年。銀行公會今天發布新聞稿表示，年關將至，為體恤有還款困難債務人的感受，1月23日至29日春節連續假期期間，各銀行含委外催收機構將停止一切催收作業，包含簡訊、信函、電話、拜訪、強制執行債務人的動產或不動產等一切活動。銀行公會表示，將持續宣導債務協商相關資訊，請有困難的債務人盡速與債權金融機構聯繫辦理相關協商事宜；同時提醒，債務人切勿輕信不法代辦債務協商公司保證協商成功的承諾。（編輯：楊凱翔）1090103
2020年商業服務業景氣  商研院：偏樂觀明朗,產經,2020/01/03 13:03,https://www.cna.com.tw/news/afe/202001030104.aspx,（中央社記者廖禹揚台北3日電）商研院今天發布最新商業服務業景氣預測指出，下降中指標降速明顯減緩，出現進入尾聲跡象，實質投資與金融持續成長，今年偏向樂觀預期更趨明朗。財團法人商業發展研究院今天發表台灣商業服務業景氣循環同行指標綜合指數，預測商業服務業景氣至今年5月仍下降，但降幅相對和緩，有進入尾聲跡象，應與台商回流帶動民間投資，加上政府持續祭出景氣激勵措施有關，建議可持續加強。商研院指出，降速走緩主因實質民間固定資本形成從2018年3月止降轉升後景氣循環指數不斷爬升，至去年11月已高達102.81。商研院表示，民間實質固定資本形成至本次觀察值，已有21個月連續上升，達到20年來該指標歷次擴張期的最長紀錄，且與過去擴張期結束時步調相比還有4倍力道，增勢仍旺。此外，服務業貿易長期以來的逆差從2017年1月開始縮小，循環趨勢值從2018年8月開始超越長期趨勢，去年11月已達100.96。商研院表示，為力求景氣早日恢復活力，應持續加強激勵景氣措施，並配合數位經濟趨勢，盡速布局數位化新科技投資及商業模式運用。（編輯：郭萍英）1090103
捷流閥業今年營運看俏 法人估營收獲利有望創高,證券,2020/01/03 13:24,https://www.cna.com.tw/news/afe/202001030110.aspx,（中央社記者張建中台北3日電）工業閥門供應商捷流閥業將於6日上櫃，公司看好今年營運表現，中國、美國等石化和船舶產業閥門需求強勁。法人預期，捷流閥業今年營收與獲利可望同創歷史新高。捷流閥業上櫃承銷案以競價拍賣進行，競拍得標加權平均價格新台幣95.51元，公開申購價78元，總計超過27萬人參與申購，申購過程凍結超過210億元資金，中籤率僅0.37%。市場人士指出，若以1月2日興櫃收盤參考價格115.99元粗估，價差達37.99元，約48.71%。捷流閥業去年前11月合併營收22億元，年增29.15%，超越前年全年水準。法人預估，捷流閥業去年第4季營收可望較前年同期佳，去年度營收和獲利可望同創歷年新高，每股純益有機會接近8元。展望今年，捷流閥業看好中國、美國等地石化和船舶產業閥門訂單需求，預期石化產業業績比重可望較目前的4成持續攀高。捷流閥業透露，目前訂單能見度達6個月，將持續提升生產自給率，推升毛利率。法人預期，受惠台塑美國公司新廠訂單增加、中國石化產業產能持續擴張、壓艙水處理系統需求增加及台商資金回流建廠等，捷流閥業今年營收可望再成長10%，續創歷史新高紀錄，獲利也有機會同創新高。（編輯：楊玫寧）1090103
台股震盪收紅 小漲9.95點,證券,2020/01/03 13:58,https://www.cna.com.tw/news/afe/202001030119.aspx,（中央社台北3日電）台北股市今天開高震盪整理，收盤小漲9.95點，為12110.43點，漲幅0.08%，成交金額新台幣1927.76億元。加權指數開盤為12167.44點，盤中最高12197.64點，最低12023.60點；不含金融股指數10274.77點，漲3.63點。八大類股漲跌幅：泥窯股跌0.33%、食品股漲0.44%、塑化股漲0.75%、紡織股漲0.09%、機電股跌0.19%、造紙股跌0.42%、營建股跌0.34%、金融股漲0.38%。委買張數1304萬6276張，委賣張數821萬5671張，成交張數550萬5620張。收盤時上漲266家，下跌577家，持平111家。成交量前5名個股為富邦VIX、元大滬深300正2、群創、元大S&P原油正2、旺宏。漲幅前5名個股為大毅、億麗、富邦VIX估、國巨、美德醫療-DR。跌幅前5名個股為泰聚亨-DR、天瀚、同泰、恆大、華通。1090103
1月台指期跌15點,證券,2020/01/03 13:52,https://www.cna.com.tw/news/afe/202001030123.aspx,（中央社台北3日電）台北股市今天終場漲9.95點，收12110.43點。1月台指期以12086點作收，下跌15點，與現貨相較，逆價差24.43點。台灣期貨交易所為近2個月指數期貨契約訂定開盤參考價為，1月期貨12101點、2月期貨12091點。台股今天終場漲9.95點，收12110.43點，成交金額新台幣1927.76億元。1月台指期貨以12086點作收，跌15點，成交17萬2648口；2月期貨以12075點作收，跌16點，成交3475口。實際收盤價格以期交所公告為準。1090103
1月電子期跌 金融期漲,證券,2020/01/03 13:57,https://www.cna.com.tw/news/afe/202001030126.aspx,（中央社台北3日電）台北股市今天上漲9.95點，收12110.43點。1月電子期收532.9點，下跌1.9點，逆價差1.33點；1月金融期收1361點，上漲2.2點，逆價差4.33點。1月電子期以532.9點作收，下跌1.9點，成交6332口。2月電子期以532.4點作收，下跌1.7點，成交49口。電子現貨以534.23點作收，下跌0.85點；1月電子期貨與現貨相較，逆價差1.33點。1月金融期貨以1361點作收，上漲2.2點，成交2032口。2月金融期以1358.2點作收，上漲2.2點，成交36口。金融現貨以1365.33點作收，上漲5.21點；1月金融期貨與現貨相較，逆價差4.33點。實際收盤價以期交所公告為準。1090103
外資喊進致茂 目標價上看171元,證券,2020/01/03 14:02,https://www.cna.com.tw/news/afe/202001030130.aspx,（中央社記者吳家豪台北3日電）日系外資表示，檢測設備廠致茂受惠於5G基礎建設、3D感測、電動車等趨勢帶動長期成長，有助獲利回溫，維持買進評等，目標價從160元調升到171元。致茂股價今天上漲3元開出，盤中最高來到152元，終場收在148元、漲幅約1.37%，成交量近4900張。日系外資發布研究報告，將致茂2019年、2020年獲利預估值調降41%、19%，主要反映2019年前3季總體經濟不確定性導致需求保守，以及模組化組裝系統（MAS）事業持續下滑。且致茂公布去年第3季財報後，股價持續低迷，原因包括中國大陸電動車需求放緩、模組化組裝系統訂單能見度有限。不過，日系外資仍看好致茂將受惠於多項長期成長趨勢，在檢測設備領先地位將有助於搶攻5G基礎建設、3D感測、電動車等商機；致茂也是貿易戰受惠者之一，包括供應鏈移轉和中國推動產業在地化都是利多題材。考量致茂核心事業成長符合預期、長期成長走勢無虞，日系外資維持「買進」投資評等，目標價從160元調升到171元。（編輯：鄭雪文）1090103
台積電尾盤奮力一拉 台股驚險收小紅,證券,2020/01/03 14:51,https://www.cna.com.tw/news/afe/202001030133.aspx,（中央社記者韓婷婷台北3日電）台股早盤雖在美股大漲激勵下進逼12200點大關，不過美軍空襲伊拉克導致美股盤後下跌，地緣政治疑慮再起，油價衝高，亞股受到衝擊，所幸台積電尾盤猛拉翻紅，帶動指數收小紅。加權股價指數終場小漲9.95點、漲幅0.08%、收在12110.43點、成交值新台幣1927.76億元，盤中指數震盪劇烈，高低相差174點，成交值創下近期新高，台積電尾盤翻紅、鴻海力守平盤之上，金融、傳產權值股表現凸出，成為指數支柱。櫃買指數則相對弱勢，收盤重挫1.31%，收148.94點，一舉摜破5日線149.56點，成交值也出現454.28億元近期大量。分析師指出，美軍空襲伊拉克首都機場，造成美股盤後下跌、油金急漲讓國際地緣政治疑慮再起，加上早盤成交值預估超過2000億元，市場擔憂短線過熱，紛紛選擇退場觀望，除了權值股外，僅剩被動元件族群漲勢較為整齊。法人表示，指數進入12000點高檔區後，市場居高思危，雖然對於今年整體經濟仍審慎樂觀，但台股週線已5連紅，指數在農曆年前可能區間盤整，重新沈澱籌碼。（編輯：鄭雪文）1090103
三大法人賣超台股9.73億元,證券,2020/01/03 15:03,https://www.cna.com.tw/news/afe/202001030146.aspx,（中央社台北3日電）台股今天漲9.95點，收在12110.43點，成交值新台幣1927.76億元。三大法人外資及陸資賣超、投信買超、自營商賣超，合計賣超新台幣9.73億元。自營商賣超10.05億元，投信買超1.82億元，外資及陸資賣超1.5億元。分析師指出，美軍空襲伊拉克首都機場，造成美股盤後下跌、油金急漲讓國際地緣政治疑慮再起，加上早盤成交值預估超過2000億元，市場擔憂短線過熱，紛紛選擇退場觀望。法人表示，指數進入12000點高檔區後，市場居高思危，指數在農曆年前可能區間盤整沈澱籌碼。1090103
信邦去年營收連8年新高 今年續旺,證券,2020/01/03 15:21,https://www.cna.com.tw/news/afe/202001030151.aspx,（中央社記者韓婷婷台北3日電）電子零組件廠商信邦自結去年12月合併營收新台幣13.17億元，月減4.11%，年增14.23%；累計全年營收181.72億元，年增14.90%，連續8年改寫歷史高點紀錄，今年持續看旺。信邦第4季進入產業相對淡季，單季營收41.11億元，季減19.65%，不過年增6.29%。信邦指出，全年度合併營收181.72億元，再次超越前1年營運表現，為歷史高點，自2012年以來，已連續8年改寫營收歷史高點紀錄。信邦2019年在美中貿易戰的影響下，雖造成經濟環境的不確定性，信邦仍繳出一份不錯的成績單。自3月起，連續7個月改寫單月營收歷史高點紀錄至9月，表現相當亮眼穩健。就產品別銷售比重，連接線組生產銷售占集團營收74.02%；連接器及零組件銷售占25.98%。在產業別的銷售分布，工業應用產業占28.22%；通訊及電子周邊產業占合併營收27.40%；綠能及節能產業占26.34%；醫療及健康照護產業占9.22%；汽車產業占8.82%。展望2020年，由於看好新產品未來發展，包括防摔氣囊腰帶、外骨骼機器人、智能電動車等各領域新產品將陸續推出，信邦樂觀看待業績，預期將不低於去年，預料將持續創高之路。（編輯：林興盟）1090103
許璋瑤：去年新上市家數減 籌資金額9年新高,證券,2020/01/03 20:36,https://www.cna.com.tw/news/afe/202001030152.aspx,（中央社記者潘智義台北3日電）台灣證券交易所董事長許璋瑤今天表示，去年台股集中市場新上市公司19家，較前年29家大減，但籌資金額新台幣233.2億元，較前年167.3億元增加4成，為近9年新高。許璋瑤在記者會指出，受制國際政經局勢影響，去年大多國際主要交易所新上市公司（IPO）衰退，平均下滑約2成，由於企業上市通常需要2至3年輔導，單一年度IPO家數難以呈現變動全貌。他說，去年、前年IPO家數合計48家，平均24家，今年目標就設定24家。台灣證券交易所總經理簡立忠指出，期盼優質公司申請上市，但資本市場很多元，各家企業的想法也不同，不必刻意強求；不過，有些家族企業覺得自家經營很好，不必分享經營成果給外人，但當經營者想要交班給第2代時，卻面臨不願接棒的情形，這時候經營者轉念，讓專業經理人接棒，並將公司上市。簡立忠說，宏碁培養很多優秀經理人，公司也一再分拆成很多公司，都是經理人當家，對市場、技術、人才的培養很有幫助。（編輯：郭萍英）1090103
黑鷹失事8死5傷 9壽險公司啟動重大災害關懷,產經,2020/01/03 15:34,https://www.cna.com.tw/news/afe/202001030158.aspx,（中央社記者劉姵呈台北3日電）黑鷹直升機失事造成8名軍士官罹難、5人受傷，壽險業展開傷亡保戶名單查詢，目前國壽、富邦壽、台壽、新壽、三商壽、南山壽、中壽、元大及全球人壽皆確認有保戶，已啟動重大關懷機制。UH-60M黑鷹直升機2日上午在新北宜蘭交界山區失事，機上13人，共8名軍士官罹難，其中參謀總長沈一鳴也不幸罹難，另有5人受傷，送往三軍總醫院治療。壽險業立即展開傷亡保戶名單查詢，目前有9家壽險公司確認有保戶在傷亡名單中。國泰人壽表示，經查有5名罹難者為保戶，理賠金額共計新台幣1174.7萬元，服務人員於第一時間就向罹難者家屬表達關懷慰問。富邦人壽表示，目前已知有3名罹難者及4名傷者為保戶，正協助家屬進行理賠申請相關事宜；台灣人壽主動比對資料後，也確認有2名罹難者為保戶，理賠金額估算約達1100萬元。新光人壽、三商美邦人壽皆確認各有3名保戶在罹難名單中，但基於保護傷亡者與家屬的立場，不便透露保戶投保金額與險種，顧及保戶及家屬無暇分心處理理賠事宜，已立即啟動慰問關懷。另外全球人壽、中國人壽與南山人壽也都確認各有1名罹難者及1名傷者為保戶；元大人壽有1名罹難者為保戶。壽險公司皆表示，對國軍黑鷹直升機迫降失事的傷亡深表哀悼祝禱之意，已立即啟動重大災害關懷機制，將儘速協助傷亡保戶與家屬理賠相關事宜，服務人員予以關懷慰問，將全力協助保戶家屬度過難關。（編輯：趙蔚蘭）1090103
國營事業甄試增額221名  錄取率提升至7.23%,產經,2020/01/03 16:23,https://www.cna.com.tw/news/firstnews/202001030174.aspx,（中央社記者蔡芃敏台北3日電）經濟部宣布國營事業108年新進職員甄試增列需用名額計221名，總錄取人數增至1440名，錄取率將由6.12%提升至7.23%，正式聘用人員起薪依照各公司規定，約在3萬6000元至3萬9000元之間。國營事業面臨退休潮，為了補足人力、改善人力結構，台糖、台電、中油及台水等經濟部所屬國營事業在去年11月辦理新進職員甄試。經濟部今天發布新聞稿指出，油電糖水等國營事業108年新進職員甄試增列需用名額計221名，增額後甄試錄取總人數為1440名，以首節實際到考人數1萬9927人計算，錄取率將由6.12%提升至7.23%經濟部說明，各用人機構得視業務需要，在預算員額範圍內，提報各類別增額人數，經甄試委員會同意後，由試務處於初試放榜前公告。108年新進職員甄試共計招考26個類別，經用人機構因業務需要提報後，共計增列221名，分別為企管41名、人資2名、財會13名、國貿1名、資訊11名、統計資訊2名、政風2名、法務2名、地政5名、土木20名、建築3名、機械28名、電機59名、儀電7名、環工5名、畜牧獸醫2名、農業1名、化學3名、化工製程13名、石油開採1名，增額後甄試錄取總人數為1440名。經濟部指出，正式聘用人員起薪及晉薪會依照所分發的公司規定辦理，目前各油電糖水起薪平均落在約新台幣3萬6000元至3萬9000元之間，再依據工作績效逐步晉升。（編輯：黃國倫）1090103
新台幣升0.9分 收30.105元,產經,2020/01/03 16:09,https://www.cna.com.tw/news/afe/202001030176.aspx,（中央社台北3日電）台北外匯市場新台幣兌美元今天收盤收30.105元，升0.9分，成交金額9.12億美元。新台幣兌美元今天開盤價為30.12元，最高30.00元、最低30.12元。1090103
精測12月營收減9.77% 創6個月低,證券,2020/01/03 16:25,https://www.cna.com.tw/news/afe/202001030181.aspx,（中央社記者張建中新竹3日電）測試介面廠中華精測去年12月業績持續滑落，營收新台幣3.1億元，月減9.77%，創6個月新低。精測去年第4季因淡季效應影響，季營收滑落至10.07億元，季減8.57%，不過，表現仍優於市場預期的季減逾1成水準。精測去年總營收33.86億元，年增3.28%，刷新歷史新高紀錄。法人預期，精測今年業績可望進一步攀高，有機會超過42億元，成長超過25%，再創歷史新高。法人指出，精測5G手機應用處理器5奈米測試案今年第1季可望逐月攀升，預計4月放量；此外，精測顯示卡探針卡用PCB也量產出貨，都將是今年營運成長主要動能。（編輯：趙蔚蘭）1090103
東元家電衝全綠能變頻 全年業績挑戰雙位數成長,證券,2020/01/03 17:01,https://www.cna.com.tw/news/afe/202001030190.aspx,（中央社記者張建中台北3日電）東元董事長邱純枝表示，今年全產品目標達到8成比重綠能設計，家電產品目標100%綠能設計，今年加速重電項目成長，全年挑戰業績成長雙位數百分點。東元集團今天下午在南港舉行2020年家電新產品上市發表會，集團會長黃茂雄和東元董事長邱純枝親自出席。展望今年集團營運，邱純枝訂下目標，今年全產品要有8成比重屬於綠能產品，其中家電產品目標100%全變頻綠能設計，目前家用空調產品已經9成屬於變頻設計。東元空調產品從去年第2季起逐漸升溫，邱純枝指出去年下半年空調產品交出漂亮的成績單，今年家電事業目標持續成長，儘管挑戰多，但財務持續穩健，變頻空調產品方向穩定。在重電項目，東元今年持續布局智能化，開發智慧監控，持續在南亞印度布局，提高在新興市場市占率。邱純枝指出，今年重電項目有4個成長方案，其中布局中壓變頻器搭配中高壓馬達、低壓變頻器、車用電機，車用電機鎖定台灣和中國大陸商機，預估重電成長項目占今年成長目標比重1/2以上。在東南亞和南亞布局，東元持續深耕印度工業電機和中小馬達，也會布局車用電機產品。邱純枝指出，東南亞對東元來說，今年是重要質變的一年，集團整理東南亞管理高層，將引進具有未來性的管理階層，改變東元在東南亞市場的策略。整體來看，邱純枝表示，今年東元集團發展審慎樂觀，業績設定超越去年，挑戰雙位數成長目標，其中家電產品市占和業績成長雙位數百分點，重電項目成長兩位數百分點。在餐飲布局，黃茂雄表示，樂觀看待未來發展，目前機器人供餐服務在30多個據點使用，集團也在桃園觀音規劃智慧農場，推廣有機食品。黃茂雄表示，今年在餐飲領域有3個規劃項目，要經過經營會議討論。媒體問及寶佳集團對東元持股增加，黃茂雄指出，大家都是做好朋友，東元集團務正業，不會想東想西，任何投資人都歡迎。談到年終獎金，邱純枝指出，公司員工最低有60天，最高也有3個月到4個月。東元今年商用空調強調客製化設計，今年新產品除了主推節能變頻及R32環保系列，也推出家用空調-雲端服務App、以及變頻商用冰箱新品。從產品營收比重來看，去年馬達占比約5成，自動化暨智能系統占比約7%，家電占比約11%，能源暨工程占比約8%，東訊占比約3%，其他占比約19%。（編輯：趙蔚蘭）1090103
南亞科12月業績回升 法說會10日登場,證券,2020/01/03 16:56,https://www.cna.com.tw/news/afe/202001030194.aspx,（中央社記者張建中新竹3日電）南亞科去年12月業績止跌回升，只是第4季營收滑落至新台幣131.15億元，季減逾1成。南亞科預計10日召開法人說明會，法人預期，南亞科可望釋出正面訊息。南亞科自結去年12月營收43.3億元，月增1.59%；第4季營收131.15億元，季減11.37%，主要是第3季銷售高於預期，業績基期墊高影響。南亞科預計10日召開法說會，屆時將公布去年營運結果，並說明未來營運展望。南亞科總經理李培瑛先前看好，今年動態隨機存取記憶體（DRAM）市況可望好轉。市調機構集邦科技也認為，DRAM市況趨於樂觀，伺服器記憶體報價有機會於今年第1季搶先上漲。法人預期，南亞科法說會應可對記憶體後市釋出正面訊息。（編輯：趙蔚蘭）1090103
許璋瑤：台股市值年增7.1兆 不只外資賺錢,證券,2020/01/03 20:36,https://www.cna.com.tw/news/firstnews/202001030195.aspx,（中央社記者潘智義台北3日電）台灣證券交易所董事長許璋瑤今天表示，去年台股創近30年新高，市值較前年增加新台幣7.1兆元。外界以為外資大買台積電，在台股賺最多，依持股比例來看，其實內資賺更多。台股去年站上12000點關卡，但封關收在11997點，較前年底上漲約2270點，漲幅23.3%，為近10年最佳，在全球股市表現優異，去年外資更買超2441.6億元。許璋瑤在記者會指出，去年初內、外資持股比重約60.03%、39.97%，依持股比例來看，應該是內資賺比較多，但或許有人會認為權值股台積電帶領台股上漲，外資對台積電持股比較較高，所以獲利較佳，但事實上去年台股大漲，不限於台積電大漲，也有很多股票大漲；除外資獲利，政府基金也賺不少。他強調，去年1至11月政府基金投資收益超過5千億元，其中勞退基金收益即達4127億元，雖非全來自台股收益，但在台股獲利可觀，股價上揚，勞工朋友也可間接受惠。去年台股除台積電大漲，證交所統計，若以還原權值計算，去年942家上市公司平均報酬率達29.6%，其中台灣50指數成分股平均報酬率46%，顯示權值股因電子產業優勢，漲幅較高，其餘892家上市股票平均報酬率26.4%，顯示投資者大部分獲利。另外，去年集中市場日均成交值1201億元，較前年1302億元減少8%，但仍是近12年次高，全年周轉率80%，維持良好流動性，且去年第4季隨股價持續上升，平均日均成交值已恢復1300億元。證交所統計，去年台股市值36.4兆元，連同上櫃、興櫃股票市值3.9兆元，總市值超過40.3兆元，創下歷史新高。（編輯：黃國倫）1090103
