標題,分類,時間,網址,內文
台積電法說會16日登場  外資轉買超股價完成填息,證券,2020/01/03 17:43,https://www.cna.com.tw/news/afe/202001030214.aspx,（中央社記者張建中新竹3日電）台積電法人說明會將於16日登場，外資今天轉賣為買，買超2593張，推升台積電股價攀高，一度達新台幣345元，完成填息，並平歷史最高價，終場收小漲0.5元。台積電今天公告，108年第4季法人說明會將於109年1月16日召開，將公布108年第4季財務報告，及109年第1季業績展望。法人預期，第1季為蘋果（Apple）傳統備貨淡季，不過，今年第1季在聯發科與超微（AMD）需求強勁支撐下，台積電營運表現可望淡季不淡，有機會較去年第4季持平表現，維持在營運高檔水準。受惠5G與高效運算需求強勁成長，法人看好，台積電7奈米製程業績可望持續成長，5奈米製程也將量產挹注業績，今年營運應可恢復高成長動能，總營收將成長15%至20%，續創歷史新高紀錄。據統計，外資在連續3個交易日賣超後，今天轉賣為買，買超台積電2593張，投信也轉買超197張，自營商則持續賣超1108張。台積電今天股價走勢震盪，在美國存託憑證（ADR）大漲3.3%，收在60.04美元，創歷史新高激勵下，早盤股價表現強勁，一度達新台幣345元，花了11個交易日完成填息，並平歷史最高價。只是隨著美軍空襲伊拉克，油價高漲，市場緊張氣氛升高，大盤指數一度由紅翻黑，台積電股價也震盪走低，一度達335.5元，跌3.5元，尾盤在買盤湧入下，股價翻紅，終場收在339.5元，小漲0.5元。（編輯：黃國倫）1090103
5G黃金頻段標金衝破900億元大關 世界第3高,產經,2020/01/03 18:45,https://www.cna.com.tw/news/firstnews/202001030225.aspx,（中央社記者吳柏緯台北3日電）5G競標金失速狂飆，持續往世界紀錄推進。今天總標金已經踏破900億元大關，達新台幣947.98億元。其中黃金頻段3.5GHz的標金達931.50億元，僅次於義大利與德國，為世界第3高。5G第一波釋照競標從去年12月10日開始，底價訂為300億元，由中華電信、遠傳電信、台灣大哥大、亞太電信、台灣之星共5大電信業者廝殺角逐。競標今天進入第18天，截至下午4時，第180回合的開標結果，最搶手的3.5GHz頻譜，暫時總標金高達931.50億元，每單位的價格也成長至34.50億元。28GHz標金則維持不動，暫時得標金16.48億元，1800MHz仍無人出手。5G標金一路超車，如今黃金頻段3.5GHz的標金已經站上世界第3高。根據台經院產經資料庫與工研院的資料顯示，目前世界各國的5G競標中，3.5GHz頻段的最高標金出現在義大利，其次為德國，原本排名第3的國家為南韓，不過台灣在競標的第15日超車，一舉成為世界第3高。根據這份資料顯示，義大利在2018年10月完成5G釋照，當時3.5GHz頻段總共釋出200MHz，標金達48.20億美元，折合台幣約為1450億元、德國在2019年6月完成5G釋照，3.5GHz頻段總共釋出300MHz，標金達47.18億美元，折合台幣約為1420億元。市場人士指出，台灣市場規模小，而且釋出頻譜有限，卻有5家電信業者競逐，是堆高標金的主要原因。雖然台灣應該不至於超越義大利與德國，但是標金突破千億恐怕在所難免。（編輯：趙蔚蘭）1090103
美軍空襲波及股匯市 新台幣震盪收升0.9分,產經,2020/01/03 18:17,https://www.cna.com.tw/news/afe/202001030228.aspx,（中央社記者潘姿羽台北3日電）美軍空襲伊拉克首都機場，連帶影響台灣金融市場的表現，今天台股一度由紅翻黑，新台幣升值幅度也持續收斂，午後外資轉為匯入，推動匯價觸及30元的整數關卡，終場則以30.105元作收。新台幣兌美元今天走勢震盪，開盤價為30.12元，先升值而後緩步拉回，午後又漸漸走高，來到盤中最高點30.0元，不過疑似央行進場調節，升幅快速收斂，新台幣兌美元今天收盤收30.105元，升值0.9分，台北及元太外匯市場總成交金額13.62億美元。「今天主要是跟國際局勢走」外匯交易員表示，美軍空襲伊拉克首都機場是今日最大事件，台股一度偏跌、新台幣也走弱，這部分主要受外資匯出影響，後來台股拉回，加上外資下午轉為賣美元，新台幣便開始回升。外匯交易員分析，這幾天外資在台股呈現賣超，但從匯市來看，外資仍是雙向操作，沒有撤離的跡象，推測外資僅是做些調節，對台股仍抱有信心，因此股匯市還是有支撐力道。（編輯：黃國倫）1090103
Gogoro去年銷售翻倍 機車市占率16%,證券,2020/01/03 18:30,https://www.cna.com.tw/news/afe/202001030245.aspx,（中央社記者韓婷婷台北3日電）電動機車在2019年快速成長，其中市場領導品牌Gogoro全年銷售量突破14.5萬輛，年增達105%，在台灣機車市場占比達16%；其中12月單月掛牌數更突破2萬輛，創下新紀錄。2019年是Gogoro品牌爆炸性成長的1年，尤其12月掛牌數衝上2萬2750輛，市占率為21.3%，僅次於光陽（KYMCO）的31.8%，連續2個月奪下機車市場亞軍，超越三陽（SYM）的19.8%及山葉（YAMAHA）的19.7%。2019年電動機車總掛牌數16萬8544輛，市占率為18.7%，比起2018年成長107%，創造從2015年起每年銷量幾近翻倍成長的速度成長。其中Gogoro是最大的動能，2019銷售就囊括14萬5678輛，年增105%，在電動機車占比86.4%，在整體機車市場占比16%。為了加速市場滲透率，電動車以團體戰策略擴大版圖，Powered by Gogoro Network（PBGN）智慧電動車聯盟2019年掛牌數達到15萬2347輛，累計PBGN智慧電動車聯盟總車口數達27萬4623輛，今年度也更將迎來台鈴工業的新車款，持續加溫電動機車市場。展望2020年，預計將有更多機車品牌推出電動機車新品，搶攻汰舊換新商機，為電動機車市場加溫；不過，由於經濟部補助購買電動機車從每部新台幣1萬元減少到7000元，環保署新購補助也同步退場，補助金額將較2019年減少5000元，去年底換購潮是否能延續同樣的力道仍是觀察重點。（編輯：蘇志宗）1090103
新版婚紗攝影定型化契約上路 一條龍服務有保障,產經,2020/01/03 19:09,https://www.cna.com.tw/news/afe/202001030255.aspx,（中央社記者廖禹揚台北3日電）新版婚紗攝影定型化契約元旦上路，針對婚紗攝影業者提供的一條龍服務，從定金收取、外景拍攝、消費者選定樣片的著作權歸屬，都有兼顧雙方權益的更詳細內容。經濟部在1998年制定婚紗攝影（禮服租售及拍照）契約範本，做為業者及消費者簽約參考，但無實質法規拘束力，為強化契約約束力及公平性，經濟部去年公告婚紗攝影服務定型化契約應記載及不得記載事項，於今年元旦正式上路，希望減少相關消費爭議。經濟部商業司今天發布新聞稿指出，許多婚攝業者提供化妝、拍照、攝影、禮服等一條龍服務，耗時長且契約金額所費不貲，因此針對定金收取、外景拍攝、消費者選定樣片的著作權歸屬、指定攝影師的變更等細項訂定新版定型化契約。定金收取部分，分為定金、選定禮服或擇定拍照日期、拍攝付款、選定樣片付款及取件付款等5階段，第一階段定金收取金額不可超過契約總金額20%，之後第2至第4階段累計不可超過50%、60%及80%。禮服押金則不得超過契約總金額10%。外景拍攝部分，若因天候不符約定狀況，須依事先約定方式另擇期拍攝，或以其他拍攝方式替代；若無事先約定，另擇期拍攝須再次造型、化妝者，業者不可加收費用。若有指定攝影師或造型師，因故無法提供服務時，業者應立即通知消費者重新選定，若消費者已支付指定費且不願重新選定，可要求終止契約，並請求加倍返還已收取的指定費。經消費者選定樣片及照片，除另有約定，著作財產權人為消費者，業者非經同意，不得任意複印張貼或做為宣傳使用；未經選定樣片及照片應銷毀，同樣不得任意使用。商業司表示，消費者若認為發生權利受損或訂定契約權利義務明顯不公平現象，可先向業者反映，若業者處理方式仍無法解決疑義，可撥打「1950」全國性消費者服務專線，或至各地方政府消費者服務中心洽詢。若業者確實違反定型化契約，主管機關可以要求限期改正，否則直轄市、縣（市）政府可處3萬元以上、30萬元以下罰鍰，並得按次處罰。1090103
2019年機車銷售擺尾 光陽破30萬輛奪冠,產經,2020/01/03 19:17,https://www.cna.com.tw/news/afe/202001030257.aspx,（中央社記者韓婷婷台北3日電）2019交通部統計數據正式出爐，全台機車總銷售量為90萬2302輛，KYMCO （光陽工業）以30萬390輛再度奪下冠軍寶座，市占率達33.3%。三陽及山葉則分居二、三名。光陽不僅是2019年度銷售唯一突破30萬台的機車品牌，也是連續第4個年度維持在30萬台的高水準表現，已在台灣創下連續20年銷售第一紀錄。光陽集團執行長柯俊斌表示，12月總市場領牌10萬6969輛，月成長2萬6796輛，光陽12月單月掛牌數則衝上3萬3997輛，刷新單月歷史新紀錄，在傳統度小月時機繳出亮眼成績單，主要原因為消費者預期2020年政府購車補助限縮及廠商促銷優惠方案而提前消費所致。柯俊斌表示，各大車廠表現也都很好，年底大家都卯足勁銷售、民眾買氣也相當旺盛。根據資料顯示，12月「油電大戰」仍然激烈交火，10月起，電動車因補助即將限縮造成搶購，但在12月車市成長動能卻以燃油車22934輛占最大宗，較上月成長41.4%；電動車則受燃油車排擠月成長僅3862輛，市占比甚至出現下滑至27%以下狀態。光陽表示，迎接2020年，政府補助款將出現「油車升、電車降」，汰舊換新對象擴大適用四行程舊型機車，為搶攻500萬輛的換購商機，柯俊斌宣布2020總共將推出15款七期環保機車，持續鞏固二輪車霸主地位。（編輯：趙蔚蘭）1090103
東森購物業績亮眼 王令麟：東森幣奏效,產經,2020/01/03 20:36,https://www.cna.com.tw/news/afe/202001030259.aspx,（中央社記者江明晏台北3日電）東森國際旗下轉投資東森購物，2019年全年合併草莓網營收年成長22%，達204億元，衝破200億大關，東森購物董事長王令麟表示，全通路整體業績表現亮眼，主要歸功於東森幣奏效。東森購物表示，自2018年8月開始發送東森幣，累積至2019年12月31日為止，17個月共發行超過54億東森幣，其中有28億已被使用，使用率逾53%，是目前所有台灣發行的電商幣當中發行量最高的錢幣。東森購物分析，在東森幣助攻下，東森購物在2019年會員成長和業績上有所斬獲，第一，帶動全通路會員新客成長及舊客甦醒，其中VIP成長高。第二，提高回購率。東森購物董事長王令麟表示，東森幣推出迄今，東森購物的訂單數成長19%、件數成長26%、營業額成長33%、折抵金額成長56%。2019年11月VIP會員人數為43.4萬，與去年2018年同期33.4萬相比，成長30%，東森購物VIP人數累計至2019年11月總計為43.3萬人，共創造125.8億元消費金額，占全通路營收73.5%，人數與營收都創下5年以來的新高，東森幣功不可沒。（編輯：黃國倫）1090103
投資台灣再添4家 3大方案總投資額達8519億,產經,2020/01/03 20:04,https://www.cna.com.tw/news/firstnews/202001030262.aspx,（中央社記者廖禹揚台北3日電）經濟部投資台灣事務所今天通過1家台商及3家根留台灣業者投資申請，共加碼投資新台幣52億元，投資台灣3大方案至今已帶動投資8519億元，預估創造7萬445個本國就業機會。今天通過聯審業者包括台商回台方案的元太科技工業，以及根留台灣方案的東隆興業、穗高科技、川益科技，經濟部表示，3大方案後續仍有80、90家企業排隊待審。面板廠元太科技運用源自麻省理工學院多媒體實驗室技術，轉戰電子紙領域，不到10年時間造就達數十億美金產值的電子書市場，成為全球首屈一指電子紙產業龍頭。這次投資將強化電子紙薄膜新產能在台布署，以改建廠房，導入智慧製造機台與管理系統，因應美中貿易高關稅衝擊。紡織廠東隆興業則規劃投入8億元，在彰化縣芳苑工業區廠設置功能性布紗智能產線，預估招募41個本國人才。鋁合金製造商穗高科技將投資12億元，擴建南科台南園區新廠，建置熱處理、CNC加工、精密線材及陽極表面智慧化產線，生產航太所需鋁線棒材及鋁加工件產品，將帶來21名本國就業機會。由伺服器導軌領導大廠川湖科技轉投資的川益科技將投資約20億元，南科高雄園區建置二廠提升產能，以智慧化產線生產滑軌產品，可創造435個本國就業機會。（編輯：趙蔚蘭）1090103
華碩電競周邊在台銷量 2019年成長逾27%,產經,2020/01/03 20:36,https://www.cna.com.tw/news/afe/202001030264.aspx,（中央社記者吳家豪台北3日電）隨著遊戲用的筆記型電腦發展，帶動周邊產品商機，電腦品牌廠華碩今天宣布，旗下電競品牌「ROG玩家共和國」電競周邊2019年在台灣銷售量成長逾27%，並推出5款新產品。資策會MIC資深產業分析師潘建光表示，遊戲用筆電讓中輕度玩家同時滿足娛樂與兼顧工作用途，只要將遊戲用筆電接上周邊產品，就能創造出高品質的遊戲環境，預期遊戲用筆電的發展，將帶動周邊產品商機，包含螢幕、鍵盤、滑鼠、耳麥等。潘建光建議，廠商未來如果能針對筆電產品外型與周邊產品持續創新，再搭配外部遊戲產品，將有機會與競爭者產生差異化。華碩2019年第3季稅後淨利56.33億元，季增235%，年增69%；華碩2大事業群包括系統事業群與開放平台事業群，去年第3季同步達成營收及獲利較2018年同期正成長，手機事業的轉型效益也逐步顯現。不過，日系外資先前發布研究報告指出，華碩本業結構未明顯改善，加上處理器缺貨和美中貿易戰持續影響，重申「劣於大盤」投資評等和目標價193元。（編輯：黃國倫）1090103
2019年上櫃公司庫藏股執行率 3家不到5成,證券,2020/01/03 19:50,https://www.cna.com.tw/news/afe/202001030265.aspx,（中央社記者韓婷婷台北3日電）櫃買中心表示，為提升資訊揭露透明度，提供投資人更豐富的資訊品質，將按季發布最近1年上櫃公司執行買回庫藏股情形，根據統計2019年有中天、新洲及健信3家執行率低於50%。根據櫃買中心統計，最近1年度（108年1月1日起至108年12月31日止）上櫃公司執行買回庫藏股計有56件（41家公司），已期限屆滿或執行完畢或終止執行件數計44件。執行率達100%者計21件；買回庫藏股執行率低於50%者有3件。中天於2019年3月25日決議實施庫藏股，預計買回1萬張，實際買回張數為1881張，執行率僅18.81%；新洲於2019年5月3日決議實施庫藏股，預計買回3000張，實際買回張數為557張，執行率僅18.57%；健信於2019年10月17日決議實施庫藏股，預計買回1000張，實際買回張數為442張，執行率僅44.2%。櫃買中心表示，為提升資訊揭露透明度，將按季發布最近1年上櫃公司執行買回庫藏股情形，投資人得自公開資訊觀測站「投資專區」的「庫藏股資訊專區」項下子項目「庫藏股統計彙總表」查詢相關資訊。（編輯：蘇志宗）1090103
許璋瑤：不擔心MSCI調高上證A股權重 台股仍看好,證券,2020/01/03 20:36,https://www.cna.com.tw/news/afe/202001030267.aspx,（中央社記者潘智義台北3日電）台灣證券交易所董事長許璋瑤今天表示，不擔心指數編製公司明晟（MSCI）將中國上證A股權重調高至20%，只要國際經濟情勢穩定，台股依然看好。許璋瑤在記者會回答媒體提問，中國人民銀行調降存款準備率時指出，中國大陸有地方債、公司債的問題，金融市場緊張，所以銀行透過降準釋出資金，提供當地企業營運必要資金；不過，台灣資金充沛，只要國際經濟朝正向發展，台灣資本市場健全，應該可以維持穩定。他話鋒一轉接著說，台灣公司治理表現一向受國際肯定，MSCI去年3度調整中國A股納入比例，從5%提升為20%，國際資金陸續流入A股市場，但台股受到影響相當輕微，在MSCI新興市場指數權重去年11月為11.46%，僅較前年同期11.63%些微下降，而台股在MSCI新興市場永續（ESG）指數權重反而持續成長，去年增加為16.65%，遠高於新興市場指數。因此，顯現台股在公司治理及永續發展的努力，具有吸引全球永續投資的優勢。去年吸引外資大幅買超2442億元，為近3年最高。他說，美中貿易談判已達成第一階段協議，且英國脫歐情勢也漸趨明朗，國際不確定因素稍微和緩，對全球經濟將有助益。國際貨幣基金（IMF）預測，全球經濟將成長3.4%，較去年的成長率3%回升。國內經濟方面，他指出，主計處預測，今年整體經濟可望成長2.72%，較去年樂觀。政府推出多項措施引導台商資金回流，吸引回國投資金額約新台幣8400億元，去年已實質投資超過2000億元，今年投資可望加速進行，有助國內生產及就業。（編輯：趙蔚蘭）1090103
美擊斃伊朗指揮官油價大漲 亞股走勢分歧,證券,2020/01/03 20:43,https://www.cna.com.tw/news/afe/202001030276.aspx,（中央社香港3日綜合外電報導）伊朗軍方高級指揮官今天清晨突然遭美國擊斃，中東緊張升溫，油價應聲飆漲超過4%，投資人逃往避險標的，日圓匯價和金價勁揚。在能源類股攀高之下，亞洲股市今天收盤漲跌互見。與伊朗關係密切的伊拉克準軍事部隊「人民動員」（Hashed al-Shaabi）今天稍早宣布，伊朗「聖城部隊」（Quds Force）指揮官蘇雷曼尼（Qasem Soleimani）在巴格達國際機場遭襲擊身亡。美國總統川普隨後在推特張貼一張美國國旗圖片。美國國防部並表示，川普親自下令追殺蘇雷曼尼。伊朗最高領導人哈米尼（Ayatollah Ali Khamenei）則警告將採取「嚴厲報復」，伊朗外交部長查瑞夫（Mohammad Javad Zarif）也說，美方行動是「令情勢惡化的危險行為」。亞洲股市昨天大多走揚，歸功於美中貿易協議持續激勵樂觀氣氛、各國央行放寬貨幣政策，以及英國脫歐相關疑慮緩和。然而瑞穗銀行（Mizuho Bank）分析師史蒂芬‧梁（Steven Leung，譯音）指出：「投資人擔心伊朗情勢惡化，可能會出現一些報復行動；加上週末將至，人們會想先減少曝險。由於過去1個月左右股市上漲許多，因此傳出任何壞消息，都讓投資人有理由獲利了結。」香港股市今天終場下跌0.3%。上海股市收低0.1%，新加坡和孟買股市收跌0.4%，曼谷股市也收黑。不過，雪梨股市收盤上漲0.6%。首爾和台北股市小漲0.1%。威靈頓股市收高0.9%，吉隆坡、馬尼拉和雅加達股市也全收紅。東京股市適逢新年連續假期休市。（譯者：李宛諭/核稿：張正芊）1090103
街口打廣告推託付寶買基金 金管會：規避監理,產經,2020/01/03 21:05,https://www.cna.com.tw/news/firstnews/202001030281.aspx,（中央社記者劉姵呈、劉家豪台北3日電）街口支付「託付寶」廣告打出以電子支付帳戶買基金，可享有比定存高的保證年收益1.5%，金管會今天表示，民眾不能透過「託付寶」作基金申贖，與相關規定不符，有規避監理問題。街口支付打出「街口支付 託付寶」廣告，再踩金管會紅線。街口投信稍晚在官網發聲明表示，相關廣告內容提及街口投信及街口投信的基金，均未經街口投信審閱與同意，與街口投信業務無關。另外，街口投信說，街口投信的基金經金融監督管理委員會核准或申報生效，但不表示絕無風險，街口投信以往的績效不保證基金最低投資收益；街口投信除了盡善良管理人的注意義務外，不負責基金盈虧，也不保證最低收益。金管會證券期貨局官員今天向中央社者表示，街口支付廣告因強調保證收益，有不當招攬情況。且民眾目前僅可透過投信銷售機構開戶，或以電子支付帳戶買投信發行的新台幣計價基金，但「託付寶」為街口投信母公司街口金融科技公司的商家之一，與相關規定不符，有規避監理的問題。另外，民眾若要透過街口支付買街口投信基金，需分別跟街口投信和街口支付簽約，才能由投信指定付款帳戶（街口支付）申贖，且街口投信也必須先修改契約內容，才可使用電子支付的方式提供客戶申贖。街口支付也在官網發布聲明指出，託付寶廣告由街口集團的街口金融科技負責，並非由街口支付刊登。並強調，託付寶服務中的街口支付，僅依法令從事代理收付經核准金融商品的款項，不涉及基金代銷。官員表示，會請投信投顧公會提醒投信業者，恪守相關從業規範，強調客戶只能從規定的管道作申贖，金管會也會持續關注。街口支付曾在2018年9月首度推出自稱「台版餘額寶」的「街口託付帳戶」，並宣稱「保障年收益」，已被金管會禁止。（編輯：林孟汝）1090103
台股週線連5紅 電子零組件漲最多,證券,2020/01/03 21:23,https://www.cna.com.tw/news/afe/202001030284.aspx,（中央社記者潘智義台北3日電）台灣證券交易所統計，今天加權指數收在12110.43點，週線上漲18.84點，漲幅約0.16%，週線連5紅，以電子零組件類指數上漲3.56%最大，汽車類指數下跌1.76%最大。證交所統計，今天全體上市公司總值為新台幣36兆7533.37億元，較上週五市值36兆6969.08億元增加564.29億元，增幅約為0.15%。宏遠投顧副總經理陳冠升表示，近期資金回流台股，可望推升元月行情，加上1月11日總統大選，迎接農曆年可能在1月下旬推升過年前的紅包行情，或可使得台股行情持續到農曆年前後；1月11日選舉日前後，及農曆年前的盤勢將是後續指標。陳冠升指出，選舉政策作多，短線台股沒有重挫危機，但因近期股價漲多，今天盤中傳出美伊地緣政治問題，使台股由上漲百點到殺低約80點，最後收盤漲約9點，走勢震盪劇烈。他認為，目前電子股依然強勢，建議優先考慮電子股，但近期股價漲多個股將震盪加劇，投資須控管風險。證交所指出，本週未含金融類指數上漲20.79點，漲幅約為0.2%，未含電子類指數上漲23.54點，漲幅約為0.15%，未含金融電子類指數上漲37.08點，漲幅約為0.29%。證交所統計，本週集中交易市場總成交金額為5797.92億元，全體上市股票成交金額為5361.85億元，股票成交量周轉率為1.17%。本週各產業上市股票交易成交金額前3名依序為電子零組件類1514.04億元，占全體上市股票交易金額28.24%。半導體類1372.41億元，占全體上市股票交易金額25.6%。光電類739.63億元，占全體上市股票交易金額13.79%。本週成交量周轉率前3名產業依序為電子零組件類6.01%、光電類2.95%、生技醫療類2.11%。累計今年初開盤迄今共2個交易日，集中市場總成交金額為3362.11億元，市場日平均成交金額為1681.06億元，股票成交量周轉率為0.65%，股票日平均成交量周轉率為0.33%。（編輯：黃國倫）1090103
鴻海威州廠完成屋頂安裝 年度目標達陣,證券,2020/01/03 21:27,https://www.cna.com.tw/news/afe/202001030285.aspx,（中央社記者張建中新竹3日電）鴻海位於美國威斯康辛州的建廠計畫達成重要里程碑，完成工廠屋頂安裝，和防風雨外殼設施，達成年度目標。鴻海表示，這一計畫相當緊湊，不過，在團隊與合作的數十家威州的企業及員工努力下，讓年度目標能夠順利完成。鴻海指出，目前已為威谷科技園區簽訂3.7億美元合約，並使用近8000噸美國鋼鐵。除廠房建設，鴻海同時展開人才培育與商機開拓，其中，人才培育方面，鴻海廣招美國西北大學、普渡大學、密西根大學等畢業生，研習人工智慧、工廠製造等，為在威斯康辛州的建廠工程，培育生力軍。（編輯：趙蔚蘭）1090103
