標題,分類,時間,網址,內文
利多大力加持 歐股開年收紅,證券,2020/01/03 01:35,https://www.cna.com.tw/news/afe/202001030007.aspx,（中央社倫敦2日綜合外電報導）受到美國與中國終於達成第一階段貿易協議、得以減緩雙方緊張關係，以及中國將下調金融機構存款準備率的激勵，歐洲股市在2020年第一個交易日收紅。英國倫敦FTSE 100指數上漲61.86點或0.82%，收在7604.30點。德國法蘭克福DAX 30指數上漲136.92點或1.03%，收在13385.93點。巴黎CAC 40指數上漲63.44點或1.06%，收在6041.50點。（譯者：徐崇哲）1090103
美股2020年首個交易日 3大指數再攀新高,證券,2020/01/03 08:02,https://www.cna.com.tw/news/firstnews/202001030011.aspx,（中央社記者尹俊傑紐約2日專電）中國人民銀行宣布降準支撐經濟後，美股延續去年旺盛漲勢，今年首個交易日3大指數續以新高收盤。科技股漲勢凌厲，蘋果股票分割後首度衝上300美元價位。人行（中國央行）1日宣布，6日起調降金融機構存款準備金率0.5個百分點。這項措施估計向中國金融體系釋放人民幣8000億元資金，有助降低融資成本，增加今年經濟成長率「保6」本錢，激勵全球多地股市新年開紅盤。美股今天開高走高，道瓊工業指數終場上漲330.36點，漲幅1.16%，收在28868.8點；標準普爾500指數勁揚27.07點，漲幅0.84%，收在3257.85點。兩項指數都創近一個月來最佳單日表現。以科技股為主的那斯達克綜合指數猛漲119.58點，漲幅1.33%，收在9092.19點，創去年10月11日以來最佳表現。蘋果公司（Apple）股價勁揚2.3%，收在300.35美元，2014年股票一分為七以來股價首度攻上300美元。隨著蘋果事業多元發展，重獲投資人青睞，去年蘋果股價飆漲86%，創2009年以來最佳表現。除蘋果外，其他指標科技股也表現亮眼。亞馬遜（Amazon.com）、臉書（Facebook）與Google母公司Alphabet漲幅都超過2%。晶片股表現不遑多讓，費城半導體指數上漲逾2%。台積電美國存託憑證（ADR）猛漲3.3%，收在60.04美元，再創歷史新高。去年股價翻倍的超微（AMD）今天飆漲7%，美光科技（Micron Technology）漲幅也接近3%。工業類股方面，與中國連動密切的波音（Boeing）股價勁揚2.3%，3M與開拓重工（Caterpillar）漲幅都達2%左右。中國降準支撐經濟為新年度全球股市帶來利多，陸股上海證券交易所綜合股價指數、港股恆生指數漲幅都超過1%，道瓊歐洲600指數漲幅也達0.9%。去年12月31日，美國總統川普宣布今年1月15日將在白宮簽署美中首階段貿易協議，之後擇期前往北京展開第2階段協議談判，穩定為美中貿易戰困擾多時的投資人情緒，也有助美股延續去年旺盛漲勢。去年道瓊指數勁揚22.3%，創2017年以來最佳表現；標普500指數與那斯達克指數分別大漲29.6%、35.2%，都創下2013年以來最佳表現。華爾街日報報導，支撐美股亮麗表現的許多條件依舊存在，包括貿易緊張情勢降溫、聯邦準備理事會（Fed）貨幣政策寬鬆、美國經濟成長穩健，有利美股今年續漲。但華爾街對美股今年表現預測相對保守，部分銀行甚至提醒投資人股市短線可能震盪。高盛集團（Goldman Sachs）預估標普500指數今年上漲5%；美國銀行（Bank of America）更保守，預期標普500指數今年只會漲2%，但建議投資人續抱股票。（編輯：王永志）1090103
中東局勢緊張及油儲呈減少跡象 油價漲,產經,2020/01/03 05:44,https://www.cna.com.tw/news/afe/202001030012.aspx,（中央社紐約2日綜合外電報導）因中東局勢緊張及美國原油庫存出現進一步下降跡象，推動國際油價今天上漲。紐約市場西德州中級原油的2月期貨價格上漲12美分，收在每桶61.18美元。倫敦市場北海布倫特原油的3月期貨價格上漲25美分，收在每桶66.25美元。（譯者：徐睿承）1090103
蘋果漲破300美元 台股多頭火種旺,證券,2020/01/03 08:09,https://www.cna.com.tw/news/afe/202001030018.aspx,（中央社記者韓婷婷台北3日電）美中貿易戰樂觀，中國祭出經濟刺激措施，激勵美股3大指數同創新高，蘋果股票分割後首度衝上300美元價位，有利台股多頭，分析師預期台股有機會在農曆年前一拚改寫歷史新高。美股4大指數全面走揚，道瓊工業指數上漲330.36點、漲幅1.16%，收在28868.8點，NASDAQ指數上漲119.58點、漲幅1.33%，收在9092.19點，S&P 500指數上漲27.07點、漲幅0.84%，收在3257.85點，費城半導體指數上漲38.29點、漲幅2.07%，收在1887.91點。分析師表示，在美中即將簽署第一階段貿易協議下，市場氣氛轉趨樂觀，美股也頻創新高，蘋果（Apple）股價站上300美元，可望帶動台股蘋概三王台積電、大立光、鴻海持續擔綱多頭主力，在指數站上12100點，距離歷史高點12682點不到600點下，豬年封關前，台股有機會挑戰歷史新高。分析師指出，雖然市場氣氛趨於樂觀，但台股昨天上漲下外資卻出現小賣動作，加上在台指期小減多單，頗有居高思危的訊號，國內壽險業者也連續3個月減碼台股，台股要趕在豬年封關前創歷史新高，希望中也透露出些許阻礙。受到貿易戰利多及中國將下調金融機構存款準備率激勵，歐股普遍收漲，倫敦FTSE 100指數上漲0.82%，收在7604.3點，法蘭克福DAX 30指數上漲1.03%，收在13385.93點，巴黎CAC 40指數上漲1.06%，收在6041.5點。（編輯：楊玫寧）1090103
看好假期季度銷售 蘋果股價衝高逾300美元,證券,2020/01/03 10:35,https://www.cna.com.tw/news/firstnews/202001030021.aspx,（中央社紐約2日綜合外電報導）蘋果公司（Apple Inc.）今天在美股收盤股價站上300美元，外界預期在AirPods等穿戴裝置和計劃推出串流電視服務的需求帶動下，假期季度將表現亮麗。蘋果今天股價上漲2.3%收300.35美元，在股票分拆後首度超越300美元關卡。蘋果今天股價表現明顯不同於去年初的走勢，當時這家iPhone製造商下修財測，將近20年以來首度調降銷售預測。揮別一年前的挫折，蘋果去年股價表現超越所有大型科技股票，年線漲幅達86%，為10年以來最大漲幅。投資人對蘋果近15億用戶基礎和發揮Apple Watch、AirPods、Apple TV等配套產品功效的能力，以及每隔數年iPhone和iPad重要硬體換機週期逐漸看好。此外，這家科技大廠也提升用戶基礎，以成為自iCloud、Apple TV+、Apple Music和AppleCare等服務創造經常性收入的關鍵。蘋果預計今年秋季推出5G網路iPhone，上半年也料將推出一款新的低價手機。（譯者：徐睿承/核稿：曾依璇）1090103
台股開盤漲66.96點,證券,2020/01/03 09:17,https://www.cna.com.tw/news/afe/202001030023.aspx,（中央社台北3日電）台北股市今天開盤漲66.96點，加權股價指數為12167.44點，成交金額新台幣36.51億元。1090103
新台幣開盤貶0.6分 為30.120元,產經,2020/01/03 09:18,https://www.cna.com.tw/news/afe/202001030024.aspx,（中央社台北3日電）台北外匯市場新台幣兌美元匯率今天以30.120元開盤，貶0.6分。新台幣兌美元開盤交易區間為30.120元至30.060元。1090103
台積電ADR衝新高 股價填息平歷史高點,證券,2020/01/03 10:31,https://www.cna.com.tw/news/afe/202001030028.aspx,（中央社記者張建中新竹3日電）台積電美國存託憑證（ADR）突破60美元關卡，創下歷史新高，帶動今天股價同步走高，一度達新台幣345元，不僅完成填息，並平歷史最高價。中國人民銀行宣布6日起調降金融機構存款準備金率0.5個百分點，激勵美股持續攀高，道瓊工業指數大漲330.36點，漲幅1.16%，收在28868.8點，費城半導體指數漲逾2%，台積電ADR漲3.3%，收在60.04美元，折台股361.61元。隨著ADR創下歷史新高，台積電今天股價同步走高，早盤一度達345元，漲6元，漲幅1.77%。台積電第2季股利於去年12月19日除息，每股配發2.5元現金股息後，今天終於完成填息，並平歷史最高價，市值達8.94兆元。台積電預計16日召開法人說明會，除將公布去年營運結果外，也將說明今年營運展望。法人預期，台積電今年第1季在聯發科與超微（AMD）等客戶需求強勁下，營運可望淡季不淡，有機會持平表現。法人預期，台積電今年在5G與高效運算需求強勁成長下，7奈米製程業績可望持續成長，5奈米也將開始量產挹注業績，營運應可恢復高成長動能，全年營收將較去年成長15%至20%，續創歷史新高紀錄。（編輯：鄭雪文）1090103
被動元件漲價效應發酵 族群股價齊揚,證券,2020/01/03 10:12,https://www.cna.com.tw/news/afe/202001030035.aspx,（中央社記者張建中新竹3日電）被動元件漲價效應發酵，激勵國巨等類股股價同步大漲，其中，大毅股價更是強攻漲停。被動元件市場需求強勁，市場傳出已有廠商調漲積層陶瓷電容與厚膜電阻產品報價1成，甚至有廠商部分產品停止接單。隨著需求升溫、價格走揚，市場看好被動元件廠營運可望好轉，國巨等被動元件類股成為市場資金湧入焦點，股價同步大漲。國巨股價一度達新台幣475元，大漲39元，漲幅達8.94%，創15個月新高價；奇力新一度達141.5元，漲11.5元，漲幅8.84%。華新科股價一度達262元，漲22.5元，漲幅9.39%；禾伸堂達125.5元，漲8元，漲幅6.8%。大毅股價更一度漲停，達58.8元，漲幅9.91%。（編輯：鄭雪文）1090103
蘋果首度衝上300美元 蘋概股齊漲簇擁,證券,2020/01/03 10:16,https://www.cna.com.tw/news/afe/202001030036.aspx,（中央社記者韓婷婷台北3日電）美股4大指數在2020年開盤第1天開高擺尾同創新高，蘋果（Apple）股票分割後首度站上300美元，激勵台灣蘋概股全面開高，台股三王台積電、大立光與鴻海股價氣勢如虹。蘋果股價儘管在2019年全年已大漲近90%，2020年開紅盤第1天再展強勢，開高後一路走高，尾盤勁揚2.28%收在300.35美元，續創分割後新高價。激勵台灣蘋果相關供應鏈齊漲簇擁，股王大立光、可成、臻鼎-KY、台郡、康控-KY等早盤漲幅都一度超過2%。受惠多鏡頭及後鏡頭供貨比重可望大幅提升的玉晶光加緊腳步追趕大立光，近來在外資持續加碼推升下股價站上600元關卡，持續創下歷史新高價，今天在過高後在短線獲利了結賣壓下，漲幅相對趨緩，早盤維持在平盤上下小幅震盪。台積電今天續強，漲幅一度也有1%以上，持續扮演台股多頭火種，被動元件的國巨也在5G世代來臨，基地台、手機、汽車用量均擴增帶動下，再度重回供不應求的漲價市況，股價竄出大漲逾7%，成為新亮點。鴻海則有越走越高的趨勢，早盤漲幅超過1%。台灣蘋概股在2019年表現並不如蘋果本尊強勢，個股間表現也不太同調，今年能否整軍齊步走仍有待觀察，不過不少法人看好5G帶動的換機潮，加上因應5G元件需求及規格提升所推動的產業動能，受惠產業包括鏡頭、被動元件、半導需、功率放大器（PA）、微波通訊（RF）、記憶體、散熱、基頻IC等。中國大陸央行2日宣布將於6日下調金融機構存款準備金率0.5個百分點，加上美中貿易也即將簽訂第1階段協議，增強投資人對2020年全球經濟成長的樂觀預期，道瓊工業指數大漲330.36點，勁揚1.16%，以28868.8點再創新高，也激勵台股今天持續創波段新高。（編輯：楊凱翔）1080103
台股一度漲近百點 衝高後爆量翻黑,證券,2020/01/03 11:28,https://www.cna.com.tw/news/afe/202001030045.aspx,（中央社記者韓婷婷台北3日電）美股持續向上，台股早盤也展現多頭氣勢，在台股三王領軍下，指數一度進逼12200點，被動元件族群表現最強勢。不過衝高後短線賣壓出籠，10時30分後指數快速翻黑，量能破千億。截至11時，加權股價指數下跌32點、為12068點、成交值新台幣1254億元；蘋果（Apple）股價站上300美元大關，蘋概股受惠，早盤台積電、大立光盤中漲幅一度近1.5%、2.5%，鴻海漲幅也超過1%，指數漲近百點，但隨即賣壓出籠，台積電在完成填息後翻黑，股王大立光也由紅翻黑，衝擊電子族群遇壓回檔。分析師表示，台股在站上12100點之後，多頭氣盛，今天更有爆量表現，預估量能可望突破2000億元，不過由於量能增溫太快，短線可能需要整理，籌碼面沈澱後才有利多頭續攻。分析師指出，雖然台股一片榮景，但外資短線似乎尚未歸隊，2日在期現貨市場皆小賣，內資也有壽險業者連3個月減碼台股，在指數處於相對高檔之際，短線震盪恐怕加劇。法人則指出，在指數進入12000點之上長線高檔區後，權值股可望扮演穩盤角色，具業績、題材的中小型股則有機會突圍而出，例如近期有缺貨題材的被動元件就相當強勢，受惠多鏡頭趨勢的光學族群，也有機會續創新高。（編輯：鄭雪文）1090103
因應少子高齡 央行：宜擴大財源推動,產經,2020/01/03 11:42,https://www.cna.com.tw/news/afe/202001030062.aspx,（中央社記者潘姿羽台北2020年1月3日電）國際情勢變化快速，替台灣經濟前景帶來不確定性，但中央銀行指出，台灣少子化、高齡化的問題，也不利總體經濟潛能，政府必須致力於結構性改革，且宜擴大財源推動，放大政策成效。央行於報告中點出，台灣在少子化及高齡化的趨勢下，未來勞動力供給不足，而且隨著人口結構老化，工作年齡人口減少，勞動力的結構也會趨於高齡化。根據國發會人口推估資料，台灣15歲至64歲的工作年齡人口已在2015年達到高點，而後逐年減少，估計工作年齡人口比重將從2015年的73.9%，降至2065年的49.7%；央行指出，屆時工作年齡人口將不及人口的半數，和美國、日本、南韓、新加坡、香港等相比，僅略高於南韓。近幾年政府因應台灣少子高齡化、整體勞參率偏低的勞動市場長期結構性問題，已積極透過人口、勞動、教育、投資及產業政策，希望提升勞動力的量與質；央行指出，政府因應勞動市場結構問題的對策方向與國際作法一致，但若能擴大財源推動，效果可能較佳。央行表示，日本及南韓同樣面臨少子高齡化的嚴峻問題，且均投入高額財政預算積極因應；雖然台灣也推動「我國少子女化對策計畫」、前瞻基礎建設當中的「因應少子化友善育兒空間建設」及「人才培育促進就業之建設」，但相較之下，規模仍有限。央行指出，日本以2019年10月起，調高消費稅率約1.7兆日圓的財源（約新台幣5000億元），挹注幼兒教育免費措施、低收入家庭的大學等高等教育免費措施，希望能提高生育率，並促使婦女重返職場及強化人力資源發展；南韓政府也為了提高生育率，自2006年以來，投入約152.9兆韓元（約新台幣4.3兆元）於生育補貼。央行總結，政府未來財政若有餘裕空間，或許可適度計劃性增加經費，擴大政策成效。（編輯：鄭雪文）
伊朗高級將領遭美空襲死亡 油價聞訊飆漲,產經,2020/01/03 11:52,https://www.cna.com.tw/news/afe/202001030064.aspx,（中央社香港3日綜合外電報導）伊朗高級將領遭美國空襲死亡，導致美伊緊張局勢惡化，同時讓外界對這個蘊藏豐富原油地區爆發衝突感到憂慮，原油價格今天聞訊飆漲逾4%。根據與伊朗關係密切的伊拉克準軍事部隊「人民動員」（Hashed al-Shaabi），伊朗「聖城部隊」（Quds Force）指揮官蘇雷曼尼（Qasem Soleimani）在巴格達國際機場遭空襲死亡。這項消息傳出後，倫敦市場北海布倫特原油價格飆漲4.4%，報每桶69.16美元。紐約市場西德州中級原油價格勁揚4.3%，報每桶63.84美元。（譯者：徐睿承/核稿：張曉雯）1090103
新台幣午盤升1.5分 暫收30.099元,產經,2020/01/03 12:20,https://www.cna.com.tw/news/afe/202001030070.aspx,（中央社台北3日電）台北外匯市場新台幣兌美元今天中午暫收30.099元，升1.5分，成交金額4.55億美元。新台幣兌美元今天開盤價為30.120元，早盤最高30.041元、最低30.120元。1090103
5G標金飆破900億 黃金頻段創全球紀錄,產經,2020/01/03 12:35,https://www.cna.com.tw/news/firstnews/202001030073.aspx,（中央社記者江明晏台北3日電）5G第一波釋照競標進入第18天，至174回合總標金來到906.01億元的天價，最熱門的3.5GHz頻段暫得標金來到889.53億元，每10MHz的暫得標金額33.49億元，若除以人口數，則創全球新高紀錄。5G第一波釋照去年12月10日開始競標，底價訂為新台幣300億元，由中華電信、遠傳電信、台灣大哥大、亞太電信、台灣之星共5大電信業者廝殺角逐。5G第一波釋照今天競標進入第18天、第4週，並跨入2020年，第174回合暫時得標總標金為新台幣906.01億元，最熱門的頻段3.5GHz目前暫得標金889.53億元，單一頻段就已接近900億元的天價，每一單位頻寬價格來到33.49億元，較每單位價格9億元、總價243億元的底價成長約2.7倍；28GHz暫得標金16.48億元，1800MHz同樣尚無人出手。值得注意的是，業界分析，台灣首次5G競標，3.5GHz每10MHz單位暫時得標金已來到33.49億元，高於南韓，雖仍低於義大利和德國，但如果除以各國人口數，台灣3.5GHz的取得價值刷新全球最高紀錄，且台灣目前還只是競標數量而已，後續還有位置競標，恐怕會進一步推升標金。5G競標金額被市場形容是「失速列車」，遠超過國家通訊傳播委員會（NCC）設定的440億元，以及市場預期的600億元上下，連國家通訊傳播委員會（NCC）都呼籲業者冷靜、理性。面對5G標金不斷飆高，中華電信董事長謝繼茂日前分析，主因是「需求大於供給」，3.5GHz只有釋出270MHz頻段，但台灣每個業者都對5G商機充滿信心。市場指出，由於台灣之星、亞太電信勢必要拿到5G入場券，中華電信、台灣大哥大、遠傳電信中，應該有2家業者想標到100MHz，270MHz顯然不足以分配，導致5G標金一路衝高。（編輯：鄭雪文）1090103
金融業展望上半年股優於債 下半年聚焦東奧5G,產經,2020/01/03 12:18,https://www.cna.com.tw/news/afe/202001030076.aspx,（中央社記者劉姵呈台北3日電）展望2020年，台新銀行預估為貨幣寬鬆、景氣持續樂觀的一年，上半年股債市偏漲，配置為股優於債，下半年進入整理，則要股債平衡，投資人可留意東京奧運及5G等題材。台新銀行今天發布新聞稿表示，展望2020年將是貨幣寬鬆的一年，多數國家會祭出財政政策，在貨幣與財政的雙軌政策趨勢確立下，預估2020年上半年股債市偏漲，下半年進入整理，投資布局宜兼顧收益與成長。台新銀投資策略總監莊明書分析，以歷年美國總統大選前6至12個月美股漲多跌少、製造業與非製造業指數僅短期走緩、失業率創二戰以來新低、房地產市場穩定等數據來看，整體而言，預期2020年景氣仍將持續樂觀。莊明書建議，投資人應以增股、增勢、增價值作為布局方向，除了固定收益產品之外，應增持股性資產，同時可將手中獲利部位轉移至低基期、具轉機的標的。舉例來說，美國總統大選現任總統提出的競選牛肉及美中貿易戰和緩，將有助基期較低的陸股及新興市場等後續表現；另外，2020東京奧運、5G等題材，也可望成為資金追逐焦點。總結來看，因應市場審慎樂觀的態勢，台新銀建議，2020年上半年資產配置為「股優於債」，下半年則是「股債平衡」。此外，台新銀執行副總經理黃培直表示，保守投資人布局方向可選擇優質且有穩定利息收入的標的；積極投資人則可瞄準獲利高成長、指數高連動以及景氣循環高相關類型的標的。至於追求平衡投資的投資人，黃培直建議可將高成長、高連動、高相關作為投資準則，達到平衡配置；希望靈活操作的投資人，上半年可採積極的策略，待價格處於相對高點時逢高調節，轉為以息收概念為主軸的布局，並在債市以中信評、中天期的高收益、新興市場為投資標的。（編輯：楊凱翔）1090103
陳副總統：鼓勵跨界應用 創造文化經濟量能,產經,2020/01/03 12:28,https://www.cna.com.tw/news/afe/202001030082.aspx,（中央社記者潘智義台北3日電）副總統陳建仁今天在台北電器空調影音3C電腦年終購物節開幕致辭時表示，政府鼓勵業者跨界應用，提高文化產業結構，結合科技創新創意，達成節能減碳目標，創造文化經濟量能。陳建仁指出，2019年台灣創新競爭力排名高居全球第4，亞洲第1，台灣是超級創新國，希望發展跨境、跨領域、跨虛實的文化科技產業，結合影視新興的垂直應用，來輔助電影、電視、線上影音、流行音樂、動畫、漫畫等，創新不同業別的創意活動分工營運模式，奠定文化科技產業的創新價值鏈。他說，參展的商品可謂品牌最齊全、品質最有保障、商品價值最實在、最好康，幫消費者把關，所以購物節是最好的選擇。業界推出琳瑯滿目的參展產品、促銷活動，民眾可以買到喜歡的產品。另外，經濟部次長王美花表示，家電新產品節電功能好，民眾可以趁年終購物節汰舊換新。台北市副市長黃珊珊則說，台北市透過節能減碳、智慧操控等方式，已連續2年用電量負成長。（編輯：楊玫寧）1090103
太陽能單晶市場穩定 多晶報價持續走跌,產經,2020/01/03 12:37,https://www.cna.com.tw/news/afe/202001030091.aspx,（中央社記者張建中新竹3日電）適逢年關交替，本週整體太陽能市場延續2019年末狀況，呈現單晶市場穩定和多晶市場報價持續下跌走勢。據市調機構集邦科技調查，太陽能多晶矽晶圓本週報價跌1.21%，多晶電池跌3.17%；單晶矽晶圓、單晶電池、高效單晶電池與特高效單晶電池報價則全面持平。集邦科技表示，多晶矽晶圓與電池市場需求依然疲弱，產品價格持續走跌，多晶矽晶圓供應鏈以降低庫存水位為目標，產業洗牌效應正逐步發酵。單晶矽晶圓與電池市場需求相對熱絡，集邦科技指出，市場供給量也充裕，且多由大廠訂單支撐，產品價格不致劇烈波動，維持穩定表現。展望未來，集邦科技表示，海外市場開工區域與時間可能出現變化，中國市場可望於農曆年後湧現新一波動能。（編輯：楊玫寧）1090103
學者憂中日韓FTA衝擊產業 經部三方向因應,產經,2020/01/03 14:46,https://www.cna.com.tw/news/afe/202001030093.aspx,（中央社記者廖禹揚台北3日電）中日韓峰會達成共識，將積極推動3國FTA與RCEP如期簽署，學者憂心可能影響台灣產業競爭力；經濟部今天表示，必須以差異化、高值化及具信賴度的售後服務，來爭取訂單與客戶。中國國務院總理李克強、日本首相安倍晉三、南韓總統文在寅去年底於中國四川成都舉行會談，會議成果文件載明，將積極推動2020年如期簽署區域全面經濟夥伴協定（RCEP），並加速推動3國自由貿易協定（FTA）協商，學者憂心，一旦中日韓FTA及RCEP完成簽署，將威脅台灣出口競爭力。經濟部政務次長王美花今天出席活動受訪表示，中日韓FTA仍處早期階段，還不清楚後續要怎麼談、談多久，現階段就此評論還為時過早。至於RCEP簽署對台灣產業影響，王美花坦言，企業的確會希望台灣也能加入，但在尚未加入前，暫時還是從差異化、高值化、具信賴度的售後服務等方向，以台灣特有的技術與品質爭取訂單及客戶，保持既有市場。台灣出口享有資訊科技協定（ITA）零關稅優惠的高科技產品約占總出口額的7成，剩下3成受影響可能性較大；王美花說，RCEP成員國目前正在進行各國之間的相關關稅確認，目前了解，應與東協及中國大陸、南韓之間FTA相關降稅內容差異不大，但對台灣產業影響還須等詳細資料公開才較好評估。（編輯：林淑媛）1090103
