標題,分類,時間,網址,內文
遠傳赴微軟創新論壇 秀5G大人物實力,產經,2019/06/05 19:19,https://www.cna.com.tw/news/afe/201906050277.aspx,（中央社記者江明晏台北5日電）遠傳電信連續兩年獲邀出席微軟「亞洲研究院創新論壇」，成為台灣電信業唯一受邀「創新匯」成員，遠傳電信總經理井琪也在論壇中分享5G時代「大人物」數位轉型的機會和挑戰。井琪今天帶領遠傳技術團隊代表出席微軟在北京舉行的「亞洲研究院創新論壇」，遠傳是「創新匯」成員中唯一的電信業者。井琪並受邀於論壇中分享遠傳如何利用遠傳5G「大人物」(大數據、人工智慧、物聯網)技術對內推動遠傳數位轉型，並與遠東集團關係企業合作共同開發AI應用場域，對外則協助企業客戶產業創新升級。微軟「亞洲研究院創新論壇」是為「創新匯」成員量身打造的年度科技盛會，匯聚來自不同產業的數位創新領袖與微軟亞洲研究院資深技術專家，共同探討AI最新趨勢與挑戰。井琪表示，數位轉型是全球顯學，當新科技逐漸成熟，企業的競爭優勢隨時可能被顛覆，如何搶占先機，成為數位轉型領先者，影響企業脈動。未來5G高速、大頻寬和低延遲特性，將能結合邊緣運算和AI機器學習滿足產業應用需要的海量連結、即時反應等需求，創造更高的產業價值。遠傳期望藉由與微軟緊密的長期合作，運用微軟在AI領域突破性的技術成果，結合遠傳長期布局5G技術、物聯網產業應用、大數據平台建置以及堅強的ICT整合實力，讓雙方的創新研發能力與產業經驗優勢互補，共同打造解決企業痛點、改善人們生活的AI創新應用解決方案。遠傳與微軟結盟長期AI策略合作夥伴，共同推動台灣產業升級與人才培育，繼去年微軟邀請遠傳成為台灣「微軟AI研發中心」電信產業首位合作夥伴；去年5月遠傳首度應邀出席微軟在北京舉行的「亞洲研究院創新論壇」，成為台灣唯一受邀的「創新匯」成員；12月遠傳並以創新匯成員身分邀請微軟亞洲研究院長洪小文到遠傳演講，針對遠傳AI技術發展及創新應用深度交流；今年2月更攜手微軟舉辦「遠傳AI黑客松競賽」。遠傳也在去年宣布啟動「2020數位轉型計畫」，積極布局大數據、人工智慧、物聯網所謂的「遠傳大人物」創新應用，AI落地實績遍及紡織、水泥、鋼鐵等產業，包含AI智慧路燈、雲端智能環控/環安、AI資安管理平台、AI人臉辨識及甫於「台北5G國際高峰會(Taipei 5G Summit)」現場利用5G訊號展演的AI智慧驗布機等。（編輯：郭萍英）1080605
大巨蛋容留人數引討論 遠雄：規範本該遵守,產經,2019/06/05 19:31,https://www.cna.com.tw/news/afe/201906050280.aspx,（中央社記者韋樞台北5日電）台北市長柯文哲今天在演講場合提及大巨蛋環評人數是5萬9833人，容留人數上限可以相同，兩者愈近愈簡單。遠雄企業團表示，在不超過環評當量人數的要求下，本就是該遵守的規範。柯文哲中午接受中華民國工商協進會邀請，會中以「光榮城市」為題進行演講，被問及大巨蛋相關問題時說，大巨蛋設計雖然奇怪，但還是可以克服，若容留人數上限為5萬9833人，以後要怎麼改再想想看。如果大巨蛋的商場可以變商辦，人數下降，可以減少公安壓力。會後他接受媒體訪問時進一步說明，大巨蛋是台灣第1個大型公共建築物，但法律卻沒有清楚定義，如環評人數為5萬9833人，台建中心通過的避難人數為14萬人，容留人數要多少，這就變成有太多空間。若是容留人數愈低，審查就愈容易通過，反之就愈難。遠雄企業團副總經理楊舜欽表示，大巨蛋容留人數本來就有各種不同標準，柯文哲所提6萬人之下如果是指環評人數5萬9833人的話，在不超過環評當量人數的要求下，本來就是遠雄該遵守的規範。至於實際營運人數，則屬市政府消防局的職權，遠雄會依照法規完成各階段模擬。至於商場動用途變更，一切以符合投資執行企劃書為前提，在不違背BOT甲、乙雙方投資營運企劃下，都可以協商。（編輯：楊凱翔）1080605
行政院審查通過大林蒲案 總經費1045.7億,產經,2019/06/05 19:31,https://www.cna.com.tw/news/afe/201906050282.aspx,（中央社記者廖禹揚台北5日電）經濟部表示，行政院今天審查大林蒲案通過，計畫總經費修正為1045.7億元，先前有疑慮的自償率部分提高至7成，其餘由公務預算編列393億元支持，強調中央絕不會卡高雄。經濟部今天發布新聞稿表示，行政院今天召開「全國循環專區試點暨新材料循環產業園區申請設置計畫」（大林蒲案）審查會議，依高市府5月15日意見修正計畫內容審查通過。經濟部官員表示，計畫總年期維持106年至117年，但發放補償費時程從109年調整為110年4月，總經費則略為調降至新台幣1045.7億元，由中央與高雄市政府以合作開發方式推動，並將自償率提高至7成，不足缺口縮減至393億元，由公務預算編列支持。經濟部表示，考量高市府為順利推動大林蒲遷村作業，於當地設置大林蒲村普查專案辦公室所需支用108年度經費，經行政院同意先行動支，再由經濟部與高市府盡速完成相關程序。會中並先請高市府擬定遷村計畫細節，並啟動遷村前查估作業。經濟部表示，自高雄市長韓國瑜上任後，經濟部主動邀請高市府討論本案，並與市府逐一確認大林蒲案的計畫內容；行政院也高度重視本案，相關預算早已匡列完成，並以最快速度審查通過。經濟部強調，中央絕不會卡高雄，反而是全力挺高雄，支持高雄建設，未來遷村工作細節，也希望高市府能積極與在地市民協調。（編輯：林興盟）1080605
大林蒲案啟動 居民盼更清楚遷村計畫內容,產經,2019/06/05 21:26,https://www.cna.com.tw/news/firstnews/201906050284.aspx,（中央社記者王淑芬高雄5日電）今天經濟部所提「全國循環專區試點暨新材料循環產業園區申請設置計畫」通過，大林蒲遷村啟動。不過，當地居民盼更清楚的遷村內容，還強調是居民配合政府用地需求遷村。高雄市長韓國瑜上任後即明確表示大林蒲遷村計畫持續辦理，並向中央爭取最好的遷村安置方案。行政院通過經濟部所提「全國循環專區試點暨新材料循環產業園區申請設置計畫」，也宣示大林蒲遷村正式啟動，高市府在計畫通過前，已成立專案推動辦公室，持續遷村作業。大林蒲遷村計畫是指小港區毗鄰林園石化區、中油大林廠、台電大林發電廠等濱海，含鳳源、鳳興、鳳林等6里居民，他們長期飽受工業污染，居住環境惡劣；前市長陳菊就展開遷村調查了解居民遷村意願，前後任行政院長，以及現任行政院副院長陳其邁都關切遷村計畫，並允全力協助。長期在地方活動的「金煙囪文化協會」創會理事長、鳳興里長洪富賢受訪表示，未看過遷村計畫書內容，也沒有官員向居民說明相關遷村事宜，不了解土地「一坪換一坪」的計算方式，促官員說清楚講明白，釐清「政府需地才辦理遷村，非居民要求遷村」的原則。住在大林蒲近60年「要健康婆婆媽媽團」高雄團團長洪秀菊告訴中央社記者，盼官員儘速向居民說清遷村計畫內容，勿讓居民陷入恐慌。依市府先前概估，遷村總戶數約1萬1500戶。高雄市府經發局表示，循環產業園區計畫含產業園區設置、遷村安置作業及經費，預計民國117年開發完成，預估可新增約210公頃產業用地，帶來投資約新台幣320億元，並可創造約1萬6000個在地就業機會。高雄市盼園區建設一併解決大林蒲地區被工業區包圍的困境及既有金屬、石化產業轉型升級，與工業管線穿越市區的問題，達成環境正義、經濟發展與城市安全的永續發展目標。在遷村換地部分，市府規劃以住商地區建地「一坪換一坪」辦理，至於未來的土地利用上，朝能源、物料循環再利用的新型態園區，並引進綠色循環、高值材料產業等，為高雄既有產業轉型、高值發展。高雄市府都市發展局表示，因應大林蒲遷村計畫，5月底於中油大林蒲康樂活動中心2樓成立「大林蒲遷村專案辦公室」，專責處理相關遷村事宜，召集人是副市長李四川。（編輯：吳佳穎/孫承武）1080605行政院審查通過大林蒲案 總經費1045.7億（中央社記者廖禹揚台北5日電）經濟部表示，行政院今天審查大林蒲案通過，計畫總經費修正為1045.7億元，先前有疑慮的自償率部分提高至7成，其餘由公務預算編列393億元支持，強調中央絕不會卡高雄。經濟部今天發布新聞稿表示，行政院今天召開「全國循環專區試點暨新材料循環產業園區申請設置計畫」（大林蒲案）審查會議，依高市府5月15日意見修正計畫內容審查通過。經濟部官員表示，計畫總年期維持106年至117年，但發放補償費時程從109年調整為110年4月，總經費則略為調降至新台幣1045.7億元，由中央與高雄市政府以合作開發方式推動，並將自償率提高至7成，不足缺口縮減至393億元，由公務預算編列支持。經濟部表示，考量高市府為順利推動大林蒲遷村作業，於當地設置大林蒲村普查專案辦公室所需支用108年度經費，經行政院同意先行動支，再由經濟部與高市府盡速完成相關程序。會中並先請高市府擬定遷村計畫細節，並啟動遷村前查估作業。經濟部表示，自高雄市長韓國瑜上任後，經濟部主動邀請高市府討論本案，並與市府逐一確認大林蒲案的計畫內容；行政院也高度重視本案，相關預算早已匡列完成，並以最快速度審查通過。經濟部強調，中央絕不會卡高雄，反而是全力挺高雄，支持高雄建設，未來遷村工作細節，也希望高市府能積極與在地市民協調。（編輯：林興盟）1080605
新台幣波動劇烈 央行罕見表態動用外匯存底調節,產經,2019/06/05 20:20,https://www.cna.com.tw/news/firstnews/201906050291.aspx,（中央社記者邱柏勝台北5日電）美中貿易戰升溫，新台幣劇烈波動，單月貶幅2.24%，創逾3年半最大，央行表示，為維持市場秩序，進場調節，抵銷外匯存底投資運用收益。央行並公布5月外匯存底4644.34億美元，月減3.94億美元，終止連6個月創高紀錄。過去外匯存底出現減少，央行皆表示是因為人民幣、歐元兌美元貶值，以這些貨幣持有的外匯存底折計成美元後金額減少，抵銷外匯存底投資收益所致，但這次直接在新聞稿中表明，外匯存底減少是因新台幣波動劇烈，央行為維持匯市秩序進場調節，抵銷外匯存底投資運用收益，實屬罕見。對此，央行外匯局局長顏輝煌解釋，5月台北外匯市場日平均波動幅度為6.9分，較4月日平均波動幅度3.5分高出近2倍；且因美中貿易戰升溫，不確定風險增加，據金管會統計，外資5月淨匯出達20.3億美元，這也導致新台幣貶幅加大，央行基於維持市場秩序穩定，才決定進場調節。顏輝煌表示，並非新台幣波動幅度較大，央行就一定會進場調節，同時必須綜合考量所有相關情勢，經分析評估，才會決定是否進場調節。他重申，央行並無能力讓新台幣升值或貶值，只能減緩新台幣過度波動，並強調央行無能力扭轉新台幣的升貶趨勢。此外，根據央行統計顯示，至108年5月底，外資持有國內股票及債券按當日市價計算，連同新台幣存款餘額共折計3523億美元，約當外匯存底的76%，月減336億美元、月減7個百分點。主因5月台股重挫469點，外資持股市值降低，且外資累計賣超金額達1449億元所致。（編輯：郭萍英）1080605
外電指美利率看台壽險業臉色 央行：過度誇大,產經,2019/06/05 20:05,https://www.cna.com.tw/news/afe/201906050294.aspx,（中央社記者邱柏勝台北5日電）外媒報導，台灣壽險業持有大量美債，若台灣金融市場動盪，新台幣大升，壽險業恐大量拋售美債，最終甚至可能影響美國聯準會（Fed）決策。央行今天提出3點澄清，認為該外電過度誇大。英國金融時報專欄作者Robin Wiggleworth撰文指出，台灣壽險業持有大量美債，若台灣金融市場發生動盪，新台幣大幅升值，台灣壽險業恐因匯損抵銷、甚至遠超利息收益，終將迫使台灣壽險業者退出美國市場、拋售大量美債，不僅影響美債市場，甚至恐影響聯準會貨幣決策。此文一出，驚動兩大財金部會，金管會官員強調，台灣金融市場「正常而穩定」，且台灣壽險業已依保險業風險管理實務守則控管各種風險。而根據資料顯示，目前台灣壽險業每年總保費收入仍大於保險費支出，尚無流動性風險疑慮。央行今天更提出3點澄清，認為該外電報導過度誇大。首先，依美國證券業暨金融市場協會（SIFMA）資料，截至2018年底，美國房貸擔保抵押債券或不動產抵押債券憑證（MBS或CMO）及公司債流通在外餘額合計約為19兆美元。但根據金管會保險局資料，台灣保險業於美國曝險總金額為新台幣6兆4175億元，折約2082億美元，僅占美國債券流通在外餘額約1%，比重甚微，不僅難以對美國債券市場產生重大影響，更不可能左右美國貨幣政策。其次，央行表示，台灣壽險業維持審慎的匯率風險管理，且極端狀況發生機率甚低。截至2019年4月止，壽險業國外投資匯率避險比例約49%。若加計外幣非投資型保單（自然避險），則其國外投資避險比例增加至約75%，顯示壽險業仍審慎因應匯率風險，發生保戶大量解約，迫使壽險業者大量拋售國外資產的可能性極低。最後，央行強調，台灣金融體系相當健全，且相對於其他主要貨幣，新台幣對美元匯率波動幅度向來相對穩定，若大量資金移動導致新台幣匯率大幅波動，而有不利經濟與金融穩定之虞時，央行將本於職責維持外匯市場秩序，以維持金融市場穩定。（編輯：楊凱翔）1080605
鴻海5月營收同期新高 通訊類產品助攻,證券,2019/06/05 20:16,https://www.cna.com.tw/news/afe/201906050297.aspx,（中央社記者鍾榮峰台北5日電）鴻海自結5月合併營收新台幣3842.17億元，是歷年同期新高，主要是通訊類產品表現較4月佳。展望第2季，法人指出需觀察美中貿易戰影響。鴻海自結5月合併營收3842.17億元，較4月3797.86億元微增1.17%，比去年同期3471.04億元成長10.69%，創歷年同期新高。累計今年前5月鴻海自結合併營收1兆8203.36億元，較去年同期1兆7186.68億元增加5.92%。從三大產品線來看，鴻海指出，5月相較4月，通訊（communication）類產品表現最佳，運算（computing）產品次之，再來是消費性電子（consumer electronics）產品。法人指出，5月包括iPhone等消費性電子產品進入新舊產品交替階段，不過通訊類產品有支撐，帶動鴻海5月業績站上同期新高。鴻海今天股價收在當日最低點71元，跌幅1.11%，成交量來到4萬7848張；外資法人今天賣超鴻海2萬2556張，三大法人賣超鴻海2萬2830張，鴻海今天市值持續在新台幣兆元之下，來到9842.7億元。鴻海將於6月11日於土城總部會議中心舉行法人說明會，其中鴻海5位新任一般董事候選人也將出席進行簡報，並回答投資法人問題。展望第2季，法人指出鴻海第2季業績仍待觀察整體經濟大環境走勢，尤其是美中貿易戰進展，以及iPhone在中國價格調整後的市場銷售和拉貨力道。（編輯：林興盟）1080605
國稅局稅務窗口 助攻百億資金回台投資,產經,2019/06/05 20:21,https://www.cna.com.tw/news/afe/201906050301.aspx,（中央社記者吳佳蓉台北5日電）配合行政院「歡迎台商回台投資行動方案」，各區國稅局年初成立稅務諮詢窗口。財政部統計，至今已受理210件一般稅法諮詢，最終進入個案諮詢且實際匯資金的案件共4件，匯回金額逾新台幣113.8億元。針對海外資金課稅，財政部現有三道協助機制，除正在修法階段的「海外資金匯回專法」，以及年初針對個人海外資金課稅所發布的解釋令外。五區國稅局也設立稅務諮詢窗口，提供台商就現行稅制，進行一般稅法諮詢；若涉及複雜個案情形，會由各區局長出面，召集專責小組與台商進行個別諮詢。財政部今天舉辦「記者茶敘交流會」。財政部長蘇建榮說，截至目前，五區國稅局的稅務諮詢窗口，總共接到210件一般稅法諮詢案件，目的在釐清對海外所得課稅的稅務疑慮，其中有11件真正進入到個案諮詢階段，針對個案實際情形與國稅局做討論，之中並有9案已結案，大部分是企業諮詢案件。財政部賦稅署署長李慶華補充，所謂「諮詢結案」案件，指的是個人或企業已與國稅局就匯回資金的課稅方式、稅額多少達成共識，且有國稅局的正式行文，賦予法律效力。不過，確認稅負狀況後，個人或企業資金是否會實際匯回，還是要根據其投資決策來評估。賦稅署統計，在9件已結案的稅務諮詢案件中，有4案已完成營所稅結算申報並繳納；其中3案為南區國稅局案件，總匯回金額約113.8億元，另1案則為台北市國稅局案件，匯回資金無法評估。其餘5案，資金則尚未匯回台灣，納稅人仍在評估決策當中。蘇建榮強調，不能單以匯回個案件數來評估稅務諮詢的成效，有些單一個案，匯回金額的就達幾10億元，每一案顯示意義都不同。另一方面，對於今天工商協進會表示，希望將營所稅稅率由20%降為17%。蘇建榮則回應，從國際比較來看，台灣營所稅稅率20%低於韓國、日本、美國，其他國家甚至還有地方所得稅，加上現行產業創新條例已提供不少租稅優惠，現行營所稅稅率應屬適當。（編輯：楊凱翔）1080605
佳世達5月營收年增7.97% 續創同期新高,證券,2019/06/05 20:26,https://www.cna.com.tw/news/afe/201906050304.aspx,（中央社記者潘智義台北5日電）液晶顯示器製造商佳世達科技今天公布5月合併營收為新台幣135.98億元，續創歷年同期新高，較去年同期成長7.97%，較4月成長5.4%。佳世達統計，今年1至5月合併營收663.53億元，較去年同期增加10.74%。佳世達科技指出，5月合併營收續創同期新高，主因轉投資公司如友通、其陽、拍檔等挹注之外，現有產品也表現強勁。佳世達表示，以轉投資事業組成聯合艦隊為近年最重要的轉型策略，希望集結優秀的隱形冠軍，提升附加價值，共創成長。佳世達投資友通、拍檔、凱圖、虹韻等新成員後，挹注集團資源，不僅帶動新成員業績成長，更貢獻佳世達整體表現，共同提升多方的股東價值。（編輯：黃國倫）1080605
日圓一個半月升值近6% 哈日族這兩招亡羊補牢,產經,2019/06/05 20:43,https://www.cna.com.tw/news/firstnews/201906050305.aspx,（中央社記者邱柏勝台北5日電） 日圓兌新台幣近一個半月升值近6%，升勢之快令人咋舌，也讓許多來不及換匯的民眾扼腕。不過，赴日民眾仍有「亡羊補牢」機會，無論是透過線上換匯，或使用「旅日神卡」消費，都能減少失血。受美中貿易戰升級影響，市場避險情緒再起，資金除回流美國、促使美元轉強外，部分也轉向具有避險功能的黃金與日圓等，導致日圓最近表現強勢。根據台銀牌告價格，昨天日圓現金賣出價盤中來到0.2955元，創兩年半新高紀錄，收盤價為0.2948元，若與4月17日的0.2789元相比，僅一個半月兌新台幣就升值近6%，簡單來說，跟一個半月前相比，民眾到日本自由行的消費就貴了快6%。對於死忠哈日族來說，在日圓低檔時已經大量買進日圓現鈔，但對於部分臨時才要動身前往日本的民眾而言，差幾天換匯，成本就高出不少。對此，銀行主管表示，短期內日圓要大幅貶值並不容易，民眾只能透過幾種做法，儘量少「失點血」。首先，是使用線上結匯，或是透過外幣提款機（ATM）提領日圓，存戶都能獲得匯率折讓優惠，比起臨櫃換匯便宜。另外，部分銀行臨櫃換匯免手續費，有些銀行需要手續費，因此選擇免收手續費的銀行換匯，也能省下一些錢。其次，就是使用信用卡消費。銀行人士說，用信用卡消費可享受比現金匯價更低的即期匯價，且如果是去日本玩，使用國際發卡組織JCB的信用卡，只需經過一次換匯（日圓換新台幣），但若使用VISA、MasterCard信用卡，就要經過兩次換匯（先換成美元再換新台幣），因此用JCB卡的匯價會比較好。另外，現在許多銀行都針對喜愛赴日旅遊的民眾祭出所謂的「旅日神卡」，市面上甚至已出現日本消費現金回饋3%、回饋無上限的信用卡，消費等於直接先打97折（但必須扣除海外刷卡手續費），更是常去日本玩的哈日族必辦的信用卡。（編輯：趙蔚蘭）1080605
光收發模組出貨攀高 眾達5月營收年增22.6%,證券,2019/06/05 20:36,https://www.cna.com.tw/news/afe/201906050306.aspx,（中央社記者潘智義台北5日電）眾達科技公司今天公布，5月合併營收新台幣2.22億元，較去年同期成長22.6%，續創同期新高；累計今年1至5月合併營收9.79億元，較去年同期成長28.9%。眾達指出，5月合併營收續創新高，主要來自於32G光收發模組出貨量再攀新高，且從客戶需求量預估來看，下半年將持續成長。眾達表示，目前高速光收發模組的主要需求來自於巨量資料中心（Hyper-scale data center）與5G通訊基礎建設的建置，屬剛性需求，且因應北美客戶要求，公司研發多時的100G單通道及400G光收發模組產品可望進入量產，目前相關生產及測試設備已進駐蘇州廠房，並開始小量試產出貨。眾達說明，由於100G單通道、400G光收發模組開發進度順利，將辦理額度5000張的現金增資案，用於設置無塵室與購買機器設備以，及充實營運資金用途，預計6月送件，以因應100G單通道、400G光收發模組產品的量產進度。眾達評估，5G通訊基礎建設今年可望啟動，Google、Amazon、Facebook與Microsoft合計3年內擴增巨量資料中心達450座目標持續進行。眾達指出，今年已有32G光收發模組的成長動能下，100G單通道、400G光收發模組產品，將成為新一波成長動能。（編輯：楊凱翔）1080605
EMI材料出貨旺 鼎炫5月營收走揚,證券,2019/06/05 20:59,https://www.cna.com.tw/news/afe/201906050316.aspx,（中央社記者潘智義台北5日電）全球衡器暨專業電磁波遮蔽材料（EMI）廠商鼎炫投資控股公司今天公布5月合併營收為新台幣1.54億元，較去年同期成長18.71%，主因EMI材料出貨暢旺。鼎炫-KY（鼎炫投資控股公司）表示，整體營收連續3月維持較前一個月增長局面，且今年以來單月營收皆創歷年同期新高紀錄。累計今年1至5月合併營收6.92億元，較去年同期成長27.88%。鼎炫-KY說，持續受惠EMI材料事業在筆電、平板電腦既有材料訂單出貨較去年同期增加，加上國際品牌客戶已啟動今年新款機種材料備貨力道，推升5月EMI材料營收比重維持高檔，占合併營收約6成水準。在衡器業務方面，鼎炫-KY指出，南京地區智慧農貿客戶新規格產品已持續拉貨，5月智能衡器出貨占衡器事業比重提升至17%。針對中美貿易戰不確定因素，鼎炫-KY指出，因產品分散至不同地區供應鏈，客戶分布全球，目前影響不大，但已於4月赴印度設立營業籌備處，先以拓展當地衡器銷售布局，未來再視業務發展設立新生產基地。（編輯：黃國倫）1080605
