標題,分類,時間,網址,內文
台電實驗新節電方案 夏月尖峰價差最高10倍,產經,2019/06/01 16:15,https://www.cna.com.tw/news/afe/201906010124.aspx,（中央社記者廖禹揚台北1日電）繼住商型簡易時間電價後，今年再擬定「即時電價」，非夏月及夏月分別依用電狀況擬定紅、黃、綠等不同電價表，夏月尖峰價差最高可達10倍，最快明年報請經濟部核定後實施。電價計算方式多元，包括累進電價、標準型時間電價、住商型簡易時間電價等，依離尖峰時段調整電價，以抑低尖峰時段用電。而搭配智慧電表設置，台電最新研擬以小時為單位的「即時電價」，依備轉容量率及備轉容量預估隔天情況，決定採用何種電價表。台電發言人徐造華表示，夏月及非夏月分別都有紅、黃、綠3種電價，會在前一天晚上6時前通知用戶隔天以哪種顏色電價計算，若以夏月尖峰時段相比，紅色與綠色電價價差可達約10倍。徐造華強調，即時電價仍在實驗階段，共有200至300戶已裝設智慧電表用戶參與，在8、9月實驗方案結束後，會再檢討節電效果及用戶回饋意見，再報請經濟部核定，實際施行方案與上路時程尚未確定。（編輯：郭萍英）1080601
台積電國巨股東會5日登場 聚焦下半年展望,證券,2019/06/01 16:04,https://www.cna.com.tw/news/afe/201906010126.aspx,（中央社記者張建中新竹1日電）台積電與國巨股東常會都將於5日登場，隨著美中貿易戰延燒，產業不確定性升高，兩大廠下半年營運展望成為產業景氣風向球，料將是下週市場關注焦點。台股本週仍受美中貿易戰發展左右，因中國不會透過制裁蘋果(Apple)反制美國，激勵台積電等蘋果概念股股價走揚，並帶動台股5月31日大漲115.5點，收復10417點年線關卡，週線上漲170.21點。眾所矚目的晶圓代工廠台積電股東會將於5日登場，台積電創辦人張忠謀去年6月股東會後交棒退休，今年股東會將首度由董事長劉德音主持。台積電先前表示，將持續出貨華為，其餘客戶需求也沒有特別變化，第2季營運目標不變，季營收將約75.5億至76.5億美元，將季增約7%，下半年仍將強勁成長，全年營運目標也不變，將微幅成長。只是後續有高通(Qualcomm)與美光(Micron)等多家廠商紛紛表態暫停供貨華為，有不少外資認為台積電營運恐無法避免受到影響，紛紛調降台積電營運展望與目標價。台積電是否修正下半年營運展望，將是下半年產業景氣是否會出現旺季不旺的重要觀察指標，料將是台積電股東會市場關注重點。被動元件大廠國巨也將於5日召開股東會，國巨因市場需求趨緩影響，營運自去年第4季起快速滑落，短期大中華區消費電子拉貨動能未見明顯反彈，第2季展望依然保守，國巨下半年展望也將備受市場關注。（編輯：黃國倫）1080601
川普關稅大刀指向墨西哥 台廠再受威脅,產經,2019/06/01 16:52,https://www.cna.com.tw/news/firstnews/201906010132.aspx,（中央社記者廖禹揚台北1日電）美國總統川普將關稅大刀指向墨西哥，學者分析，墨西哥輸美產品多為中間材，台商在墨西哥投資原本就是為了就近供應美國市場，若加徵關稅成真，台廠可能會評估從墨西哥撤廠。包含緯創、緯穎、和碩、仁寶等，都在墨西哥設有製造廠或據點，其中緯穎墨西哥產能約占6成。川普推文再度對全球經濟投下震撼彈，6月10日起對墨西哥產品加徵5%關稅，至墨西哥設法阻止非法移民經美墨邊境進入美國為止，關稅稅率將逐月攀升5個百分點，若墨西哥無法滿足白宮要求，稅率將於10月1日升至25%。對於川普動輒以提高關稅威脅貿易對手，台灣經濟研究院景氣預測中心副主任邱達生接受中央社記者訪問時指出，美墨關係與美中大不同，中國輸美大宗產品為電腦、智慧型手機、服飾等成品，但墨西哥是美國企業生產所需的零組件等中間財供應國，大多是美商或台灣電子五哥等外商到墨西哥當地投資生產。若川普提高墨西哥產品輸美關稅，邱達生認為，這等於是變相將美國企業上游成本提高，將導致美國遭到輸入型通膨的威脅，「以美國目前經濟狀況可能會受不了」。邱達生進一步指出，美國4月消費者物價指數（CPI）為1.98%，聯準會（Fed）一般在達到2%就會研議升息，避免通膨不斷惡化，但川普不希望聯準會升息，避免對美股產生衝擊，一方面又要對墨西哥加稅，「現在整體措施是錯亂、矛盾的」，因此他推估川普對墨西哥加徵關稅的可能性不高。不過，川普行為模式一向難以捉摸，若他一意孤行，邱達生分析，台商在墨西哥投資生產零組件，是因為可以就近供應美國市場所需，若美國對墨西哥加稅，「基本上就沒有誘因了」，業者可能評估從墨西哥撤廠。值得注意的是，雖然川普大動作威脅要對墨西哥輸美產品加稅，但廠商也在觀望墨西哥是否會在6月舉行的G20峰會中作出關於加強管制非法移民的象徵性承諾，以促使川普收回成命。此外，中華經濟研究院第一研究所所長劉孟俊表示，在美中貿易戰開打後，從統計數據來看，台灣對墨西哥投資的確有增加趨勢，顯示墨西哥具有的廉價勞力與地理區位優勢是因應美中貿易戰的第3種選擇。但川普對墨西哥祭出關稅措施，是否可能影響台商，劉孟俊認為尚待觀察，美國每次加徵關稅措施都有豁免名單，避免影響美國企業；而世界貿易組織（WTO）也簽有資訊科技協定（ITA），是否可因此免於加稅，還有待評估。（編輯：林淑媛）1080601
對墨課徵關稅 美恐討不到便宜,產經,2019/06/01 20:39,https://www.cna.com.tw/news/afe/201906010172.aspx,（中央社台北1日電）美國總統川普揚言對墨西哥課徵的關稅，可能涵蓋多達3600億美元商品，這將是美國迄今對貿易夥伴國徵收的最大規模懲罰性關稅。美國商界認為這是嚴重錯誤，將對美國自身經濟產生負面衝擊。「華爾街日報」（The Wall Street Journal） 報導，在擬議中，這5%關稅將自6月10日開徵，適用於所有自墨西哥進口的商品；其中汽車、原油和水果蔬菜3類商品以往鮮少在美國當局的報復性貿易措施下受到波及。同時美方對墨西哥課徵的關稅將逐月調升5%，迄10月間將達到25%，除非墨西哥採取某些行動以減少抵達美國邊界的移民人數。各大產業都將捲入這場貿易衝突，影響所及包括價值大約340億美元的小客車、340億美元卡車和巴士、140億美元以上的原油以及大約140億美元果蔬，這都是美國並未從中國大量進口的品項。一旦達到25%稅率，這將成為川普到目前為止在貿易方面的最劇烈手段，猶大於對進口中國洗衣機、太陽能板、鋼鋁或其他任何商品所課徵的關稅。即使只對墨西哥產品徵收5%關稅，都高於1994年北美自由貿易協定（Nafta）實施前的大約4%平均稅率。25%關稅可能會對墨西哥產生毀滅性影響，因為出口占有墨國1/3以上國內生產毛額，其中4/5出口品銷往美國。在美方宣布課稅消息後，披索匯價昨天出現急貶。曾參與北美自由貿易協定談判的墨國前貿易領導官員戴拉卡耶（Luis de la Calle）表示，他對醞釀中的美、墨貿易戰最大憂慮在於，這將影響墨國未來經濟走向，使主張保護主義以及擴大國家經濟職能的人士更加振振有詞。他說：「這將摧毀美國－墨西哥－加拿大協定（USMCA，經修訂後的北美自由貿易協定），確保墨西哥維持開放和自由的市場經濟制度應是美方的當務之急，但如今川普政府的作法卻會將墨西哥推往相反的方向。」就美國而言，一旦對墨西哥課徵的關稅稅率達到25%，將會對自身經濟產生比較重大的衝擊。牛津經濟公司（Oxford Economics）首席美國經濟師達科（Gregory Daco）指出，對進口墨西哥商品一律課徵這種稅率，將使美國2020年經濟成長率下降0.7%，因為美國商界和消費者的負擔將因此增加，這也會打亂美國的供應鏈。美墨加貿協定規範這3國之間每年1.2兆美元以上的商品流通，儘管中國是美國進口商品的最大單一來源地，但雙方每年商品貿易總額約6600億美元，只是美墨加協定下的大約半數。全美績優公司執行長公會「商業圓桌組織」（Business Roundtable）發表聲明說，「對墨西哥片面課徵關稅是個嚴重錯誤」；並說，北美地區免關稅貿易為美國創造了1200萬個工作機會。（譯者：張佑之）1080601
美將終止貿易優惠待遇 印度經濟再受挫,產經,2019/06/01 19:28,https://www.cna.com.tw/news/afe/201906010184.aspx,（中央社華盛頓1日綜合外電報導）美國總統川普宣布，自6月5日起，美國將終止對印度的貿易優惠待遇。對成長減緩且失業率創新高的印度而言，將再次遭遇經濟打擊。根據美國國會數據，印度一直是美國實施數十年之久普遍性優惠關稅制度（Generalized System of Preferences）的最大受益者，這讓印度在2017年出口達57億美元的零關稅商品至美國。川普在昨晚發布的聲明中說，希望能有更多美國商品進入印度市場。川普說：「我認為印度未向美國保證，將公平且合理地開放市場。」他表示：「因此終止印度受惠開發中國家的待遇是適切做法。」川普在3月就宣布，將結束與印度的優惠貿易協議，但當時未提及日期。美國在2017至2018財政年度對印度的貿易逆差達267億美元。昨天公布的官方數據顯示，印度1到3月的國內生產毛額（GDP）成長放緩至5.8%，連3季減速；2017到2018財政年度的失業率達6.1%，創45年來新高。（譯者：蔡佳伶/核稿：徐崇哲）1080601
