標題,分類,時間,網址,內文
從Uber條款看共享經濟 學者籲建產業策略觀,產經,2019/11/10 10:02,https://www.cna.com.tw/news/firstnews/201911100016.aspx,（中央社記者蔡芃敏台北10日電）破壞式創新的共享經濟與傳統產業相互衝撞。學者認為，新經濟牽涉面向廣，政府應該有產業策略觀，建立橫跨部會的協調機制、及明確產業政策目標，才能全面發展新興事業。「共享經濟」越來越盛行，更影響人們不同層面的生活。然而，交通部日前公告俗稱「Uber條款」的汽車運輸業管理規則第103條之1輔導期間至11月30日止。除了Uber表示失望，叫車平台駕駛自救會成員直言「政府不顧一萬多名駕駛死活」；勞動部認定多個美食外送平台與外送員為「僱傭關係」，台灣協作暨共享經濟協會批評武斷認定雙方為僱傭關係，將影響彈性工作模式，扼殺外送經濟。從Uber納入運輸業到美食外送平台的勞資關係，新經濟模式與傳統產業、法律規則相互衝撞，台灣共享經濟該怎麼走？台北科技大學智慧科技法律政策研究中心主任江雅綺認為，可以理解政府發展新興產業、平台經濟，但若以現有產業規範看待新興產業，恐怕會失去新興產業的精神，要想降低社會衝擊，不過，政府應該思考消費者、新科技、勞工等面向，建立整體的產業發展策略觀。她表示，共享經濟崛起可歸為2大原因，一是閒置資源，二是數位科技的進步。以Uber來說，司機可以透過數位平台媒合載客，利用閒暇時間賺取金錢。交通部秉持「人合法、車合法、平台合法」政策理念，鼓勵駕駛人考取計程車執業登記證、靠行掛計程車牌及加入多元化車隊，並修正相關法規。江雅綺說，看得出來交通部以主管機關立場努力協調，讓車隊多元化、費率彈性，不過，在如此規範下「共享」精神恐怕會逐漸消失，影響彈性工作模式，「這是有點可惜的」。江雅綺認為，新經濟牽涉面向很廣，若僅有單一主管機關容易受到主管業務所限，恐怕不夠全面，政府應該建立一個橫跨各部會的協調機制，提出明確的政策目標、準則，讓各個機關可以遵循、執行，才能更全面發展新興事業。社團法人台灣協作暨共享經濟協會理事長彭仕邦表示，平台經濟涵蓋層面都非常廣，如果只是由單一部會主責，難以兼顧多元面向及各方需求，盼建立跨部會窗口，討論新興工作型態適用的法規。「新經濟不會100%吞食市場，新經濟與傳統經濟可以並行。」彭仕邦以新加坡為例，新加坡是亞洲開放Uber合法營運的國家，Uber又在2018年將東南亞業務賣給新加坡叫車平台Grab，印尼叫車平台Go-jek也在同年進軍新加坡；新加坡也同意計程車業龍頭康福德高（ComfortDelGro）若透過網路APP預約計程車，也能享有彈性計價空間。雖然叫車平台在新加坡蓬勃發展，然而，康福德高並沒有因此失去優勢。觀察康福德高2018年叫車量，年增率達7%至8%。彭仕邦說，新加坡保護傳統業者，也給予新創業者時間適應，叫車平台在新加坡蓬勃發展，計程車業者素質、軟硬體也都升級，顯現新經濟與傳統經濟可以共榮。他呼籲，期盼政府儘速制定適用平台經濟的大準則，並打造適合新興工作型態的法規，內容涵蓋消費者權益、勞動關係、法規彈性等，讓相關業者能有所適從。（編輯：林孟汝）1081110
台灣製造銷美不加徵關稅 台蠟：陸廠欲委代工,產經,2019/11/10 12:26,https://www.cna.com.tw/news/afe/201911100026.aspx,（中央社記者潘智義台北10日電）美中貿易風波不平，台灣蠟品公司董事長林哲印表示，台灣製造銷美不加徵關稅，不只國際大廠希望在台製造，連中國大陸蠟品廠都想委託台廠代工，生產蠟品銷美。林哲印日前接受中央社訪問表示，台廠在美中貿易戰中展現優勢，成為陸廠羨慕的對象，雖有中國大陸廠商想要委託台灣蠟品公司代工，對每個月營收貢獻也相當可觀，但因毛利偏低， 所以仍在協商中。他直言，台蠟轉虧為盈的關鍵在於放棄進口高成本的製蠟原料，因為原本符合成本效益的台灣原料供應商關廠後，迫不得已才向外商進口原料，但成本太高，造成虧損，所以只能調整生產模式，改變製程，才可以買到較便宜的原料，轉虧為盈。因此，控制成本、毛利十分重要。除了製蠟，他指出，台蠟也跨入水產市場，進口冰島鮭魚在亞太地區銷售，因冰島重視海洋環保，受到饕客喜愛；尤其近年中國經濟快速成長，消費力大增，中國占全球人口1/4，但鮭魚食用量卻僅全球的1/16，所以先跨入中國水產市場。針對中國水產市場，台蠟除攜手在中國擁有200多家大賣場的大潤發，並和上海當地一家加工廠合作，掌握中國6000家肯德基商品的水產內餡生意，同時看好盒馬生鮮大賣場、宜家結合餐廳、賣場通路；除鮭魚之外，也銷售智利盛產的帝王蟹。閒置土地利用方面，他認為，若將3400坪土地當停車場養地，不符經濟效益，所以興建太陽能電廠，並在去年與台灣電力公司簽約20年，每個月有16%左右收益，20年就有新台幣2億多元收益，扣掉建造費7000多萬元，土地還是台蠟所有，算是有效率的養地。（編輯：林興盟）1081110
非洲工商產業領袖高峰會 11日在台登場,產經,2019/11/10 11:32,https://www.cna.com.tw/news/afe/201911100051.aspx,"（中央社記者顧荃台北10日電）外交部表示，「2019年非洲工商產業領袖高峰會」11日至15日在台舉行，來自史瓦帝尼王國、南非及奈及利亞等國家，逾20位產業界領袖，來台進行貿易洽談及企業參訪。外交部說，非洲工商產業領袖高峰會是由非洲駐台經貿聯合辦事處、經濟部非洲市場推動辦公室及外貿協會共同舉辦，外交部為表示全力支持，將11日於舉行歡迎茶會；12日下午於外貿協會舉辦「非洲商機暨市場說明會」，邀請有興趣前往非洲拓展商務或投資的廠商參加。另外，外交部表示，史瓦帝尼王國投資促進局執行長高邁祖魯（Sibani Mngomezulu）一行4人應邀於4日至13日訪台，也將參加「2019年非洲工商產業領袖高峰會」，並在台北、高雄各舉辦一場投資貿易說明會，參訪台灣企業及新竹科學園區等。外交部指出，非洲為世界第2大洲，面積廣達3000萬平方公里，擁有豐富的天然資源及年輕的勞動人力，GDP平均成長率5.5%，是目前全球經濟成長最快速的區域之一。外交部說，「非洲大陸自由貿易區（African Continental Free Trade Area, AfCFTA）」自今年5月30日正式生效後，將是涵蓋12億人口及2.5兆美元GDP的市場，也是自世界貿易組織（WTO）成立以來，世界上最大的自由貿易區。台非經貿領域具有極大的發展潛力，期待與非洲國家有更密切的交流與互動。（編輯：楊凱翔）1081110"
加徵關稅是否分階段取消 學者：美中各有堅持,產經,2019/11/10 12:38,https://www.cna.com.tw/news/afe/201911100056.aspx,（中央社記者潘智義台北10日電）中國商務部透露，美將分階段取消加徵關稅，但遭美國總統川普否認。學者認為，中國願放低姿態，雙方有討價還價空間，但中國不放棄國家補貼政策，美國不願棄強權地位，還有得喬。實踐大學財務金融學系講座教授沈中華表示，雖然美國是典型的資本主義國家，希望企業公平競爭，不能接受政府補貼，但中國是社會主義國家，要中國放棄這種濃厚社會主義特色的政策，恐怕不是一件容易的事，因為他們認為這是國家照顧企業、照顧人民的一種方式。沈中華指出，中國願意開放市場，且與美國就專利權進行協商，也口頭承諾美國到中國設廠技術不必轉移，因此即便是中國未放棄國家補貼政策，但美國已在貿易戰取得上風，應可在加徵關稅議題上鬆口。中華經濟研究院諮詢委員周濟認為，對美國而言，美中貿易戰只是前哨戰，接下來的科技戰才是主戰場，延伸的就是國防軍備實力，但最終目的仍是要展現強權地位。周濟說，美國總統川普是地產大亨，出價、喊價的本領自然不容小看，和中國握手言和之際，敲定的協議可能會生變；和中國吵最兇的時候，也可能翻臉不認帳，只有最後簽約了才算數。他直言，雖然川普是非典型的美國政治人物，與傳統歐美、西方國家領袖的思維不同，與前幾任美國總統也大異其趣，但他強調優先解決國內問題的做法，卻似乎是符合共和黨內部的政治氛圍；例如前美國總統雷根也優先考慮國內政策，並促成蘇聯解體，川普當然不至於讓中國瓦解，但做法卻有共和黨一貫政策的影子。他以日本為例，日本知道自己扮演的角色，絕對不會和美國爭老大，也因此讓出許多商品規格制定的主導權，影響產品競爭力；中國政府不可能步上日本的後塵，更不會甘心居於美國之下，所以不會讓出經濟的主導權給美國。觀察美中貿易戰雙方的手段，沈中華分析，美國加徵關稅是最主要手段，也是美中協商的主軸；川普也臨時上演要中國償還美國持有清代政府公債戲碼，但他發現美國法院早已裁定無須償還後，就不再提起。雖然中國一度大賣持有的美國政府公債，但債券愈賣價值愈低，也就不再拋售。他說，中國可能為降低美國加徵關稅的衝擊，讓人民幣略貶救出口，但卻不可能真的故意讓人民幣大貶，否則造成購買力降低，資金外移，得不償失，更不利人民幣成為國際主要貨幣的目標。有關開放市場部分，他表示，中國開放外國人到中國設立公司，獲利繳稅後匯回母國，但對於外人赴中投資股市，就有資格限制，避免炒匯。因此，有外國專業投資機構的制度，必須向主管機關申請投資額度，所以即便中國朝金融自由化方向走，也不可能像香港金融市場那麼開放。他認為，全世界很多國家都對金融市場維持部分限制，如限制自然人、法人匯出資金額度，避免短時間資金大量匯出造成市場劇烈波動。因此，中國開放市場也不至於到無限制的開放。（編輯：林興盟）1081110
台商回流不缺地 經濟部備妥500公頃土地,產經,2019/11/10 16:23,https://www.cna.com.tw/news/afe/201911100115.aspx,（中央社記者蔡芃敏台北10日電）台商回台方案即將衝破新台幣7000億元，因應廠商用地需求，經濟部表示，台糖雲林、嘉義及台南農場等約500公頃土地，已準備將建6工業區，預計最慢2021年前完成報編開發。總統蔡英文昨天指出，下週台商回流投資金額將破新台幣7000億元，政府已打下未來3到5年，甚至10幾年的經濟發展動能基礎。經濟部長沈榮津日前也說，美中貿易摩擦應為常態性質，台商移動步調已經很清楚。為了解決台商用地需求，政府覓地計畫已有初步結果，經濟部工業局副局長楊伯耕今天接受電訪時證實此事，經濟部預計在彰化以南縣市開發工業區，待經濟部長沈榮津報告後，最終由行政院長蘇貞昌定案。他說，6處地點分別是雲林馬光農場、嘉義南靖及公館農場、台南沙崙農場、高雄九鬮農場、屏東一處農場用地，每個工業區面積約為90公頃，第一期工業區計畫開發面積約500公頃。楊伯耕進一步說明，工業區採取「只租不售」立場不變，提供需要業者用地，同時避免土地炒作，預計最慢2021年前完成報編開發，提供廠商規劃設廠。不過，部分廠商期盼釋出北部土地，且台商回流熱烈，政府釋出土地、增設工業區步調是否跟得上台商回流潮。楊伯耕表示，經濟部手上約20公頃土地，若廠商對小面積國有土地、特定區域土地有需求，經濟部將全力協助廠商，經濟部也會加速清查閒置土地。他說，北部國有地大多已開發，目前回流廠商大多擴建既有廠房，不過，為了解決北部、都會區用地問題，經濟部推動都市型工業區更新立體化發展方案，廠商透過容積獎勵，最高可增加容積達50%，解決用地需求。另外，科學園區則有高雄橋頭科學園區及台南科學園區擴建案，行政院長蘇貞昌今天視察「南科三期」預定地台糖新市看西農場，指示擴建三期計畫應加速、加碼進行。（編輯：楊凱翔）1081110
貿易戰關稅消息紛雜 投信看好台股長線仍偏多,證券,2019/11/10 17:05,https://www.cna.com.tw/news/afe/201911100125.aspx,（中央社記者潘智義台北10日電）中國發布美國同意分階段取消加徵關稅消息，卻遭美國總統川普否認，美股、台股都應聲下跌，但投信指出，台股短線高檔震盪，長線趨勢依然偏多。台北股市8日收在11579.54點，小跌27.02點，但週線上漲180.01點，上市公司市值衝破新台幣35兆元。日盛日盛基金經理人張亞瑋表示，股市受美中貿易戰影響逐漸鈍化，且因貿易戰對全球景氣衝擊下降，加上今年美國聯邦準備理事會（Fed）已3度降息，明年第1季仍有降息1碼的可能，使市場資金寬鬆，可望挹注股市，雖然指數高檔震盪難免，但長線趨勢依然偏多。張亞瑋指出，近期美股位於新高附近，台股則是短線拉回，資金往低基期補漲股移動，主流績優股如5G、IC設計、功率放大器（PA）等人氣族群漲多拉回，因這些族群股票10月營收維持高檔，仍可發揮旺季效應，且已舉行的上市公司第3季財報法人說明會偏正面，有利台股。他說，半導體龍頭台積電法說會釋放利多訊息，受惠5G、人工智慧（AI）及高速運算晶片（HPC）應用發展，高階製程需求強勁，上修明年資本支出，短期受惠明年第1季中國及韓國新機拉貨動能，2020年第1季手機供應鏈可望維持淡季不淡，產業基本面展望佳。產業方面，張亞瑋分析，股價基期偏低的蘋果供應鏈、5G帶動的基站、手機軟硬板新的規格及材料改變、迷你發光二極體（Mini LED）、手機全屏及有機發光二極體（OLED）滲透率提升受惠股，看好至2020年第1季的半導體需求。全球知名的經濟預測及商業諮詢機構報告顯示，2035年5G可望驅動12兆美元的全球經濟活動。以5G智慧型手機為例，隨著全球愈來愈多地區的電信商提供5G服務、已商轉的5G網路涵蓋範圍不斷擴大，5G手機需求將呈現爆炸性增長。中國信託台灣活力基金經理人周俊宏表示，雖然台股後續系統性風險較低，但全球股市多數處於波段新高，宜以個股進出為主，尤其明年第1季淡季不淡、產業展望正面、具轉機性股票為主。周俊宏說明，美國延續貨幣寬鬆政策、歐洲央行推新一輪量化寬鬆政策（QE），且市場對美中協議多為正向預期，外部干擾相對較低。近期受惠於蘋概股拉抬，第4季受iPhone銷售優於預期，與農曆年提前拉貨影響，上市公司營收可望淡季不淡。他認為，受惠蘋概股、企業營運轉佳與第3季財報激勵，台股屢創波段新高，雖小幅拉回，但在選股上，仍可鎖定蘋概股、5G、伺服器、半導體、記憶體、進口替代與生技族群。（編輯：楊凱翔）1081110
