標題,分類,時間,網址,內文
降雨舒緩水情 水利署：樂觀但不敢大意,產經,2018/06/18 16:56,https://www.cna.com.tw/news/firstnews/201806180161.aspx,（中央社記者朱則瑋台北18日電）中南部連日大雨，適時舒緩水情，水利署今天表示，對於水情樂觀但不敢大意，未來降雨情形仍難掌握，假使雨量未達預期，台南市等地區限水措施恐怕還得持續。台南市、澎湖縣處於一階段限水，高雄市、桃園市及新北市林口區則水情稍緊。不過，上週開始至今連日降雨，有效舒緩水情。由於未來降雨情形仍不明朗，水利署認為水情「惡化機會不大」，但還是要依照中央氣象局預測資料來做評估，降雨量假使不足，限水措施還是得要持續。水利署副署長王藝峰說，農業用水部分，嘉南平原二期稻作是否休耕，以及何時解除限水措施，水利署每週會跟各單會開會檢討評估；現在氣候變遷令人難以捉摸，降雨狀況不好掌控，水利署會步步為營，全力保持全台工業、農業及個人用水無虞。王藝峰指出，目前粗估，6月前不會進入第三階段限水措施，並保有2個月餘水量，民眾不需太過擔心缺水問題，加上近來南部地區持續的降雨，整體情勢還是審慎樂觀。依照水利署今天下午3時的資料顯示，曾文水庫有效蓄水量達2439萬噸，蓄水率5.38%；南化水庫有效蓄水量3008.31萬噸，蓄水率32.04%，對比昨天兩個水庫的數據都呈現微幅成長。另外，南部科學工業園區雖然也配合水利署進行自主節水，不過園區廠商利用晚間施行節水措施，因此，對於整體產能及運作沒有太大影響。（編輯：張良知）1070618
新加坡肯德基禁塑膠吸管 停供塑膠杯蓋,產經,2018/06/18 20:00,https://www.cna.com.tw/news/afe/201806180212.aspx,（中央社記者黃自強新加坡18日專電）新加坡肯德基今天宣布，為響應無吸管計畫，新加坡本地84家速食連鎖店，將從20日起停止提供塑膠杯蓋與吸管，不過，對外帶飲料的消費者仍會提供塑膠杯蓋。新加坡聯合早報、亞洲新聞台（Channel News Asia）報導，根據肯德基公告，停止使用塑膠杯蓋與吸管的目的，是為響應肯德基的無吸管環保計畫。報導說，肯德基旗下的速食連鎖店屆時每年可減少17.8公噸的塑膠使用量。新加坡人對塑膠袋等塑料用品需求量大，步出超級市場總是拎著裝滿食材或日用品的若干塑膠袋。免費提供購物塑膠袋，讓不少人習慣成自然，每次購物猶如塑膠袋大方送。新加坡文字工作者陳士銘今天告訴中央社記者，限用一次性使用的塑膠製品，已是全球趨勢，新加坡也有不少民眾響應這種限塑的做法，這對減少資源浪費有幫助。新加坡環保組織Zero Waste SG曾於2016年6月，籲請政府和企業對塑膠袋徵收費用。包括職總平價超市、百美超市及昇菘超市等業者，也曾探討對購物塑膠袋收取費用，讓民眾不再隨手可得，後來卻未實施。新加坡現階段雖未考慮塑膠袋收費，而是要和企業或其他機構合作，鼓勵減少使用塑膠袋，改用重複利用的環保袋或食物容器。台灣擴大限用塑膠政策今年元旦上路，增加購物用塑膠袋管制範圍，不僅讓網路媒體全球公民（Global Citizen）於2月報導，也讓新加坡總理李顯龍的夫人何晶透過臉書（Facebook）分享外國媒體報導，共同分享台灣推動環保成果。（編輯：郭中翰）1070618
今彩539第107145期開獎,產經,2018/06/18 20:41,https://www.cna.com.tw/news/afe/201806180239.aspx,（中央社台北18日電）今彩539第107145期開獎，中獎號碼36、04、33、16、08。3星彩中獎號碼811，4星彩中獎號碼0562。實際中獎獎號以台彩公布為準。1070618
雙贏彩第107049期開獎,產經,2018/06/18 20:46,https://www.cna.com.tw/news/afe/201806180240.aspx,（中央社台北18日電）雙贏彩第107049期今晚開獎，中獎號碼為10、07、23、18、21、06、03、19、16、12、13、02。實際中獎獎號以台彩公布為準。1070618
威力彩第107049期開獎,產經,2018/06/18 20:55,https://www.cna.com.tw/news/afe/201806180241.aspx,（中央社台北18日電）威力彩第107049期今晚開獎，第一區中獎號碼為9、1、10、7、17、16，第二區中獎號碼為6號。實際中獎獎號以台彩公布為準。1070618
威力彩第107049期頭獎摃龜,產經,2018/06/18 22:04,https://www.cna.com.tw/news/afe/201806180258.aspx,（中央社台北18日電）威力彩第107049期今晚開獎，第一區中獎號碼為9、1、10、7、17、16，第二區中獎號碼為6號。派彩結果，頭獎摃龜。貳獎有1注中獎，獨得獎金新台幣1688萬1086元。派彩結果及中獎獎號以台彩公布為準。1070618
今彩539第107145期頭獎摃龜,產經,2018/06/18 22:06,https://www.cna.com.tw/news/afe/201806180260.aspx,（中央社台北18日電）今彩539第107145期開獎，中獎號碼36、4、33、16、8。派彩結果，頭獎摃龜。貳獎160注中獎，每注可得新台幣2萬元。3星彩中獎號碼811，正彩93注中獎，每注可得1萬2500元。4星彩中獎號碼0562，正彩1注中獎，每注可得12萬5000元。實際中獎獎號及派彩內容，以台彩公司公布為準。1070618
雙贏彩第107049期頭獎摃龜,產經,2018/06/18 22:09,https://www.cna.com.tw/news/afe/201806180261.aspx,（中央社台北18日電）雙贏彩第107049期今晚開獎，中獎號碼為10、7、23、18、21、6、3、19、16、12、13、2。派彩結果，頭獎摃龜。貳獎有43注中獎，各得獎金新台幣10萬元。派彩結果及中獎獎號以台彩公布為準。1070618
